Book	Chapter	Verse	ID	SupportReference	OrigQuote	Occurrence	GLQuote	OccurrenceNote
1PE	2	20	pr8b	figs-activepassive	κολαφιζόμενοι	1	sinning and being tormented	If your language does not use the passive form in this way, you can state this in active form or in another way that is natural in your language. Alternate translation: “someone beats you” or “your master beats you” (See: [[rc://en/ta/man/translate/figs-activepassive]])
1PE	2	20	ly9f	grammar-connect-logic-result	ἀγαθοποιοῦντες καὶ πάσχοντες	1	doing good and suffering, you will endure	This could mean: (1) someone suffers even though that person did what is good. Alternate translation: “suffering despite doing good” (2) someone suffers because that person did what is good. Alternate translation: “suffering because of doing good” (See: [[rc://en/ta/man/translate/grammar-connect-logic-result]])
1PE	2	20	qii1		τοῦτο χάρις παρὰ Θεῷ	1		See how you translated a similar phrase in the previous verse.
1PE	2	21	c1jn	figs-explicit	εἰς τοῦτο	1		Here, **this** refers back to what Peter stated at the end of the previous verse. Believers are called by God to endure suffering while doing what is good. If this might confuse your readers, you could express the meaning explicitly. Alternate translation: “to endure suffering when you have done what is good” (See: [[rc://en/ta/man/translate/figs-explicit]])
1PE	2	21	xit1	figs-activepassive	εἰς τοῦτο…ἐκλήθητε	1	to this you were called	If your language does not use the passive form in this way, you can state this in active form or in another way that is natural in your language. Alternate translation: “God has called you to this” (See: [[rc://en/ta/man/translate/figs-activepassive]])
1PE	2	21	si3l	figs-metaphor	ἐπακολουθήσητε τοῖς ἴχνεσιν αὐτοῦ	1	for you so that you might follow in his footsteps	Peter uses **follow in his footsteps** figuratively to refer to following Jesus’ example about enduring suffering. If this might confuse your readers, you could express the meaning plainly. Alternate translation: “you might imitate his behavior” (See: [[rc://en/ta/man/translate/figs-metaphor]])
1PE	2	22	wii5	figs-quotemarks	ὃς ἁμαρτίαν οὐκ ἐποίησεν, οὐδὲ εὑρέθη δόλος ἐν τῷ στόματι αὐτοῦ	1		This verse is a quotation from [Isaiah 53:9](../isa/53/09.md). It may be helpful to your readers to indicate this by setting off all of this material with quotation marks or with whatever punctuation or convention your language uses to indicate a quotation. (See: [[rc://en/ta/man/translate/figs-quotemarks]])
1PE	2	22	tyz4	figs-activepassive	οὐδὲ εὑρέθη δόλος ἐν τῷ στόματι αὐτοῦ	1	neither was deceit found in his mouth	If your language does not use the passive form in this way, you can state this in active form or in another way that is natural in your language. Alternate translation: “neither did anyone find deceit in his mouth” (See: [[rc://en/ta/man/translate/figs-activepassive]])
1PE	2	22	cjai	figs-metaphor	οὐδὲ εὑρέθη δόλος ἐν τῷ στόματι αὐτοῦ	1		Peter quotes Isaiah referring to **deceit** figuratively as if it were an object that could be found inside someone’s mouth. If this might confuse your readers, you could express the meaning plainly. Alternate translation: “neither was deceit spoken out of his mouth” (See: [[rc://en/ta/man/translate/figs-metaphor]])
1PE	2	22	lw1u	figs-metonymy	οὐδὲ εὑρέθη δόλος ἐν τῷ στόματι αὐτοῦ	1	neither was deceit found in his mouth	Peter quotes Isaiah figuratively describing something the Messiah would say by association with **his mouth**, which he would use to say something. In this case it is something the Messiah did not say. If your readers would not understand this, you could use an equivalent expression or plain language. Alternate translation: “neither did he say something deceitful” (See: [[rc://en/ta/man/translate/figs-metonymy]])
1PE	2	23	lj4a	figs-activepassive	ὃς λοιδορούμενος, οὐκ ἀντελοιδόρει	1	He, being reviled, did not revile back	If your language does not use the passive form in this way, you can state this in active form or in another way that is natural in your language. Alternate translation: “whom people reviled, did not revile them back” (See: [[rc://en/ta/man/translate/figs-activepassive]])
1PE	2	23	gqb5	figs-explicit	παρεδίδου…τῷ κρίνοντι δικαίως	1		Here, **the one who judges justly** refers to God. This means that Jesus trusted God to punish those who reviled him or to prove that he was innocent. If this might confuse your readers, you could express the meaning explicitly. Alternate translation: “he entrusted himself to God, who judges justly” (See: [[rc://en/ta/man/translate/figs-explicit]])
1PE	2	24	k632	figs-rpronouns	ὃς τὰς ἁμαρτίας ἡμῶν αὐτὸς ἀνήνεγκεν	1	He himself	Peter uses the word **himself** here to emphasize that Jesus alone is the one who bore our sins. Use a way that is natural in your language to indicate this emphasis. Alternate translation: “none other than Jesus bore our sins” or “Jesus, that very person, bore our sins” (See: [[rc://en/ta/man/translate/figs-rpronouns]])
1PE	2	24	w49m	figs-metaphor	τὰς ἁμαρτίας ἡμῶν…ἀνήνεγκεν ἐν τῷ σώματι αὐτοῦ ἐπὶ τὸ ξύλον	1	carried our sins in his body to the tree	Peter uses **bore our sins** figuratively to refer to Jesus being punished for **our sins** as if **sins** were an object that he carried on **his body**. If this might confuse your readers, you could express the meaning plainly. Alternate translation: “suffered the punishment for our sins in his body on the tree” (See: [[rc://en/ta/man/translate/figs-metaphor]])
1PE	2	24	zl8e	figs-metonymy	τὸ ξύλον	1	the tree	Peter uses **tree** figuratively to refer to the cross on which Jesus died, which was made of wood. If your readers would not understand this, you could use an equivalent expression or plain language, as in the UST. (See: [[rc://en/ta/man/translate/figs-metonymy]])
1PE	2	24	x7ni	figs-metaphor	ταῖς ἁμαρτίαις ἀπογενόμενοι	1		Here, **having died to sins** is a metaphor that means to no longer be controlled by sin. Like a dead person is free from sinning because they are no longer alive, so believers are free to stop sinning because Jesus bore the punishment for their sins. If this might confuse your readers, you could express the meaning plainly. Alternate translation: “being no longer controlled by sin” (See: [[rc://en/ta/man/translate/figs-metaphor]])
1PE	2	24	fxej	grammar-connect-time-sequential	ταῖς ἁμαρτίαις ἀπογενόμενοι	1		This clause refers to an event that occurs before the event in the next clause. If it would be helpful to your readers, you could show this relationship by using a fuller phrase. Alternate translation: “after having died to sins” (See: [[rc://en/ta/man/translate/grammar-connect-time-sequential]])
1PE	2	24	jaka	figs-exclusive	τῇ δικαιοσύνῃ ζήσωμεν	1		When Peter says **we**, he is speaking of himself and other believers in Christ, so **we** would be inclusive. Your language may require you to mark this form. (See: [[rc://en/ta/man/translate/figs-exclusive]])
1PE	2	24	w69k	figs-quotemarks	οὗ τῷ μώλωπι ἰάθητε	1		This clause is a quotation from [Isaiah 53:5](../isa/53/05.md). It may be helpful to your readers to indicate this by setting off all of this material with quotation marks or with whatever punctuation or convention your language uses to indicate a quotation. (See: [[rc://en/ta/man/translate/figs-quotemarks]])
1PE	2	24	ep4s	figs-activepassive	οὗ τῷ μώλωπι ἰάθητε	1	of whose wounds you were healed	If your language does not use the passive form in this way, you can state this in active form or in another way that is natural in your language. Alternate translation: “God has healed you by means of his wounds” (See: [[rc://en/ta/man/translate/figs-activepassive]])
1PE	2	24	lx3n	figs-synecdoche	οὗ τῷ μώλωπι	1		Here, **wounds** figuratively refers to all the suffering Jesus endured when he was beaten and killed on the cross. If our readers would misunderstand this, you could express the meaning plainly. Alternate translation: “by whose suffering and death” (See: [[rc://en/ta/man/translate/figs-synecdoche]])
1PE	2	24	n0l5	figs-metaphor	ἰάθητε	1		Here, **healed** could mean: (1) being freed from the penalty and power of sin, which could include physical healing. Alternate translation: “you were freed from the effects of sin” (2) being forgiven for their sins and having a restored relationship with God. Alternate translation: “you were forgiven” (See: [[rc://en/ta/man/translate/figs-metaphor]])
1PE	2	25	sgt9	figs-simile	ἦτε…ὡς πρόβατα πλανώμενοι	1	you as sheep are being led astray	Peter speaks figuratively about his readers before they believed in Christ as if they had been similar to lost sheep that were wandering around aimlessly. If this might confuse your readers, you could express the meaning plainly. Alternate translation: “you were living aimlessly without knowing God” (See: [[rc://en/ta/man/translate/figs-simile]])
1PE	2	25	jkfu	figs-activepassive	ἐπεστράφητε	1		If your language does not use the passive form in this way, you can state this in active form or in another way that is natural in your language. Alternate translation: “God has turned you back” (See: [[rc://en/ta/man/translate/figs-activepassive]])
1PE	2	25	i5lu	figs-metaphor	τὸν ποιμένα καὶ ἐπίσκοπον τῶν ψυχῶν ὑμῶν	1	the shepherd and guardian of your souls	Peter uses **shepherd** and **overseer** figuratively to refer to Jesus. Just as a **shepherd** protects his sheep and an **overseer** takes care of his workers, Jesus protects and takes care of those who trust in him. If this might confuse your readers, you could express the meaning plainly. Alternate translation: “the one who protects and takes care of your souls” (See: [[rc://en/ta/man/translate/figs-metaphor]])
1PE	2	25	z6q2	figs-synecdoche	τῶν ψυχῶν ὑμῶν	1		See how you translated this phrase in [1:9](../01/09.md). (See: [[rc://en/ta/man/translate/figs-synecdoche]])
1PE	3	intro	cqf4			0		# 1 Peter 3 General Notes<br><br>## Structure and Formatting<br><br>1. How believers should act toward other people (2:11–3:12)<br>2. How believers should endure suffering (3:13–4:6)<br><br>Some translations set each line of poetry farther to the right than the rest of the text to make it easier to read. The ULT does this with the poetry that is quoted from the Old Testament in [verses 10–12](../03/10.md).<br><br>## Other Possible Translation Difficulties in this Chapter<br><br>### “the spirits in prison”<br><br>[Verse 19](../03/19.md) states that Jesus went and proclaimed to “the spirits in prison,” but does not mention what Jesus proclaimed or who those spirits are. [Verse 20](../03/20.md) states that these spirits disobeyed God during the time of Noah. Many scholars think that this means one of the following three meanings, each of which will be discussed in the notes for verses [19](../03/19.md) and [20](../03/20.md): (1) The spirits are demons who were imprisoned by God because they did something evil during Noah’s time (see [2 Peter 2:4–5](../2pe/02/04.md); [Jude 6–7](../jud/01/06.md); [Genesis 6:1–4](../gen/06/01.md)). [Verse 19](../03/19.md) then means that Jesus went to the place where they are imprisoned and proclaimed his victory to them at some time between his death on the cross and his return to heaven. (2) The spirits are sinful human beings who died during the flood in Noah’s time, and the prison is the realm of the dead. [Verse 19](../03/19.md) then means that Jesus went to hell and proclaimed his victory to those dead people there at some time between his death and resurrection. (3) The spirits are sinful human beings who died during the flood in Noah’s time, but [verse 19](../03/19.md) refers to the pre-incarnate form of Jesus indirectly preaching the gospel to them through the preaching of Noah.<br><br>### “Baptism now saves you”<br><br>In [verse 20](../03/20.md) Peter refers to the story of God rescuing Noah and his family from the flood “through water.” Then in [verse 21](../03/21.md) he states that the water is an “antitype” for baptism, which is a Christian ritual by which a person publicly identifies as a Christian. Then Peter makes the statement that baptism “now saves you.” Since the New Testament authors repeatedly state that God alone saves people and that no one can do any work to be saved, Peter’s statement cannot mean that a person can be saved by being baptized. Rather, Peter uses the word “baptism” figuratively to refer to the faith in Jesus that a person publicly confesses when that person is baptized. Peter indicates later in [verse 21](../03/21.md) that he is not referring to water baptism, which he describes as “the removal of dirt from the flesh.” Peter further states that the baptism he is referring to saves “through the resurrection of Jesus Christ,” which means that a person is saved by faith in Jesus, because Jesus rose from the dead.
1PE	3	1	p454			0	General Information:	In [verses 1–6](../03/01.md) Peter gives instructions specifically to women who are wives.
1PE	3	1	wp5p	figs-metonymy	τινες ἀπειθοῦσιν τῷ λόγῳ	1	some are disobedient to the word	Here, **being disobedient to the word** could refer to: (1) refusing to believe the gospel message, as in [2:8](../02/08.md). Alternate translation: “some do not believe the message about Jesus” (2) disobeying the commands God gave in his word. Alternate translation: “some do not obey what God commands in his word” (See: [[rc://en/ta/man/translate/figs-metonymy]])
1PE	3	1	kbis	figs-activepassive	κερδηθήσονται	1	they will be won	If your language does not use the passive form in this way, you can state this in active form or in another way that is natural in your language. Alternate translation: “you will win them” (See: [[rc://en/ta/man/translate/figs-activepassive]])
1PE	3	1	bs56	figs-idiom	κερδηθήσονται	1	they will be won	Here, **won** is an idiom that means that the unbelieving husbands will become believers in Jesus. If your readers would not understand this, you could use an equivalent idiom or use plain language. Alternate translation: “they will be persuaded to believe in Christ” (See: [[rc://en/ta/man/translate/figs-idiom]])
1PE	3	1	qp4q	figs-ellipsis	ἄνευ λόγου	1	without a word	Peter is leaving out some of the words that a clause would need in many languages to be complete. If your readers might misunderstand this, you could supply these words from the context. Alternate translation: “without you saying a word.” (See: [[rc://en/ta/man/translate/figs-ellipsis]])
1PE	3	1	b56u	figs-metonymy	ἄνευ λόγου	1		Here, **word** refers to anything the wives might say to their husbands about the gospel message. If this might confuse your readers, you could express the meaning plainly. Alternate translation: “without a word about the gospel” (See: [[rc://en/ta/man/translate/figs-metonymy]])
1PE	3	2	rzrl	grammar-connect-logic-result	ἐποπτεύσαντες	1		This phrase indicates the reason why the unbelieving husbands would become believers in Jesus. These husbands became believers because they **observed** how their wives behaved. If your readers would misunderstand this, you could express the meaning explicitly. Alternate translation: “because they observed” (See: [[rc://en/ta/man/translate/grammar-connect-logic-result]])
1PE	3	2	zft4	figs-abstractnouns	τὴν ἐν φόβῳ ἁγνὴν ἀναστροφὴν ὑμῶν	1	having seen your pure behavior with respect	If your language does not use an abstract noun for the idea of **behavior**, you could express the same idea in another way. Alternate translation: “you behave purely and with fear” (See: [[rc://en/ta/man/translate/figs-abstractnouns]])
1PE	3	2	ng3s	figs-explicit	τὴν…ἁγνὴν ἀναστροφὴν ὑμῶν	1	your pure behavior with respect	This could refer to: (1) the wives’ sincere and honest behavior. Alternate translation: “your sincere behavior” (2) the wives’ sexually chaste behavior. Alternate translation: “your sexually chaste behavior” (See: [[rc://en/ta/man/translate/figs-explicit]])
1PE	3	3	p1bg	writing-pronouns	ὧν	1		Here, **whose** refers to the Christian wives to whom Peter is speaking. If this might confuse your readers, you could express the meaning explicitly. Alternate translation: “your” (See: [[rc://en/ta/man/translate/writing-pronouns]])
1PE	3	3	ysvn	figs-abstractnouns	ὧν…κόσμος	1		If your language does not use an abstract noun for the idea of **adornment**, you could express the same idea in another way. Alternate translation: “they way you adorn yourselves” (See: [[rc://en/ta/man/translate/figs-abstractnouns]])
1PE	3	4	oav8	grammar-connect-logic-contrast	ἀλλ’ ὁ κρυπτὸς τῆς καρδίας ἄνθρωπος	1		If it would be helpful in your language, you could begin this verse as a new sentence. If you do so, then you will need to repeat the subject and verb from the previous verse. Alternate translation: “Rather, let your adornment be the inner man of the heart” (See: [[rc://en/ta/man/translate/grammar-connect-logic-contrast]])
1PE	3	4	m2n3	figs-metonymy	ὁ κρυπτὸς τῆς καρδίας ἄνθρωπος	1		Here, **hidden man** and **heart** both refer to a person’s thoughts or emotions. If this would confuse your readers, you could express the meaning plainly. Alternate translation: “the inner thoughts” (See: [[rc://en/ta/man/translate/figs-metonymy]])
1PE	3	4	l2yq	figs-possession	ὁ κρυπτὸς τῆς καρδίας ἄνθρωπος	1	the inner person of the heart	Peter is using the possessive form to indicate that the **hidden man** is the same thing as **the heart**. If this is not clear in your language, you could use express the meaning explicitly. Alternate translation: “the hidden man, which is the heart” or “the hidden man, namely, the heart” (See: [[rc://en/ta/man/translate/figs-possession]])
1PE	3	4	l1js	figs-possession	ἐν τῷ ἀφθάρτῳ τοῦ πραέως καὶ ἡσυχίου πνεύματος	1		Peter is using the possessive form to indicate that the **imperishable thing** is the same thing as **a gentle and quiet spirit**. If this is not clear in your language, you could use express the meaning explicitly. Alternate translation: “in the imperishable thing, which is a gentle and quiet spirit” or “in the imperishable thing, namely, a gentle and quiet spirit” (See: [[rc://en/ta/man/translate/figs-possession]])
1PE	3	4	spi6	figs-metonymy	τοῦ πραέως καὶ ἡσυχίου πνεύματος	1		Here,**quiet** means “peaceful” or “calm.” It does not mean the opposite of loud. If this might confuse your readers, you could express the meaning plainly. Alternate translation: “of a gentle and peaceful spirit” (See: [[rc://en/ta/man/translate/figs-metonymy]])
1PE	3	4	gbw9	figs-metonymy	τοῦ πραέως καὶ ἡσυχίου πνεύματος	1	of a gentle and quiet spirit	Here, **spirit** refers to a person’s attitude or temperament. If this might confuse your readers, you could express the meaning plainly. Alternate translation: “of a gentle and quiet attitude.” (See: [[rc://en/ta/man/translate/figs-metonymy]])
1PE	3	4	j5bu	figs-metaphor	ὅ ἐστιν ἐνώπιον τοῦ Θεοῦ πολυτελές	1	which is precious before God	Peter refers to God’s opinion figuratively as if it were a person standing directly in front of him. If this might confuse your readers, you could express the meaning plainly. Alternate translation: “which God considers to be very precious” (See: [[rc://en/ta/man/translate/figs-metaphor]])
1PE	3	5	dq60	figs-metaphor	ἐκόσμουν ἑαυτάς	1		Peter speaks figuratively of the attitude of the holy women as if it were something with which they **adorned themselves**. If this might confuse your readers, you could express the meaning plainly. Alternative translation: “made themselves beautiful” (See: [[rc://en/ta/man/translate/figs-metaphor]])
1PE	3	5	jbuf		ὑποτασσόμεναι τοῖς ἰδίοις ἀνδράσιν	1		See how you translated the similar clause in [verse 1](../03/01.md).
1PE	3	6	kpnl	translate-names	Σάρρα…τῷ Ἀβραάμ	1		**Sarah** is the name of a woman and **Abraham** is the name of her husband. (See: [[rc://en/ta/man/translate/translate-names]])
1PE	3	6	t3xl	figs-idiom	ἧς ἐγενήθητε τέκνα	1	whose children you have become	Peter uses a Hebrew idiom here in which people are said to be the **children** of someone who has qualities similar to theirs. Women who believe and who act like Sarah acted are thought of as if they were her actual **children**. If this might confuse your readers, you could express the meaning plainly or use a simile. Alternate translation: “who resemble her as if you were her children” (See: [[rc://en/ta/man/translate/figs-idiom]])
1PE	3	6	v2so	figs-doublenegatives	μὴ φοβούμεναι μηδεμίαν πτόησιν	1		The phrase **not being afraid of any** translates two negative words in Greek. Peter uses them together to emphasize that believing women should not fear anything at all. If your language can use two negatives together for emphasis without them cancelling each other to create a positive meaning, it would be appropriate to use that construction here. (See: [[rc://en/ta/man/translate/figs-doublenegatives]])
1PE	3	7	lbc2			0	General Information:	In this verse Peter gives instructions specifically to men who are husbands.
1PE	3	7	uddn	figs-genericnoun	συνοικοῦντες…τῷ γυναικείῳ	1		Here, **the female** refers to the wives of the men to whom Peter is writing, not to one particular woman. If this would be misunderstood in your language, use a more natural phrase. Alternate translation: “live with the women whom you have married” (See: [[rc://en/ta/man/translate/figs-genericnoun]])
1PE	3	7	lulz	figs-abstractnouns	κατὰ γνῶσιν	1	live with your wife according to understanding, as with a weaker container	If your language does not use an abstract noun for the idea of **knowledge**, you could express the same idea in another way. Alternate translation: “in a knowledgeable way” (See: [[rc://en/ta/man/translate/figs-abstractnouns]])
1PE	3	7	eq1z	figs-metaphor	ὡς ἀσθενεστέρῳ σκεύει	1	as with a weaker container	Here Peter refers to women figuratively as if they were **weaker** containers. The word **container** is a term used to refer to both men and women in the Bible ([Acts 9:15](../act/09/15.md)). Just as clay pots can break easily, so are human beings weak. Here Peter specifically refers to women as **weaker** containers because woman are usually physically weaker than men. If this might confuse your readers, you could express the meaning plainly. Alternate translation: “as with someone who is weaker than you are” (See: [[rc://en/ta/man/translate/figs-metaphor]])
1PE	3	7	a88w	figs-abstractnouns	ἀπονέμοντες τιμήν ὡς καὶ συνκληρονόμοις χάριτος ζωῆς	1	assigning her honor as also fellow heirs of the grace of life	If your language does not use abstract nouns for the ideas of **honor** and **heirs**, you could express the same ideas in another way. Alternate translation: “honor them as also those who will inherit with you the grace of life” (See: [[rc://en/ta/man/translate/figs-abstractnouns]])
1PE	3	7	n4rf	figs-metaphor	συνκληρονόμοις χάριτος ζωῆς	1	fellow heirs of the grace of life	Peter speaks of **the grace of life** figuratively as if it were something that people inherit. If this might confuse your readers, you could express the meaning plainly or use a simile. Alternate translation: “those who will experience the grace of life together” (See: [[rc://en/ta/man/translate/figs-metaphor]])
1PE	3	7	quba	figs-possession	χάριτος ζωῆς	1		Peter is using the possessive form to describe **grace** that is **life**. The word **grace** refers to a gracious gift and **life** refers to eternal **life**. If this might confuse your readers, you could express the meaning explicitly. Alternate translation: “of the gracious gift, namely, eternal life” (See: [[rc://en/ta/man/translate/figs-possession]])
1PE	3	7	dwm6	figs-activepassive	εἰς τὸ μὴ ἐνκόπτεσθαι τὰς προσευχὰς ὑμῶν	1	so that your prayers will not be hindered	If your language does not use the passive form in this way, you can state this in active form or in another way that is natural in your language. Alternate translation: “so that nothing will hinder your prayers” (See: [[rc://en/ta/man/translate/figs-activepassive]])
1PE	3	8	nk97			0	General Information:	In [verses 8–12](../03/08.md) Peter writes instructions to all believers.
1PE	3	8	f5y7		ὁμόφρονες	1	be likeminded	Alternate translation: “have the same opinion and be” or “have the same attitude and be”
