Book	Chapter	Verse	ID	SupportReference	OrigQuote	Occurrence	GLQuote	OccurrenceNote
MRK	4	35	qua2			0	Connecting Statement:	As Jesus and his disciples take a boat to escape the crowds of people, a great storm arises. His disciples are afraid when they see that even the wind and the sea obey Jesus.
MRK	4	35	hc5b		λέγει αὐτοῖς	1	he says to them	“Jesus said to his disciples”
MRK	4	35	biy2		τὸ πέραν	1	the other side	“the other side of the Sea of Galilee” or “the other side of the sea”
MRK	4	37	at6u	figs-ellipsis	ἤδη γεμίζεσθαι τὸ πλοῖον	1	to already be filling the boat	It may be helpful to state that **the boat** was **filling** up with water. Alternate translation: “the boat was in danger of being filled with water” (See: [[rc://en/ta/man/translate/figs-ellipsis]])
MRK	4	38	qy5l		τῇ πρύμνῃ	1	the stern	This is at the very back of the boat. “the stern of the boat”
MRK	4	38	xdm6		ἐγείρουσιν αὐτὸν	1	they wake him up	The word **they** refers to the disciples.
MRK	4	38	b4xb	figs-rquestion	οὐ μέλει σοι ὅτι ἀπολλύμεθα?	1	do you not care that we are perishing?	The disciples asked this question to convey their fear. This question can be written as a statement. Alternate translation: “you need to pay attention to what is happening; we are all about to die!” (See: [[rc://en/ta/man/translate/figs-rquestion]])
MRK	4	38	qtb3	figs-exclusive	ἀπολλύμεθα	1	we are perishing	The word **we** includes the disciples and Jesus. (See: [[rc://en/ta/man/translate/figs-exclusive]])
MRK	4	39	yym6	figs-doublet	σιώπα, πεφίμωσο	1	Be silent! Be still!	These two phrases are similar and used to emphasize what Jesus wanted the wind and the sea to do. (See: [[rc://en/ta/man/translate/figs-doublet]])
MRK	4	39	ag41		γαλήνη μεγάλη	1	a great calm	“a great stillness over the sea” or “a great calm over the sea”
MRK	4	40	h7n3		καὶ εἶπεν αὐτοῖς	1	And he said to them	“And Jesus said to his disciples”
MRK	4	40	w5n4	figs-rquestion	τί δειλοί ἐστε? οὔπω ἔχετε πίστιν	1	Why are you afraid? Do you not yet have faith?	Jesus asks these questions to make his disciples consider why they are **afraid** when he is with them. These questions can be written as statements. Alternate translation: “You should not be afraid. You need to have more faith.” (See: [[rc://en/ta/man/translate/figs-rquestion]])
MRK	4	41	u8e1	figs-rquestion	τίς ἄρα οὗτός ἐστιν, ὅτι καὶ ὁ ἄνεμος καὶ ἡ θάλασσα ὑπακούει αὐτῷ?	1	Who then is this, for even the wind and the sea obey him?	The disciples ask this question in amazement at what Jesus did. This question can be written as a statement. Alternate translation: “This man is not like ordinary men; even the wind and the sea obey him!” (See: [[rc://en/ta/man/translate/figs-rquestion]])
MRK	5	intro	lh25			0		# Mark 5 General Notes<br><br>## Possible translation difficulties in this chapter<br><br>### “Talitha, koum”<br><br>The words **Talitha, koum** ([Mark 5:41](../mrk/05/41.md)) are from the Aramaic language. Mark writes them the way they sound and then translates them. (See: [[rc://en/ta/man/translate/translate-transliterate]])
MRK	5	1	fix1			0	Connecting Statement:	After Jesus calms the great storm, he heals a man who has many demons, but the local people in Gerasa are not glad about his healing, and they beg Jesus to leave.
MRK	5	1	gt8a		ἦλθον	1	They came	The word **They** refers to Jesus and his disciples.
MRK	5	1	ahx8		τῆς θαλάσσης	1	the sea	This refers to the Sea of Galilee.
MRK	5	1	vsc7	translate-names	τῶν Γερασηνῶν	1	the Gerasenes	This name refers to the people who live in Gerasa. (See: [[rc://en/ta/man/translate/translate-names]])
MRK	5	2	pf16	figs-idiom	ἐν πνεύματι ἀκαθάρτῳ	1	with an unclean spirit	This is an idiom meaning that the man is “controlled” or “possessed” by the unclean spirit. Alternate translation: “controlled by an unclean spirit” or “that an unclean spirit possessed” (See: [[rc://en/ta/man/translate/figs-idiom]])
MRK	5	4	da4x	figs-activepassive	αὐτὸν πολλάκις…δεδέσθαι	1	He had been bound many times	This can be written in active form. Alternate translation: “People had bound him many times” (See: [[rc://en/ta/man/translate/figs-activepassive]])
MRK	5	4	nep6	figs-activepassive	τὰς πέδας συντετρῖφθαι	1	his shackles were shattered	This can be written in active form. Alternate translation: “he shattered his shackles” (See: [[rc://en/ta/man/translate/figs-activepassive]])
MRK	5	4	fk7t		πέδαις	1	shackles	pieces of metal that people wrap around the arms and legs of prisoners and attach with chains to objects that do not move so the prisoners cannot move
MRK	5	4	tu2d	figs-explicit	οὐδεὶς ἴσχυεν αὐτὸν δαμάσαι	1	no one was strong enough to subdue him	The man was so **strong** that **no one** could **subdue him**. Alternate translation: “He was so strong that no one was strong enough to subdue him” (See: [[rc://en/ta/man/translate/figs-explicit]])
MRK	5	4	gp74		αὐτὸν δαμάσαι	1	to subdue him	“to control him”
MRK	5	5	z9ah		κατακόπτων ἑαυτὸν λίθοις	1	cut himself with stones	Often times when a person is possessed by a demon, the demon will cause the person to do self-destructive things, such as cutting himself.
MRK	5	6	y6c2	figs-explicit	καὶ ἰδὼν τὸν Ἰησοῦν ἀπὸ μακρόθεν	1	And seeing Jesus from a distance	When the man first saw Jesus, Jesus would have been getting out of the boat. (See: [[rc://en/ta/man/translate/figs-explicit]])
MRK	5	6	pw4y		προσεκύνησεν	1	bowed down before	This means that he knelt down before Jesus out of reverence and respect, not out of worship.
MRK	5	7	ux6u	figs-events		0	General Information:	The information in these two verses may be reordered to present the events in the order that they happened, as in the UST. (See: [[rc://en/ta/man/translate/figs-events]])
MRK	5	7	tt7a		κράξας	1	crying out	“the unclean spirit, crying out”
MRK	5	7	ppu5	figs-rquestion	τί ἐμοὶ καὶ σοί Ἰησοῦ, Υἱὲ τοῦ Θεοῦ τοῦ Ὑψίστου?	1	What to me and to you, Jesus, Son of the Most High God?	The unclean spirit asks this question out of fear. This can be written as a statement. Alternate translation: “Leave me alone, Jesus, Son of the Most High God! There is no reason for you to interfere with me.” (See: [[rc://en/ta/man/translate/figs-rquestion]])
MRK	5	7	q8c8		Ἰησοῦ…μή με βασανίσῃς	1	Jesus … may you not torment me	Jesus has the power to torment unclean spirits.
MRK	5	7	kd19	guidelines-sonofgodprinciples	Υἱὲ τοῦ Θεοῦ τοῦ Ὑψίστου	1	Son of the Most High God	This is an important title for Jesus. (See: [[rc://en/ta/man/translate/guidelines-sonofgodprinciples]])
MRK	5	7	p768		ὁρκίζω σε τὸν Θεόν	1	I beg you by God	Here the unclean spirit is swearing **by God** as he makes a request of Jesus. Consider how this type of request is made in your language. Alternate translation: “I beg you before God” or “I swear by God himself and beg you”
MRK	5	9	p6ye		ἐπηρώτα αὐτόν	1	he was asking him	“Jesus asked the unclean spirit”
MRK	5	9	h6ch	figs-metaphor	λέγει αὐτῷ, Λεγιὼν ὄνομά μοι, ὅτι πολλοί ἐσμεν.	1	he says to him, “My name is Legion, for we are many.”	One spirit was speaking for many here. He spoke of them as if they were a legion, a Roman army unit of about 6,000 soldiers. Alternate translation: “And the spirit said to him, ‘Call us an army, for many of us are inside the man.’” (See: [[rc://en/ta/man/translate/figs-metaphor]])
MRK	5	12	uk54		παρεκάλεσαν αὐτὸν	1	they begged him	“the unclean spirits begged Jesus”
MRK	5	13	iff6	figs-explicit	ἐπέτρεψεν αὐτοῖς	1	he permitted them	It may be helpful to state clearly what Jesus allowed them to do. Alternate translation: “Jesus allowed the unclean spirits to do what they asked permission to do” (See: [[rc://en/ta/man/translate/figs-explicit]])
MRK	5	13	g3xx		ὥρμησεν…κατὰ τοῦ κρημνοῦ εἰς τὴν θάλασσαν, ὡς δισχίλιοι, καὶ ἐπνίγοντο ἐν τῇ θαλάσσῃ	1	about 2,000—rushed down the steep hill into the sea, and drowned in the sea	You can make this a separate sentence: “rushed down the steep slope into the sea. There were about 2,000 pigs, and they drowned in the sea”
MRK	5	13	a28z	translate-numbers	ὡς δισχίλιοι	1	about 2,000	“about two thousand pigs” (See: [[rc://en/ta/man/translate/translate-numbers]])
MRK	5	14	lt8x	figs-ellipsis	εἰς τὴν πόλιν καὶ εἰς τοὺς ἀγρούς	1	in the city and in the countryside	You can state this clearly that the men gave their report to the people who were in the **city** and **countryside**. Alternate translation: “to people in the city and in the countryside” (See: [[rc://en/ta/man/translate/figs-ellipsis]])
MRK	5	15	qih4		τὸν λεγεῶνα	1	the Legion	This was the name of the many demons that were in the man. See how you translated this in [Mark 5:9](../05/09.md).
MRK	5	15	fb4b	figs-idiom	σωφρονοῦντα	1	being in his right mind	This is an idiom meaning that he is thinking clearly. Alternate translation: “being of a normal mind” or “thinking clearly” (See: [[rc://en/ta/man/translate/figs-idiom]])
MRK	5	15	yv69		ἐφοβήθησαν	1	they became afraid	The word **they** refers to the group of people who went out to see what had happened.
MRK	5	16	t4ez		οἱ ἰδόντες, πῶς ἐγένετο	1	those who had seen how it happened	“the people who had witnessed what had happened”
MRK	5	18	mwg9		ὁ δαιμονισθεὶς	1	the one who had been demon-possessed	Though the man is no longer **demon-possessed**, he is still described in this way. Alternate translation: “the man who had been demon-possessed”
MRK	5	19	e21m	figs-explicit	καὶ οὐκ ἀφῆκεν αὐτόν	1	But he did not permit him	You can state clearly what Jesus did not allow the man to do. Alternate translation: “But he did not allow the man to come with them” (See: [[rc://en/ta/man/translate/figs-explicit]])
MRK	5	20	g8ed	translate-names	τῇ Δεκαπόλει	1	the Decapolis	This is the name of a region that means “Ten Cities.” It is located to the southeast of the Sea of Galilee. (See: [[rc://en/ta/man/translate/translate-names]])
MRK	5	20	y8vn	figs-ellipsis	πάντες ἐθαύμαζον	1	everyone was marvelling	It may be helpful to state why the people were **marvelling**. Alternate translation: “all the people who heard what the man said were amazed” (See: [[rc://en/ta/man/translate/figs-ellipsis]])
MRK	5	21	wyl3			0	Connecting Statement:	After healing the demon-possessed man in region of the Gerasenes, Jesus and his disciples return across the lake to Capernaum where the one of the rulers of the synagogue asks Jesus to heal his daughter.
MRK	5	21	t3dc	figs-ellipsis	τὸ πέραν	1	the other side	It may be helpful to add information to this phrase. Alternate translation: “the other side of the sea” (See: [[rc://en/ta/man/translate/figs-ellipsis]])
MRK	5	21	lyt8		παρὰ τὴν θάλασσαν	1	beside the sea	“on the seashore” or “on the shore”
MRK	5	21	p4p7		τὴν θάλασσαν	1	the sea	This is the Sea of Galilee.
MRK	5	22	v1dm	translate-names	Ἰάειρος	1	Jairus	This is the name of a man. (See: [[rc://en/ta/man/translate/translate-names]])
MRK	5	23	jd27		ἐπιθῇς τὰς χεῖρας	1	you may lay your hands	Here, **lay your hands** refers to a prophet or teacher placing his hand on someone and imparting either healing or a blessing. In this case, Jarius is asking Jesus to heal his daughter.
MRK	5	23	kzz8	figs-activepassive	ἵνα σωθῇ καὶ ζήσῃ	1	in order that she may be healed and she may live	You can state this in active form. Alternate translation: “and heal her and make her live” (See: [[rc://en/ta/man/translate/figs-activepassive]])
MRK	5	24	d7zg	figs-explicit	καὶ ἀπῆλθεν μετ’ αὐτοῦ	1	And went with him	“So Jesus went with Jairus.” Jesus’ disciples also went with him. Alternate translation: “So Jesus and the disciples went with Jairus” (See: [[rc://en/ta/man/translate/figs-explicit]])
MRK	5	24	jgg5		συνέθλιβον αὐτόν	1	was pressing around him	This means they crowded around Jesus and pressed themselves together to be closer to Jesus.
MRK	5	25	rn7h			0	Connecting Statement:	While Jesus is on his way to heal the man’s little 12-year-old girl, a woman who has been sick for 12 years interrupts by touching Jesus for her healing.
MRK	5	25	e2cz	writing-participants	καὶ γυνὴ οὖσα	1	And a woman, being	This introduces the woman as a new character in the story. Consider how new people are introduced into a story in your language. (See: [[rc://en/ta/man/translate/writing-participants]])
MRK	5	25	h58w	figs-euphemism	ἐν ῥύσει αἵματος δώδεκα ἔτη	1	with a flow of blood for 12 years	The woman did not have an open wound; rather, her monthly flow of blood would not stop. Your language may have a polite way to refer to this condition. (See: [[rc://en/ta/man/translate/figs-euphemism]])
MRK	5	25	idh9	translate-numbers	δώδεκα ἔτη	1	for 12 years	“for twelve years” (See: [[rc://en/ta/man/translate/translate-numbers]])
MRK	5	26	vgh2		εἰς τὸ χεῖρον ἐλθοῦσα	1	having become worse	“her sickness got worse” or “her bleeding increased”
MRK	5	27	z2hg	figs-explicit	τὰ περὶ τοῦ Ἰησοῦ	1	the things about Jesus	She had heard reports about Jesus of how he healed people. Alternate translation: “that Jesus healed people” (See: [[rc://en/ta/man/translate/figs-explicit]])
MRK	5	27	v7h8		τοῦ ἱματίου	1	cloak	outer garment or coat
MRK	5	28	wge2	figs-activepassive	σωθήσομαι	1	I will be saved	You can state this in active form. Alternate translation: “it will save me” or “his power will heal me” (See: [[rc://en/ta/man/translate/figs-activepassive]])
MRK	5	29	c1vz	figs-activepassive	ἴαται ἀπὸ τῆς μάστιγος	1	she had been healed from the disease	You can state this in active form. Alternate translation: “the sickness had left her” or “she was no longer sick” (See: [[rc://en/ta/man/translate/figs-activepassive]])
MRK	5	30	ma2b		τὴν ἐξ αὐτοῦ δύναμιν ἐξελθοῦσαν	1	his power had gone out from him	When the woman touched Jesus, Jesus felt **his power** healing her. Jesus himself did not lose any of his power to heal people when he healed her. Alternate translation: “his healing power had healed the woman”
MRK	5	31	hb58		τὸν ὄχλον συνθλίβοντά σε	1	this crowd pressed in on you	This means they crowded around Jesus and **pressed** themselves together to be closer to Jesus. See how you translated this in [Mark 5:24](../05/24.md).
MRK	5	33	yn9g		προσέπεσεν αὐτῷ	1	fell down before him	“knelt down before him.” She knelt down before Jesus as an act of honor and submission.
MRK	5	33	b6kz	figs-ellipsis	εἶπεν αὐτῷ πᾶσαν τὴν ἀλήθειαν	1	told him the whole truth	The phrase **the whole truth** refers to how she had touched him and became well. Alternate translation: “told him the whole truth about how she had touched him” (See: [[rc://en/ta/man/translate/figs-ellipsis]])
MRK	5	34	gbk8		θυγάτηρ	1	Daughter	Jesus was using this term figuratively to refer to the woman as a believer.
MRK	5	34	a5qw		ἡ πίστις σου	1	your faith	“your faith in me”
MRK	5	35	kmm7		ἔτι αὐτοῦ λαλοῦντος	1	While he was still speaking	“While Jesus was still speaking”
MRK	5	35	ld5e		ἔρχονται ἀπὸ τοῦ ἀρχισυναγώγου	1	they came from the synagogue leader’s house	This could mean: (1) these people had come from Jarius’ house. (2) Jairus had previously given these people orders to go see Jesus. (3) these people had been sent by the man who was presiding as the synagogue leader in Jairus’ absence.
MRK	5	35	akl8		τοῦ ἀρχισυναγώγου	1	the synagogue leader’s house	The leader of the synagogue is Jairus.
MRK	5	35	ip1p		λέγοντες	1	saying	“saying to Jairus”
MRK	5	35	t2wd	figs-rquestion	τί ἔτι σκύλλεις τὸν διδάσκαλον?	1	Why trouble the teacher any longer?	This question can be written as a statement. Alternate translation: “It is useless to bother the teacher any longer.” or “There no need to bother the teacher any longer.” (See: [[rc://en/ta/man/translate/figs-rquestion]])
MRK	5	35	c5c1		τὸν διδάσκαλον	1	the teacher	This refers to Jesus.
MRK	5	36	zei3	translate-versebridge		0	General Information:	You may want to combine verses 37 and 38 and reorder them to present the events in the order that they happened, as in the UST. (See: [[rc://en/ta/man/translate/translate-versebridge]])
MRK	5	36	ge2r		μόνον πίστευε	1	Only believe	If necessary, you can state what Jesus is commanding Jairus to believe. Alternate translation: “Just believe I can make you daughter live”
MRK	5	37	y884		οὐκ ἀφῆκεν	1	he did not permit	Jesus did not permit
MRK	5	37	ed49	figs-explicit	μετ’ αὐτοῦ συνακολουθῆσαι	1	to accompany him	“to come with him.” It may be helpful to state where they were going. Alternate translation: “to accompany him to Jairus’ house” (See: [[rc://en/ta/man/translate/figs-explicit]])
MRK	5	38	t154		θεωρεῖ	1	sees	Jesus saw
MRK	5	39	m7pu		λέγει αὐτοῖς	1	he says to them	“Jesus said to the people who were weeping”
MRK	5	39	a3ih	figs-rquestion	τί θορυβεῖσθε καὶ κλαίετε?	1	Why are you upset and weeping?	Jesus asked this question to help them see their lack of faith. This may be written as a statement. Alternate translation: “This is not a time to be upset and crying.” (See: [[rc://en/ta/man/translate/figs-rquestion]])
MRK	5	39	g83c		τὸ παιδίον οὐκ ἀπέθανεν, ἀλλὰ καθεύδει	1	The child has not died, but is sleeping	Jesus uses the common word for sleep, and so should the translation.
MRK	5	40	jm38		κατεγέλων αὐτοῦ	1	They were laughing at him	Jesus used the common word for sleep (verse 39). The reader should understand that the people who hear Jesus laugh at him because they truly do know the difference between a dead person and a sleeping person and they think he does not.
MRK	5	40	tkl7		ἐκβαλὼν πάντας	1	having put them all outside	“having sent all the other people outside the house”
MRK	5	40	mi3u		τοὺς μετ’ αὐτοῦ	1	those with him	This refers to Peter, James, and John.
MRK	5	40	wca3	figs-explicit	εἰσπορεύεται ὅπου ἦν τὸ παιδίον	1	he enters where the child was	It may be helpful to state where **the child** is. Alternate translation: “he went into the room where the child was lying” (See: [[rc://en/ta/man/translate/figs-explicit]])
MRK	5	41	hx3c	translate-transliterate	ταλιθὰ, κοῦμ!	1	Talitha, koum!	This is an Aramaic sentence, which Jesus spoke to the little girl in her language. Write these words as is with your alphabet. (See: [[rc://en/ta/man/translate/translate-transliterate]])
MRK	5	42	pt5t	translate-numbers	ἦν…ἐτῶν δώδεκα	1	she was 12 years of age	“she was twelve years old” (See: [[rc://en/ta/man/translate/translate-numbers]])
MRK	5	43	i5ja	figs-quotations	διεστείλατο αὐτοῖς πολλὰ ἵνα μηδεὶς γνοῖ τοῦτο, καὶ	1	he strictly ordered them that no one should know about this, and	You can state this as a direct quote. Alternate translation: “he ordered them strictly, ‘No one should know about this!’ Then” or “he ordered them strictly, ‘Do not tell anyone about what I have done!’ Then” (See: [[rc://en/ta/man/translate/figs-quotations]])
MRK	5	43	ij1k		διεστείλατο αὐτοῖς πολλὰ	1	he strictly ordered them	“he strongly commanded them”
MRK	5	43	n29k	figs-quotations	καὶ εἶπεν δοθῆναι αὐτῇ φαγεῖν	1	and he told them to give her something to eat	You can state this as a direct quote. Alternate translation: “and he told them, ‘Give her something to eat.’” (See: [[rc://en/ta/man/translate/figs-quotations]])
MRK	6	intro	kl7n			0		# Mark 6 General Notes<br><br>## Special concepts in this chapter<br><br>### “Anointed with oil”<br><br>In the ancient Near East, people would try to heal sick people by putting olive oil on them.
MRK	6	1	mi7z			0	Connecting Statement:	Jesus returns to his hometown, where he is not accepted.
MRK	6	1	mjr1		τὴν πατρίδα αὐτοῦ	1	his hometown	This refers to the town of Nazareth, where Jesus grew up and where his family lived. This does not mean that he owned land there.
MRK	6	2	y4xj		τίς ἡ σοφία ἡ δοθεῖσα τούτῳ	1	what is this wisdom that has been given to him?	This question, which contains passive construction, can be asked in active form. Alternate translation: “what is this wisdom that he has gained?”
MRK	6	2	s1xy		διὰ τῶν χειρῶν αὐτοῦ γινόμεναι	1	being done by his hands	This phrase emphasizes that Jesus himself does the miracles. Alternate translation: “that he himself works”
MRK	6	3	s3wl	figs-rquestion	οὐχ οὗτός ἐστιν ὁ τέκτων, ὁ υἱὸς τῆς Μαρίας, καὶ ἀδελφὸς Ἰακώβου, καὶ Ἰωσῆτος, καὶ Ἰούδα, καὶ Σίμωνος? καὶ οὐκ εἰσὶν αἱ ἀδελφαὶ αὐτοῦ ὧδε πρὸς ἡμᾶς?	1	Is this not the carpenter, the son of Mary and the brother of James and Joses and Judas and Simon? And are his sisters not here with us?	These questions can be written as a statement. Alternate translation: “He is just an ordinary carpenter! We know him and his family. We know Mary his mother. We know his younger brothers James, Joses, Judas and Simon. And his younger sisters also live here with us.” (See: [[rc://en/ta/man/translate/figs-rquestion]])
MRK	6	3	tlub	translate-names	Ἰακώβου…Ἰωσῆτος…Ἰούδα…Σίμωνος	1	James … Joses … Judas … Simon	These are the names of men. (See: [[rc://en/ta/man/translate/translate-names]])
MRK	6	4	ni6w		αὐτοῖς	1	to them	“to the crowd”
MRK	6	4	l436	figs-doublenegatives	οὐκ ἔστιν προφήτης ἄτιμος, εἰ μὴ	1	A prophet is not without honor, except	This sentence uses a double negative to create emphasis of the positive equivalent. Alternate translation: “A prophet is always honored, except” or “The only place a prophet is not honored is” (See: [[rc://en/ta/man/translate/figs-doublenegatives]])
MRK	6	5	k9gh		ὀλίγοις ἀρρώστοις, ἐπιθεὶς τὰς χεῖρας	1	having laid his hands on a few sick people, he healed them.	Prophets and teachers would put their **hands** on people in order to heal them or bless them. In this case, Jesus was healing people.
MRK	6	7	w7qq	translate-versebridge		0	General Information:	Jesus’ instructions in verses 8 and 9 can be reordered to separate what he told the disciples to do from what he told them not to do, as in the UST. (See: [[rc://en/ta/man/translate/translate-versebridge]])
MRK	6	7	g5um			0	Connecting Statement:	Jesus sends his disciples out in sets of two to preach and to heal.
MRK	6	7	pmq4		προσκαλεῖται τοὺς δώδεκα	1	he called the Twelve	Here the word **called** means that he summoned the Twelve to come to him.
MRK	6	7	d6sx	translate-numbers	δύο δύο	1	two by two	“2 by 2” or “in pairs” (See: [[rc://en/ta/man/translate/translate-numbers]])
MRK	6	8	t9a2	figs-synecdoche	μὴ ἄρτον	1	no bread	Here, **bread** is a synecdoche for food in general. Alternate translation: “no food” (See: [[rc://en/ta/man/translate/figs-synecdoche]])
MRK	6	10	wv9h		ἔλεγεν αὐτοῖς	1	he was saying to them	“Jesus said to the Twelve”
MRK	6	10	h31d	figs-metonymy	ἐκεῖ μένετε ἕως ἂν ἐξέλθητε ἐκεῖθεν	1	remain there until you may go away from there	Here, **remain** represents daily going back to that house to eat and sleep there. Alternate translation: “eat and sleep in that house until you leave that place” (See: [[rc://en/ta/man/translate/figs-metonymy]])
MRK	6	11	b2kb	figs-explicit	εἰς μαρτύριον αὐτοῖς	1	as a testimony against them	It may be helpful to explain how this action was **a testimony against them**. Alternate translation: “as a testimony to them. By doing that, you will be testifying that they did not welcome you” (See: [[rc://en/ta/man/translate/figs-explicit]])
MRK	6	12	sqt2	figs-ellipsis	ἐξελθόντες	1	having gone out	It may be helpful to state that they went out to various towns. Alternate translation: “having gone out to various towns” (See: [[rc://en/ta/man/translate/figs-ellipsis]])
MRK	6	12	xtva		ἐκήρυξαν	1	they proclaimed	The word **they** refers to the Twelve and does not include Jesus.
MRK	6	13	i7eq	figs-ellipsis	δαιμόνια πολλὰ ἐξέβαλλον	1	they were casting out many demons	It may be helpful to state that they cast the demons out of people. Alternate translation: “they were casting many demons out of people” (See: [[rc://en/ta/man/translate/figs-ellipsis]])
