Book	Chapter	Verse	ID	SupportReference	OrigQuote	Occurrence	GLQuote	OccurrenceNote
GAL	6	1	rrg9	figs-yousingular	σκοπῶν σεαυτόν	1	Be concerned about yourself	These words treat the Galatians as though they are all one person to emphasize that he is talking to each of them. Alternate translation: “Be concerned about yourselves” or “I say to each one of you, ‘Be careful for yourself’” (See: [[rc://en/ta/man/translate/figs-yousingular]])
GAL	6	1	ljx6	figs-activepassive	μὴ καὶ σὺ πειρασθῇς	1	so you also may not be tempted	If your language does not use the passive form in this way, you can state this in active form or in another way that is natural in your language. Alternate translation: “so that you  are tempted and also sin” (See: [[rc://en/ta/man/translate/figs-activepassive]])
GAL	6	2	m6jz		ἀναπληρώσετε τὸν νόμον τοῦ Χριστοῦ	1		Here, **the law of Christ** does not refer to a set of rules, but most likely to the Messiah’s command to love one another in [John 13:34](1jn/13/34). It involves submission to the person of Jesus and not to a code or list of commandments. This is similar to Paul’s statement that the law can be summarized by loving one another in [Galatians 5:14].
GAL	6	3	v6ts		εἰ γὰρ	1	For if	**For** could be connected to: (1) **carry one another’s burdens** ([Galatians 6:2](../06/02.md)) (2)  **lest you also might be tempted** ([Galatians 6:1](../06/01.md)) (3) *Let us not become conceited** ([Galatians 5:26](../05/26.md)).
GAL	6	3	m4wk		εἶναί τι	1	he is something	Alternate translation: “he is better than others”
GAL	6	3	zz1g		μηδὲν ὤν	1	he is nothing	Alternate translation: “he is not better than others”
GAL	6	5	ee8v		τὸ ἴδιον φορτίον βαστάσει	1	each one will carry his own load	The could mean: (1) each person has their own responsibilities and tasks. Alternate translation: “each person must do the work that God has given him” or “each person is responsible for only his  work” (2) each person is responsible for their own weaknesses and sins. Alternate translation: “each person is responsible for their own weaknesses”
GAL	6	7	x5pi	figs-metaphor	ὃ γὰρ ἐὰν σπείρῃ ἄνθρωπος, τοῦτο καὶ θερίσει	1	for whatever a man plants, that he will also gather in	Here, **sow** represents doing things that end in some kind of result, and **reap** represents experiencing the results of what one has done. Alternate translation: “for just as a farmer gathers in the fruit of whatever kind of seeds he plants, so everyone experiences the results of whatever he does” (See: [[rc://en/ta/man/translate/figs-metaphor]])
GAL	6	7	gii9	figs-gendernotations	ὃ γὰρ ἐὰν σπείρῃ ἄνθρωπος	1	whatever a man plants	Alternate translation: “whatever a person plants” or “whatever someone plants” (See: [[rc://en/ta/man/translate/figs-gendernotations]])
GAL	6	8	lzz8	figs-metaphor	ὁ σπείρων εἰς τὴν σάρκα ἑαυτοῦ	1	plants seed to his own sinful nature	Here, **sowing** is a metaphor for doing deeds that will have consequences later. In this case, **sowing to his own flesh** refers to a person doing sinful actions because of his sinful nature. Alternate translation: “the person who continually does deeds following the evil desires of their heart” or “the person who does the things he wants to do because of his sinful nature” or “the person who does what pleases his sinful self” (See: [[rc://en/ta/man/translate/figs-metaphor]])
GAL	6	8	dge9	figs-metaphor	θερίσει φθοράν	1	will gather in destruction	Here, **destruction** refers to God punishing the person as if the person were harvesting a crop. Alternate translation: “will receive punishment for what he did” or “he will harvest death” or “he will harvest punishment that is forever” (See: [[rc://en/ta/man/translate/figs-metaphor]])
GAL	6	8	aqz2	figs-metaphor	ὁ δὲ σπείρων εἰς τὸ Πνεῦμα	1	plants seed to the Spirit	Here, **sowing** is a metaphor for doing deeds that will have consequences later. In this case, **sowing to the Spirit** refers to a person who does good actions because he is obeying and following God’s Spirit. Alternate translation: “the person who does the things God’s Spirit loves” or “the person who lives to please the Spirit” (See: [[rc://en/ta/man/translate/figs-metaphor]])
GAL	6	8	k1p7		ἐκ τοῦ Πνεύματος θερίσει ζωὴν αἰώνιον	1	will gather in eternal life from the Spirit	Here, **eternal life** refers to God rewarding the person as if the person were harvesting a crop. Alternate translation: “will receive eternal life as a reward from God’s Spirit” or “he will harvest eternal life from the Holy Spirit”
GAL	6	9	u77c		καιρῷ γὰρ ἰδίῳ	1	for at the right time	Alternate translation: “for at the proper time” or “when the right time arrives”
GAL	6	10	ax66		ἄρα οὖν	1	So then	Alternate translation: “As a result of this” or “Because of this”
GAL	6	10	jz9i		τοὺς οἰκείους τῆς πίστεως	1	those who belong to the household of faith	Alternate translation: “those who are members of God’s family through faith in Christ”
GAL	6	11	i7ap			0	Connecting Statement:	As Paul closes this letter, he gives one more reminder that the law does not save and that they should remember the cross of Christ.
GAL	6	11	d6rk		τῇ ἐμῇ χειρί	1	with my own hand	This could mean: (1) Paul had someone write most of this letter as Paul told him what to write, but Paul himself wrote this last part of the letter (2) Paul wrote the whole letter himself.
GAL	6	12	kmd7		εὐπροσωπῆσαι ἐν σαρκί	1	make a good impression	Alternate translation: “others will think well of them” or “others will think that they are good people”
GAL	6	12	r5p1		ἐν σαρκί	1	in the flesh	Here, **in the flesh** refers to their desire to circumcise the Galatian believers. Alternate translation: “outwardly” or “by the way their bodies appear”
GAL	6	12	jd4x	figs-metonymy	τῷ σταυρῷ	1	the cross	Here, **for the cross** represents what Christ did for us when he died on the cross. Alternate translation: “the work Jesus did on the cross” (See: [[rc://en/ta/man/translate/figs-metonymy]])
GAL	6	14	v2qs	figs-ellipsis	κἀγὼ κόσμῳ	1	I to the world	The words **has been crucified** are understood from the previous phrase. This means  that the natural world has stopped having any claims or influence on Paul. Alternate translation: “and I have been crucified to the world” (See: [[rc://en/ta/man/translate/figs-ellipsis]])
GAL	6	15	n6n7		καινὴ κτίσις	1	a new creation	Here, **a new creation** refers to the whole process of conversion when someone trusts in the Messiah and the Holy Spirit gives that person new life.
GAL	6	16	b4al		τὸν Ἰσραὴλ τοῦ Θεοῦ	1	peace and mercy be upon them, even upon the Israel of God	This could refer to: (1) believers in general are the Israel of God (2) Jewish believers are the Israel of God (3) the Jews in general are the Israel of God
GAL	6	17	cz8a		κόπους μοι	1	trouble me	This means Paul does not want the Galatian believers to doubt his authority or continue to cause him trouble by following teachers who demand them to become circumcised.
GAL	6	17	j729		ἐγὼ γὰρ τὰ στίγματα τοῦ Ἰησοῦ ἐν τῷ σώματί μου βαστάζω	1	for I carry on my body the marks of Jesus	Here, **the marks** were scars from people who beat and whipped Paul because they did not like him teaching about Jesus. Alternate translation: “for the scars on my body show that I serve Jesus”
GAL	6	18	pk25		ἀδελφοί	1	brothers	See how you translated this in [Galatians 1:2](../01/02.md).