Book	Chapter	Verse	ID	SupportReference	OrigQuote	Occurrence	GLQuote	OccurrenceNote
JHN	front	intro	t6za			0		# Introduction to the Gospel of John<br><br>## Part 1: General Introduction<br><br>### Outline of the Gospel of John<br><br>1. Introduction about who Jesus is (1:1–18)<br>2. Jesus is baptized, and he chooses twelve disciples (1:19–51)<br>3. Jesus preaches, teaches, and heals people (2–11)<br>4. The seven days before Jesus’ death (12–19)<br>    *   Mary anoints the feet of Jesus (12:1–11)<br>    *   Jesus rides a donkey into Jerusalem (12:12–19)<br>    *   Some Greek men want to see Jesus (12:20–36)<br>    *   The Jewish leaders reject Jesus (12:37–50)<br>    *   Jesus teaches his disciples (13–17)<br>    *   Jesus is arrested and undergoes trial (18:1–19:15)<br>    *   Jesus is crucified and buried (19:16–42)<br>5. Jesus rises from the dead (20:1–29)<br>6. John says why he wrote his gospel (20:30–31)<br>7. Jesus meets with the disciples (21)<br><br>### What is the Gospel of John about?<br><br>The Gospel of John is one of four books in the New Testament that describe some of the life and teachings of Jesus Christ. These books are called “Gospels,” which means “good news.” Their authors wrote about different aspects of who Jesus was and what he did. John said that he wrote his Gospel “so that people might believe that Jesus is the Christ, the Son of the living God” (20:31). John’s Gospel repeatedly emphasizes that Jesus is God in human form.<br><br>John’s Gospel is very different from the other three Gospels. John does not include some of the teachings and events that the other writers included in their Gospels. Also, John wrote about some teachings and events that are not in the other Gospels.<br><br>John wrote much about the miraculous signs Jesus did to prove that what Jesus said about himself was true. (See: [[rc://en/tw/dict/bible/kt/sign]])<br><br>### How should the title of this book be translated?<br><br>Translators may choose to call this book by its traditional title, “The Gospel of John” or “The Gospel According to John.” Or they may choose a title that may be clearer, such as, “The Good News About Jesus That John Wrote.” (See: [[rc://en/ta/man/translate/translate-names]])<br><br>### Who wrote the Gospel of John?<br><br>This book does not give the name of the author. However, since early Christian times, most Christians have thought that the Apostle John was the author. Further evidence that the Apostle John wrote this Gospel is the fact that his name does not occur once within it. Instead, this Gospel contains the phrase “the disciple whom Jesus loved” in places where the other Gospels indicate that John was involved. The Apostle John most likely referred to himself in this manner because he wanted to humbly testify to his close relationship with Jesus as part of Jesus’ inner circle of disciples who became the “pillars” of the early church (Galatians 2:9).<br><br>## Part 2: Important Religious and Cultural Concepts<br><br>### Why does John write so much about the final week of Jesus’ life?<br><br>John wrote much about Jesus’ final week. He wanted his readers to think deeply about Jesus’ final week and his death on the cross. He wanted people to understand that Jesus willingly died on the cross so that God could forgive them for sinning against him. (See: [[rc://en/tw/dict/bible/kt/sin]])<br><br>## Part 3: Important Translation Issues<br><br>### What do the words “remain,” “reside,” and “abide” mean in the Gospel of John?<br><br>John often used the words “remain,” “reside”, and “abide” as metaphors. John spoke of a believer becoming more faithful to Jesus and knowing Jesus better as if Jesus’ word “remained” in the believer. John also spoke of someone being spiritually joined to someone else as if the person “remained” in the other person. Christians are said to “remain” in Christ and in God. The Father is said to “remain” in the Son, and the Son is said to “remain” in the Father. The Son is said to “remain” in believers. The Holy Spirit is also said to “remain” in the believers.<br><br>Many translators will find it impossible to represent these ideas in their languages in exactly the same way. For example, Jesus intended to express the idea of the Christian being spiritually together with him when he said, “He who eats my flesh and drinks my blood remains in me, and I in him” (John 6:56). The UST uses the idea of “will be joined to me, and I will be joined to him.” But translators may have to find other ways of expressing the idea.<br><br>In the passage, “If my words remain in you” (John 15:7), the UST expresses this idea as, “If you live by my message.” Translators may find it possible to use this translation as a model.<br><br>### What are the major issues in the text of the Gospel of John?<br><br>The following verses found in older versions of the Bible but are not included in most modern versions. Translators are advised not to translate these verses. However, if in the translators’ region, there are older versions of the Bible that include these verses, the translators can include them. If they are translated, they should be put inside square brackets (\[\]) to indicate that they were probably not original to John’s Gospel.<br><br>*   “waiting for the moving of the water. For an angel of the Lord occasionally went down into the pool and stirred the water and whoever went first after the stirring of the water, was made well from the disease they had.” (5:3-4)<br>*   “going through the midst of them, and so passed by” (8:59)<br><br>The following passage is included in most older and modern versions of the Bible. But it is not in the earliest copies of the Bible. Translators are advised to translate this passage. It should be put inside of square brackets (\[\]) to indicate that it may not have been original to John’s Gospel.<br><br>*   The story of the adulterous woman (7:53-8:11)<br><br>(See: [[rc://en/ta/man/translate/translate-textvariants]])
JHN	1	intro	k29b			0		# John 1 General Notes<br><br>## Structure and formatting<br><br>Some translations set each line of poetry farther to the right than the rest of the text to make it easier to read. The ULT does this with the poetry in [1:23](../01/23.md), which are words from the Old Testament.<br><br>## Special concepts in this chapter<br><br>### “The Word”<br><br>John uses the phrase “the Word” to refer to Jesus ([1:1, 14](../01/01.md)). John is saying that God’s most important message to all people is actually Jesus, a person with a physical body. (See: [[rc://en/tw/dict/bible/kt/wordofgod]])<br><br>### Light and Darkness<br><br>The Bible often speaks of unrighteous people, people who do not do what pleases God, as if they were walking around in darkness. It speaks of light as if it were what enables those sinful people to become righteous, to understand what they are doing wrong and begin to obey God. In [1:4–9](../01/04.md), John uses an extended metaphor in which light represents what is true and good and darkness represents what is false and evil. John applies that light metaphor to Jesus in order to show that Jesus is the embodiment of God’s truth and goodness. (See: [[rc://en/tw/dict/bible/kt/righteous]])<br><br>### “Children of God”<br><br>People are sometimes described as “children of God” because God created them. However, John uses this expression in a different sense in this chapter. He uses it to describe people who have entered into a father-child relationship with God by putting their faith and trust in Jesus. God indeed created all people, but people can only become children of God in this sense by believing in Jesus. "Children" in this usage does not refer to those who are young, but only to the relationship that people have at any age to their father. (See: [[rc://en/tw/dict/bible/kt/believe]])<br><br>## Important figures of speech in this chapter<br><br>### Metaphors<br><br>John uses the metaphors of light and darkness and of “the Word” to tell the reader that he will be writing more about good and evil and about what God wants to tell people through Jesus. (See: [[rc://en/ta/man/translate/figs-metaphor]])<br><br>## Other possible translation difficulties in this chapter<br><br>### “In the beginning”<br><br>Some languages and cultures speak of the world as if it has always existed, as if it had no beginning. But “very long ago” is different from “in the beginning,” and you need to be sure that your translation communicates correctly.<br><br>### “Son of Man”<br><br>Jesus refers to himself as the “Son of Man” in this chapter ([1:51](../01/51.md)). Your language may not allow people to speak of themselves as if they were speaking about someone else. (See: [[rc://en/tw/dict/bible/kt/sonofman]] and [[rc://en/ta/man/translate/figs-123person]])
JHN	1	1	er9g		ἐν ἀρχῇ ἦν	1	In the beginning	This phrase refers to the very earliest time before God created the heavens and the earth. It does not refer to time in the distant past. Alternate translation: “Before the beginning of the universe there was” or “Before the universe began there was”
JHN	1	1	z59q	figs-explicit	ὁ λόγος, καὶ ὁ λόγος…καὶ Θεὸς ἦν ὁ λόγος	1	the Word	Here, **the Word** refers to Jesus. It does not refer to a spoken word. ULT indicates this by capitalizing **Word** to indicate that this is a title for Jesus. Use whatever convention your language uses to indicate that this is a name. If “word” is feminine in your language, it could be translated as “the one who is called the Word.” Alternate translation: “Jesus, who is the Word, and Jesus … and Jesus was God” (See: [[rc://en/ta/man/translate/figs-explicit]])
JHN	1	2	u6xx	writing-pronouns	οὗτος	1		**He** here refers to Jesus, whom John has called “the Word” in the previous verse. If it would be clearer in your language, you could say this explicitly. Alternate translation: “Jesus” or “the Word” (See: [[rc://en/ta/man/translate/writing-pronouns]])
JHN	1	2	k8cf		ἐν ἀρχῇ	1		Here, this phrase refers to the very earliest time before God created the heavens and the earth. See how you translated this phrase in verse [1](../01/01.md). Alternate translation: “before the beginning of the universe” or “before the universe began”
JHN	1	3	gm5g	figs-activepassive	πάντα δι’ αὐτοῦ ἐγένετο	1	All things were made through him	If it would be clearer in your language, you can translate this with an active verb and say who did the action. Alternate translation: “God made all things through him” (See: [[rc://en/ta/man/translate/figs-activepassive]])
JHN	1	3	t1lj	writing-pronouns	αὐτοῦ	1		Here, **him** refers to Jesus, the one who is called “the Word.” If it would be clearer in your language, you could say this explicitly. Alternate translation: “Jesus” or “the Word” (See: [[rc://en/ta/man/translate/writing-pronouns]])
JHN	1	3	aqs1	figs-doublenegatives	χωρὶς αὐτοῦ ἐγένετο οὐδὲ ἕν ὃ γέγονεν	1	without him there was not one thing made that has been made	If your language does not permit double negatives, these words should communicate that the opposite of “all things were made through him” is false. Alternate translation: “with him came into being everything that came into being” (See: [[rc://en/ta/man/translate/figs-doublenegatives]])
JHN	1	3	v4yk	figs-activepassive	χωρὶς αὐτοῦ ἐγένετο οὐδὲ ἕν ὃ γέγονεν	1		If it would be clearer in your language, you can translate this with an active verb and say who did the action. Alternate translation: “God did not make one thing without him” or “God made with him everything that God has made” (See: [[rc://en/ta/man/translate/figs-activepassive]])
JHN	1	4	dv2f	writing-pronouns	ἐν αὐτῷ	1	In him	Here, **him** refers to Jesus, the one who is called “the Word.” If it would be clearer in your language, you could say this explicitly. Alternate translation: “Jesus” or “the Word” (See: [[rc://en/ta/man/translate/writing-pronouns]])
JHN	1	4	pz5c		ζωὴ	1		Here, it is best to use a general term for **life**. If you must use a more specific word, consider that **life** here could refer to: (1) eternal life, which is the meaning John uses for this term throughout this Gospel. Alternate translation: “the means of receiving eternal life” (2) physical life, which would mean that this verse continues the discussion about the creation of the universe in the previous verses. Alternate translation: “the life of all living things” (3) both physical life and eternal life. Alternate translation: “the life of all living things and the source of eternal life” (See: [[rc://en/tw/dict/bible/kt/life]])
JHN	1	4	ffbw	figs-explicit	καὶ ἡ ζωὴ	1		Here, **the life** refers to the same life stated in the previous phrase. If it would be clearer in your language, you could say this explicitly. Alternate translation: “and that life” (See: [[rc://en/ta/man/translate/figs-explicit]])
JHN	1	4	dpeb	figs-metaphor	τὸ φῶς τῶν ἀνθρώπων	1		Here, **light** is a metaphor for what is true and good. Alternate translation: “the true and good things” (See: [[rc://en/ta/man/translate/figs-metaphor]])
JHN	1	4	saci	figs-possession	τὸ φῶς τῶν ἀνθρώπων	1		Here, **of** indicates to whom the **light** is given. Alternate translation: “the light given to men” (See: [[rc://en/ta/man/translate/figs-possession]])
JHN	1	4	jzwk	figs-gendernotations	 τῶν ἀνθρώπων	1		Although the term **men** is masculine, John is using the word here in a generic sense that includes both men and women. Alternate translation: “of people” (See: [[rc://en/ta/man/translate/figs-gendernotations]])
JHN	1	5	dgin	figs-metaphor	τὸ φῶς…φαίνει	1		Here, **the light shines** is a metaphor. John speaks figuratively of God's truth and goodness being revealed as if it were a light shining. This truth and goodness was revealed to the world by Jesus. He is the embodiment of God's truth and goodness. If it would be clearer in your language, you could say this plainly or with a simile. Alternate translation: “God reveals his truth and goodness” or “God’s truth and goodness is like a light that shines” (See: [[rc://en/ta/man/translate/figs-metaphor]])
JHN	1	5	y5ry	figs-metaphor	ἐν τῇ σκοτίᾳ…καὶ ἡ σκοτία	1	The light shines in the darkness, and the darkness did not overcome it	Here, **darkness** is a metaphor for what is false and evil. It is the spiritual **darkness** of the people in the world who do not love Jesus. If it would be clearer in your language, you could say this plainly or with a simile. Alternate translation: “in the false and evil world, and that evil world” or “in the evil world that is like a dark place, and that dark place” (See: [[rc://en/ta/man/translate/figs-metaphor]])
JHN	1	5	w9ni		αὐτὸ οὐ κατέλαβεν	1		Here, the word translated **overcome** could also be translated as “understand.” It could mean: (1) the evil forces in the world did not conquer God’s truth and goodness. Alternate translation: “did not conquer it” (2) the people in the world who don't know God do not understand his truth and goodness. Alternate translation: “did not comprehend it” (3) the evil forces of this world neither conquered nor understood God’s truth and goodness. Alternate translation: “did not conquer or comprehend it” 
JHN	1	5	yv8l	writing-pronouns	αὐτὸ οὐ κατέλαβεν	1		Here, **it** refers to the light mentioned earlier in the verse. If it would be clearer in your language, you could say this explicitly. Alternate translation: “did not overcome the light” (See: [[rc://en/ta/man/translate/writing-pronouns]])
JHN	1	6	qa1s	figs-activepassive	ἀπεσταλμένος παρὰ Θεοῦ	1		If it would be clearer in your language, you could use an active verbal form in place of the passive verbal form **having been sent**. Alternate translation, as in the UST: “whom God has sent” (See: [[rc://en/ta/man/translate/figs-activepassive]])
JHN	1	6	gih6	figs-explicit	Ἰωάννης	1		Here, **John** refers to Jesus’ cousin, often referred to as “John the Baptist.” (See: rc://en/tw/dict/bible/names/johnthebaptist) It does not refer to the Apostle John who wrote this Gospel. If it would be clearer to your readers, you could say this explicitly. Alternate translation: “John the Baptist” or “John the Immerser” (See: [[rc://en/ta/man/translate/figs-explicit]])
JHN	1	7	mtlb	writing-pronouns	οὗτος 	1		**He** here refers to John the Baptist, who was introduced in the previous verse. If it would be clearer in your language, you could say this explicitly. Alternate translation: “John the Baptist” or “John the Immerser” (See: [[rc://en/ta/man/translate/writing-pronouns]])
JHN	1	7	mht8	figs-metaphor	περὶ τοῦ φωτός	1	testify about the light	Here, **light** is a metaphor for the revelation of God’s truth and goodness in Jesus. If it would be clearer in your language, you could say this plainly. Alternate translation: “about Jesus, who revealed the true and good things of God” (See: [[rc://en/ta/man/translate/figs-metaphor]])
JHN	1	7	cdl5		δι’ αὐτοῦ	1		Here, **through** indicates the means by which everyone might believe in the light. If it would be clearer in your language, you could say this explicitly. Alternate translation: “by means of him”
JHN	1	7	m4fo	writing-pronouns	δι’ αὐτοῦ	1		Here, **him** refers to John the Baptist. It does not refer to Jesus or the light. If it would be clearer in your language, you could say this explicitly. Alternate translation: “through John the Baptist” or “through John the Immerser” (See: [[rc://en/ta/man/translate/writing-pronouns]])
JHN	1	8	pn9t	writing-pronouns	ἐκεῖνος 	1		**That one** here refers to John the Baptist. If it would be clearer in your language, you could say this explicitly. Alternate translation: “John the Baptist” or “John the Immerser” (See: [[rc://en/ta/man/translate/writing-pronouns]])
JHN	1	8	kbwh	figs-metaphor	τὸ φῶς…τοῦ φωτός	1		Here, **light** is a metaphor for the revelation of God’s truth and goodness in Jesus. See how you translated it in the previous verse. Alternate translation: “Jesus, who revealed the true and good things of God … Jesus” (See: [[rc://en/ta/man/translate/figs-metaphor]])
JHN	1	9	xe1z	figs-metaphor	τὸ φῶς τὸ ἀληθινὸν, ὃ 	1	The true light	Here, **light** is a metaphor that represents Jesus as the one who both reveals the truth about God and is himself that truth. If it would be clearer in your language, you could say this plainly. Alternate translation: “Jesus, who truly embodied God’s truth, who” (See: [[rc://en/ta/man/translate/figs-metaphor]])
JHN	1	9	rbsj	figs-metaphor	ὃ φωτίζει πάντα ἄνθρωπον	1		Here, **light** is a metaphor for God’s truth and goodness. Alternate translation: “which reveals the true and good things of God to all men” (See: [[rc://en/ta/man/translate/figs-metaphor]])
JHN	1	9	u00s	figs-gendernotations	ἄνθρωπον	1		Although the term **men** is masculine, John is using the word here in a generic sense that includes both men and women. Alternate translation: “people” (See: [[rc://en/ta/man/translate/figs-gendernotations]])
JHN	1	10	c2ne	writing-pronouns	ἦν…δι’ αὐτοῦ…αὐτὸν	1		**He** and **him** in this verse refer to Jesus. If if would be clearer in your language, you could say this explicitly. Alternate translation: “Jesus was … through Jesus … Jesus” (See: [[rc://en/ta/man/translate/writing-pronouns]])
JHN	1	10	io8w	figs-metonymy	ἐν τῷ κόσμῳ	1		Here, **world** refers to to the earth on which people live. It does not refer only to the people in the world or to the entire universe. Alternate translation: “on the earth” (See: [[rc://en/ta/man/translate/figs-metonymy]])
JHN	1	10	krcb	figs-metonymy	ὁ κόσμος	1		Here, **world** refers to the universe God created. It does not refer only to the people in the world or only to the earth. Alternate translation: “the universe” (See: [[rc://en/ta/man/translate/figs-metonymy]])
JHN	1	10	b93e	grammar-connect-logic-contrast	καὶ ὁ κόσμος αὐτὸν οὐκ ἔγνω	1	He was in the world, and the world was made through him, and the world did not know him	Here, **and** introduces a contrast between what was expected, that the world would recognize its Creator, and what happened, that the world did to do that. Alternate translation: “but the world did not know him” or “yet the world did not know him” (See: [[rc://en/ta/man/translate/grammar-connect-logic-contrast]])
JHN	1	10	ke5s	figs-metonymy	ὁ κόσμος	2	the world did not know him	Here, **world** refers to the people who lived in it. Alternate translation: “the people in the world” (See: [[rc://en/ta/man/translate/figs-metonymy]])
JHN	1	10	t1qv		οὐκ ἔγνω	1		Alternate translation: “did not acknowledge” 
JHN	1	11	jr6d	writing-pronouns	εἰς τὰ ἴδια ἦλθεν	1	He came to his own, and his own did not receive him	**He**, **his**, and **him** in this verse refer to Jesus. If if would be clearer in your language, you could say this explicitly. Alternate translation: “Jesus came to his own” (See: [[rc://en/ta/man/translate/writing-pronouns]])
JHN	1	11	jvgs	figs-explicit	τὰ ἴδια…οἱ ἴδιοι	1		Here, **his own** could refer to: (1) his own people, the nation of Israel. Alternate translation: “his fellow Jews … his fellow Jews” (2) his own creation. Alternate translation: “the people he created … the people he created” (See: [[rc://en/ta/man/translate/figs-explicit]])
JHN	1	11	h13y	grammar-connect-logic-contrast	καὶ	1		Here, **and** introduces a contrast between what was expected, that his own people would know their Messiah, and what happened, that his own people did not do that. Alternate translation: “but” (See: [[rc://en/ta/man/translate/grammar-connect-logic-contrast]])
JHN	1	11	va1w		αὐτὸν οὐ παρέλαβον	1	receive him	Here, **receive** means to accept a person into one’s presence with friendliness. Alternate translation: “did not accept him” or “did not welcome him”
JHN	1	12	pvtl	figs-infostructure	ὅσοι δὲ ἔλαβον αὐτόν, ἔδωκεν αὐτοῖς ἐξουσίαν τέκνα Θεοῦ γενέσθαι, τοῖς πιστεύουσιν εἰς τὸ ὄνομα αὐτοῦ	1		If it would be natural in your language, you could change the order of these phrases. You will also need to adjust some words to fit the new order. Alternate translation: “But as many as received him and believed in his name, he gave to them the authority to become children of God” (See: [[rc://en/ta/man/translate/figs-infostructure]])
JHN	1	12	ijje		ἔλαβον αὐτόν	1		Here, **receive** means to accept a person into one’s presence with friendliness. See how you translated this word in the previous verse. Alternate translation: “accepted him” or “welcomed him”
JHN	1	12	w20o	writing-pronouns	αὐτόν	1		Here, **him** and all singular third person pronouns in this verse refer to Jesus. If it would be clearer in your language, you could say this explicitly. Alternate translation: “Jesus” (See: [[rc://en/ta/man/translate/writing-pronouns]])
JHN	1	12	x4f9		ἔδωκεν αὐτοῖς ἐξουσίαν	1	he gave the right	Here, the word translated **authority** means either the right or ability to do something. Alternate translation: “he gave to them the right” or “he made it possible for them”
JHN	1	12	uc6e	figs-metaphor	τέκνα Θεοῦ	1	children of God	The word **children** is a metaphor that represents our relationship to God, which is like children to a father. (See: [[rc://en/ta/man/translate/figs-metaphor]])
JHN	1	12	jp3y	figs-metonymy	πιστεύουσιν εἰς τὸ ὄνομα αὐτοῦ	1	believed in his name	Here, **name** is a metonym that stands for Jesus’ identity and everything about him. Alternate translation: “believed in him” (See: [[rc://en/ta/man/translate/figs-metonymy]])
JHN	1	13	no4j	writing-pronouns	οἳ	1		**These** here refers to the children of God mentioned in the previous verse. If it would be clearer for your readers, you could say this explicitly. Alternate translation: “These children of God” (See: [[rc://en/ta/man/translate/writing-pronouns]])
JHN	1	13	ygxb	figs-metaphor	ἐγεννήθησαν	1		Here, **born** is used figuratively to describe God changing a person from being dead spiritually to being alive spiritually when they believe in Jesus. John recorded Jesus referring to this change as being “born again” in [3:3](../03/03.md). (See: [[rc://en/tw/dict/bible/kt/bornagain]]) If it would be clearer in your language, you could use an expression that indicates spiritual rebirth rather than physical birth. Alternate translation: “born spiritually” (See: [[rc://en/ta/man/translate/figs-metaphor]])
JHN	1	13	k24g	figs-metaphor	οὐκ ἐξ αἱμάτων…ἐγεννήθησαν	1		Here, **bloods** refers to the bloodlines or genetic contributions of both parents of a child. Alternate translation: “were not born from human bloodlines” or “were not born from human decent” (See: [[rc://en/ta/man/translate/figs-metaphor]])
