Book	Chapter	Verse	ID	SupportReference	OrigQuote	Occurrence	GLQuote	OccurrenceNote
MRK	12	9	rde6	grammar-connect-words-phrases	οὖν	1	Therefore	Jesus has finished telling the parable and is now asking the people what they think will happen next. (See: [[rc://en/ta/man/translate/grammar-connect-words-phrases]])
MRK	12	9	g4ce		ἀπολέσει	1	destroy	kill
MRK	12	9	mc5y	figs-explicit	δώσει τὸν ἀμπελῶνα ἄλλοις	1	will give the vineyard to others	The word **others** refers to other vine growers who will care for the vineyard. Alternate translation: “he will give the vineyard to other vine growers to care for it” (See: [[rc://en/ta/man/translate/figs-explicit]])
MRK	12	10	v6ta			0	General Information:	This scripture was written long before in God’s word.
MRK	12	10	xj9j	figs-rquestion	οὐδὲ τὴν Γραφὴν ταύτην ἀνέγνωτε:	1	And have you not read this scripture?	Jesus reminds the people of a **scripture** passage. He uses a rhetorical question here to rebuke them. This can be written as a statement. Alternate translation: “And surely you have read this scripture.” or “And you should remember this scripture.” (See: [[rc://en/ta/man/translate/figs-rquestion]])
MRK	12	10	jpa3		ἐγενήθη εἰς κεφαλὴν γωνίας	1	has become the head of the corner	You can state this in active form. Alternate translation: “the Lord made into the cornerstone”
MRK	12	11	r8z8		παρὰ Κυρίου ἐγένετο αὕτη	1	This came from the Lord	“The Lord has done this”
MRK	12	11	k5w6	figs-metaphor	ἔστιν θαυμαστὴ ἐν ὀφθαλμοῖς ἡμῶν	1	it is marvelous in our eyes	Here, **in our eyes** stands for seeing, which is a metaphor for the people’s opinion. Alternate translation: “we have seen it and think that it is marvelous” or “we think that it is wonderful” (See: [[rc://en/ta/man/translate/figs-metaphor]])
MRK	12	12	b1vz		ἐζήτουν αὐτὸν κρατῆσαι	1	they were seeking to seize him	Here, **they** refers to the chief priests, scribes, and elders. This group may be referred to as “the Jewish leaders.”
MRK	12	12	sl74		ἐζήτουν	1	they were seeking	“they wanted”
MRK	12	12	lx62	figs-explicit	καὶ ἐφοβήθησαν τὸν ὄχλον	1	but they feared the crowd	They were afraid of what **the crowd** would do to them if they arrested Jesus. This can be made clear. Alternate translation: “but they feared what the crowd would do if they arrested him” (See: [[rc://en/ta/man/translate/figs-explicit]])
MRK	12	12	v9wb		πρὸς αὐτοὺς	1	against them	“to accuse them”
MRK	12	13	s1hb			0	Connecting Statement:	In an effort to trap Jesus, some of the Pharisees and Herodians, and then the Sadducees, come to Jesus with questions.
MRK	12	13	z2sf		καὶ ἀποστέλλουσιν	1	And they send	“Then the Jewish leaders sent”
MRK	12	13	pj3c		τῶν Ἡρῳδιανῶν	1	the Herodians	This was the name of an informal political party that supported Herod Antipas.
MRK	12	13	kuy5	figs-metaphor	ἵνα αὐτὸν ἀγρεύσωσιν	1	in order to trap him	Here the author describes tricking Jesus as “trapping him.” Alternate translation: “to trick him” (See: [[rc://en/ta/man/translate/figs-metaphor]])
MRK	12	14	dh3d		λέγουσιν	1	they say	Here, **they** refers to those sent from among the Pharisees and the Herodians.
MRK	12	14	cp3x	figs-litotes	οὐ μέλει σοι περὶ οὐδενός	1	it is not a concern to you about anyone	The negation can modify the verb. Alternate translation: “you do not care about people’s opinions” (See: [[rc://en/ta/man/translate/figs-litotes]])
MRK	12	14	xptc	figs-idiom	οὐ μέλει σοι περὶ οὐδενός	1	it is not a concern to you about anyone	This is an idiom that means that Jesus does not show favoritism. Alternate translation: “you are not concerned with earning people’s favor” (See: [[rc://en/ta/man/translate/figs-idiom]])
MRK	12	15	g48w	figs-explicit	ὁ…εἰδὼς αὐτῶν τὴν ὑπόκρισιν	1	he, knowing their hypocrisy	They were acting hypocritically. This can be explained more clearly. Alternate translation: “Jesus, knowing that they did not really want to know what God wanted them to do” (See: [[rc://en/ta/man/translate/figs-explicit]])
MRK	12	15	c7nj	figs-rquestion	τί με πειράζετε?	1	Why do you test me?	Jesus rebukes the Jewish leaders because they were trying to trick him. This can be written as a statement. Alternate translation: “I know you are trying to make me say something wrong so you can accuse me.” (See: [[rc://en/ta/man/translate/figs-rquestion]])
MRK	12	15	wl34	translate-bmoney	δηνάριον	1	a denarius	This coin was worth a day’s wages. (See: [[rc://en/ta/man/translate/translate-bmoney]])
MRK	12	16	ev6s		οἱ δὲ ἤνεγκαν	1	And they brought one	“So the Pharisees and the Herodians brought a denarius”
MRK	12	16	wd1n		ἡ εἰκὼν αὕτη καὶ ἡ ἐπιγραφή	1	is this likeness and inscription	“is this picture and name”
MRK	12	16	gi96	figs-ellipsis	οἱ…εἶπαν αὐτῷ, Καίσαρος	2	they said to him, “Caesar’s.”	Here, **Caesar’s** refers to his likeness and inscription. Alternate translation: “they said, ‘They are Caesar’s likeness and inscription” (See: [[rc://en/ta/man/translate/figs-ellipsis]])
MRK	12	17	fl4l	figs-metonymy	τὰ Καίσαρος ἀπόδοτε Καίσαρι	1	The things of Caesar, give back to Caesar	Jesus is teaching that his people must respect the government by paying taxes. This figure of speech can be clarified by changing **Caesar** to Roman government. Alternate translation: “Give to the Roman government the things that belong to the Roman government” (See: [[rc://en/ta/man/translate/figs-metonymy]])
MRK	12	17	la16	figs-ellipsis	καὶ τὰ τοῦ Θεοῦ τῷ Θεῷ	1	and the things of God, to God	The understood verb may be supplied. Alternate translation: “and give to God the things of God” (See: [[rc://en/ta/man/translate/figs-ellipsis]])
MRK	12	17	pw4r	figs-explicit	ἐξεθαύμαζον ἐπ’ αὐτῷ	1	they were marveling at him	They were amazed at what Jesus had said. This can be made explicit. Alternate translation: “they marveled at him and at what he had said” (See: [[rc://en/ta/man/translate/figs-explicit]])
MRK	12	18	rdl7	figs-explicit	οἵτινες λέγουσιν ἀνάστασιν μὴ εἶναι	1	who say there is no resurrection	This phrase explains who the Sadducees were. This can be written more clearly. Alternate translation: “who say there is no resurrection from the dead” (See: [[rc://en/ta/man/translate/figs-explicit]])
MRK	12	19	e8x2	figs-quotations	Μωϋσῆς ἔγραψεν ἡμῖν, ὅτι ἐάν τινος ἀδελφὸς ἀποθάνῃ	1	Moses wrote to us, ‘If someone’s brother may die	The Sadducees are quoting what **Moses** had written in the law. Moses’ quote can be expressed as an indirect quote. Alternate translation: “Moses wrote for us that if a man’s brother dies” (See: [[rc://en/ta/man/translate/figs-quotations]])
MRK	12	19	m8fh		ἔγραψεν ἡμῖν	1	wrote to us	“wrote to us Jews.” The Sadducees were a group of Jews. Here they use the word **us** to refer to themselves and all Jews.
MRK	12	19	g49e		λάβῃ ὁ ἀδελφὸς αὐτοῦ τὴν γυναῖκα	1	his brother should take the wife	“the man should marry his brother’s wife”
MRK	12	19	m2um	figs-explicit	ἐξαναστήσῃ σπέρμα τῷ ἀδελφῷ αὐτοῦ	1	should raise up offspring to his brother	“have a son for his brother.” The man’s first son would be considered to be the dead brother’s son, and the son’s descendants would be considered to be the dead brother’s descendants. You can state this clearly. Alternate translation: “should have a son who will be considered to be the dead brother’s son” (See: [[rc://en/ta/man/translate/figs-explicit]])
MRK	12	20	wz27	figs-hypo	ἑπτὰ ἀδελφοὶ ἦσαν	1	There were seven brothers	The Sadducees talk about a situation that did not really happen because they want Jesus to tell them what he thinks is right and wrong. Alternate translation: “Suppose there were seven brothers” (See: [[rc://en/ta/man/translate/figs-hypo]])
MRK	12	20	pj71		ὁ πρῶτος	1	the first	the first brother
MRK	12	20	af1t		ὁ πρῶτος ἔλαβεν γυναῖκα	1	the first took a wife	“the first married a woman.” Here marrying a woman is spoken of as “taking” her.
MRK	12	21	d61g	figs-ellipsis	ὁ δεύτερος…ὁ τρίτος	1	the second … the third	These numbers refer to each of the brothers and can be expressed as such. Alternate translation: “the second brother … the third brother” (See: [[rc://en/ta/man/translate/figs-ellipsis]])
MRK	12	21	na6s		ὁ δεύτερος ἔλαβεν αὐτήν	1	the second took her	“the second married her.” Here marrying a woman is spoken of as “taking” her.
MRK	12	21	l1ds	figs-explicit	ὁ τρίτος ὡσαύτως	1	the third likewise	It may be helpful to explain what **likewise** means. Alternate translation: “the third brother married her as his other bothers did, and he also died leaving no children” (See: [[rc://en/ta/man/translate/figs-explicit]])
MRK	12	22	wjq8	figs-ellipsis	οἱ ἑπτὰ	1	the seven	This refers to all the brothers. Alternate translation: “the seven brothers” (See: [[rc://en/ta/man/translate/figs-ellipsis]])
MRK	12	22	l3dg	figs-explicit	οἱ ἑπτὰ οὐκ ἀφῆκαν σπέρμα	1	the seven did not leave offspring	Each of the brothers married the woman and then died before he had any children with her. You can state this clearly. Alternate translation: “eventually all seven brothers married that woman one by one, but none of them had any children with her, and one by one they died” (See: [[rc://en/ta/man/translate/figs-explicit]])
MRK	12	23	w4wu	figs-rquestion	ἐν τῇ ἀναστάσει, ὅταν ἀναστῶσιν, τίνος αὐτῶν ἔσται γυνή	1	In the resurrection, when they may rise again, of which of them will she be a wife?	The Sadducees are testing Jesus by asking this question. If your readers can only understand this as a request for information, this can be written as a statement. Alternate translation: “Now tell us whose wife she will be in the resurrection, when they all rise again.” (See: [[rc://en/ta/man/translate/figs-rquestion]])
MRK	12	24	zp2p	figs-rquestion	οὐ διὰ τοῦτο πλανᾶσθε, μὴ εἰδότες τὰς Γραφὰς, μηδὲ τὴν δύναμιν τοῦ Θεοῦ?	1	Are you not being led astray because of this, not knowing the scriptures nor the power of God?	Jesus rebukes the Sadducees because they are mistaken about God’s law. This may be written as a statement. Alternate translation: “You are mistaken because you do not know the scriptures nor the power of God.” (See: [[rc://en/ta/man/translate/figs-rquestion]])
MRK	12	24	li2y		μὴ εἰδότες τὰς Γραφὰς	1	not knowing the scriptures	This means that they do not understand what is written in the Old Testament **scriptures**.
MRK	12	24	i8il		τὴν δύναμιν τοῦ Θεοῦ	1	the power of God	“how powerful God is”
MRK	12	25	nvh6		ὅταν γὰρ…ἀναστῶσιν	1	For when they may rise	Here the word **they** refers to the brothers and the woman from the example.
MRK	12	25	y8vz	figs-metaphor	ἀναστῶσιν	1	they may rise	Waking and getting up from sleep is a metaphor for becoming alive after having been dead. (See: [[rc://en/ta/man/translate/figs-metaphor]])
MRK	12	25	vh7r		ἐκ νεκρῶν	1	from the dead	From among all those who have died. This expression describes all **dead** people together in the underworld. To rise from among them speaks of becoming alive again.
MRK	12	25	p5ak		οὔτε γαμοῦσιν οὔτε γαμίζονται	1	they neither marry nor are given in marriage	“they do not marry, and they are not given in marriage”
MRK	12	25	h7ii	figs-activepassive	γαμίζονται	1	are given in marriage	You can state this in active form. Alternate translation: “and no one gives them in marriage” (See: [[rc://en/ta/man/translate/figs-activepassive]])
MRK	12	25	pi8l		τοῖς οὐρανοῖς	1	the heavens	This refers to the place where God lives.
MRK	12	26	z36n	figs-activepassive	ὅτι ἐγείρονται	1	that are raised	This can be expressed with an active verb. Alternate translation: “who rise” or “who rise to live again” (See: [[rc://en/ta/man/translate/figs-activepassive]])
MRK	12	26	jc5a		τῇ βίβλῳ Μωϋσέως	1	the book of Moses	“the book that Moses wrote”
MRK	12	26	w2lj	figs-explicit	τοῦ βάτου	1	the bush	This refers to the part of the Book of Moses that tells about when God spoke to Moses out of a **bush** that was burning but that did not burn up. Alternate translation: “the passage about the burning bush” or “the words about the fiery bush” (See: [[rc://en/ta/man/translate/figs-explicit]])
MRK	12	26	si2b		τοῦ βάτου	1	the bush	This refers to a shrub, a woody plant that is smaller than a tree.
MRK	12	26	y35v		πῶς εἶπεν αὐτῷ ὁ Θεὸς	1	how God spoke to him	“about when God spoke to Moses”
MRK	12	26	re82		ἐγὼ ὁ Θεὸς Ἀβραὰμ, καὶ ὁ Θεὸς Ἰσαὰκ, καὶ ὁ Θεὸς Ἰακώβ	1	I am the God of Abraham and the God of Isaac and the God of Jacob	This means that **Abraham**, **Isaac**, and **Jacob** worship **God**. These men have died physically, but they are still alive spiritually and still worship God.
MRK	12	27	dgc9	figs-nominaladj	Θεὸς νεκρῶν, ἀλλὰ ζώντων	1	the God of the dead, but of the living	Here, **the dead** refers to people who are dead, and **the living** refers to people who are alive. Alternate translation: “not the God of dead people, but of living people” (See: [[rc://en/ta/man/translate/figs-nominaladj]])
MRK	12	27	v7ui	figs-ellipsis	Θεὸς νεκρῶν, ἀλλὰ ζώντων	1	the God of the dead, but of the living	You can state **the God** clearly in the second phrase. Alternate translation: “not the God of dead people, but the God of living people” (See: [[rc://en/ta/man/translate/figs-ellipsis]])
MRK	12	27	l22e		ζώντων	1	of the living	This includes people who are alive physically and spiritually.
MRK	12	27	wmz2	figs-explicit	πολὺ πλανᾶσθε	1	You are quite being led astray	It may be helpful to state what they are lead astray about. Alternate translation: “When you say that dead people do not rise again, you are quite mistaken” (See: [[rc://en/ta/man/translate/figs-explicit]])
MRK	12	27	sp7x		πολὺ πλανᾶσθε	1	You are quite being led astray	“You are completely mistaken” or “You are very wrong”
MRK	12	28	q1u5		ἐπηρώτησεν αὐτόν	1	he asked him	“the scribe asked Jesus”
MRK	12	29	n74y	figs-nominaladj	πρώτη ἐστίν	1	The first is	Here, **The first** refers to the most important commandment. Alternate translation: “The most important commandment is” (See: [[rc://en/ta/man/translate/figs-nominaladj]])
MRK	12	29	mq92		ἄκουε, Ἰσραήλ, Κύριος ὁ Θεὸς ἡμῶν Κύριος εἷς ἐστιν	1	Hear, O Israel, the Lord our God, the Lord is one	“Listen, O Israel! The Lord our God is one Lord”
MRK	12	30	xjng	figs-doublet	ἐξ ὅλης τῆς καρδίας σου, καὶ ἐξ ὅλης τῆς ψυχῆς σου, καὶ ἐξ ὅλης τῆς διανοίας σου, καὶ ἐξ ὅλης τῆς ἰσχύος σου	1	from your whole heart … from your whole soul … from your whole mind … from your whole strength	These four phrases are used together to mean “completely” or “earnestly.” (See: [[rc://en/ta/man/translate/figs-doublet]])
MRK	12	30	q49v	figs-metonymy	ἐξ ὅλης τῆς καρδίας σου, καὶ ἐξ ὅλης τῆς ψυχῆς σου	1	from your whole heart, and from your whole soul	Here, **heart** and “soul” are metonyms for a person’s inner being. (See: [[rc://en/ta/man/translate/figs-metonymy]])
MRK	12	31	tp6p	figs-simile	ἀγαπήσεις τὸν πλησίον σου ὡς σεαυτόν	1	You will love your neighbor as yourself	Jesus uses this simile to compare how people are to love each other with the same love as they love themselves. Alternate translation: “You must love your neighbor as much as you love yourself” (See: [[rc://en/ta/man/translate/figs-simile]])
MRK	12	31	pyc1		τούτων	1	than these	Here the word **these** refers to the two commandments that Jesus had just told the people.
MRK	12	32	qqm4		καλῶς, Διδάσκαλε	1	Good, Teacher	“Good answer, Teacher” or “Well said, Teacher”
MRK	12	32	awe3	figs-idiom	εἷς ἐστιν	1	he is one	This means that there is only **one** God. Alternate translation: “there is only one God” (See: [[rc://en/ta/man/translate/figs-idiom]])
MRK	12	32	as2j	figs-ellipsis	οὐκ ἔστιν ἄλλος	1	that there is no other	The word “God” is understood from the previous phrase. Alternate translation: “that there is no other God” (See: [[rc://en/ta/man/translate/figs-ellipsis]])
MRK	12	33	xnq9	figs-doublet	ἐξ ὅλης τῆς καρδίας…ἐξ ὅλης τῆς συνέσεως…ἐξ ὅλης τῆς ἰσχύος	1	from your whole heart … from your whole understanding … from your whole strength	These three phrases are used together to mean “completely” or “earnestly.” (See: [[rc://en/ta/man/translate/figs-doublet]])
MRK	12	33	k42a	figs-metonymy	ἐξ ὅλης τῆς καρδίας	1	from your whole heart	Here, **heart** is a metonym for person’s thoughts, feelings, or inner being. (See: [[rc://en/ta/man/translate/figs-metonymy]])
MRK	12	33	tw15	figs-simile	τὸ ἀγαπᾶν τὸν πλησίον ὡς ἑαυτὸν	1	to love your neighbor as yourself	This simile compares how people are **to love** each other with the same love that they love themselves. Alternate translation: “to love your neighbor as much as you love yourself” (See: [[rc://en/ta/man/translate/figs-simile]])
MRK	12	33	ll9t	figs-idiom	περισσότερόν ἐστιν	1	is even more than	This idiom means that something is more important than something else. In this case, these two commandments are more pleasing to God that burnt offering and sacrifices. This may be written clearly. Alternate translation: “is even more important than” or “is even more pleasing to God than” (See: [[rc://en/ta/man/translate/figs-idiom]])
MRK	12	34	b144	figs-litotes	οὐ μακρὰν εἶ ἀπὸ τῆς Βασιλείας τοῦ Θεοῦ	1	You are not far from the kingdom of God	You can state this in positive form. Alternate translation: “You are very close to the kingdom of God” (See: [[rc://en/ta/man/translate/figs-litotes]])
MRK	12	34	is4c	figs-metaphor	οὐ μακρὰν εἶ ἀπὸ τῆς Βασιλείας τοῦ Θεοῦ	1	You are not far from the kingdom of God	Here Jesus speaks of the man being ready to submit to God as king as being physically close to **the kingdom of God**, as if it where a physical place. Alternate translation: “You are close to submitting to God as king” (See: [[rc://en/ta/man/translate/figs-metaphor]])
MRK	12	34	rgh8	figs-litotes	οὐδεὶς οὐκέτι ἐτόλμα	1	no one any longer was daring	You can state this in positive form. Alternate translation: “everyone was afraid” (See: [[rc://en/ta/man/translate/figs-litotes]])
MRK	12	35	ptc8	figs-explicit	ἀποκριθεὶς ὁ Ἰησοῦς ἔλεγεν διδάσκων ἐν τῷ ἱερῷ	1	answering, Jesus, teaching in the temple, said	Some time has passed and Jesus is now in the temple. This is not part of the previous conversation. Alternate translation: “And later, while Jesus was teaching in the temple area, he said to the people” (See: [[rc://en/ta/man/translate/figs-explicit]])
MRK	12	35	q6e4	figs-rquestion	πῶς λέγουσιν οἱ γραμματεῖς ὅτι ὁ Χριστὸς, υἱὸς Δαυείδ ἐστιν?	1	How do the scribes say that the Christ is the son of David?	Jesus uses this question to get the people to think deeply about the Psalm he is about to quote. This can be written as a statement. Alternate translation: “Consider why the scribes say the Christ is the son of David.” (See: [[rc://en/ta/man/translate/figs-rquestion]])
MRK	12	35	i6a4		υἱὸς Δαυείδ	1	the son of David	“a descendant of David”
MRK	12	36	e1zq	figs-rpronouns	αὐτὸς Δαυεὶδ	1	David himself	This word **himself** refers to **David** and is used to place emphasis on him and what he said. Alternate translation: “It was David who” (See: [[rc://en/ta/man/translate/figs-rpronouns]])
MRK	12	36	ejy2	figs-idiom	ἐν τῷ Πνεύματι τῷ ἁγίῳ	1	in the Holy Spirit	This means that he was inspired by **the Holy Spirit**. That is, the Holy Spirit directed David in what he said. Alternate translation: “inspired by the Holy Spirit” (See: [[rc://en/ta/man/translate/figs-idiom]])
MRK	12	36	dv7b	figs-explicit	εἶπεν…εἶπεν ὁ Κύριος τῷ Κυρίῳ μου	1	said, ‘The Lord said to my Lord	Here David calls God **The Lord** and calls the Christ **my Lord**. This can be written more clearly. Alternate translation: “said about the Christ, ‘The Lord God said to my Lord” (See: [[rc://en/ta/man/translate/figs-explicit]])
MRK	12	36	v53p	translate-symaction	κάθου ἐκ δεξιῶν μου	1	Sit at my right hand	Jesus is quoting a psalm. Here God is speaking to the Christ. To sit at the **right hand** of God is a symbolic action of receiving great honor and authority from God. Alternate translation: “Sit in the place of honor beside me” (See: [[rc://en/ta/man/translate/translate-symaction]])
MRK	12	36	mml8	figs-metaphor	ἕως ἂν θῶ τοὺς ἐχθρούς σου ὑποκάτω τῶν ποδῶν σου	1	until I may place your enemies under your feet	In this quote, God speaks of defeating enemies as placing them under his feet. Alternate translation: “until I completely defeat your enemies” (See: [[rc://en/ta/man/translate/figs-metaphor]])
MRK	12	37	ka5u		λέγει αὐτὸν, Κύριον	1	calls him ‘Lord,’	Here the word **him** refers to the Christ.
MRK	12	37	rh2t	figs-rquestion	καὶ πόθεν υἱός αὐτοῦ ἐστιν?	1	and how is he his son?	This can be written as a statement. Alternate translation: “so consider how the Christ can be a descendant of David” (See: [[rc://en/ta/man/translate/figs-rquestion]])
MRK	12	38	z649	figs-abstractnouns	ἀσπασμοὺς ἐν ταῖς ἀγοραῖς	1	greetings in the marketplaces	The noun **greetings** can be expressed with the verb “greet.” Alternate translation: “for people to greet them in the marketplaces” (See: [[rc://en/ta/man/translate/figs-abstractnouns]])
MRK	12	38	k31m	figs-explicit	ἀσπασμοὺς ἐν ταῖς ἀγοραῖς	1	greetings in the marketplaces	These greetings showed that the people respected the scribes. Alternate translation: “to be greeted respectfully in the marketplaces” or “for people to greet them respectfully in the marketplaces” (See: [[rc://en/ta/man/translate/figs-explicit]])
MRK	12	40	jtw4	figs-metaphor	οἱ κατεσθίοντες τὰς οἰκίας τῶν χηρῶν	1	They devour the houses of the widows	Here Jesus describes the scribes’ cheating of **widows** and stealing of their **houses** as “devouring” their houses. Alternate translation: “They also cheat widows in order to steal their houses from them” (See: [[rc://en/ta/man/translate/figs-metaphor]])
MRK	12	40	j27b	figs-synecdoche	τὰς οἰκίας τῶν χηρῶν	1	the houses of the widows	The words **widows** and **houses** are synecdoches for helpless people and all of a person’s important possessions, respectively. Alternate translation: “everything from helpless people” (See: [[rc://en/ta/man/translate/figs-synecdoche]])
MRK	12	40	qm52	figs-activepassive	οὗτοι λήμψονται περισσότερον κρίμα	1	These will receive greater condemnation	You can state this in active form. Alternate translation: “God will certainly punish them with greater condemnation” or “God will certainly punish them severely” (See: [[rc://en/ta/man/translate/figs-activepassive]])
MRK	12	40	h36x	figs-explicit	λήμψονται περισσότερον κρίμα	1	will receive greater condemnation	The word **greater** implies a comparison. Here the comparison is to other men who are punished. Alternate translation: “will receive greater condemnation than other people” (See: [[rc://en/ta/man/translate/figs-explicit]])
MRK	12	41	r69x			0	Connecting Statement:	Still in the temple area, Jesus comments on the value of the widow’s offering.
MRK	12	41	p2kp		τοῦ γαζοφυλακίου	1	the temple offering box	This **box**, which everyone could use, was the place into which people gave offerings to the **temple**.
MRK	12	42	g6ry	translate-bmoney	λεπτὰ δύο	1	two mites	“two small copper coins.” These were the least valuable coins available. (See: [[rc://en/ta/man/translate/translate-bmoney]])
MRK	12	42	n29e		ἐστιν κοδράντης	1	are a quadrans	“are worth very little.” A **quadrans** is worth very little. Translate **quadrans** with the name of the smallest coin in your language if you have one that is worth very little.
