Book	Chapter	Verse	ID	SupportReference	OrigQuote	Occurrence	GLQuote	OccurrenceNote
JHN	13	intro	zk68			0		# John 13 General Notes<br><br>## Structure and formatting<br><br>The events of this chapter are commonly referred to as the last supper or the Lord’s supper. This Passover feast in many ways parallels Jesus’ sacrifice as the lamb of God. (See: [[rc://en/tw/dict/bible/kt/passover]])<br><br>## Special concepts in this chapter<br><br>### The washing of feet<br><br>People in the ancient Near East thought that feet were very dirty. Only servants would wash people’s feet. The disciples did not want Jesus to wash their feet because they considered him their master and themselves his servants, but he wanted to show them that they needed to serve each other. (See: [[rc://en/ta/man/translate/translate-symaction]])<br><br>### I AM<br><br>John records Jesus as saying these words four times in this book, once in this chapter. They stand alone as a complete sentence, and they literally translate the Hebrew word for “I AM,” by which Yahweh identified himself to Moses. For these reasons, many people believe that when Jesus said these words he was claiming to be Yahweh. (See: [[rc://en/tw/dict/bible/kt/yahweh]]).<br><br>## Other possible translation difficulties in this chapter<br><br>### “Son of Man”<br><br>Jesus refers to himself as the “Son of Man” in this chapter ([John 13:31](../../jhn/13/31.md)). Your language may not allow people to speak of themselves as if they were speaking about someone else. (See: [[rc://en/tw/dict/bible/kt/sonofman]] and [[rc://en/ta/man/translate/figs-123person]])
JHN	13	1	wk2k	writing-background		0	General Information:	It is not yet Passover and Jesus is together with his disciples for supper. These verses explain the setting of the story and give background information about Jesus and Judas. (See: [[rc://en/ta/man/translate/writing-background]])
JHN	13	1	w7w3	guidelines-sonofgodprinciples	Πατέρα	1	Father	**Father** is an important title for God. (See: [[rc://en/ta/man/translate/guidelines-sonofgodprinciples]])
JHN	13	1	a1w4		ἀγαπήσας	1	loved	This is the kind of love that comes from God, which is focused on the good of others, even when it does not benefit oneself. This kind of love cares for others, no matter what they do.
JHN	13	2	xn6r	figs-idiom	τοῦ διαβόλου ἤδη βεβληκότος εἰς τὴν καρδίαν, ἵνα παραδοῖ αὐτὸν Ἰούδας, Σίμωνος Ἰσκαριώτης	1	the devil had already put it into the heart of Judas Iscariot son of Simon, to betray Jesus	The phrase **put into the heart** is an idiom that means to cause someone to think about something. Alternate translation: “the devil had already caused Judas Iscariot, the son of Simon, to think about betraying Jesus” (See: [[rc://en/ta/man/translate/figs-idiom]])
JHN	13	3	u3vn	writing-background		0	Connecting Statement:	Verse 3 continues to tell us background information about what Jesus knew. The action in the story begins in verse 4. (See: [[rc://en/ta/man/translate/writing-background]])
JHN	13	3	fd2t	guidelines-sonofgodprinciples	Πατὴρ	1	Father	**Father** is an important title for God. (See: [[rc://en/ta/man/translate/guidelines-sonofgodprinciples]])
JHN	13	3	x8hc	figs-metonymy	πάντα δέδωκεν αὐτῷ…εἰς τὰς χεῖρας	1	had given everything over into his hands	Here, **his hands** is a metonym for power and authority. Alternate translation: “had given him complete power and authority over everything” (See: [[rc://en/ta/man/translate/figs-metonymy]])
JHN	13	3	a6qj		ἀπὸ Θεοῦ ἐξῆλθεν καὶ πρὸς τὸν Θεὸν ὑπάγει	1	he had come from God and was going back to God	Jesus had always been with the Father, and would return there after his work on earth was finished.
JHN	13	4	t7cu		ἐγείρεται ἐκ τοῦ δείπνου καὶ τίθησιν τὰ ἱμάτια	1	He got up from dinner and took off his outer clothing	Because the region was very dusty, it was customary for the host of a dinner to provide a servant to wash the feet of the guests. Jesus took off his **outer clothing** so he would look like a servant.
JHN	13	5	s1pc		ἤρξατο νίπτειν τοὺς πόδας τῶν μαθητῶν	1	began to wash the feet of the disciples	Because the region was very dusty, it was customary for the host of a dinner to provide a servant **to wash the feet** of the guests. Jesus did the work of the servant by washing the disciples’ feet.
JHN	13	6	bz27	figs-rquestion	Κύριε, σύ μου νίπτεις τοὺς πόδας?	1	Lord, are you going to wash my feet?	Peter’s question shows that he is not willing for Jesus to wash his feet. Alternate translation: “Lord, it is not right for you to wash the feet of me, a sinner!” (See: [[rc://en/ta/man/translate/figs-rquestion]])
JHN	13	8	f6dg	figs-doublenegatives	ἐὰν μὴ νίψω σε, οὐκ ἔχεις μέρος μετ’ ἐμοῦ	1	If I do not wash you, you have no share with me	Jesus states two negatives to convince Peter to allow him to wash his feet. Alternate translation: “I must wash your feet so that you can have fellowship with me” (See: [[rc://en/ta/man/translate/figs-doublenegatives]])
JHN	13	8	m90p	figs-explicit	ἐὰν μὴ νίψω σε, οὐκ ἔχεις μέρος μετ’ ἐμοῦ	1		Jesus implies that Peter must let him wash his feet if he wants to continue being a disciple. Alternate translation: “If I wash you, you will always belong with me” (See: [[rc://en/ta/man/translate/figs-explicit]])
JHN	13	10	tv57			0	General Information:	Jesus uses the word **you** to refer to all of his disciples.
JHN	13	10	m7vj			0	Connecting Statement:	Jesus continues to speak to Simon Peter.
JHN	13	10	is57	figs-metaphor	ὁ λελουμένος οὐκ ἔχει χρείαν, εἰ μὴ τοὺς πόδας νίψασθαι	1	He who is bathed has no need, except to wash his feet	Here, **been washed** is a metaphor that means that God has cleansed a person spiritually. Alternate translation: “If anyone has already received God’s forgiveness, he now only needs to receive cleansing from his daily sins” (See: [[rc://en/ta/man/translate/figs-metaphor]])
JHN	13	11	ccz4	figs-explicit	οὐχὶ πάντες καθαροί ἐστε	1	Not all of you are clean	Jesus implies that the one who will betray him, Judas, has not trusted in him. Therefore God has not forgiven him of his sins. Alternate translation: “Not all of you have received God’s forgiveness” (See: [[rc://en/ta/man/translate/figs-explicit]])
JHN	13	12	p45l	figs-rquestion	γινώσκετε τί πεποίηκα ὑμῖν?	1	Do you know what I have done for you?	This remark appears in the form of a question so Jesus can emphasize the importance of what he is teaching his disciples. Alternate translation: “You need to understand what I have done for you!” (See: [[rc://en/ta/man/translate/figs-rquestion]])
JHN	13	13	m9z8	figs-explicit	ὑμεῖς φωνεῖτέ με ὁ Διδάσκαλος καὶ, ὁ Κύριος	1	You call me ‘teacher’ and ‘Lord,’	Here Jesus implies that his disciples have great respect for him. Alternate translation: “You show me great respect when you call me ‘teacher’ and ‘Lord.’” (See: [[rc://en/ta/man/translate/figs-explicit]])
JHN	13	15	pk3l	figs-explicit	καθὼς ἐγὼ ἐποίησα ὑμῖν, καὶ ὑμεῖς ποιῆτε	1	you should also do just as I did for you	Jesus implies that his disciples should be willing to follow his example and serve one another. Alternate translation: “you should also humbly serve each other” (See: [[rc://en/ta/man/translate/figs-explicit]])
JHN	13	16	n5cb			0	Connecting Statement:	Jesus continues to speak to his disciples.
JHN	13	16	h6gt		ἀμὴν, ἀμὴν	1	Truly, truly	See how you translated this in [John 1:51](../01/51.md).
JHN	13	16	tpl8		μείζων	1	greater	one who is more important or more powerful, or one who should have an easier life or a more pleasant life
JHN	13	17	an8u	figs-activepassive	μακάριοί ἐστε	1	you are blessed	Here, **are blessed** means good, beneficial things will happen to them. You can translate this in an active form. Alternate translation: “God will bless you” (See: [[rc://en/ta/man/translate/figs-activepassive]])
JHN	13	18	u5fl	figs-activepassive	ἵνα ἡ Γραφὴ πληρωθῇ	1	this so that the scripture will be fulfilled	You can translate this in an active form. Alternate translation: “this is in order to fulfill the scripture” (See: [[rc://en/ta/man/translate/figs-activepassive]])
JHN	13	18	v5pv	figs-idiom	ὁ τρώγων μετ’ ἐμοῦ τὸν ἄρτον, ἐπῆρεν ἐπ’ ἐμὲ τὴν πτέρναν αὐτοῦ	1	He who eats my bread lifted up his heel against me	Here the phrase **eating bread with me** is an idiom for someone who pretends to be a friend. The phrase **lifted up his heel** is also an idiom, which means someone who has become an enemy. If you have idioms in your language that carry these meanings, you can use them here. Alternate translation: “The one who has pretended to be my friend has turned out to be an enemy” (See: [[rc://en/ta/man/translate/figs-idiom]])
JHN	13	19	qd39		ἀπ’ ἄρτι λέγω ὑμῖν πρὸ τοῦ γενέσθαι	1	I tell you this now before it happens	“I am telling you now what is going to happen before it happens”
JHN	13	19	gg19		ἐγώ εἰμι	1	I AM	This could mean: (1) Jesus is identifying himself as Yahweh, who identified himself to Moses as “I AM.” (2) Jesus is saying, “I am the one I claim to be.”
JHN	13	20	di3t		ἀμὴν, ἀμὴν	1	Truly, truly	See how you translated this in [John 1:51](../01/51.md).
JHN	13	21	bq84		ἐταράχθη	1	troubled	was concerned, upset
JHN	13	21	j7x1		ἀμὴν, ἀμὴν	1	Truly, truly	See how you translated this in [John 1:51](../01/51.md).
JHN	13	22	dhs3		ἔβλεπον εἰς ἀλλήλους οἱ μαθηταὶ, ἀπορούμενοι περὶ τίνος λέγει	1	The disciples looked at each other, wondering of whom he was speaking	The disciples looked at each other and wondered: “Who will betray Jesus?”
JHN	13	23	xvi8		εἷς ἐκ τῶν μαθητῶν αὐτοῦ…ὃν ἠγάπα ὁ Ἰησοῦς	1	One of his disciples, whom Jesus loved	This refers to John.
JHN	13	23	z8ze	figs-explicit	ἀνακείμενος	1	lying down at the table	During the time of Christ, Jews would often dine together in the Greek style, in which they lay on their sides on low couches. (See: [[rc://en/ta/man/translate/figs-explicit]])
JHN	13	23	p2ee		τῷ κόλπῳ τοῦ Ἰησοῦ	1	Jesus’ side	Lying with one’s head against the side of another diner in the Greek style was considered to be the place of greatest friendship with him.
JHN	13	23	a58j		ἠγάπα	1	loved	This kind of love comes from God and focuses on the good of others, even when it does not benefit oneself. This kind of love cares for others, no matter what they do.
JHN	13	26	qpj8	writing-background	Ἰσκαριώτη	1	Iscariot	This may indicate that Judas was from the village of Kerioth. (See: [[rc://en/ta/man/translate/writing-background]])
JHN	13	27	r8lk	figs-ellipsis	καὶ μετὰ τὸ ψωμίον	1	Then after the bread	The words “Judas took” are understood from the context. Alternate translation: “Then after Judas took the bread” (See: [[rc://en/ta/man/translate/figs-ellipsis]])
JHN	13	27	xk39	figs-idiom	τότε εἰσῆλθεν εἰς ἐκεῖνον ὁ Σατανᾶς	1	Satan entered into him	This is an idiom that means **Satan** took complete control of Judas. Alternate translation: “Satan then took control of him” or “Satan then started to command Judas” (See: [[rc://en/ta/man/translate/figs-idiom]])
JHN	13	27	rz21		λέγει οὖν αὐτῷ ὁ Ἰησοῦς	1	so Jesus said to him	Here Jesus is speaking to Judas.
JHN	13	27	agd7		ὃ ποιεῖς, ποίησον τάχειον	1	What you are doing, do it quickly	“Do quickly what you are planning to do!”
JHN	13	29	rv4z		τοῖς πτωχοῖς ἵνα τι δῷ	1	that he should give something to the poor	You can translate this as a direct quote: “Go and give some money to the poor.”
JHN	13	30	dw7m	writing-background	ἐκεῖνος ἐξῆλθεν εὐθύς; ἦν δὲ νύξ	1	he went out immediately. It was night	John seems to draw attention here to the fact that Judas will do his evil or “dark” deed in the darkness of the **night**. Alternate translation: “he went out immediately into the dark night” (See: [[rc://en/ta/man/translate/writing-background]])
JHN	13	31	d6l8	figs-activepassive	νῦν ἐδοξάσθη ὁ Υἱὸς τοῦ Ἀνθρώπου, καὶ ὁ Θεὸς ἐδοξάσθη ἐν αὐτῷ	1	Now the Son of Man is glorified, and God is glorified in him	You can translate this in an active form. Alternate translation: “Now people are about to see how the Son of Man will receive honor and how God will receive honor through what the Son of Man is doing” (See: [[rc://en/ta/man/translate/figs-activepassive]])
JHN	13	32	uaj7	figs-rpronouns	ὁ Θεὸς δοξάσει αὐτὸν ἐν αὐτῷ, καὶ εὐθὺς δοξάσει αὐτόν	1	God will glorify him in himself, and he will glorify him immediately	The word **him** refers to the Son of Man. The word **himself** is a reflexive pronoun that refers to God. Alternate translation: “God himself will immediately give honor to the Son of Man” (See: [[rc://en/ta/man/translate/figs-rpronouns]])
JHN	13	33	zki6		τεκνία	1	Little children	Jesus uses the term **Little children** to communicate that he loves the disciples as though they were his children.
JHN	13	33	lp65	figs-synecdoche	καθὼς εἶπον τοῖς Ἰουδαίοις	1	as I said to the Jews	Here, **Jews** is a synecdoche for the Jewish leaders who opposed Jesus. Alternate translation: “just as I said to the Jewish leaders” (See: [[rc://en/ta/man/translate/figs-synecdoche]])
JHN	13	34	fkc7			0	Connecting Statement:	Jesus continues speaking to his disciples.
JHN	13	34	nmf5		ἀγαπᾶτε	1	love	This is the kind of **love** that comes from God and focuses on the good of others, even when it does not benefit oneself. This kind of love cares for others, no matter what they do.
JHN	13	35	kyd9	figs-hyperbole	πάντες	1	everyone	You may need to make explicit that this exaggeration refers only to those people who see how the disciples love each other. (See: [[rc://en/ta/man/translate/figs-hyperbole]])
JHN	13	37	ye6m		τὴν ψυχήν μου…θήσω	1	lay down my life	“I will give up my life” or “I will die”
JHN	13	38	qp88	figs-rquestion	τὴν ψυχήν σου ὑπὲρ ἐμοῦ θήσεις?	1	Will you lay down your life for me?	This remark appears in the form of a question to add emphasis to Jesus’ statement. Alternate translation: “You say that you will die for me, but the truth is that you will not!” (See: [[rc://en/ta/man/translate/figs-rquestion]])
JHN	13	38	sp7p		οὐ μὴ ἀλέκτωρ φωνήσῃ, ἕως οὗ ἀρνήσῃ με τρίς	1	the rooster will not crow before you have denied me three times	“you will say that you do not know me three times before the rooster crows”
JHN	14	intro	kv6m			0		# John 14 General Notes<br><br>## Special concepts in this chapter<br><br>### “My Father’s house”<br><br>Jesus used these words to speak of heaven, where God lives, not of the temple. (See: [[rc://en/tw/dict/bible/kt/heaven]])<br><br>### The Holy Spirit<br><br>Jesus told his disciples that he would send the Holy Spirit to them. The Holy Spirit is the Comforter ([John 14:16](../../jhn/14/16.md)) who is always with God’s people to help them and to speak to God for them, He is also the Spirit of truth ([John 14:17](../../jhn/14/17.md)) who tells God’s people what is true about God so they know him better and serve him well. (See: [[rc://en/tw/dict/bible/kt/holyspirit]])
JHN	14	1	a2xv			0	Connecting Statement:	The part of the story from the previous chapter continues. Jesus reclines at the table with his disciples and continues to speak to them.
JHN	14	1	w3dn	figs-metonymy	μὴ ταρασσέσθω ὑμῶν ἡ καρδία	1	Do not let your heart be troubled	Here, **heart** is a metonym for a person’s inner being. Alternate translation: “Stop being so anxious and worried” (See: [[rc://en/ta/man/translate/figs-metonymy]])
JHN	14	2	cp9z		ἐν τῇ οἰκίᾳ τοῦ Πατρός μου, μοναὶ πολλαί εἰσιν	1	In my Father’s house are many rooms	“There are many places to live in my Father’s house”
JHN	14	2	eca3		ἐν τῇ οἰκίᾳ τοῦ Πατρός μου	1	In my Father’s house	This refers to heaven, where God lives.
JHN	14	2	v9px	guidelines-sonofgodprinciples	Πατρός	1	Father	**Father** is an important title for God. (See: [[rc://en/ta/man/translate/guidelines-sonofgodprinciples]])
JHN	14	2	fp9r		μοναὶ πολλαί	1	many rooms	Here, **rooms** can refer to single rooms, or to larger dwellings.
JHN	14	2	xb2y	figs-you	πορεύομαι ἑτοιμάσαι τόπον ὑμῖν	1	I am going to prepare a place for you	Jesus is **going to prepare a place** in heaven for every person who trusts in him. The **you** is plural and refers to all his disciples. (See: [[rc://en/ta/man/translate/figs-you]])
JHN	14	4	ir1d	figs-metaphor	τὴν ὁδόν	1	the way	This could be: (1) a metaphor that refers to “the way to God.” (2) a metaphor that refers to “the one who takes people to God.” (See: [[rc://en/ta/man/translate/figs-metaphor]])
JHN	14	5	e1dl		πῶς δυνάμεθα τὴν ὁδὸν εἰδέναι	1	how can we know the way?	“how can we know how to get there?”
JHN	14	6	i8le	figs-metaphor	ἡ ἀλήθεια	1	the truth	This could be: (1) a metaphor that means “the true person.” (2) a metaphor that means “the one who speaks true words about God.” (See: [[rc://en/ta/man/translate/figs-metaphor]])
JHN	14	6	z9tr	figs-metaphor	ἡ ζωή	1	the life	This is a metaphor that means Jesus can give life to people. Alternate translation: “the one who can make people alive” (See: [[rc://en/ta/man/translate/figs-metaphor]])
JHN	14	6	g5hn	figs-explicit	οὐδεὶς ἔρχεται πρὸς τὸν Πατέρα, εἰ μὴ δι’ ἐμοῦ	1	no one comes to the Father except through me	People can come to God and live with him only by trusting Jesus. Alternate translation: “No one can come to the Father and live with him unless he comes through me” (See: [[rc://en/ta/man/translate/figs-explicit]])
JHN	14	6	f95q	guidelines-sonofgodprinciples	Πατέρα	1	Father	**Father** is an important title for God. (See: [[rc://en/ta/man/translate/guidelines-sonofgodprinciples]])
JHN	14	8	kum1	guidelines-sonofgodprinciples	Κύριε, δεῖξον ἡμῖν τὸν Πατέρα	1	Lord, show us the Father	**Father** is an important title for God. (See: [[rc://en/ta/man/translate/guidelines-sonofgodprinciples]])
JHN	14	9	mr1a	figs-rquestion	τοσοῦτον χρόνον μεθ’ ὑμῶν εἰμι, καὶ οὐκ ἔγνωκάς με, Φίλιππε?	1	I have been with you for so long and you still do not know me, Philip?	This remark appears in the form of a question to add emphasis to Jesus’ words. Alternate translation: “Philip, I have been with you disciples already for a very long time. You should know me by now!” (See: [[rc://en/ta/man/translate/figs-rquestion]])
JHN	14	9	l3s8	guidelines-sonofgodprinciples	ὁ ἑωρακὼς ἐμὲ, ἑώρακεν τὸν Πατέρα	1	Whoever has seen me has seen the Father	To see Jesus, who is God the Son, is to see God **the Father**. **Father** is an important title for God. (See: [[rc://en/ta/man/translate/guidelines-sonofgodprinciples]])
JHN	14	9	x1uh	figs-rquestion	πῶς σὺ λέγεις, δεῖξον ἡμῖν τὸν Πατέρα?	1	How can you say, ‘Show us the Father’?	This remark appears in the form of a question to emphasize Jesus’ words to Philip. Alternate translation: “So you really should not be saying, ‘Show us the Father!’” (See: [[rc://en/ta/man/translate/figs-rquestion]])
JHN	14	10	v2jb			0	Connecting Statement:	Jesus asks Philip a question and then he continues to speak to all of his disciples.
JHN	14	10	hc1z	figs-rquestion	οὐ πιστεύεις ὅτι ἐγὼ ἐν τῷ Πατρὶ, καὶ ὁ Πατὴρ ἐν ἐμοί ἐστιν?	1	Do you not believe … in me?	This remark appears in the form of a question to emphasize Jesus’ words to Philip. Alternate translation: “You really should believe that I am in the Father and the Father is in me.” (See: [[rc://en/ta/man/translate/figs-rquestion]])
JHN	14	10	e4se	guidelines-sonofgodprinciples	Πατρὶ	1	Father	**Father** is an important title for God. (See: [[rc://en/ta/man/translate/guidelines-sonofgodprinciples]])
JHN	14	10	pgk6		τὰ ῥήματα ἃ ἐγὼ λαλῶ ὑμῖν, ἀπ’ ἐμαυτοῦ οὐ λαλῶ	1	The words that I say to you I do not speak from my own authority	“What I am telling you is not from me” or “The words I tell you are not from me”
JHN	14	10	wh9w		τὰ ῥήματα ἃ ἐγὼ λαλῶ ὑμῖν	1	The words that I say to you	Here, **you** is plural. Jesus is now speaking to all of his disciples.
JHN	14	11	ew6g	figs-idiom	ἐγὼ ἐν τῷ Πατρὶ, καὶ ὁ Πατὴρ ἐν ἐμοί	1	I am in the Father, and the Father is in me	This is an idiom that means God the Father and Jesus have a unique relationship. Alternate translation: “I am one with the Father, and the Father is one with me” or “my Father and I are just as though we were one” (See: [[rc://en/ta/man/translate/figs-idiom]])
JHN	14	12	gh64		ἀμὴν, ἀμὴν	1	Truly, truly	See how you translated this in [John 1:51](../01/51.md).
JHN	14	12	h2rh		ὁ πιστεύων εἰς ἐμὲ	1	believes in me	This means to believe that Jesus is the Son of God.
JHN	14	12	cn14	guidelines-sonofgodprinciples	Πατέρα	1	Father	**Father** is an important title that describes the relationship between God and Jesus. (See: [[rc://en/ta/man/translate/guidelines-sonofgodprinciples]])
JHN	14	13	n2id	figs-metonymy	ὅ τι ἂν αἰτήσητε ἐν τῷ ὀνόματί μου	1	Whatever you ask in my name	Here, **name** is a metonym that represents the authority of Jesus. Alternate translation: “Whatever you ask, using my authority” (See: [[rc://en/ta/man/translate/figs-metonymy]])
JHN	14	13	i138	figs-activepassive	ἵνα δοξασθῇ ὁ Πατὴρ ἐν τῷ Υἱῷ	1	so that the Father will be glorified in the Son	You can translate this in an active form. Alternate translation: “so I can show everyone how great my Father is” (See: [[rc://en/ta/man/translate/figs-activepassive]])
JHN	14	13	j6nh	guidelines-sonofgodprinciples	Πατὴρ…Υἱῷ	1	Father … Son	**Father** and **Son** are important titles that describe the relationship between God and Jesus. (See: [[rc://en/ta/man/translate/guidelines-sonofgodprinciples]])
JHN	14	14	sgk6	figs-metonymy	ἐάν τι αἰτήσητέ με ἐν τῷ ὀνόματί μου, ἐγὼ ποιήσω	1	If you ask me anything in my name, I will do it	Here, **name** is a metonym that represents the authority of Jesus. Alternate translation: “If you ask me anything as one of my followers, I will do it” or “Whatever you ask of me, I will do it because you belong to me” (See: [[rc://en/ta/man/translate/figs-metonymy]])
JHN	14	16	tu1e		Παράκλητον	1	Comforter	This refers to the Holy Spirit.
JHN	14	17	sc6r		Πνεῦμα τῆς ἀληθείας	1	Spirit of truth	This refers to the Holy Spirit who teaches people what is true about God.
JHN	14	17	i2v7	figs-metonymy	ὃ ὁ κόσμος οὐ δύναται λαβεῖν	1	The world cannot receive him	Here the **world** is a metonym that refers to the people who oppose God. Alternate translation: “whom the unbelieving people in this world will never welcome” or “whom those who oppose God will not accept” (See: [[rc://en/ta/man/translate/figs-metonymy]])
JHN	14	18	hy8v	figs-explicit	οὐκ ἀφήσω ὑμᾶς ὀρφανούς	1	leave you alone	Here Jesus implies that he **will not leave** his disciples with no one to care for them. Alternate translation: “I will not leave you with no one to care for you” (See: [[rc://en/ta/man/translate/figs-explicit]])
JHN	14	19	r5q8	figs-metonymy	ὁ κόσμος	1	the world	Here the **world** is a metonym that represents the people who do not belong to God. Alternate translation: “the unbelievers” (See: [[rc://en/ta/man/translate/figs-metonymy]])
JHN	14	20	b87j		γνώσεσθε ὑμεῖς ὅτι ἐγὼ ἐν τῷ Πατρί μου	1	you will know that I am in my Father	God the **Father** and Jesus live as one person. Alternate translation: “you will know that my Father and I are just like one person”
JHN	14	20	he2a	guidelines-sonofgodprinciples	Πατρί μου	1	my Father	**Father** is an important title for God. (See: [[rc://en/ta/man/translate/guidelines-sonofgodprinciples]])
JHN	14	20	ht8z		ὑμεῖς ἐν ἐμοὶ, κἀγὼ ἐν ὑμῖν	1	you are in me, and that I am in you	“you and I are just like one person”
JHN	14	21	rw8n		ἀγαπῶν	1	loves	This kind of love comes from God and focuses on the good of others, even when it does not benefit oneself. This kind of love cares for others, no matter what they do.
