Book	Chapter	Verse	ID	SupportReference	OrigQuote	Occurrence	GLQuote	OccurrenceNote
ROM	3	21	e5ky	figs-explicit	νόμου…τοῦ νόμου	1	now	While the first occurrence of **the law** in this verse refers to the laws that God gave the Jews through Moses, the second occurrence refers to the first five books in the Old Testament that were written by Moses. The ULT shows this different by using **the law** and **the Law** respectively. If this might confuse your readers, you could state this more explicitly. Alternate translation: “the laws God gave Israel … the part of Scripture that Moses wrote” (See: [[rc://en/ta/man/translate/figs-explicit]])
ROM	3	21	nlj0	figs-possession	χωρὶς νόμου	1		Here, **apart from the law** could mean: (1) **apart from** doing what **the law** requires. Alternate translation: “without having to do what the law requires” (2) outside of what **the law** says. Alternate translation: “not related to what the law says” or “differently than what the law says” (See: [[rc://en/ta/man/translate/figs-possession]])
ROM	3	21	e4qe	figs-activepassive	δικαιοσύνη Θεοῦ πεφανέρωται	1	apart from the law the righteousness of God has been made known	If your language does not use the passive form in this way, you could express the idea in active form or in another way that is natural in your language. If you must state who did the action, Paul implies that “God” did it. Alternate translation: “God has made his righteousness visible” or “God has revealed his righteousness” (See: [[rc://en/ta/man/translate/figs-activepassive]])
ROM	3	21	qkis	figs-possession	δικαιοσύνη Θεοῦ	1		See how you translated this phrase in [1:17](../01/17.md). (See: [[rc://en/ta/man/translate/figs-possession]])
ROM	3	21	gvca	figs-activepassive	μαρτυρουμένη ὑπὸ τοῦ νόμου καὶ τῶν προφητῶν	1		If your language does not use the passive form in this way, you could express the idea in active form or in another way that is natural in your language. Alternate translation: “the Law and the Prophets bearing witness” (See: [[rc://en/ta/man/translate/figs-activepassive]])
ROM	3	21	tnf8	figs-personification	μαρτυρουμένη ὑπὸ τοῦ νόμου καὶ τῶν προφητῶν	1	It was witnessed by the Law and the Prophets	Here Paul uses **the Law and the Prophets** figuratively as if they were people who could witness or testify in a courtroom. If this might confuse your readers, you could express the meaning plainly. Alternate translation: “what God says in the Law and the Prophets is a written testimony to this” (See: [[rc://en/ta/man/translate/figs-personification]])
ROM	3	21	bgyx	figs-synecdoche	ὑπὸ τοῦ νόμου καὶ τῶν προφητῶν	1		Paul is using the name of two parts of the Hebrew Scriptures, **the Law and the Prophets**, to represent the entire Hebrew Scriptures in general. If this might confuse your readers, you could express the meaning plainly. Alternate translation: “in your Scriptures” (See: [[rc://en/ta/man/translate/figs-synecdoche]])
ROM	3	22	pec5	grammar-connect-words-phrases	δὲ	1		Here, **but** indicates that what follows explains how a person receives “the righteousness of God”. It does not indicate a contrast. Alternate translation: “namely,” or “even” (See: [[rc://en/ta/man/translate/grammar-connect-words-phrases]])
ROM	3	22	cvhy	figs-possession	δικαιοσύνη…Θεοῦ	1		See how you translated this phrase in the previous verse. (See: [[rc://en/ta/man/translate/figs-possession]])
ROM	3	22	q4m1	figs-possession	διὰ πίστεως Ἰησοῦ Χριστοῦ	1		Here, **faith in Jesus Christ** is a possessive form that indicates **faith** that is associated with **Jesus Christ**. This could refer to: (1) trust in Jesus Christ. Alternate translation: “by trusting in Jesus Christ” or “by believing in Jesus Christ” (2) the faithfulness of Jesus Christ. Alternate translation: “through the faithfulness that Jesus Christ possesses” or “through how faithful Jesus Christ is” (See: [[rc://en/ta/man/translate/figs-possession]])
ROM	3	22	c4mg	figs-ellipsis	τοὺς πιστεύοντας	1		Paul is leaving out some words that a clause would need in many languages to be complete. If it would be helpful in your language, you could supply this word from the context. Alternate translation: “those who believe in him” or “those who believe in Jesus for salvation” (See: [[rc://en/ta/man/translate/figs-ellipsis]])
ROM	3	22	o6qe	grammar-connect-logic-result	γάρ	1		Here, **for** introduces a reason clause. Paul is giving the reason why **the righteousness of God** is **for all those who believe**. Use a natural way in your language to indicate the reason why something is true. Alternate translation: “because” (See: [[rc://en/ta/man/translate/grammar-connect-logic-result]])
ROM	3	22	daa3	figs-abstractnouns	οὐ…ἐστιν διαστολή	1		If your language does not use an abstract noun for the idea of **distinction**, you could express the same idea in a different way. Alternate translation: “God does not discriminate” or “God is not partial” (See: [[rc://en/ta/man/translate/figs-abstractnouns]])
ROM	3	23	x1hu	grammar-connect-logic-result	γὰρ	1		**For** here introduces a reason clause. Paul is giving the reason why “there is no distinction,” as stated in the previous verse. Use a natural way in your language to indicate the reason why something is true. Alternate translation: “The reason for this is that” (See: [[rc://en/ta/man/translate/grammar-connect-logic-result]])
ROM	3	23	akn9	figs-nominaladj	πάντες	1		Here Paul uses the adjective **all** as a noun that refers to **all** the people who have existed or will exist. If this might confuse your readers, you could express the meaning plainly. Alternate translation: “all people” (See: [[rc://en/ta/man/translate/figs-nominaladj]])
ROM	3	23	jbe9	figs-metaphor	ὑστεροῦνται τῆς δόξης τοῦ Θεοῦ	1		Paul speaks figuratively of **all** people as if they were something that fails to reach its destination. He means that they lack or do not attain **the glory of God**. If your readers would not understand this, you could express the meaning plainly. Alternative translation: “lack the glory of God” or “fail to attain the glory of God” (See: [[rc://en/ta/man/translate/figs-metaphor]])
ROM	3	23	vwsf	figs-possession	τῆς δόξης τοῦ Θεοῦ	1		Here the possessive form **the glory of God** could refer to: (1) the glory that God shared with humans when he created them, but which they lost when the first humans sinned. Alternate translation: “the glory God once gave them” or “the glory from God” (2) glorifying God, as in the similar phrase “the glory of the imperishable God” in [1:23](../01/23.md). Alternate translation: “of glorifying God” (See: [[rc://en/ta/man/translate/figs-possession]])
ROM	3	24	ibi2	figs-personification	δικαιούμενοι δωρεὰν τῇ αὐτοῦ χάριτι	1		Here, **grace** is spoken of figuratively as though it were a person who could **justify** someone. Paul means that God graciously makes people righteous as a gift. If this might confuse your readers, you could express this meaning plainly. Alternate translation: “and are gifted with becoming righteous because God is gracious” (See: [[rc://en/ta/man/translate/figs-personification]])
ROM	3	24	evs8	figs-explicit	δικαιούμενοι δωρεὰν	1		Paul assumes that his readers know that those who are **being justified freely** are “all” those who “have sinned” in the previous verse. If it would be helpful to your readers, you could say that explicitly. Alternate translation: “all people are being freely justified” (See: [[rc://en/ta/man/translate/figs-explicit]])
ROM	3	24	jgcu		δωρεὰν	1		Alternate translation: “as a gift” or “without payment”
ROM	3	24	atij	figs-abstractnouns	τῇ αὐτοῦ χάριτι, διὰ τῆς ἀπολυτρώσεως τῆς ἐν Χριστῷ Ἰησοῦ	1		If your language does not use abstract nouns for the ideas of **grace** and **redemption**, you could express the same ideas with different forms. Alternate translation: “by God being gracious through redeeming them in Christ Jesus” or “due to how kind God is, because Christ Jesus redeemed them” (See: [[rc://en/ta/man/translate/figs-abstractnouns]])
ROM	3	24	hyeb	figs-explicit	ἀπολυτρώσεως	1		The word translated as **redemption** refers to rescuing someone from captivity by paying a ransom. Your language may require you to indicate what the people are redeemed from. This could mean: (1) Jesus redeems people from eternal punishment. Alternative translation: “redemption from eternal punishment” (2) Jesus redeems people from being enslaved to sin. Alternative translation: “redemption from enslavement to sin” (See: [[rc://en/ta/man/translate/figs-explicit]])
ROM	3	24	lno6	figs-metaphor	τῆς ἐν Χριστῷ Ἰησοῦ	1		Here, Paul speaks figuratively of **redemption** as if it were an object that could be inside Jesus. Paul means that God redeemed all people who believe in Jesus by uniting them to **Christ Jesus**. If your readers might misunderstand this, you can express the meaning plainly. Alternative translation: “that comes through union with Christ Jesus” or “that is through being united to Christ Jesus” (See: [[rc://en/ta/man/translate/figs-metaphor]])
ROM	3	25	ci0v	figs-metaphor	ὃν προέθετο ὁ Θεὸς ἱλαστήριον	1		Here Paul uses **presented** figuratively as if Jesus were an Old Testament atonement sacrifice that was **presented** to God in the temple. He means that Jesus’ death was a sacrifice for the sins of humankind. If your readers would not understand this, you could express the meaning plainly. Alternative translation: “whom God offered to atone for the sins of humanity” (See: [[rc://en/ta/man/translate/figs-metaphor]])
ROM	3	25	t2d8	figs-abstractnouns	ἱλαστήριον, διὰ πίστεως…εἰς ἔνδειξιν τῆς δικαιοσύνης αὐτοῦ	1		If your language does not use abstract nouns for the ideas of **propitiation**, **faith**, **demonstration**, or **righteousness**, you could express the same ideas with different forms. Alternate translation: “to atone for people’s sins by trusting … to demonstrate how he makes people righteous” (See: [[rc://en/ta/man/translate/figs-abstractnouns]])
ROM	3	25	m159	figs-metonymy	ἐν τῷ αὐτοῦ αἵματι	1	in his blood	Here Paul uses **his blood** figuratively to refer to Jesus’ death. If this might confuse your readers, you could express the meaning plainly. Alternate translation: “in Christ’s death” (See: [[rc://en/ta/man/translate/figs-metonymy]])
ROM	3	25	ieq9	grammar-connect-logic-goal	εἰς ἔνδειξιν	1	disregard	Here, **for** indicates that the phrase that follows is the purpose for which God **presented** Jesus as **a propitiation**. Use a natural way in your language to indicate a purpose clause. Alternate translation (without a comma preceding): “in order to demonstrate” (See: [[rc://en/ta/man/translate/grammar-connect-logic-goal]])
ROM	3	25	ze9m	figs-possession	τῆς δικαιοσύνης αὐτοῦ	1		See how you translated “the righteousness of God” in [1:17](../01/17.md). (See: [[rc://en/ta/man/translate/figs-possession]])
ROM	3	25	siri	figs-abstractnouns	διὰ τὴν πάρεσιν	1		If your language does not use an abstract noun for the idea of **overlooking**, you could express the same idea with a different form. Alternate translation: “because he overlooked” (See: [[rc://en/ta/man/translate/figs-abstractnouns]])
ROM	3	25	ydoj	figs-abstractnouns	τῶν προγεγονότων ἁμαρτημάτων	1		If your language does not use an abstract noun for the idea of **sin**, you could express the same idea in a different way. Alternate translation: “how they had sinned previously” (See: [[rc://en/ta/man/translate/figs-abstractnouns]])
ROM	3	26	b2f6	grammar-connect-logic-result	ἐν	1		Here, **in** introduces a reason clause. Paul is giving the reason for God “overlooking of the sins that happened previously,” as stated in the previous verse. Use a natural way in your language to indicate the reason why something is true. Alternate translation: “The reason for this is” (See: [[rc://en/ta/man/translate/grammar-connect-logic-result]])
ROM	3	26	lm1r	figs-abstractnouns	ἐν τῇ ἀνοχῇ τοῦ Θεοῦ	1	This all happened for the demonstration of his righteousness at this present time	If your language does not use an abstract noun for the idea of **forbearance**, you could express the same idea with a verbal form. Alternate translation: “because God is so forbearing” or “since God forbears” (See: [[rc://en/ta/man/translate/figs-abstractnouns]])
ROM	3	26	cg55	figs-possession	ἐν τῇ ἀνοχῇ τοῦ Θεοῦ	1	so that he could be just, and justify the one who has faith in Jesus	Paul is using the possessive form to describe **God** who is characterized by **forbearance**. If this might confuse your readers, you could state this explicitly. Alternate translation: “in God’s forbearance” (See: [[rc://en/ta/man/translate/figs-possession]])
ROM	3	26	b1xa	figs-possession	πρὸς τὴν ἔνδειξιν τῆς δικαιοσύνης αὐτοῦ	1		See how you translated this phrase in the previous verse. (See: [[rc://en/ta/man/translate/figs-possession]])
ROM	3	26	v1c9		ἐν τῷ νῦν καιρῷ	1		Alternate translation: “at this time in history” or “currently”
ROM	3	26	jjwq	grammar-connect-logic-goal	εἰς τὸ εἶναι αὐτὸν	1		Here, **so that** indicates that what follows is a purpose clause. Paul is stating the purpose for which God now demonstrates **his righteousness**. Use a natural way in your language for introducing a purpose clause. Alternate translation (without a comma preceding): “in order that he would be” (See: [[rc://en/ta/man/translate/grammar-connect-logic-goal]])
ROM	3	26	x6cf	figs-genericnoun	τὸν ἐκ πίστεως Ἰησοῦ	1		Paul is speaking of all people who have **faith in Jesus**, not one particular person. If it would be helpful in your language, use a more natural phrase. Alternate translation: “anyone who is from faith in Jesus” or “every person who trusts in Jesus”(See: [[rc://en/ta/man/translate/figs-genericnoun]])
ROM	3	26	qdkw	figs-possession	τὸν ἐκ πίστεως Ἰησοῦ	1		Here Paul is using the possessive form to describe a person who is characterized by **faith in Jesus**. If this is not clear in your language, you could express the meaning plainly. Alternate translation: “the one who is characterized by faith in Jesus” (See: [[rc://en/ta/man/translate/figs-possession]])
ROM	3	26	ab0w	figs-possession	πίστεως Ἰησοῦ	1		See how you translated this phrase in [verse 22](../03/22.md). (See: [[rc://en/ta/man/translate/figs-possession]])
ROM	3	27	emwi			0	Connecting Statement:	In [verses 27–31](../03/27.md) Paul uses a series of rhetorical questions and answers in order to emphasize that God alone makes people righteous through faith in Jesus. Like in [verses 1–9](../03/01.md), Paul is speaking as if he were a non-Christian Jew when he asks the rhetorical questions, but he is speaking as himself when he answers those questions.
ROM	3	27	e0wc	grammar-connect-logic-result	οὖν	1		Here, **then** indicates that what follows is a response to what Paul said in [verses 21–26](../03/21.md). If it might help your readers, you could state this explicitly. Alternate translation: “If it is God who makes people righteous through faith in Jesus, then where is” (See: [[rc://en/ta/man/translate/grammar-connect-logic-result]])
ROM	3	27	fjm4	figs-rquestion	ποῦ οὖν ἡ καύχησις?	1	Where then is boasting? It is excluded	Paul is not asking for information, but is using this question here to express an objection that a Jew might have to what Paul said in [verses 21–26](../03/21.md). If you would not use rhetorical questions for this purpose in your language, you could translate his words as a statement or an exclamation and communicate the emphasis in another way. Alternate translation: “There then is no grounds for boasting!” (See: [[rc://en/ta/man/translate/figs-rquestion]])
ROM	3	27	mvs0	figs-metaphor	ποῦ οὖν ἡ καύχησις	1		Here Paul speaks figuratively of **boasting** as if it were an object that could be in a location. He means that no one can boast because only God makes people righteous. If this might confuse your readers, you could express the meaning plainly. Alternative translation: “Then can anyone boast” (See: [[rc://en/ta/man/translate/figs-metaphor]])
ROM	3	27	pub7	figs-abstractnouns	ποῦ οὖν ἡ καύχησις	1		If your language does not use an abstract noun for the idea of **boasting**, you could express the same idea with a verbal form. Alternate translation: “Who then can boast” (See: [[rc://en/ta/man/translate/figs-abstractnouns]])
ROM	3	27	px29	figs-explicit	ἐξεκλείσθη	1		In this sentence Paul responds to the rhetorical question in the previous sentence. If it might help your readers, you could state this explicitly. Alternate translation: “I would respond by saying, ‘It is excluded!’” (See: [[rc://en/ta/man/translate/figs-explicit]])
ROM	3	27	eufl	figs-activepassive	ἐξεκλείσθη	1		If your language does not use the passive form in this way, you can state this in active form or in another way that is natural in your language. Alternate translation: “God has excluded it” or “God does not allow it” (See: [[rc://en/ta/man/translate/figs-activepassive]])
ROM	3	27	v3ut	figs-ellipsis	διὰ ποίου νόμου? τῶν ἔργων?…διὰ νόμου πίστεως	1	On what grounds? Of works? No, but on the grounds of faith	Paul is leaving out some of the words that these sentences would need in many languages to be complete. If your readers might misunderstand this, you could supply these words from the context. Alternate translation: “Through what kind of law is a person made righteous? Is a person made righteous through the works of the law? … a person made righteous through a law of faith” (See: [[rc://en/ta/man/translate/figs-ellipsis]])
ROM	3	27	dpny	figs-rquestion	διὰ ποίου νόμου? τῶν ἔργων?	1		In these two sentences Paul is not asking for information, but is using these two questions here to express the objections that a Jew might have to what Paul said in the previous sentence and in [verses 21–26](../03/21.md). If you would not use a rhetorical question for this purpose in your language, you could translate his words as a statement or an exclamation and communicate the emphasis in another way. Alternate translation: “Surely through a kind of law! Surely through the works!” or “Surely a person is made righteous through a kind of law! Surely a person is made righteous through works!”(See: [[rc://en/ta/man/translate/figs-rquestion]])
ROM	3	27	bgyy	figs-possession	τῶν ἔργων?	1		Paul is using the possessive form to describe a **law** that is characterized by **works**. If this might confuse your readers, you could use a different expression. Alternate translation: “Through a law characterized by works?” or “By doing what the law requires?” (See: [[rc://en/ta/man/translate/figs-possession]])
ROM	3	27	h9wb	figs-explicit	οὐχί, ἀλλὰ διὰ νόμου πίστεως	1		In this sentence Paul responds to the rhetorical questions in the previous two sentences. If it might help your readers, you could state this explicitly. Alternate translation: “I would respond by saying, ‘No! But through a law of faith.’” (See: [[rc://en/ta/man/translate/figs-explicit]])
ROM	3	27	tg79	figs-exclamations	οὐχί	1		**No!** is an exclamation that communicates a strong contrast to the previous statement. Use an exclamation that is natural in your language for communicating a strong contrast. Alternate translation: “Not at all!” (See: [[rc://en/ta/man/translate/figs-exclamations]])
ROM	3	27	ynz1	figs-possession	διὰ νόμου πίστεως	1		Paul is using the possessive form to describe a **law** that is characterized by **faith**. If this might confuse your readers, you could use a different expression. Alternate translation: “through a law characterized by faith” or “by doing what faith requires” (See: [[rc://en/ta/man/translate/figs-possession]])
ROM	3	27	mlcq	figs-abstractnouns	πίστεως	1		If your language does not use an abstract noun for the idea of **faith**, you could express the same idea with a different form. Alternate translation: “of trusting in God” (See: [[rc://en/ta/man/translate/figs-abstractnouns]])
ROM	3	28	qe9p	grammar-connect-words-phrases	γὰρ	1		**For** here indicates that what follows explains what “the law of faith” means in the previous verse. If this might confuse your readers, you could state this explicitly. Alternate translation: “In fact” (See: [[rc://en/ta/man/translate/grammar-connect-words-phrases]])
ROM	3	28	jtqq	figs-exclusive	λογιζόμεθα	1		Here, **we** is used exclusively to speak of Paul and other Christian Jews, as indicated in [verse 9](../03/09.md). Your language may require you to mark these forms. Alternate translation: “we believing Jews consider” or “we believing Jews regard” (See: [[rc://en/ta/man/translate/figs-exclusive]])
ROM	3	28	t8um	figs-gendernotations	ἄνθρωπον	1	a person is justified by faith	Although the term **man** is masculine, Paul is using the word here in the generic sense that includes both men and women. Alternate translation: “humankind” or “a person” (See: [[rc://en/ta/man/translate/figs-gendernotations]])
ROM	3	28	ph88	figs-activepassive	δικαιοῦσθαι…ἄνθρωπον	1		If your language does not use the passive form in this way, you can state this in an active form or in another way that is natural in your language. If you must state who did the action, Paul implies that “God” did it. Alternate translation: “that God justifies a man” or “that God makes a man righteous” (See: [[rc://en/ta/man/translate/figs-activepassive]])
ROM	3	28	jb14	figs-abstractnouns	πίστει	1		If your language does not use an abstract noun for the idea of **faith**, you could express the same idea with a verbal form. Alternate translation: “by believing in Jesus” (See: [[rc://en/ta/man/translate/figs-abstractnouns]])
ROM	3	28	s747	figs-possession	χωρὶς ἔργων νόμου	1	without works of the law	See how you translated “apart from the law” in [verse 21](../03/21.md). (See: [[rc://en/ta/man/translate/figs-possession]])
ROM	3	28	ycx2	figs-possession	ἔργων νόμου	1	without works of the law	Paul is using the possessive form to refer to **the works** that God requires in **the law**. If this might confuse your readers, you could state this explicitly. Alternate translation: “the works that the law requires” (See: [[rc://en/ta/man/translate/figs-possession]])
ROM	3	29	hdbq	grammar-connect-words-phrases	ἢ	1		**Or** here indicates that the next two sentences are the responses that a Jew might have to what Paul said in the previous verse. If this might confuse your readers, you could state this explicitly. Alternate translation: “Or you Jews might say” (See: [[rc://en/ta/man/translate/grammar-connect-words-phrases]])
ROM	3	29	ineu	figs-ellipsis	οὐχὶ καὶ ἐθνῶν? ναὶ, καὶ ἐθνῶν	1		Paul is leaving out some of the words that these sentences would need in many languages to be complete. If your readers might misunderstand this, you could supply these words from the previous verse. Alternate translation: “Is he not also God of Gentiles? Yes, he is also God of Gentiles” (See: [[rc://en/ta/man/translate/figs-ellipsis]])
ROM	3	29	m8eo	figs-explicit	ἐθνῶν…ἐθνῶν	1		See how you translated this word in [1:5](../01/05.md). (See: [[rc://en/ta/man/translate/figs-explicit]])
ROM	3	29	ch7p	figs-rquestion	Ἰουδαίων ὁ Θεὸς μόνον? οὐχὶ καὶ ἐθνῶν?	1		Paul is not asking for information, but is using these two questions here to express the responses that a Jew might have to what Paul said in the previous verse. If you would not use a rhetorical question for this purpose in your language, you could translate his words as a statement or an exclamation and communicate the emphasis in another way. Alternate translation: “God is surely not only the God of Jews! He is surely also the God of Gentiles!” (See: [[rc://en/ta/man/translate/figs-rquestion]])
ROM	3	29	rq5m	figs-explicit	ναὶ, καὶ ἐθνῶν	1		In this sentence Paul responds to the rhetorical questions in the previous two sentences. If it might help your readers, you could state this explicitly. Alternate translation: “I would respond by saying, ‘Yes, also of Gentiles’” (See: [[rc://en/ta/man/translate/figs-explicit]])
ROM	3	29	gp74	figs-exclamations	ναὶ	1		**Yes** is an exclamation word that communicates enthusiasm. Use an exclamation that is natural in your language for communicating enthusiasm. Alternate translation (change the period to an exclamation point): “Of course!” (See: [[rc://en/ta/man/translate/figs-exclamations]])
