Book	Chapter	Verse	ID	SupportReference	OrigQuote	Occurrence	GLQuote	OccurrenceNote
1TH	front	intro	jp2y			0		# Introduction to 1 Thessalonians<br><br>## Part 1: General Introduction<br><br>### Outline of the Book of 1 Thessalonians<br><br>In this letter, the apostle Paul, along with Silvanus and Timothy, encourages and makes appeals to the Thessalonian Church (See: rc://en/tw/bible/names/thessalonica.md). Paul is the spokesman for all of them, using “we” to refer to the group, but in certain places Paul speaks for himself using “I” (See [2:18](../02/18.md); 3:5; 5:27). The background story for the apostles’ activity in Thessalonica can be found in Acts 17:1-10.<br><br>1. Apostolic memories of the Thessalonian Church (1:1-10)<br>   * Greeting (1:1)<br>   * Thanksgiving for the Thessalonian Christians (1:2-4)<br>   * Examples of Thessalonian suffering (1:6-10)<br>1. Apostolic authority (2:1-16)<br>   * Persecution of the Church (2:1-13)<br>   * Opposition to the Church (2:14-16)<br>1. Timothy’s visit to Thessalonica (3:1-13)<br>   * Reason for the visit (3:1-5)<br>   * Report about the visit (3:6-13)<br>1. Apostolic teachings (4:1-18)<br>   * Holiness (4:1-8)<br>   * Christian love (4:9-12)<br>   * Manner of the Second Coming of Christ (4:13-18)<br>1. Final teachings (5:1-28)<br>   * Timing of the Second Coming of Christ (5:1-10)<br>   * Final appeals and teachings (5:11-28)<br><br>### Who wrote 1 Thessalonians?<br><br>Paul wrote 1 Thessalonians, with the agreement of Silvanus and Timothy. Paul was from the city of Tarsus. He had been known as Saul in his early life. Before becoming a Christian, Paul was a Pharisee. He persecuted Christians. After he became a Christian, he traveled several times throughout the Roman Empire telling people about Jesus. Paul wrote this letter while staying in the city of Corinth. Of all Paul’s letters that are in the Bible, many scholars think 1 Thessalonians was the first letter Paul wrote.<br><br>Silvanus is also mentioned in 2 Corinthians 1:19; 2 Thessalonians 1:1; 1 Peter 5:12. “Silas,” the name used in the book of Acts, is a contracted form of Silvanus and considered to be the same person. Timothy was leader of the church at Ephesus (see 1 Timothy 1:1-4). Paul wrote this letter while staying in the city of Corinth with these two men. The mention of all three men in 1:1 indicates they were in Thessalonica together at some point. Many scholars think 1 Thessalonians was the first letter that Paul wrote.<br><br>### What is the Book of 1 Thessalonians about?<br><br>Paul wrote this letter to the church in the city of Thessalonica, after the Jews in the city forced him to leave. Ancient Thessalonica was located on the southeast coast of ancient Macedonia, and is now called Thessaloniki, located in northeast Greece. (See: rc://en/ta/man/translate/writing-background). Paul wrote it. In this letter Paul said he considered his visit to them a success, even though he was forced to leave (See Acts 17:1-10).<br><br>Paul responded to the news from Timothy about the Thessalonian believers. The believers there were being persecuted. He encouraged them to continue living in a way that pleased God. He also comforted them by explaining what happens to those who die before Christ returns.<br><br>### How should the title of this book be translated?<br><br>Translators may choose to call this book by its traditional title, “1 Thessalonians” or “First Thessalonians.” They may instead prefer to choose a clearer title, such as “Paul’s First Letter to the Church in Thessalonica,” or “The First Letter to the Church in Thessalonica.” (See: [[rc://en/ta/man/translate/translate-names]])<br><br>## Part 2: Important Religious and Cultural Concepts<br><br>### Trinity<br><br>In this letter, the doctrine of the Holy Trinity finds solid support. The terms: God, Father, Son, Lord, Jesus, and Holy Spirit appear numerous times. (See: rc://en/tw/bible/kt/god.md)<br><br>### The Gospel<br><br>In this letter, Paul frequently refers to the apostles' ministry of the gospel and uses different phrases to communicate the concept of God's good news about Jesus Christ. (See: rc://en/tw/bible/kt/goodnews.md)<br><br>### Prayer<br><br>Paul reassures the Thessalonians that his group of apostles frequently prays for them (See [1:2](../01/02.md). He also gives instructions about prayer (See [5:2](../05/17.md), and asks the Thessalonians to pray for them (See [5:25](../05/25.md)). (See: rc://en/tw/bible/kt/pray.md)<br><br>### Faith and Faithfulness<br><br>Through the letter the Thessalonians are commended for their faithfulness to God. They are reminded to trust God and remain faithful to Gospel living. (See: [[rc://en/tw/bible/kt/faithful.md]])(See: [[rc://en/tw/bible/kt/faith.md]])<br><br>### Apostolic authority<br><br>Much of this letter is a defense of the apostles authority, based on their teaching and living. The term “apostles” is used in [2:6](../02/06.md) to reinforce that Paul, Silvanus, and Timothy are sent by God. (See: [[rc://en/tw/bible/kt/apostle.md]])<br><br>### Second Coming of Christ<br><br>Paul wrote much in this letter about Jesus’ eventual return to Earth. When Jesus returns, he will judge all mankind. He will also rule over creation, and there will be peace everywhere.<br><br>### The Fate of reposed Christians<br><br>Paul made clear that those who who die before Christ’s return will come back to life and be with Jesus. They will not remain dead forever. Paul wrote this to encourage the Thessalonians. For some of them worried that those Christians who died would miss the great “day of the Lord” when Jesus returns.<br><br>### Idolatry<br><br>The Greek and Roman cultural background in Thessalonica meant that many members of the church were former pagans who practiced some sort of idolatry (See [1:9](../01/09.md)(See: [[rc://en/tw/bible/other/image.md]]). <br><br>### Suffering<br><br>Much of this letter addresses both the sufferings of the apostles and the Thessalonian Church for faithfulness to the gospel. (See: [[rc://en/tw/bible/other/afflict.md]])(See: [[rc://en/tw/bible/other/persecute.md]])(See: [[rc://en/tw/bible/other/suffer.md]])<br><br>### Sanctification<br><br>The concept of holiness is prevalent in this letter. Chapter four discusses how a Christian should practice a holy life. (See: [[rc://en/tw/bible/kt/sanctify.md]])<br><br>## Part 3: Important Translation Issues<br><br>### What did Paul mean by expressions like “in Christ” and “in Christ Jesus” and “in the Lord Jesus Christ” and “in God the Father” and “in the Holy Spirit”?<br><br>Paul meant to express the idea of a union between God and Christians that includes all three persons of the Trinity. Please see the introduction to the Book of Romans for more details about these kind of expressions.<br><br>### What did Paul mean by expressions like “his coming” and “the coming of the Lord Jesus” and “the coming of the Lord Jesus Christ”?<br><br>Paul used “coming” in a specific way in relation to Jesus Christ to refer to the time when he will come again to earth, this time displaying his glory and power and gathering his people to himself. Depending on the nuances of your language, you may need to translate this with a special concept or word.<br><br>### What did Paul mean by expressions like “the word of God” or “the word of the Lord”?<br><br>Throughout this letter, Paul uses these well-known phrases or abbreviations to refer to the Gospel message.<br><br>### What did Paul mean by expressions like “brothers”?<br><br>Throughout this letter, “brothers” is a metaphor that that refers to all believers, including females. (See [1:4](../01/04.md); 2:1, 9, 14, 17; 3:7; 4:1, 6, 10, 13; 5:1, 4, 12, 14, 26, 27)<br><br>### Major textual issues in the text of the book of First Thessalonians<br><br>When ancient manuscripts of the Bible differ, ULT puts the reading that scholars consider to be the most accurate in its text, but it puts other possibly accurate readings in footnotes. The introductions to each chapter will discuss places where the ancient manuscripts differ in significant ways, and notes will address those places again where they occur in the book. If a translation of the Bible already exists in your region, consider using the readings found in that version. If not, we recommend that you follow the readings in the ULT text. (See: rc://en/ta/man/translate/translate-textvariants)<br><br>*   “Grace and peace to you” (See [1:1](../01/01.md)). Some other manuscripts read: “Grace and peace to you from God our Father and the Lord Jesus Christ.”<br>*  “but we became little children in the midst of you, as if a mother might comfort her own children” (See [2:7](../02/07.md)). Some other manuscripts read, “Instead, we were as gentle among you as a mother comforting her own children.” <br>*   “Timothy, our brother and a servant of God” (See [3:2](../03/02.md)). Some other manuscripts read: “Timothy, our brother and fellow worker for God.”  <br><br>(See: [[rc://en/ta/man/translate/translate-textvariants]])
1TH	1	intro	y8c5			0		# 1 Thessalonians 1 General Notes<br><br>## Outline of 1 Thessalonians 1<br><br>1. Greeting (1:1)<br>2. Prayer of thanksgiving for the Thessalonian Church (1:2-10)<br>*   Memory of the Thessalonians (1:2-5)<br>    *   apostolic prayers (1:2)<br>    *   work of the Thessalonians (1:2-3)<br>    *   God's election of the Thessalonians (1:4-5)<br>*   Thessalonians’ example (1:6-10)<br>    *   reception of the apostles’ teaching (1:6)<br>    *   examples to Macedonia and Achaia (1:7-10)<br>        *   example of suffering (1:7)<br>        *   preaching of the gospel (1:8)<br>        *   turned away from idolatry to God (1:9)<br>        *   waiting for the Second Coming of Christ (1:10)<br><br>## Structure and formatting<br><br>Verse 1 formally introduces this letter. Letters in the ancient Near East commonly had introductions of this type.<br>Verses 2-4 give a general thanksgiving and encouragement to the Thessalonian Church.<br><br>## Special concepts in this chapter<br><br>### Trinity<br><br>God the Father, God the Son, and God the Holy Spirit are mentioned numerous times in this chapter. They are described in their identity, activity, and the union that the Christian has in them.<br><br>### Hardship<br><br>Like the apostles before them, the Thessalonian church endured persecution for the sake of the gospel. The way that they responded with faith to the gospel message even in affliction and then preached that gospel to others made them examples to the churches throughout the regions of Macedonia and Achaia.<br><br>### Faithfulness<br><br>Paul mentions the faithfulness of the Thessalonian church throughout this chapter. See, for example, “work of faith” in 1:3, “example to all those who believe” in 1:7, and “faith toward God” in 1:8.<br><br>
1TH	1	1	ms5e	figs-ellipsis	Παῦλος, καὶ Σιλουανὸς, καὶ Τιμόθεος τῇ ἐκκλησίᾳ	1	Paul and Silvanus and Timothy to the church	Here, some words are omitted that a sentence would need in order to be complete in many languages. Alternate translation: “We are Paul, Silvanus, and Timothy, writing to the church” (See rc://en/ta/man/translate/figs-ellipsis)
1TH	1	1	zivb	figs-explicit	Παῦλος, καὶ Σιλουανὸς, καὶ Τιμόθεος	1	Paul and Silvanus and Timothy to the church	Paul is understood to be the author of this letter. Silvanus and Timothy are with him as he writes and are in agreement with what he writes. If that might not be understood in your language, you could include this information in your translation. Alternate translation: “I, Paul, together with Silvanus and Timothy, write” (See: [[rc://en/ta/man/translate/figs-explicit]])
1TH	1	1	r7n0	translate-names	Σιλουανὸς	1	Paul and Silvanus and Timothy to the church	The name **Silvanus** is a longer form of the name **Silas**, the form of the name used for this same man in the book of Acts. You could choose to use the shorter form here, as well, or you could choose to use the longer form here and include a footnote explaining that they are forms of the same name. (See: [[rc://en/ta/man/translate/translate-names]])
1TH	1	1	z7wu	figs-metaphor	ἐν Θεῷ Πατρὶ καὶ Κυρίῳ Ἰησοῦ Χριστῷ	1	Paul and Silvanus and Timothy to the church	Here, Paul speaks figuratively of the believers as though they were occupying space inside of God and Jesus. This metaphor expresses the idea that believers are spiritually united to God and Jesus. If this might be misunderstood in your language, you can express the meaning in a non-figurative way. Alternate translation: “united to God the Father and the Lord Jesus Christ” or “sharing life with God the Father and the Lord Jesus Christ” (See: [[rc://en/ta/man/translate/figs-metaphor]])
1TH	1	1	vlb3	guidelines-sonofgodprinciples	Θεῷ Πατρὶ καὶ Κυρίῳ Ἰησοῦ Χριστῷ	1		When **God** is called **Father** (See [1:3](../01/03..md)) it is meant to highlight his relationship to **Jesus** as “Son” (See [1:10](../01/10..md)). Here, the Old Testament title for **God**, **Lord**, is applied to **Jesus**, equating him with **God**. Be sure to accurately translate these titles in your translation. (See: [[rc://en/ta/man/translate/guidelines-sonofgodprinciples]])<br><br>
1TH	1	1	luw5	translate-blessing	χάρις ὑμῖν καὶ εἰρήνη	1	Grace and peace to you	This phrase is a common biblical blessing formula and greeting (See Rom. 1:7; 1 Cor. 1:3; 2 Cor. 1:2; Gal. 1:3; Eph. 1:2; Phil. 1:2; Col. 1:2; 2 Th. 1:2; Philem. 1:3; 1 Pet. 1:2; 2 Pet. 1:2; Rev. 1:4). Use a form that people would recognize as a blessing that could be used as a greeting in your language. Alternate translation: “May God give you his grace and peace” or “I pray that God shows you favor and keeps you safe” (See: [[rc://en/ta/man/translate/translate-blessing]])
1TH	1	1	qx70	translate-blessing	χάρις ὑμῖν καὶ εἰρήνη	1	Grace and peace to you	The words **grace** and **peace** are abstract nouns. Your language may have a particular way of expressing these concepts, such as with verbs or description words. If so, you can use them in your translation. Alternate translation: “We pray that God will treat you kindly and give you peaceful relationships.” Also see the UST. (See: rc://en/ta/man/translate/figs-abstractnouns)
1TH	1	1	nn67	figs-you	ὑμῖν	1	to you	Throughout this letter, the word **you** is plural and refers to the church of Thessalonica, unless otherwise noted. (See: rc://en/ta/man/translate/figs-you)<br>
1TH	1	2	of3g	figs-infostructure	εὐχαριστοῦμεν…ποιούμενοι	1		In this verse, Paul describes the apostles’ prayers for the Thessalonians in two clauses. The first clause is specific, that they **give thanks to God**, and the second is general, that they **make mention** of them. If it would be clearer in your language you can reverse the order of the clauses. See the UST. (See: rc://en/ta/man/translate/figs-infostructure)<br>
1TH	1	2	o7cp	figs-hyperbole	πάντοτε…μνείαν ποιούμενοι ἐπὶ τῶν προσευχῶν ἡμῶν, ἀδιαλείπτως	1		Here, the words **always** and **continually** are exaggerations that figuratively express the intensity and frequency of the prayers offered up to God by Paul, Silvanus, and Timothy for the Thessalonians. If your language would not use exaggeration in this way, use plain language and express the emphasis in another way. Alternate translation: “We regularly give thanks to God for all of you, very often making mention of you in our prayers” (See: rc://en/ta/man/translate/figs-hyperbole)<br>
1TH	1	2	y98w	figs-exclusive	ἡμῶν	1	General Information:	In this letter, the words **we** and **our** refer to Paul, Silvanus, and Timothy, unless otherwise noted. Throughout the letter, **we** and **our** is used to convey that all three are in agreement with the letter. (See: rc://en/ta/man/translate/figs-exclusive)<br>
1TH	1	3	ecw0	figs-idiom	μνημονεύοντες	1		The main verb of this sentence is “we give thanks” (See [1:2](../01/02.md)). The phrase **remembering…before our God and Father** is an idiom that also means to thank God in prayer. The apostles are remembering these things about the Thessalonians and thanking God for them. If it would be helpful for your readers, you could move the phrase **before our God and Father** to follow **remembering**. Alternate translation: “offering thanks for…to our God and Father” or “gratefully mentioning to our God and Father” (See: rc://en/ta/man/translate/figs-idiom)<br>
1TH	1	3	w769	figs-possession	τοῦ ἔργου τῆς πίστεως, καὶ τοῦ κόπου τῆς ἀγάπης, καὶ τῆς ὑπομονῆς τῆς ἐλπίδος	1		Paul uses three pairs of words in a possessive relationship here. The most likely meaning of this possessive relationship is that the second word of each pair is the motivation for the first word of the pair. Alternate translation: “work motivated by faith and labor because of love and endurance based on future promises” (See: rc://en/ta/man/translate/figs-possession)<br>
1TH	1	3	hu8u	figs-synecdoche	τοῦ ἔργου τῆς πίστεως, καὶ τοῦ κόπου τῆς ἀγάπης, καὶ τῆς ὑπομονῆς τῆς ἐλπίδος	1		It is possible that these terms are meant as a synecdoche for the Christian faith as a whole (see 1 Corinthians 13:13). (See: [[rc://en/ta/man/translate/figs-synecdoche]])
1TH	1	3	kr8q	figs-possession	τοῦ Κυρίου ἡμῶν, Ἰησοῦ Χριστοῦ	1		The words **hope in our Lord Jesus Christ** is a possessive form. The relationship between **our Lord Jesus Christ** and **hope** could be: 1) Jesus is the object of hope. Alternate translation: “that our Lord Jesus Christ will do what he has promised”  2) Jesus is the source of hope. Alternate translation: “that comes from our Lord Jesus Christ” (See: rc://en/ta/man/translate/figs-possession)<br>
1TH	1	3	tvrg	figs-hendiadys	τοῦ Θεοῦ καὶ Πατρὸς ἡμῶν	1		Here, **our God and Father** refers to the one divine person who is both God and Father. This phrase is a hendiadys, since Father further describes God. Alternate translation: “God our Father” or “our Father God” (See: rc://en/ta/man/translate/figs-hendiadys)<br>
1TH	1	3	v01e	figs-exclusive	ἡμῶν	1		Here, **our** refers to Paul, Silvanus, Timothy, and the Thessalonian church. All believers are the spiritual children of God the Father through Jesus. (See: rc://en/ta/man/translate/figs-exclusive)
1TH	1	4	psc4	grammar-connect-time-simultaneous	εἰδότες	1		Here, **knowing** continues the simultaneous description of how the writers of this letter “give thanks” (See UST). (See: [[rc://en/ta/man/translate/grammar-connect-time-simultaneous]])
1TH	1	4	qx5o	figs-nominaladj	ἀδελφοὶ ἠγαπημένοι ὑπὸ τοῦ Θεοῦ	1		This phrase acts as nominal adjective that describes the Thessalonian Church in relational terms. They are spiritual siblings in their relationship with the writers of the letter, and beloved children in their relationship with **God** the Father (See [1:3](../01/03.md)). (See: [[rc://en/ta/man/translate/figs-nominaladj]])
1TH	1	4	erb6	figs-metaphor	ἀδελφοὶ	1	brothers	Throughout this letter, **brothers** is a metaphor meaning “fellow Christians” or “fellow believers in Christ.” If your readers would not understand what **brothers** means in this context, you could use an equivalent metaphor from your culture. (See: [[rc://en/ta/man/translate/figs-metaphor]])
1TH	1	4	egkq	figs-gendernotations	ἀδελφοὶ	1		Here, the idiom **brothers** includes females. If your language does not have this idiom, you can use a gender inclusive term that refers to male and female. Alternate translation: “brothers and sisters” or “spiritual brothers and sisters” or “fellow believers in Christ” (See [[rc://en/ta/man/translate/figs-gendernotations]])
1TH	1	4	kiz3		ἠγαπημένοι	1		The word translated **loved** indicates a past relationship with continuing results (literally, “has been and/or continues to be loved”). If your language has this verbal distinction, you could emphasize the past and present nuances in your translation. Alternate translation: “who have always been loved” or “who are continually loved”<br>
1TH	1	4	j08t	figs-activepassive	ἠγαπημένοι ὑπὸ τοῦ Θεοῦ	1		If it is clearer in your language, this passive form **loved** could be changed to an active form. Alternate translation: “whom God has always loved” (see UST)(See: [[rc://en/ta/man/translate/figs-activepassive]])
1TH	1	4	t70n	grammar-connect-logic-result	τὴν ἐκλογὴν ὑμῶν	1		This phrase **your election** is the direct objective of **knowing** and the beginning of a result clause. The reason why the writers of this letter know that the Thessalonians have been chosen as God's people is found in the following verse. (See: [[rc://en/ta/man/translate/grammar-connect-logic-result]])
1TH	1	4	ohtl	figs-abstractnouns	τὴν ἐκλογὴν ὑμῶν,	1		Here, **your election** is an abstract noun phrase. If this is unclear in your language, you could change this abstract noun to a verb form. Alternate translation: “that he chose you to belong to him,” or “that he ordained you to be his children,” or starting a new sentence, “God selected you to be his people.” (See: [[rc://en/ta/man/translate/figs-abstractnouns]])
1TH	1	5	jxfs	grammar-connect-logic-result	ὅτι	1		Here, **because** is the marker of a result clause. The writers of this letter are certain of the “election” and identity of the Thessalonian Church as God's people [1:4](../01/04.md), **because** they received the gospel message in all the ways described in verse 5. (See: [[rc://en/ta/man/translate/grammar-connect-logic-result]])
1TH	1	5	ude4	grammar-connect-logic-contrast	τὸ εὐαγγέλιον ἡμῶν οὐκ ἐγενήθη εἰς ὑμᾶς ἐν λόγῳ μόνον, ἀλλὰ καὶ ἐν δυνάμει, καὶ ἐν Πνεύματι Ἁγίῳ, καὶ πληροφορίᾳ πολλῇ	1	not in word only	The writers of this letter use a contrasting clause to emphasis the multi-faceted effect of the gospel. Alternate translation: “our gospel preaching did not come to you as only a simple message, but even accompanied with power and the Holy Spirit and full assurance” (See: [[rc://en/ta/man/translate/grammar-connect-logic-contrast]])
1TH	1	5	sm4j	grammar-connect-time-simultaneous	τὸ εὐαγγέλιον ἡμῶν οὐκ ἐγενήθη εἰς ὑμᾶς ἐν λόγῳ μόνον, ἀλλὰ καὶ ἐν δυνάμει, καὶ ἐν Πνεύματι Ἁγίῳ, καὶ πληροφορίᾳ πολλῇ	1	not in word only	If it is clearer in your language, you could change this extended phrase to a simultaneous clause, framed in a positive way. Alternate translation: “our gospel message was completely validated: by our words, by a display of power, by the Holy Spirit, by your own full assurance” (See: [[rc://en/ta/man/translate/grammar-connect-time-simultaneous]])
1TH	1	5	ud0p	figs-explicit	τὸ εὐαγγέλιον ἡμῶν	1		The assumed knowledge is that **our gospel** is a technical term for the message that the Apostles preach about the Lord Jesus Christ. This is made emphatic by including the definite article **the** in the ancient Greek text, marking it as the “well-known” or “one and only” **gospel**. Alternate translation: “happy message about the Christ” or “good news about the coming of the Christ” or “great news about the kingdom of God's Christ” (See: [[rc://en/ta/man/translate/figs-explicit]])
1TH	1	5	h675		ἀλλὰ καὶ ἐν δυνάμει, καὶ ἐν Πνεύματι Ἁγίῳ	1	but also in power, and in the Holy Spirit	This could mean: 1) the **Holy Spirit** gave the apostles the ability to preach the **gospel** powerfully. Alternate translation: “but also empowered by the Holy Spirit” 2) the **Holy Spirit** caused the preaching of the **gospel** to have a powerful effect among the Thessalonian Church (see UST). 3) the **Holy Spirit** demonstrated the truth of the **gospel** preaching through displays of **power**. Alternate translation: “but also with powerful signs from the Holy Spirit”
1TH	1	5	gxzy	translate-textvariants	Πνεύματι Ἁγίῳ	1		The assumed knowledge is that the Thessalonians know who or what **the Holy Spirit** is. This is also seen in some ancient manuscripts that use a common abbreviation that indicates this is the “well-known” **Holy Spirit**. The UGNT capitalizes the phrase to indicate this fact. (See: [[rc://en/ta/man/translate/translate-textvariants]])
1TH	1	5	t1w3	figs-abstractnouns	πληροφορίᾳ πολλῇ	1	in much assurance	**in much assurance** is an abstract noun phrase. Alternate translation: “with full assurance” or “with full confidence” or “with full conviction” or “with weighty evidence.” If it is more clear in your language you could change the nouns to a verb form. Alternate translation: “the Holy Spirit fully assured you” or “the Holy Spirit gave you full confidence” or “the Holy Spirit fully convinced you” (See: [[rc://en/ta/man/translate/figs-abstractnouns]])
