Book	Chapter	Verse	ID	SupportReference	OrigQuote	Occurrence	GLQuote	OccurrenceNote
JHN	7	38	u9cx		ὁ πιστεύων εἰς ἐμὲ, καθὼς εἶπεν ἡ Γραφή	1	He who believes in me, just as the scripture says	“As the scripture says about anyone who believes in me”
JHN	7	38	uw2q	figs-metaphor	ποταμοὶ…ῥεύσουσιν ὕδατος ζῶντος	1	rivers of living water will flow	Here, **rivers of living water** is a metaphor that represents the life that Jesus provides for those who are spiritually “thirsty.” Alternate translation: “spiritual life will flow like rivers of water” (See: [[rc://en/ta/man/translate/figs-metaphor]])
JHN	7	38	yt75	figs-metaphor	ὕδατος ζῶντος	1	living water	This could refer to: (1) **water** that gives life. (2) **water** that causes people to live. (See: [[rc://en/ta/man/translate/figs-metaphor]])
JHN	7	38	cx1q	figs-metonymy	ἐκ τῆς κοιλίας αὐτοῦ	1	from his stomach	Here the **stomach** represents the inside of a person, specifically the non-physical part of a person. Alternate translation: “from inside of him” or “from his heart” (See: [[rc://en/ta/man/translate/figs-metonymy]])
JHN	7	39	i8wx	writing-background		0	General Information:	In this verse the author gives information to clarify what Jesus is talking about. (See: [[rc://en/ta/man/translate/writing-background]])
JHN	7	39	syp9		δὲ εἶπεν	1	But he said	Here, **he** refers to Jesus.
JHN	7	39	qbr1	figs-explicit	οὔπω…ἦν Πνεῦμα	1	the Spirit had not yet been given	John implies that **the Spirit** would later come to live in those who trusted Jesus. Alternate translation: “the Spirit had not yet come to live in the believers” (See: [[rc://en/ta/man/translate/figs-explicit]])
JHN	7	39	n599		ὅτι Ἰησοῦς οὐδέπω ἐδοξάσθη	1	because Jesus was not yet glorified	Here the word **glorified** refers to the time when God would honor the Son after his death and resurrection.
JHN	7	40	shq8	figs-explicit	οὗτός ἐστιν ἀληθῶς ὁ προφήτης	1	This is indeed the prophet	By saying this, the people are indicating that they believe Jesus is **the prophet** like Moses that God had promised to send. Alternate translation: “This is indeed the prophet who is like Moses that we have been waiting for” (See: [[rc://en/ta/man/translate/figs-explicit]])
JHN	7	41	alq3	figs-rquestion	μὴ γὰρ ἐκ τῆς Γαλιλαίας ὁ Χριστὸς ἔρχεται	1	Does the Christ come from Galilee?	This remark appears in the form of a question to add emphasis. Alternate translation: “The Christ cannot come from Galilee!” (See: [[rc://en/ta/man/translate/figs-rquestion]])
JHN	7	42	n8nb	figs-rquestion	οὐχ ἡ Γραφὴ εἶπεν, ὅτι ἐκ τοῦ σπέρματος Δαυεὶδ, καὶ ἀπὸ Βηθλέεμ, τῆς κώμης ὅπου ἦν Δαυεὶδ, ἔρχεται ὁ Χριστός?	1	Have the scriptures not said that the Christ will come from the descendants of David and from Bethlehem, the village where David was?	This remark appears in the form of a question to add emphasis. Alternate translation: “The scriptures teach that Christ will come from the line of David and from Bethlehem, the village where David was!” (See: [[rc://en/ta/man/translate/figs-rquestion]])
JHN	7	42	ep4z	figs-personification	οὐχ ἡ Γραφὴ εἶπεν	1	Have the scriptures not said	The **scriptures** are referred to as if they were actually speaking as a person speaks. Alternate translation: “The prophets wrote in the scriptures” (See: [[rc://en/ta/man/translate/figs-personification]])
JHN	7	42	zjh5		ὅπου ἦν Δαυεὶδ	1	where David was	“where David lived”
JHN	7	43	lf5r		σχίσμα οὖν ἐγένετο ἐν τῷ ὄχλῳ δι’ αὐτόν	1	So there arose a division in the crowds because of him	The crowds could not agree about who or what Jesus was.
JHN	7	44	rc64	figs-idiom	ἀλλ’ οὐδεὶς ἐπέβαλεν ἐπ’ αὐτὸν τὰς χεῖρας	1	but no one laid hands on him	To lay hands on someone is an idiom which means to grab him or to hold onto him. Alternate translation: “but no one grabbed him to arrest him” (See: [[rc://en/ta/man/translate/figs-idiom]])
JHN	7	45	m3rf		οἱ ὑπηρέται	1	the officers	“the temple guards”
JHN	7	46	qwv3	figs-hyperbole	οὐδέποτε ἐλάλησεν οὕτως ἄνθρωπος	1	Never has anyone spoken like this	The officers exaggerate to show how impressed they are by what Jesus said. (See: [[rc://en/ta/man/translate/figs-hyperbole]])
JHN	7	46	wp9h	figs-explicit	οὐδέποτε ἐλάλησεν οὕτως ἄνθρωπος	1		You may need to make explicit that the officers were not claiming to know everything that every person in all times and places had ever said. “We have never heard anyone say such amazing things as this man!” (See: [[rc://en/ta/man/translate/figs-explicit]])
JHN	7	47	d4xy		οὖν…οἱ Φαρισαῖοι	1	So the Pharisees	“Because they said that, the Pharisees”
JHN	7	47	t91p		ἀπεκρίθησαν…αὐτοῖς	1	answered them	“answered the officers”
JHN	7	47	z95z	figs-rquestion	μὴ καὶ ὑμεῖς πεπλάνησθε?	1	Have you also been deceived?	The remark appears in the form of a question to add emphasis. The Pharisees are shocked at the response of the officers. Alternate translation: “You have been deceived too!” (See: [[rc://en/ta/man/translate/figs-rquestion]])
JHN	7	48	e8vu	figs-rquestion	τις ἐκ τῶν ἀρχόντων ἐπίστευσεν εἰς αὐτὸν, ἢ ἐκ τῶν Φαρισαίων?	1	Have any of the rulers believed in him, or any of the Pharisees?	This remark appears in the form of a question to add emphasis. Alternate translation: “None of the rulers or Pharisees have believed in him!” (See: [[rc://en/ta/man/translate/figs-rquestion]])
JHN	7	49	fe7d		ἀλλὰ ὁ ὄχλος οὗτος, ὁ μὴ γινώσκων τὸν νόμον, ἐπάρατοί εἰσιν	1	But this crowd that does not know the law, they are cursed	“As for this crowd that does not know the law, God will cause them to perish!”
JHN	7	50	u5ha	writing-background	ὁ ἐλθὼν πρὸς αὐτὸν πρότερον, εἷς ὢν ἐξ αὐτῶν	1	one of the Pharisees, who came to him earlier	John provides this information to remind us of who Nicodemus is. Your language may have a special way to mark background information. (See: [[rc://en/ta/man/translate/writing-background]])
JHN	7	51	ia3j	figs-rquestion	μὴ ὁ νόμος ἡμῶν κρίνει τὸν ἄνθρωπον, ἐὰν μὴ ἀκούσῃ πρῶτον παρ’ αὐτοῦ, καὶ γνῷ τί ποιεῖ?	1	Does our law judge a man … what he does?	This remark appears in the form of a question to add emphasis. You can translate this as a statement. Alternate translation: “Our Jewish law does not allow us to judge a man unless it first hears from him and knows what he does!” (See: [[rc://en/ta/man/translate/figs-rquestion]])
JHN	7	51	y8df	figs-personification	μὴ ὁ νόμος ἡμῶν κρίνει τὸν ἄνθρωπον	1	Does our law judge a man	Here Nicodemus speaks of the **law** as if it were a person. If this is not natural in your language, you may translate it with a personal subject. Alternate translation: “Do we judge a man” or “We do not judge a man” (See: [[rc://en/ta/man/translate/figs-personification]])
JHN	7	52	pt91	figs-rquestion	μὴ καὶ σὺ ἐκ τῆς Γαλιλαίας εἶ?	1	Are you also from Galilee?	The Jewish leaders know that Nicodemus is not **from Galilee**. They ask this question as a way of scoffing at him. Alternate translation: “You must also be one of those inferior persons from Galilee!” (See: [[rc://en/ta/man/translate/figs-rquestion]])
JHN	7	52	k6pg	figs-ellipsis	ἐραύνησον καὶ ἴδε	1	Search and see	This is an ellipsis. You may wish to include the information that does not appear. Alternate translation: “Search carefully and read what is written in the Scriptures” (See: [[rc://en/ta/man/translate/figs-ellipsis]])
JHN	7	52	jm59		προφήτης ἐκ τῆς Γαλιλαίας οὐκ ἐγείρεται	1	no prophet comes from Galilee	This probably refers to the belief that Jesus was born in Galilee.
JHN	7	53	s5fi	translate-textvariants		0	General Information:	The best early texts do not have 7:53–8:11. The ULT has set them apart in square brackets ([ ]) to show that John probably did not include them in his original text. Translators are encouraged to translate them, to set them apart with square brackets, and to include a footnote like the one written on [John 7:53](../07/53.md). (See: [[rc://en/ta/man/translate/translate-textvariants]])
JHN	8	intro	e667			0		# John 8 General Notes<br><br>## Structure and formatting<br><br>Translators may wish to include a note at verse 1 to explain to the reader why they have chosen to translate or to not translate verses 8:1-11.<br><br>## Special concepts in this chapter<br><br>### A light and darkness<br><br>The Bible often speaks of unrighteous people, people who do not do what pleases God, as if they were walking around in darkness. It speaks of light as if it were what enables those sinful people to become righteous, to understand what they are doing wrong and begin to obey God. Here it is all Gentiles (See: [[rc://en/tw/dict/bible/kt/righteous]])<br><br>### I AM<br><br>John records Jesus as saying these words four times in this book, three times in this chapter. They stand alone as a complete sentence, and they literally translate the Hebrew word for “I AM,” by which Yahweh identified himself to Moses. For these reasons, many people believe that when Jesus said these words he was claiming to be Yahweh. (See: [[rc://en/tw/dict/bible/kt/yahweh]]).<br><br>### The Scribes and Pharisees’ trap<br><br>The Scribes and Pharisees wanted to trick Jesus. They wanted him to say either that they should keep the law of Moses by killing a woman whom they had found committing adultery or that they should disobey the law of Moses and forgive her sin. Jesus knew that they were trying to trick him and that they did not really want to keep the law of Moses. He knew this because the law said that both the woman and the man should die, but they did not bring the man to Jesus. (See: [[rc://en/tw/dict/bible/kt/adultery]])<br><br>## Other possible translation difficulties in this chapter<br><br>### “Son of Man”<br><br>Jesus refers to himself as the “Son of Man” in this chapter ([John 8:28](../../jhn/08/28.md)). Your language may not allow people to speak of themselves as if they were speaking about someone else. (See: [[rc://en/tw/dict/bible/kt/sonofman]] and [[rc://en/ta/man/translate/figs-123person]])
JHN	8	1	mkz2			0	General Information:	While some texts have 7:53–8:11, the best and earliest texts do not include them.
JHN	8	12	m4ma	writing-newevent		0	General Information:	Jesus is speaking to a crowd near the treasury in the temple after either the events of [John 7:1-52](../07/01.md) or the events of [John 7:53-8:11](../07/53.md). The author does not mark the beginning of this new event. (See: [[rc://en/ta/man/translate/writing-newevent]])
JHN	8	12	k5ib	figs-metaphor	ἐγώ εἰμι τὸ φῶς τοῦ κόσμου	1	I am the light of the world	Here the **light** is a metaphor for the revelation that comes from God. Alternate translation: “I am the one who gives light to the world” (See: [[rc://en/ta/man/translate/figs-metaphor]])
JHN	8	12	yc5p	figs-metonymy	τοῦ κόσμου	1	the world	Here, **world** is a metonym for the people. Alternate translation: “the people of the world” (See: [[rc://en/ta/man/translate/figs-metonymy]])
JHN	8	12	zf41	figs-idiom	ὁ ἀκολουθῶν ἐμοὶ	1	he who follows me	This is an idiom that means “everyone who does what I teach” or “everyone who obeys me” (See: [[rc://en/ta/man/translate/figs-idiom]])
JHN	8	12	tse3	figs-metaphor	οὐ μὴ περιπατήσῃ ἐν τῇ σκοτίᾳ	1	will not walk in the darkness	To **walk in the darkness** is a metaphor for living a sinful life. Alternate translation: “will not live as if he were in the darkness of sin” (See: [[rc://en/ta/man/translate/figs-metaphor]])
JHN	8	12	vw7r	figs-metaphor	φῶς τῆς ζωῆς	1	light of life	Here, **light of life** is a metaphor for the truth from God that gives spiritual life. Alternate translation: “truth that brings eternal life” (See: [[rc://en/ta/man/translate/figs-metaphor]])
JHN	8	13	ih9h		σὺ περὶ σεαυτοῦ μαρτυρεῖς	1	You bear witness about yourself	“You are just saying these things about yourself”
JHN	8	13	mrj6	figs-explicit	ἡ μαρτυρία σου οὐκ ἔστιν ἀληθής	1	your witness is not true	The Pharisees are implying that the **witness** of only one person **is not true** because it cannot be verified. Alternate translation: “you cannot be your own witness” or “what you say about yourself may not be true” (See: [[rc://en/ta/man/translate/figs-explicit]])
JHN	8	14	x9rf		κἂν ἐγὼ μαρτυρῶ περὶ ἐμαυτοῦ	1	Even if I bear witness about myself	“Even if I say these things about myself”
JHN	8	15	k92s		τὴν σάρκα	1	the flesh	“human standards and the laws of men”
JHN	8	15	j79i		ἐγὼ οὐ κρίνω οὐδένα	1	I judge no one	This could mean: (1) Jesus is not judging anyone yet. (2) Jesus is not judging anyone at that time.
JHN	8	16	xnn5		ἐὰν κρίνω…ἐγώ	1	if I judge	This could mean: (1) “if I judge people.” (2) “whenever I judge people.”
JHN	8	16	jb2f		ἡ κρίσις ἡ ἐμὴ ἀληθινή ἐστιν	1	my judgment is true	“my judgment is right.”
JHN	8	16	ev1r	figs-explicit	μόνος οὐκ εἰμί	1	I am not alone	The implied information is that Jesus is not alone in his judgment. Alternate translation: “I am not alone in how I judge” or “I do not judge alone” (See: [[rc://en/ta/man/translate/figs-explicit]])
JHN	8	16	f6nu		ἐγὼ καὶ ὁ…Πατήρ	1	I am with the Father	The **Father** and the Son judge together. Alternate translation: “the Father also judges with me” or “the Father judges as I do”
JHN	8	16	r7dx	guidelines-sonofgodprinciples	ὁ…Πατήρ	1	the Father	**Father** is an important title for God. If your language must state whose Father this is, you could say “my Father” since Jesus switches to that in the following verses. (See: [[rc://en/ta/man/translate/guidelines-sonofgodprinciples]])
JHN	8	17	uvc6			0	Connecting Statement:	Jesus continues speaking to the Pharisees and other people about himself.
JHN	8	17	r2r8	figs-activepassive	γέγραπται	1	it is written	This is a passive phrase. You may translate it in an active form with a personal subject. Alternate translation: “Moses wrote” (See: [[rc://en/ta/man/translate/figs-activepassive]])
JHN	8	17	l6ln	figs-explicit	δύο ἀνθρώπων ἡ μαρτυρία ἀληθής ἐστιν	1	the testimony of two men is true	The logic implied here is that one person can verify the words of another. Alternate translation: “if two men say the same thing, then people know it is true” (See: [[rc://en/ta/man/translate/figs-explicit]])
JHN	8	18	ff2p		ἐγώ εἰμι ὁ μαρτυρῶν περὶ ἐμαυτοῦ	1	I am he who bears witness about myself	Jesus bears witness about himself. Alternate translation: “I give evidence to you about myself”
JHN	8	18	gfd3	figs-explicit	μαρτυρεῖ περὶ ἐμοῦ ὁ πέμψας με Πατήρ	1	the Father who sent me bears witness about me	The **Father** also **bears witness** about Jesus. You could make it explicit that this means Jesus’ testimony is true. Alternate translation: “my Father who sent me also brings evidence about me. So you should believe that what we tell you is true” (See: [[rc://en/ta/man/translate/figs-explicit]])
JHN	8	18	ycc8	guidelines-sonofgodprinciples	ὁ…Πατήρ	2	the Father	**Father** is an important title for God. If your language must state whose Father this is, you could say “my Father” since Jesus switches to that in the following verses. (See: [[rc://en/ta/man/translate/guidelines-sonofgodprinciples]])
JHN	8	19	s37n	writing-background		0	General Information:	In verse 20 there is a break in Jesus’ speaking where the author give us background information regarding where Jesus had been teaching. Some languages may require the information about the setting to be placed at the beginning of this part of the story in [John 8:12](../08/12.md). (See: [[rc://en/ta/man/translate/writing-background]])
JHN	8	19	b26z	guidelines-sonofgodprinciples	τὸν Πατέρα μου	1	my Father	This is an important title for God. (See: [[rc://en/ta/man/translate/guidelines-sonofgodprinciples]])
JHN	8	20	b11j	figs-metonymy	οὔπω ἐληλύθει ἡ ὥρα αὐτοῦ	1	his hour had not yet come	The word **hour** is a metonym for the time for Jesus to die. Alternate translation: “it was not yet the right time for Jesus to die” (See: [[rc://en/ta/man/translate/figs-metonymy]])
JHN	8	21	xv3g			0	Connecting Statement:	Jesus continues speaking to the crowd.
JHN	8	21	gg46		ἐν τῇ ἁμαρτίᾳ ὑμῶν ἀποθανεῖσθε	1	die in your sin	Here the word **die** refers to spiritual death. Alternate translation: “will die while you are still sinful” or “you will die while you are sinning”
JHN	8	22	a4p4	figs-synecdoche	ἔλεγον…οἱ Ἰουδαῖοι	1	The Jews said	Here, **Jews** is a synecdoche for “the Jewish leaders.” Alternate translation: “the Jewish leaders said” or “the Jewish authorities said” (See: [[rc://en/ta/man/translate/figs-synecdoche]])
JHN	8	23	zug9		ὑμεῖς ἐκ τῶν κάτω ἐστέ	1	You are from below	“You were born in this world”
JHN	8	23	a7ny		ἐγὼ ἐκ τῶν ἄνω εἰμί	1	I am from above	“I came from heaven”
JHN	8	23	svn1		ὑμεῖς ἐκ τούτου τοῦ κόσμου ἐστέ	1	You are of this world	“You belong to this world”
JHN	8	23	w9jl		ἐγὼ οὐκ εἰμὶ ἐκ τοῦ κόσμου τούτου	1	I am not of this world	“I do not belong to this world”
JHN	8	24	jgw4		ἀποθανεῖσθε ἐν ταῖς ἁμαρτίαις ὑμῶν	1	you will die in your sins	“you will die without God’s forgiving your sins”
JHN	8	24	he1k		ὅτι ἐγώ εἰμι	1	that I AM	This could mean: (1) Jesus is identifying himself as Yahweh, who identified himself to Moses as “I AM.” (2) Jesus expects the people to understand that he is referring to what he already has already said about himself: “I am from above.”
JHN	8	25	t7tv		ἔλεγον	1	They said	Here, **they** refers to the Jewish leaders ([John 8:22](../08/22.md)).
JHN	8	26	lsc7	figs-metonymy	ταῦτα λαλῶ εἰς τὸν κόσμον	1	these things I say to the world	Here the **world** is a metonym for the people who live in the world. Alternate translation: “these things I say to all the people” (See: [[rc://en/ta/man/translate/figs-metonymy]])
JHN	8	27	hh1s	guidelines-sonofgodprinciples	τὸν Πατέρα	1	the Father	**Father** is a special title for God. Some languages may require the use of a possessive before the noun. Alternate translation: “his Father” (See: [[rc://en/ta/man/translate/guidelines-sonofgodprinciples]])
JHN	8	28	x6ca		ὅταν ὑψώσητε	1	When you have lifted up	This refers to placing Jesus on the cross to kill him.
JHN	8	28	er3s		Υἱὸν τοῦ Ἀνθρώπου	1	Son of Man	Jesus used the title **Son of Man** to refer to himself.
JHN	8	28	tcs5		ἐγώ εἰμι	1	I AM	This could mean: (1) Jesus is identifying himself as Yahweh, who identified himself to Moses as “I AM.” (2) Jesus is saying, “I am the one I claim to be.”
JHN	8	28	vq9k	guidelines-sonofgodprinciples	καθὼς ἐδίδαξέν με ὁ Πατὴρ, ταῦτα λαλῶ	1	As the Father taught me, I speak these things	“I am only saying what my Father taught me to say.” The word **Father** is an important title for God. (See: [[rc://en/ta/man/translate/guidelines-sonofgodprinciples]])
JHN	8	29	w9cl		ὁ πέμψας με	1	He who sent me	Here, **the one who sent me** refers to God.
JHN	8	30	ld9x		ταῦτα αὐτοῦ λαλοῦντος	1	As Jesus was saying these things	“As Jesus spoke these words”
JHN	8	30	uj29		πολλοὶ ἐπίστευσαν εἰς αὐτὸν	1	many believed in him	“many people trusted him”
JHN	8	31	g752	figs-idiom	μείνητε ἐν τῷ λόγῳ τῷ ἐμῷ	1	remain in my word	This is an idiom that means “to obey Jesus.” Alternate translation: “obey what I have said” (See: [[rc://en/ta/man/translate/figs-idiom]])
JHN	8	31	iq3z		μαθηταί μού	1	my disciples	“my followers”
JHN	8	32	esz8	figs-personification	ἡ ἀλήθεια ἐλευθερώσει ὑμᾶς	1	the truth will set you free	This is personification. Jesus speaks of **he truth** as if it were a person. Alternate translation: “if you obey the truth, God will set you free” (See: [[rc://en/ta/man/translate/figs-personification]])
JHN	8	32	xf9m		τὴν ἀλήθειαν	1	the truth	This refers to what Jesus reveals about God. Alternate translation: “what is true about God”
JHN	8	33	n34n	figs-rquestion	πῶς σὺ λέγεις, ὅτι ἐλεύθεροι γενήσεσθε	1	how can you say, ‘You will be set free’?	This remark appears in the form of a question to express the Jewish leaders’ shock at what Jesus has said. Alternate translation: “We do not need to be set free!” (See: [[rc://en/ta/man/translate/figs-rquestion]])
JHN	8	34	i2pn		ἀμὴν, ἀμὴν	1	Truly, truly	See how you translated this in [John 1:51](../01/51.md).
JHN	8	34	jg3z	figs-metaphor	δοῦλός ἐστιν τῆς ἁμαρτίας	1	is the slave of sin	Here the word **slave** is a metaphor. This implies that **sin** is like a master for the one who sins. Alternate translation: “is like a slave to sin” (See: [[rc://en/ta/man/translate/figs-metaphor]])
JHN	8	35	sg4a	figs-metonymy	ἐν τῇ οἰκίᾳ	1	in the house	Here, **house** is a metonym for “family.” Alternate translation: “as a permanent member of a family” (See: [[rc://en/ta/man/translate/figs-metonymy]])
JHN	8	35	j73t	figs-ellipsis	ὁ Υἱὸς μένει εἰς τὸν αἰῶνα	1	the son remains forever	This is an ellipsis. You may translate it by including the implied words. Alternate translation: “the son is a member of the family forever” (See: [[rc://en/ta/man/translate/figs-ellipsis]])
JHN	8	36	n6fp	figs-explicit	ἐὰν…ὁ Υἱὸς ὑμᾶς ἐλευθερώσῃ, ὄντως ἐλεύθεροι ἔσεσθε	1	if the Son sets you free, you will be truly free	It is implied that Jesus is talking about freedom from sin. Alternate translation: “if the Son sets you free from sin, you will truly be free” (See: [[rc://en/ta/man/translate/figs-explicit]])
JHN	8	36	mapu	figs-metaphor	ἐὰν…ὁ Υἱὸς ὑμᾶς ἐλευθερώσῃ, ὄντως ἐλεύθεροι ἔσεσθε	1		Here, being **free** is a metaphor for being able not to sin. Alternate translation: “if the Son sets you free, you will truly be able to refrain from sin” (See: [[rc://en/ta/man/translate/figs-metaphor]])
JHN	8	36	w3q1	figs-123person	ἐὰν…ὁ Υἱὸς ὑμᾶς ἐλευθερώσῃ	1	if the Son sets you free	Jesus was speaking about himself. Alternate translation: “if I, the Son, set you free” (See: [[rc://en/ta/man/translate/figs-123person]])
JHN	8	36	nqcr	guidelines-sonofgodprinciples	ὁ Υἱὸς	1		**Son** is an important title for Jesus, the Son of God. (See: [[rc://en/ta/man/translate/guidelines-sonofgodprinciples]])
JHN	8	37	p4xm			0	Connecting Statement:	Jesus continues speaking to the Jews.
JHN	8	37	ph1q	figs-metonymy	ὁ λόγος ὁ ἐμὸς οὐ χωρεῖ ἐν ὑμῖν	1	my word has no place in you	Here, **word** is a metonym for the “teachings” or “message” of Jesus, which the Jewish leaders do not accept. Alternate translation: “you do not accept my teachings” or “you do not allow my message to change your life” (See: [[rc://en/ta/man/translate/figs-metonymy]])
JHN	8	38	m62y		ἃ ἐγὼ ἑώρακα παρὰ τῷ Πατρὶ, λαλῶ	1	I say what I have seen with my Father	“I am telling you about the things I saw when I was with my Father”
JHN	8	38	f9yu		καὶ ὑμεῖς…ἃ ἠκούσατε παρὰ τοῦ πατρὸς, ποιεῖτε	1	you also do what you heard from your father	The Jewish leaders do not understand that by **your father** Jesus is referring to the devil. Alternate translation: “you also continue doing what your father has told you to do”
JHN	8	39	qp2r		ὁ πατὴρ	1	father	forefather
JHN	8	40	s615		τοῦτο Ἀβραὰμ οὐκ ἐποίησεν	1	Abraham did not do this	“Abraham never tried to kill anyone who told him the true revelation from God”
JHN	8	41	i87r	figs-explicit	ὑμεῖς ποιεῖτε τὰ ἔργα τοῦ πατρὸς ὑμῶν	1	You do the works of your father	Jesus implies that their **father** is the devil. Alternate translation: “No! You are doing the things that your real father did” (See: [[rc://en/ta/man/translate/figs-explicit]])
