Book	Chapter	Verse	ID	SupportReference	OrigQuote	Occurrence	GLQuote	OccurrenceNote
MRK	9	11	s9zn	writing-pronouns	ἐπηρώτων αὐτὸν λέγοντες	1	they were questioning him	Here, the pronoun **they** refers to Peter, James, and John. Alternate translation: “Peter, James, and John were questioning Jesus, saying” (See: [[rc://en/ta/man/translate/writing-pronouns]])
MRK	9	11	je29	writing-pronouns	ἐπηρώτων αὐτὸν	1		Here, the pronoun **him** refers to Jesus. Alternate translation: “they were questioning Jesus” (See: [[rc://en/ta/man/translate/writing-pronouns]])
MRK	9	11	wgsr	translate-names	Ἠλείαν	1		**Elijah** is the name of a man. See how you translated his name in [Mark 6:15](../mrk/06/15.md). (See: [[rc://en/ta/man/translate/translate-names]])
MRK	9	12	x5ep		Ἠλείας μὲν ἐλθὼν πρῶτον ἀποκατιστάνει πάντα	1	Elijah has come first to restore all things	By saying this, Jesus affirms that **Elijah** had **come first**.
MRK	9	12	o8hf	writing-pronouns	ἔφη	1		Here, the pronoun **he** refers to Jesus. Alternate translation: “Jesus was saying” (See: [[rc://en/ta/man/translate/writing-pronouns]])
MRK	9	12	s3q3	figs-rquestion	καὶ πῶς γέγραπται ἐπὶ τὸν Υἱὸν τοῦ Ἀνθρώπου, ἵνα πολλὰ πάθῃ καὶ ἐξουδενηθῇ?	1	And how is it written about the Son of Man that he would suffer many things and would be despised?	Jesus uses uses a rhetorical question here to remind his disciples that the Scriptures also teach that the Son of Man must suffer and be despised. You could translate this question as a statement. Alternate translation: “But I also want you to consider what is written about the Son of Man. The Scriptures say that he must suffer many things and be hated” (See: [[rc://en/ta/man/translate/figs-rquestion]])
MRK	9	12	i3j7	figs-activepassive	ἐξουδενηθῇ	1	would be despised	If it would be more natural in your language, you can state the phrase **would be despised** in active form. Alternate translation: “that people would hate him” (See: [[rc://en/ta/man/translate/figs-activepassive]])
MRK	9	13	k3kj	figs-explicit	ἐποίησαν αὐτῷ ὅσα ἤθελον	1	they did whatever they wanted to him	It may be helpful to state what people did to Elijah. Alternate translation: “our leaders treated him very badly, just as they wanted to do” (See: [[rc://en/ta/man/translate/figs-explicit]])
MRK	9	14	qn7d			0	Connecting Statement:	When Peter, James, John, and Jesus came down from the mountain, they found the scribes arguing with the other disciples.
MRK	9	14	n8fd		ἐλθόντες πρὸς τοὺς μαθητὰς	1	having come to the disciples	Jesus, Peter, James, and John returned to the other **disciples** who had not gone with them up the mountain.
MRK	9	14	cs1f		εἶδον ὄχλον πολὺν περὶ αὐτοὺς	1	they saw a great crowd around them	“Jesus and those three disciples saw a great crowd around the other disciples”
MRK	9	14	wp9z		γραμματεῖς συνζητοῦντας πρὸς αὐτούς	1	scribes arguing with them	The scribes were arguing with the disciples who had not gone with Jesus.
MRK	9	15	lch5	figs-explicit	ἐξεθαμβήθησαν	1	were amazed	It may be helpful to state why they **were amazed**. Alternate translation: “was amazed that Jesus had come” (See: [[rc://en/ta/man/translate/figs-explicit]])
MRK	9	17	b7v8			0	Connecting Statement:	To explain what the scribes and other disciples were arguing about, a father of a demon-possessed man tells Jesus that he has asked the disciples to send the demon out of his son, but they could not. Jesus then casts the demon out of the boy. Later the disciples ask why they were not able to send the demon away.
MRK	9	17	zqw9	figs-idiom	ἔχοντα πνεῦμα ἄλαλον	1	having a mute spirit	This means the boy is possessed by an unclean spirit that made him unable to speak. Alternate translation: “having an unclean spirit that prevented him from speaking” or “being possessed by an unclean spirit that makes him mute” (See: [[rc://en/ta/man/translate/figs-idiom]])
MRK	9	18	zhc9		ἀφρίζει	1	he foams at the mouth	A convulsion, or seizure, can cause a person to have trouble breathing or swallowing. This causes white foam to come out of the mouth. If your language has a way to describe that, you could use it. Alternate translation: “bubbles come out of his mouth”
MRK	9	18	h98h		ξηραίνεται	1	he becomes rigid	“he becomes stiff” or “his body becomes rigid”
MRK	9	18	zre6	figs-ellipsis	οὐκ ἴσχυσαν	1	they could not	This refers to the disciples not being about to drive the spirit out of the boy. Alternate translation: “they could not drive it out of him” (See: [[rc://en/ta/man/translate/figs-ellipsis]])
MRK	9	19	tb67	figs-extrainfo	ὁ δὲ ἀποκριθεὶς αὐτοῖς λέγει	1	answering them, he says	The pronoun **them** is plural so here Jesus is addressing more than one person. However, it is not clear exactly who **them** refers to. It could refer to the disciples, the crowd, the boy and his father, some some combination of them, or to all of them at once. Here,**them** probably refers to everyone who was present. Use the form in your language that would be used for addressing a group of people. Alternate translation: “But answering all of them, Jesus said” or “Addressing them all, Jesus said” or “Addressing everyone present, Jesus said” (See: [[rc://en/ta/man/translate/figs-extrainfo]])
MRK	9	19	azc9	figs-abstractnouns	ὦ γενεὰ ἄπιστος	1	You unbelieving generation	If your language does not use an abstract noun for the idea of a **generation**, you could express the idea behind the abstract noun **generation** in another way. Alternate translation: See the UST. (See: [[rc://en/ta/man/translate/figs-abstractnouns]])
MRK	9	19	nbw0	figs-metonymy	ὦ γενεὰ ἄπιστος	1		Jesus uses the term **generation** figuratively to mean all the people who were alive at that time in history and specifically to refer to all the people who were present with him. Alternate translation: See the UST. (See: rc://en/ta/man/translate/figs-metonymy)
MRK	9	19	n4dq	figs-parallelism	ἕως πότε πρὸς ὑμᾶς ἔσομαι? ἕως πότε ἀνέξομαι ὑμῶν?	1	until when will I be with you? Until when will I bear with you?	The question **until when will I be with you** and the question **Until when will I bear with you** have very similar meanings. Jesus uses these two similar questions together in order to emphasize his frustration and disappointment. If saying the same thing twice might be confusing for your readers, you can combine the phrases into one. Alternate translation: “how long will I have to be with you and endure your unbelief” (See: [[rc://en/ta/man/translate/figs-parallelism]])
MRK	9	19	c88a	figs-rquestion	ὦ γενεὰ ἄπιστος! ἕως πότε πρὸς ὑμᾶς ἔσομαι? ἕως πότε ἀνέξομαι ὑμῶν	1	until when will I be with you? Until when will I bear with you?	Here, Jesus is using two rhetorical questions, **until when will I be with you** and **Until when will I bear with you**, to show his frustration and disappointment with unbelief. If you do not use rhetorical questions for this purpose in your language, you could translate Jesus’ words as a statement or as an exclamation and communicate the emphasis in another way. Alternate translation: “You unbelieving generation. I have become greatly weary by your unbelief” or “You unbelieving generation. Your unbelief tires me! I wonder how long I must bear with you” or “You have all gone wrong because you do not believe, so I hope I do not have to stay here and put up with you for very long!” (See: [[rc://en/ta/man/translate/figs-rquestion]])
MRK	9	19	b7u5		ἀνέξομαι ὑμῶν	1	will I bear with you	“should I endure you” or “must I put up with you”
MRK	9	20	bw3l		τὸ πνεῦμα	1	the spirit	This refers to the unclean spirit. See how you translated this in [Mark 9:17](../09/17.md).
MRK	9	20	l4r5		συνεσπάραξεν αὐτόν	1	threw him into a convulsion	This is a condition where a person has no control over his body, and his body shakes violently.
MRK	9	21	f5zm	figs-ellipsis	ἐκ παιδιόθεν	1	From childhood	“Since he was a small child.” It may be helpful to state this as a full sentence. Alternate translation: “He has been like this since he was a small child” (See: [[rc://en/ta/man/translate/figs-ellipsis]])
MRK	9	22	f5yu		σπλαγχνισθεὶς	1	having had compassion	“feeling compassion”
MRK	9	23	vh6c	figs-ellipsis	εἰ δύνῃ?	1	‘If you are able’?	Jesus repeated what the man had said to him. Alternate translation: “Do you say to me ‘If you are able’?” or “Why do you say ‘If you are able’?” (See: [[rc://en/ta/man/translate/figs-ellipsis]])
MRK	9	23	g3nd	figs-rquestion	εἰ δύνῃ?	1	‘If you are able’?	Jesus used this question to rebuke the man’s doubt. It can be expressed as a statement. Alternate translation: “You should not say to me, ‘If you are able.’” or “You ask me if I am able. Of course I am able.” (See: [[rc://en/ta/man/translate/figs-rquestion]])
MRK	9	23	kp1x		πάντα δυνατὰ τῷ πιστεύοντι	1	All things are possible for the one believing	“God can do anything for people who believe in him”
MRK	9	23	f3uj		τῷ πιστεύοντι	1	for the one believing	“for the person who believes” or “for anyone who believes”
MRK	9	23	e5kk		τῷ πιστεύοντι	1	for the one believing	This refers to belief in God. Alternate translation: “for the one who believes in God”
MRK	9	24	h4y6		βοήθει μου τῇ ἀπιστίᾳ	1	Help me in my unbelief	The man is asking Jesus to help him overcome his unbelief and increase his faith. Alternate translation: “Help me when I do not believe” or “Help me have more faith”
MRK	9	25	qaw4		ἐπισυντρέχει ὄχλος	1	the crowd is running to them	This means that more people were **running** toward where Jesus was and that the crowd there was growing larger.
MRK	9	25	ul8k		τὸ ἄλαλον καὶ κωφὸν πνεῦμα	1	You mute and deaf spirit	The words **mute** and **deaf** can be explained. Alternate translation: “You unclean spirit, you who are causing the boy to be unable to speak and unable to hear”
MRK	9	26	adb6		κράξας	1	having cried out	“after the unclean spirit cried out”
MRK	9	26	i8dz		πολλὰ σπαράξας, αὐτόν	1	convulsed him greatly	“shook him violently”
MRK	9	26	ry3l	figs-explicit	ἐξῆλθεν	1	it came out	It is implied that the spirit **came out** of the boy. Alternate translation: “it came out of the boy” (See: [[rc://en/ta/man/translate/figs-explicit]])
MRK	9	26	n7h8	figs-simile	ἐγένετο ὡσεὶ νεκρὸς	1	he became like a dead person	The boy’s appearance is compared to that of **a dead person**. Alternate translation: “the boy appeared dead” or “the boy looked like a dead person” (See: [[rc://en/ta/man/translate/figs-simile]])
MRK	9	26	ns4t		ὥστε τοὺς πολλοὺς	1	so that many	“so that many people”
MRK	9	27	g2lt	figs-idiom	κρατήσας τῆς χειρὸς αὐτοῦ	1	having taken him by his hand	This means that Jesus grasped the boy’s hand with his own **hand**. Alternate translation: “having grasped the boy by the hand” (See: [[rc://en/ta/man/translate/figs-idiom]])
MRK	9	27	r9zn		ἤγειρεν αὐτόν	1	lifted him up	“helped him get up”
MRK	9	28	sd45		κατ’ ἰδίαν	1	by himself	“privately.” This means he was alone with them.
MRK	9	28	x1ej	figs-ellipsis	ἐκβαλεῖν αὐτό	1	cast it out	“cast the unclean spirit out.” This refers to casting the spirit out of the boy. Alternate translation: “cast the unclean spirit out of the boy” (See: [[rc://en/ta/man/translate/figs-ellipsis]])
MRK	9	29	pdk2	figs-doublenegatives	τοῦτο τὸ γένος ἐν οὐδενὶ δύναται ἐξελθεῖν, εἰ μὴ ἐν προσευχῇ καὶ νηστείᾳ	1	This kind comes out by nothing except by prayer and fasting	The words **nothing** and **except** are both negative words. In some languages it is more natural to use a positive statement. Alternate translation: “This kind can be cast out only by prayer and fasting” (See: [[rc://en/ta/man/translate/figs-doublenegatives]])
MRK	9	29	v2s7	figs-ellipsis	τοῦτο τὸ γένος	1	This kind	This describes unclean spirits. Alternate translation: “This kind of unclean spirit” (See: [[rc://en/ta/man/translate/figs-ellipsis]])
MRK	9	30	q4iu			0	Connecting Statement:	After he heals the demon-possessed boy, Jesus and his disciples leave the house where they are staying. He takes time to teach his disciples alone.
MRK	9	30	pp6z		κἀκεῖθεν ἐξελθόντες	1	And having gone out from there	“And after Jesus and his disciples left that region”
MRK	9	30	f12g		παρεπορεύοντο διὰ	1	they were passing through	“they traveled through” or “they passed by”
MRK	9	31	ywi8	figs-explicit	ἐδίδασκεν γὰρ τοὺς μαθητὰς αὐτοῦ	1	for he was teaching his disciples	Jesus **was teaching his disciples** privately, away from the crowd. You can state this clearly. Alternate translation: “for he was teaching his disciples privately” (See: [[rc://en/ta/man/translate/figs-explicit]])
MRK	9	31	w75k	figs-activepassive	ὁ Υἱὸς τοῦ Ἀνθρώπου παραδίδοται	1	The Son of Man is being delivered	You can translate this in active form. Alternate translation: “Someone is going to deliver the Son of Man” (See: [[rc://en/ta/man/translate/figs-activepassive]])
MRK	9	31	y5cw	guidelines-sonofgodprinciples	ὁ Υἱὸς τοῦ Ἀνθρώπου παραδίδοται	1	The Son of Man is being delivered	Here Jesus refers to himself as the **Son of Man**. This is an important title for Jesus. “I, the Son of Man, am being delivered” (See: [[rc://en/ta/man/translate/guidelines-sonofgodprinciples]])
MRK	9	31	z8ud	figs-metonymy	εἰς χεῖρας ἀνθρώπων	1	into the hands of men	Here, **hands** is a metonym for control. Alternate translation: “into the control of men” or “so that men will be able to control him” (See: [[rc://en/ta/man/translate/figs-metonymy]])
MRK	9	31	s1n2	figs-activepassive	ἀποκτανθεὶς, μετὰ τρεῖς ἡμέρας ἀναστήσεται	1	having been killed, he will rise again after three days	You can state this in active form. Alternate translation: “after they have put him to death and three days have passed, he will rise from the dead” (See: [[rc://en/ta/man/translate/figs-activepassive]])
MRK	9	32	vtx1	figs-ellipsis	ἐφοβοῦντο αὐτὸν ἐπερωτῆσαι	1	they were afraid to ask him	They **were afraid to ask** Jesus what his statement meant. Alternate translation: “they were afraid to ask him what it meant” (See: [[rc://en/ta/man/translate/figs-ellipsis]])
MRK	9	33	xv94	writing-newevent		0	Connecting Statement:	When they come to Capernaum, Jesus teaches his disciples about being humble servants. (See: [[rc://en/ta/man/translate/writing-newevent]])
MRK	9	33	swa7		ἦλθον εἰς	1	they came to	“they arrived at.” The word **they** refers to Jesus and his disciples.
MRK	9	33	t717		διελογίζεσθε	1	were you discussing	“were you discussing with one another”
MRK	9	34	sq3c	figs-explicit	οἱ…ἐσιώπων	1	they were silent	They **were silent** because they were ashamed to tell Jesus what they had been discussing. Alternate translation: “they were silent because they were ashamed” (See: [[rc://en/ta/man/translate/figs-explicit]])
MRK	9	34	gdg3	figs-explicit	τίς μείζων	1	about who was the greatest	Here, **the greatest** refers to “the greatest” among the disciples. Alternate translation: “about who was the greatest among them” (See: [[rc://en/ta/man/translate/figs-explicit]])
MRK	9	35	jzl5	figs-metaphor	εἴ τις θέλει πρῶτος εἶναι, ἔσται πάντων ἔσχατος	1	If anyone wants to be first, he will be last of all	Here the words **first** and **last** are opposites of one another. Jesus speaks of being the “most important” as being **first** and of being the “least important” as being **last**. Alternate translation: “If anyone wants God to consider him to be the most important person of all, he must consider himself to be the least important of all” (See: [[rc://en/ta/man/translate/figs-metaphor]])
MRK	9	35	t526		πάντων	-1	of all … of all	“of all people … of all people”
MRK	9	36	gmb1		ἐν μέσῳ αὐτῶν	1	in their midst	“among them.” The word **their** refers to the crowd.
MRK	9	36	idb8		ἐναγκαλισάμενος αὐτὸ	1	having taken him in his arms	This means that he hugged the child or picked him up and held him.
MRK	9	37	h242		ἓν τῶν τοιούτων παιδίων	1	one of these little children	“a child like this”
MRK	9	37	ul12	figs-idiom	ἐπὶ τῷ ὀνόματί μου	1	in my name	This means to do something because of love for Jesus. Alternate translation: “because he loves me” or “for my sake” (See: [[rc://en/ta/man/translate/figs-idiom]])
MRK	9	37	y24n	figs-explicit	τὸν ἀποστείλαντά με	1	the one who has sent me	This refers to God, who has sent him to earth. Alternate translation: “God, who has sent me” (See: [[rc://en/ta/man/translate/figs-explicit]])
MRK	9	38	idn7		ἔφη αὐτῷ ὁ Ἰωάννης	1	John was saying to him	“John said to Jesus”
MRK	9	38	tn6s	figs-explicit	ἐκβάλλοντα δαιμόνια	1	casting out demons	“sending away demons.” This refers to **casting** **demons** out of people. Alternate translation: “casting demons out of people” (See: [[rc://en/ta/man/translate/figs-explicit]])
MRK	9	38	dxq5	figs-metonymy	ἐν τῷ ὀνόματί σου	1	in your name	Here, **name** is associated with Jesus’ authority and power. Alternate translation: “by the authority of your name” or “by the power of your name” (See: [[rc://en/ta/man/translate/figs-metonymy]])
MRK	9	38	k2i2	figs-idiom	οὐκ ἠκολούθει ἡμῖν	1	he was not following us	This means that he is not among their group of disciples. Alternate translation: “he is not one of us” or “he does not walk with us” (See: [[rc://en/ta/man/translate/figs-idiom]])
MRK	9	40	tma4		οὐκ ἔστιν καθ’ ἡμῶν	1	is not against us	“is not opposing us”
MRK	9	40	j8gq		ὑπὲρ ἡμῶν ἐστιν	1	is for us	It can be explained clearly what this means. Alternate translation: “is trying to achieve the same goals that we are”
MRK	9	41	lz5d	figs-metaphor	ποτίσῃ ὑμᾶς ποτήριον ὕδατος ἐν ὀνόματι, ὅτι Χριστοῦ ἐστε	1	may give you a cup of water in the name that you are of Christ	Jesus speaks about giving someone **a cup of water** as an example of how one person may help another. This is a metaphor for helping someone in any way. (See: [[rc://en/ta/man/translate/figs-metaphor]])
MRK	9	41	bgq1	figs-litotes	οὐ μὴ ἀπολέσῃ	1	he may certainly not lose	This negative sentence emphasizes the positive meaning. In some languages, it is more natural to use a positive statement. Alternate translation: “he will definitely receive” (See: [[rc://en/ta/man/translate/figs-litotes]])
MRK	9	42	z6k5		μύλος ὀνικὸς	1	a large millstone	a large, round stone used for grinding grain into flour
MRK	9	43	g8dv	figs-metonymy	ἐὰν σκανδαλίσῃ σε ἡ χείρ σου	1	if your hand may cause you to stumble	Here, **hand** is a metonym for desiring to do something sinful that you would do with your hand. Alternate translation: “if you want to do something sinful with one of your hands” (See: [[rc://en/ta/man/translate/figs-metonymy]])
MRK	9	43	iku4		κυλλὸν εἰσελθεῖν εἰς τὴν ζωὴν	1	to enter into life maimed	“to be maimed and then to enter into life” or “to be maimed before entering into life”
MRK	9	43	g6ww	figs-metaphor	εἰσελθεῖν εἰς τὴν ζωὴν	1	to enter into life	Dying and then beginning to live eternally is spoken of as entering **into life**. Alternate translation: “to enter into eternal life” or “to die and begin to live forever” (See: [[rc://en/ta/man/translate/figs-metaphor]])
MRK	9	43	qjm9		κυλλὸν	1	maimed	missing a body part as a result of having it removed or being injured. Here it refers to missing a hand. Alternate translation: “without a hand” or “missing a hand”
MRK	9	43	ttl7		εἰς τὸ πῦρ τὸ ἄσβεστον	1	into the unquenchable fire	“where the fire cannot be put out”
MRK	9	45	lx2b	figs-metonymy	ἐὰν ὁ πούς σου σκανδαλίζῃ σε	1	if your foot may cause you to stumble	Here the word **foot** is a metonym for desiring to do something sinful that you would do with your feet, such as going to a place you should not go to. Alternate translation: “if you want to do something sinful with one of your feet” (See: [[rc://en/ta/man/translate/figs-metonymy]])
MRK	9	45	vj49		εἰσελθεῖν εἰς τὴν ζωὴν χωλὸν	1	to enter into life lame	“to be lame and then to enter into life” or “to be lame before entering into life”
MRK	9	45	r1dy	figs-metaphor	εἰσελθεῖν εἰς τὴν ζωὴν	1	to enter into life	Dying and then beginning to live eternally is spoken of as entering **into life**. Alternate translation: “to enter into eternal life” or “to die and begin to live forever” (See: [[rc://en/ta/man/translate/figs-metaphor]])
MRK	9	45	c2vw		χωλὸν	1	lame	“unable to walk easily.” Here it refers not being able to walk well because of missing a foot. Alternate translation: “without a foot” or “missing a foot”
MRK	9	45	tmd6	figs-activepassive	βληθῆναι εἰς τὴν Γέενναν	1	to be thrown into hell	You can state this in active form. Alternate translation: “for God to throw you into hell” (See: [[rc://en/ta/man/translate/figs-activepassive]])
MRK	9	47	n5tw	figs-metonymy	ἐὰν ὁ ὀφθαλμός σου σκανδαλίζῃ σε, ἔκβαλε αὐτόν	1	if your eye may cause you to stumble, tear it out	Here the word **eye** could be: (1) a metonym for desiring to sin by looking at something. Alternate translation: “if you want to do something sinful by looking at something, tear your eye out” (2) a metonym for desiring to sin because of what you have looked at. Alternate translation: “if you want to do something sinful because of what you look at, tear your eye out” (See: [[rc://en/ta/man/translate/figs-metonymy]])
MRK	9	47	e52s	figs-explicit	μονόφθαλμον εἰσελθεῖν εἰς τὴν Βασιλείαν τοῦ Θεοῦ, ἢ δύο ὀφθαλμοὺς ἔχοντα	1	to enter into the kingdom of God with one eye than, having two eyes	This refers to the state of a person’s physical body when he dies. A person does not take his physical body with him into eternity. Alternate translation: “to enter into the kingdom of God after having lived on earth with only one eye than, having lived on earth with two eyes” (See: [[rc://en/ta/man/translate/figs-explicit]])
MRK	9	47	r2gn	figs-activepassive	βληθῆναι εἰς τὴν Γέενναν	1	to be thrown into hell	You can state this in the active form. Alternate translation: “for God to throw you into hell” (See: [[rc://en/ta/man/translate/figs-activepassive]])
MRK	9	48	uh4p	figs-explicit	ὅπου ὁ σκώληξ αὐτῶν οὐ τελευτᾷ	1	where their worm does not die	The meaning of this statement can be made explicit. Alternate translation: “where worms that eat people there do not die” (See: [[rc://en/ta/man/translate/figs-explicit]])
MRK	9	49	mr5y	figs-activepassive	πᾶς…πυρὶ ἁλισθήσεται	1	everyone will be salted with fire	You can state this in active form. Alternate translation: “God will salt everyone with fire” or “Just as salt purifies a sacrifice, God will purify everyone by allowing them to suffer” (See: [[rc://en/ta/man/translate/figs-activepassive]])
MRK	9	49	ma3s	figs-metaphor	πυρὶ ἁλισθήσεται	1	will be salted with fire	Here, **fire** is a metaphor for suffering, and putting salt on people is a metaphor for purifying them. So **will be salted with fire** is a metaphor for being purified through suffering. Alternate translation: “will be made pure in the fire of suffering” or “will suffer in order to be purified as a sacrifice is purified with salt” (See: [[rc://en/ta/man/translate/figs-metaphor]])
MRK	9	50	rb7r		ἄναλον γένηται	1	may become unsalty	“loses its salty taste”
MRK	9	50	fqb8	figs-rquestion	ἐν τίνι αὐτὸ ἀρτύσετε?	1	with what will you season it?	This can be written as a statement. Alternate translation: “you cannot make it salty again.” (See: [[rc://en/ta/man/translate/figs-rquestion]])
MRK	9	50	t76n		αὐτὸ ἀρτύσετε	1	will you season it	“will you make it taste salty again”
MRK	9	50	f34y	figs-metaphor	ἔχετε ἐν ἑαυτοῖς ἅλα	1	Have salt in yourselves	Jesus speaks of doing good things for one another as if good things were **salt** that people possess. Alternate translation: “Do good to each other, like salt adds flavor to food” (See: [[rc://en/ta/man/translate/figs-metaphor]])
