Book	Chapter	Verse	ID	SupportReference	OrigQuote	Occurrence	GLQuote	OccurrenceNote
1PE	3	21	owi3	figs-abstractnouns	οὐ σαρκὸς ἀπόθεσις ῥύπου, ἀλλὰ συνειδήσεως ἀγαθῆς, ἐπερώτημα εἰς Θεόν	1		If your language does not use abstract nouns for the ideas of **removal** and **appeal**, you could express the same ideas in another way. Alternate translation: “it does not remove dirt from the flesh, but appeals to God for a good conscience” (See: [[rc://en/ta/man/translate/figs-abstractnouns]])
1PE	3	21	hmp9	figs-metonymy	σαρκὸς	1		Here, Peter uses **flesh** figuratively to refer to a person’s physical body that is made of **flesh**. If this might confuse your readers, you could express the meaning plainly. Alternate translation: “from the body” (See: [[rc://en/ta/man/translate/figs-metonymy]])
1PE	3	21	uz0u	figs-explicit	συνειδήσεως ἀγαθῆς, ἐπερώτημα εἰς Θεόν	1		Here the phrase **a good conscience** means Peter’s readers do not feel guilty because they know that God has forgiven their sins. If this might confuse your readers, you could express this explicitly. Alternate translation: “an appeal to God to know that your sins have been forgiven” (See: [[rc://en/ta/man/translate/figs-explicit]])
1PE	3	21	jti3	figs-infostructure	καὶ ὑμᾶς…νῦν σῴζει βάπτισμα, οὐ σαρκὸς ἀπόθεσις ῥύπου, ἀλλὰ συνειδήσεως ἀγαθῆς, ἐπερώτημα εἰς Θεόν δι’ ἀναστάσεως Ἰησοῦ Χριστοῦ,	1	through the resurrection of Jesus Christ	Here, **through the resurrection of Jesus Christ** indicates the means by which the faith demonstrated by baptism saves. If it would be more natural in your language, you could change the order of these phrases to make that meaning clear. Alternate translation: “baptism now saves you also through the resurrection of Jesus Christ. It is not a removal of dirt from the flesh, but an appeal to God for a good conscience” (See: [[rc://en/ta/man/translate/figs-infostructure]])
1PE	3	21	rixf	figs-abstractnouns	δι’ ἀναστάσεως Ἰησοῦ Χριστοῦ	1		If your language does not use an abstract noun for the idea of **resurrection**, you could express the same idea in another way. Alternate translation: “through God raising Jesus Christ from the dead” (See: [[rc://en/ta/man/translate/figs-abstractnouns]])
1PE	3	22	p5ij	figs-infostructure	ὅς ἐστιν ἐν δεξιᾷ Θεοῦ, πορευθεὶς εἰς οὐρανὸν, ὑποταγέντων αὐτῷ ἀγγέλων, καὶ ἐξουσιῶν, καὶ δυνάμεων	1		The phrases **having gone** and **having been subjected** indicate that those two clauses describe events that occurred before the event in the first clause in this verse. If it would be more natural in your language, you could change the order of these phrases so that they appear in chronological order. Alternate translation: “after having gone into heaven, with angels and authorities and powers having been subjected to him, he is at the right hand of God” (See: [[rc://en/ta/man/translate/figs-infostructure]])
1PE	3	22	g4qh	figs-metonymy	ὅς ἐστιν ἐν δεξιᾷ Θεοῦ	1	who is at the right hand of God	Here, Peter uses **right hand** figuratively to refer to the place located at the right side of God in heaven. If this would confuse your readers, you could express the meaning plainly. Alternate translation: “who is at God’s right side” (See: [[rc://en/ta/man/translate/figs-metonymy]])
1PE	3	22	ldrw	figs-explicit	ὅς ἐστιν ἐν δεξιᾷ Θεοῦ	1		In this culture, the place at the **right** side of a ruler was a position of honor. If it would be helpful to your readers, you could indicate that explicitly. Alternate translation: “who is at the place of honor next to God” (See: [[rc://en/ta/man/translate/figs-explicit]])
1PE	3	22	q72i	figs-doublet	ὑποταγέντων αὐτῷ ἀγγέλων, καὶ ἐξουσιῶν, καὶ δυνάμεων	1		The words **angels**, **authorities**, and **powers** are all terms for the ranks of supernatural beings, both angelic and demonic. If your language does not have three different terms for rulers or authorities, you can combine them. Alternate translation: “all types of supernatural beings having been subjected to him” (See: [[rc://en/ta/man/translate/figs-doublet]])
1PE	3	22	f6jq	figs-activepassive	ὑποταγέντων αὐτῷ ἀγγέλων, καὶ ἐξουσιῶν, καὶ δυνάμεων	1	after … had been subjected to him	If your language does not use the passive form in this way, you can state this in active form or in another way that is natural in your language. Alternate translation: “God having subjected angels and authorities and powers to him” (See: [[rc://en/ta/man/translate/figs-activepassive]])
1PE	4	intro	zh5n			0		# 1 Peter 4 General Notes<br><br>## Structure and Formatting<br><br>1. How believers should endure suffering (3:13–4:6)<br>2. How believers should act because the end is near (4:7–11)<br>3. How believers should respond to trials (4:12–19)<br><br>Some translations set each line of poetry farther to the right than the rest of the text to make it easier to read. The ULT does this with the poetry that is quoted from the Old Testament in [verse 18](../04/18.md).<br><br>## Special Concepts in this Chapter<br><br>### Ungodly Gentiles<br><br>Although the term “Gentiles” usually refers to people who are not Jewish, in [verse 3](../04/03.md) Peter uses “Gentiles” to refer to all ungodly people who are not Jews. It does not include Gentiles who have become Christians. Actions like “licentiousness, lusts, drunkenness, carousing, drinking parties, and lawless idolatry” were typical of ungodly Gentiles. (See: [[rc://en/tw/dict/bible/kt/godly]])<br><br>## Other Possible Translation Difficulties in this Chapter<br><br>### “Let him” and “Let those”<br><br>In [verses 16–19](../04/16.md) Peter uses these phrases to tell his readers what he wants them to do. Although they are commands that he wants his readers to obey, it is as if he were telling one person what he wants other people to do. If it would be clearer in your language, you could translate these as commands, like the UST does.
1PE	4	1	b8d4	grammar-connect-words-phrases	οὖν	1		**Therefore** here refers back to what Peter has said about Jesus’ suffering in [3:18](../03/18.md). If it might help your readers, you could express this explicitly. Alternate translation: “Considering what I have written about Christ’s suffering” (See: [[rc://en/ta/man/translate/grammar-connect-words-phrases]])
1PE	4	1	ess6	figs-metonymy	σαρκὶ…σαρκὶ	1	in the flesh	Here, **flesh** refers to the human body, which is made of flesh. If this might confuse your readers, you could express the meaning plainly. Alternate translation: “in the body … in the body” (See: [[rc://en/ta/man/translate/figs-metonymy]])
1PE	4	1	p2rv	figs-metaphor	ὑμεῖς τὴν αὐτὴν ἔννοιαν ὁπλίσασθε	1	arm yourselves with the same intention	Here Peter uses **arm yourselves** figuratively to refer to preparing one’s mind for something. As soldiers get their weapons ready for battle, so should Christians be mentally prepared to suffer for their faith. If this might confuse your readers, you could express the meaning plainly or use a simile. Alternate translation: “prepare your minds with the same way of thinking” (See: [[rc://en/ta/man/translate/figs-metaphor]])
1PE	4	1	yxs5	figs-explicit	τὴν αὐτὴν ἔννοιαν	1		Here Peter uses **the same way of thinking** to refer to Jesus’ **way of thinking** when he suffered. If this might confuse your readers, you could express this explicitly. Alternate translation: “with the same way of thinking about suffering that Christ had when he suffered” (See: [[rc://en/ta/man/translate/figs-explicit]])
1PE	4	1	d66g	figs-explicit	πέπαυται ἁμαρτίας	1	has ceased from sin	Here, **ceased from sin** means “no longer living with a sinful mindset.” The idea is that suffering because of one’s faith indicates that a person is not living sinfully. Christians are often persecuted by unbelievers because they refuse to act sinfully. This phrase does not mean that Christians who suffer never sin. If this might confuse your readers, you could express this explicitly. Alternate translation: “has stopped living sinfully” (See: [[rc://en/ta/man/translate/figs-explicit]])
1PE	4	2	tjdq	grammar-connect-logic-goal	εἰς	1		Here, **in order to** introduces a purpose clause. This could mean: (1) this verse states the purpose for ceasing from sin mentioned at the end of the previous verse. Alternate translation (without a comma preceding): “so that he will” (2) this verse states the purpose for the command to “arm yourselves” in the previous verse. Alternate translation (starting a new sentence): “Arm yourselves in order to” (See: [[rc://en/ta/man/translate/grammar-connect-logic-goal]])
1PE	4	2	d49a	figs-metonymy	τὸν ἐπίλοιπον ἐν σαρκὶ…χρόνον	1		Peter uses **time in the flesh** figuratively to refer to a person’s lifetime. If this might confuse your readers, you could express the meaning plainly. Alternate translation: “the remaining time of your life” or “the rest of your life” (See: [[rc://en/ta/man/translate/figs-metonymy]])
1PE	4	2	fsvk	figs-explicit	ἀνθρώπων ἐπιθυμίαις	1		Here, **desires** refers specifically to sinful **desires**. If it would be helpful to your readers, you could express this explicitly. Alternate translation: “for the sinful desires of men” (See: [[rc://en/ta/man/translate/figs-explicit]])
1PE	4	2	gbb6	figs-gendernotations	ἀνθρώπων ἐπιθυμίαις	1	for the desires of men	Although the term **men** is masculine, Peter is using the word here in a generic sense to refer to humans in general. If this might confuse your readers, you could express the meaning plainly. Alternate translation: “for human desires” (See: [[rc://en/ta/man/translate/figs-gendernotations]])
1PE	4	3	anhj		ἀρκετὸς…ὁ παρεληλυθὼς χρόνος	1		Alternate translation: “enough time has passed”
1PE	4	3	efte	figs-metaphor	τὸ βούλημα τῶν ἐθνῶν	1		Here Peter uses **Gentiles** figuratively to refer to sinful people who do not know God. If this might confuse your readers, you could express the meaning plainly. See the discussion of this term in the General Notes for this chapter. Alternate translation: “the will of those people who do not know God” (See: [[rc://en/ta/man/translate/figs-metaphor]])
1PE	4	3	rp5p	figs-metaphor	πεπορευμένους ἐν ἀσελγείαις, ἐπιθυμίαις, οἰνοφλυγίαις, κώμοις, πότοις, καὶ ἀθεμίτοις εἰδωλολατρίαις	1		Peter speaks of these different sins figuratively as if they were places that his readers had formerly **lived in**. If this might confuse your readers, you could express the meaning plainly. Alternate translation: “having practiced licentiousness, lusts, drunkenness, carousing, drinking parties, and lawless idolatry” (See: [[rc://en/ta/man/translate/figs-metaphor]])
1PE	4	3	lm35	figs-abstractnouns	πεπορευμένους ἐν ἀσελγείαις, ἐπιθυμίαις, οἰνοφλυγίαις, κώμοις, πότοις, καὶ ἀθεμίτοις εἰδωλολατρίαις	1		If your language does not use abstract nouns for the ideas of **licentiousness, lusts, drunkenness, carousing**, and **idolatry**, you could express the same ideas in another way. Alternate translation: “having lived licentious and lustful lives, getting drunk, attending immoral parties and drinking parties, and worshiping prohibited idols” (See: [[rc://en/ta/man/translate/figs-abstractnouns]])
1PE	4	4	c4ma	figs-metaphor	μὴ συντρεχόντων ὑμῶν εἰς τὴν αὐτὴν τῆς ἀσωτίας ἀνάχυσιν	1		Peter uses **running into** figuratively to refer to being eager to participate in sinful acts with unbelievers. If this might confuse your readers, you could express the meaning plainly. Alternate translation: “you are not eagerly joining them to participate in the same outpouring of recklessness” (See: [[rc://en/ta/man/translate/figs-metaphor]])
1PE	4	4	q6k6	figs-metaphor	τῆς ἀσωτίας ἀνάχυσιν	1	outpouring of their reckless behavior	Peter uses **outpouring** figuratively to refer to acting sinfully to such a high degree that it is as if sin were pouring out of the person like a flood. If this might confuse your readers, you could express the meaning plainly. Alternate translation: “abundant acts of recklessness” (See: [[rc://en/ta/man/translate/figs-metaphor]])
1PE	4	4	w1d8	figs-explicit	τῆς ἀσωτίας	1	of their reckless behavior	The word **recklessness** refers to dangerous behavior that shows that a person does not care about the consequences of his actions. If this might confuse your readers, you could express the meaning plainly. Alternate translation: “of careless sinning” (See: [[rc://en/ta/man/translate/figs-explicit]])
1PE	4	5	datm	figs-metaphor	οἳ ἀποδώσουσιν λόγον	1		Here Peter uses **give** figuratively to refer to speaking something. If this might confuse your readers, you could express the meaning plainly. Alternate translation: “they will speak a word” (See: [[rc://en/ta/man/translate/figs-metaphor]])
1PE	4	5	r288	figs-metonymy	οἳ ἀποδώσουσιν λόγον	1		Here Peter uses **word** figuratively to refer to an explanation that they would speak using words. If this might confuse your readers, you could express the meaning plainly. Alternate translation: “they will give an account” (See: [[rc://en/ta/man/translate/figs-metonymy]])
1PE	4	5	xw39	figs-explicit	τῷ ἑτοίμως ἔχοντι κρῖναι	1	to the one who is ready to judge	Here, **the one who is ready to judge** could refer to: (1) God. Alternate translation: “to God, who is ready to judge” (2) Christ. Alternate translation: “to Christ, who is ready to judge” (See: [[rc://en/ta/man/translate/figs-explicit]])
1PE	4	5	dx7v	figs-merism	ζῶντας καὶ νεκρούς	1	the living and the dead	The phrase **living and dead ones** refers to all people, whether they are still alive or have died. If this might confuse your readers, you could express the meaning plainly. Alternate translation: “everyone” (See: [[rc://en/ta/man/translate/figs-merism]])
1PE	4	6	u54m	figs-explicit	καὶ νεκροῖς εὐηγγελίσθη	1	the gospel was preached also to the dead	Here, **dead ones** refers to people who heard the gospel while they were alive but had died by the time Peter wrote this letter. Some people believe that this clause means that Jesus went to hell and preached the gospel to people who had died before Jesus himself died on the cross. However, that idea would contradict the statement in [Hebrews 9:27](../heb/09/27.md) that “men are appointed to die once, and after that, the judgment.” The Bible does not state that God gave anyone a second chance to believe in Jesus after they had already died. If this use of **dead ones** might confuse your readers, you could express the meaning explicitly. Alternate translation: “the gospel was preached also to those who have since died” (See: [[rc://en/ta/man/translate/figs-explicit]])
1PE	4	6	ql11	figs-activepassive	εὐηγγελίσθη	1	the gospel was preached	If your language does not use the passive form in this way, you can state this in active form or in another way that is natural in your language. This could mean: (1) people preached the gospel. Alternate translation: “people preached the gospel” (2) Christ preached the gospel. Alternate translation: “Christ preached the gospel” (See: [[rc://en/ta/man/translate/figs-activepassive]])
1PE	4	6	hsg6	figs-activepassive	κριθῶσι…κατὰ ἀνθρώπους σαρκὶ	1	they were judged in the flesh according to men	If your language does not use the passive form in this way, you can state this in active form or in another way that is natural in your language. This could mean: (1) men judged and persecuted them during their lives according to human standards. Alternate translation: “men judged them in the flesh by human standards” (2) God judged them as humans during their lives. Alternate translation: “God judged them in the flesh as humans” (See: [[rc://en/ta/man/translate/figs-activepassive]])
1PE	4	6	gm1m	figs-gendernotations	κατὰ ἀνθρώπους	1		Although the term **men** is masculine, Peter is using the word here in a generic sense that includes both men and women. Alternate translation: “according to people” or “as people” (See: [[rc://en/ta/man/translate/figs-gendernotations]])
1PE	4	6	s72f	figs-metonymy	σαρκὶ	1	they were judged in the flesh according to men	Here Peter uses **in the flesh** figuratively to refer to a person’s lifetime. See how you translated this expression in [verse 2](../04/02.md). (See: [[rc://en/ta/man/translate/figs-metonymy]])
1PE	4	6	encm	figs-explicit	ζῶσι	1		Here, **live** refers to experiencing eternal life. If this might confuse your readers, you could express the meaning plainly. Alternate translation: “they might experience eternal life” (See: [[rc://en/ta/man/translate/figs-explicit]])
1PE	4	6	h154	figs-explicit	ζῶσι…πνεύματι	1		Here, **the spirit** could refer to: (1) the Holy Spirit, in which case this phrase would indicate the means by which the people received eternal life. Alternate translation: “they might live by the Spirit” (2) their spiritual existence, in which case this phrase would be referring to the spiritual realm that is contrasted with the physical realm mentioned earlier in the verse with the phrase “in the flesh.” Alternate translation: “they might live spiritually” or “they might live in the spiritual realm” See how you translated the same expression in [3:18](../03/18.md). (See: [[rc://en/ta/man/translate/figs-explicit]])
1PE	4	7	e445	figs-explicit	πάντων…τὸ τέλος	1	the end of all things	Here, **the end of all things** refers to the end of the world, when Jesus returns and judges everyone. If this might confuse your readers, you could express this explicitly. Alternate translation: “the end of the world, when Jesus returns,” (See: [[rc://en/ta/man/translate/figs-explicit]])
1PE	4	7	qs1t	figs-metaphor	ἤγγικεν	1	has come near	Peter uses **has come near** figuratively to refer to something that will happen soon. If this might confuse your readers, you could express the meaning plainly. Alternate translation: “will soon happen” (See: [[rc://en/ta/man/translate/figs-metaphor]])
1PE	4	7	ubd4	figs-doublet	σωφρονήσατε…καὶ νήψατε	1	be of sound mind, and be sober	The words translated as **sound mind** and **sober** mean basically the same thing. Peter uses them to emphasize the need to think clearly since the end of the world is near. If your language does not use repetition to do this, you could use one phrase and provide emphasis in another way. Alternate translation: “be completely clearheaded” (See: [[rc://en/ta/man/translate/figs-doublet]])
1PE	4	7	k5hh	figs-metaphor	νήψατε	1	be sober	See how you translated this word in [1:13](../01/13.md). (See: [[rc://en/ta/man/translate/figs-metaphor]])
1PE	4	7	qb4j	grammar-connect-logic-goal	εἰς προσευχάς	1		Here, **for** introduces a purpose clause. Peter is stating a purpose for his readers to think clearly. Use a natural way in your language for introducing a purpose clause. Alternate translation: “for the purpose of praying prayers” (See: [[rc://en/ta/man/translate/grammar-connect-logic-goal]])
1PE	4	8	f1lr	figs-metaphor	ὅτι ἀγάπη καλύψει πλῆθος ἁμαρτιῶν	1	for love covers a multitude of sins	Peter describes **love** figuratively as if it were a person who could cover something up, and he describes **sins** figuratively as if they were objects that could be covered up. This clause, **covers up**, means that people who love others will forgive them for the sins that they commit against them. If this might confuse your readers, you could express the meaning plainly or use similes. Alternate translation: “for those who love forgive the many sins committed against them by others” (See: [[rc://en/ta/man/translate/figs-metaphor]])
1PE	4	9	g3vw	figs-explicit	φιλόξενοι	1	hospitable	The word **hospitable** refers to showing kindness to and providing for the needs of guests and travelers. This was especially important in Peter’s time because inns were dangerous places where people did many immoral activities, so Christians could not stay in them. If it might be helpful to your readers, you could express the meaning explicitly. Alternate translation: “be those who provide food and a sleeping place” or “be those who provide room and board” (See: [[rc://en/ta/man/translate/figs-explicit]])
1PE	4	9	rzbi	figs-litotes	ἄνευ γογγυσμοῦ	1		Here Peter uses a figure of speech that expresses a strong positive meaning by using a negative word together with a word that is the opposite of the intended meaning. If this is confusing in your language, you can express the meaning positively. Alternate translation: “with cheerfulness” (See: [[rc://en/ta/man/translate/figs-litotes]])
1PE	4	10	xvj3	figs-explicit	ἕκαστος καθὼς ἔλαβεν χάρισμα	1	Just as each one has received a gift	Here, **gift** refers to special spiritual abilities that God gives to believers. If this might confuse your readers, you could express the meaning explicitly. Alternate translation: “just as each one has received a special spiritual ability from God” (See: [[rc://en/ta/man/translate/figs-explicit]])
1PE	4	10	a30t	figs-metaphor	ὡς καλοὶ οἰκονόμοι ποικίλης χάριτος Θεοῦ	1		Peter uses **stewards** figuratively to refer to Christians using spiritual abilities from God to serve other believers as if they were managing resources for a boss. If this might confuse your readers, you could express the meaning plainly or use a simile. Alternate translation: “as those managing well the diverse grace of God” (See: [[rc://en/ta/man/translate/figs-metaphor]])
1PE	4	10	smyw	figs-possession	ποικίλης χάριτος Θεοῦ	1		Peter is using the possessive form to describe **grace** that is given by God. The word **grace** refers to the various spiritual gifts that God graciously gives believers. If this might confuse your readers, you could express the meaning explicitly. Alternate translation: “of the diverse, gracious gifts from God” (See: [[rc://en/ta/man/translate/figs-possession]])
1PE	4	11	b81x	figs-ellipsis	εἴ τις λαλεῖ, ὡς λόγια Θεοῦ	1		Peter is leaving out some of the words that a clause would need in many languages to be complete. If your readers might misunderstand this, you could supply these words from the context. Alternate translation: “if anyone speaks, let him speak as if he is speaking the words of God” (See: [[rc://en/ta/man/translate/figs-ellipsis]])
1PE	4	11	vs2d	figs-ellipsis	εἴ τις διακονεῖ, ὡς ἐξ ἰσχύος ἧς χορηγεῖ ὁ Θεός	1		Peter is leaving out some of the words that a clause would need in many languages to be complete. If your readers might misunderstand this, you could supply these words from the context. Alternate translation: “if anyone serves others, let him serve others as if he were serving them with the strength that God supplies” (See: [[rc://en/ta/man/translate/figs-ellipsis]])
1PE	4	11	ir6x	figs-activepassive	δοξάζηται ὁ Θεὸς	1	so that in all God may be glorified	If your language does not use the passive form in this way, you can state this in active form or in another way that is natural in your language. Alternate translation: “you might glorify God” (See: [[rc://en/ta/man/translate/figs-activepassive]])
1PE	4	11	wq9e	figs-abstractnouns	ᾧ ἐστιν ἡ δόξα καὶ τὸ κράτος	1	may be glorified	If your language does not use abstract nouns for the ideas of **glory** and **power**, you could express the same ideas in another way. Alternate translation: “may he be recognized as glorious and powerful” (See: [[rc://en/ta/man/translate/figs-abstractnouns]])
1PE	4	12	vw9s	figs-metaphor	τῇ ἐν ὑμῖν πυρώσει	1	the fiery trial among you that is happening for a testing to you	Peter refers to suffering Christians as if they were gold being refined by being passed through a fire. In the same way that fire refines gold, trials test and strengthen a Christian’s faith. If this might confuse your readers, you could express the meaning plainly or with a simile. Alternate translation: “the trial you are experiencing that is refining you like gold is refined in fire” (See: [[rc://en/ta/man/translate/figs-metaphor]])
1PE	4	13	mhj1	figs-abstractnouns	ἐν τῇ ἀποκαλύψει τῆς δόξης αὐτοῦ	1	at the revealing of his glory	If your language does not use abstract nouns for the ideas of **revelation** and **glory**, you could express the same ideas in another way. This phrase could mean: (1) Christ will reveal his own glory. Alternate translation: “when he reveals how glorious he is” (2) God will reveal Christ’s glory. Alternate translation: “when God reveals how glorious Christ is” (See: [[rc://en/ta/man/translate/figs-abstractnouns]])
