Book	Chapter	Verse	ID	SupportReference	OrigQuote	Occurrence	GLQuote	OccurrenceNote
ROM	9	9	sufo	figs-quotemarks	κατὰ τὸν καιρὸν τοῦτον, ἐλεύσομαι, καὶ ἔσται τῇ Σάρρᾳ υἱός	1	this is the word of promise	This sentence is a quotation from [Genesis 18:10](../../gen/18/10.md), [14](../../gen/18/14.md). It may be helpful to your readers to indicate this by setting off all of this material with quotation marks or with whatever punctuation or convention your language uses to indicate a quotation. (See: [[rc://en/ta/man/translate/figs-quotemarks]])
ROM	9	9	r9dw	writing-pronouns	ἐλεύσομαι	1	this is the word of promise	The pronoun **I** here refers to God. If it might confuse your readers, you could state this explicitly. Alternate translation: “I, God, will come” (See: [[rc://en/ta/man/translate/writing-pronouns]])
ROM	9	9	hxl1	grammar-connect-logic-result	καὶ	1	this is the word of promise	Here, **and** indicates that what follows is the result of what happened in the previous clause. If it would be helpful in your language, you could state this explicitly. Alternate translation: “the result will be that” (See: [[rc://en/ta/man/translate/grammar-connect-logic-result]])
ROM	9	9	h4kf	figs-ellipsis	ἔσται τῇ Σάρρᾳ υἱός	1	this is the word of promise	This clause is leaving out a word that a sentence would need in many languages to be complete. If your readers might misunderstand this, you could supply this word from the context. Alternate translation: “a son will be born to Sarah” (See: [[rc://en/ta/man/translate/figs-ellipsis]])
ROM	9	9	wqb2	figs-activepassive	ἔσται τῇ Σάρρᾳ υἱός	1	a son will be given to Sarah	If your language does not use the passive form in this way, you can state this in active form or in another way that is natural in your language. Alternate translation: “Sarah will have a son” (See: [[rc://en/ta/man/translate/figs-activepassive]])
ROM	9	9	l18r	translate-names	Σάρρᾳ	1		See how you translated this name in [4:19](../04/19.md). (See: [[rc://en/ta/man/translate/translate-names]])
ROM	9	10	icc1	writing-pronouns	οὐ μόνον δέ	1	had conceived	Here, **this** refers to what Paul said in the previous verse, which was an example of God’s promises. If it would be helpful in your language, you could state this explicitly. Alternate translation: “Now, this is not the only example” or “Now, what God promised Abraham is not the only example” (See: [[rc://en/ta/man/translate/writing-pronouns]])
ROM	9	10	nqkc	figs-explicit	ἀλλὰ καὶ Ῥεβέκκα	1	had conceived	Paul implies that God made a promise to **Rebekah** and he states that promise in [verse 12](../09/12.md). If it would be helpful in your language, you could state this explicitly. Alternate translation: “but Rebekah also received a promise from God” (See: [[rc://en/ta/man/translate/figs-explicit]])
ROM	9	10	ciik	translate-names	Ῥεβέκκα	1	had conceived	**Rebekah** is the name of a woman, the wife of **Isaac**. (See: [[rc://en/ta/man/translate/translate-names]])
ROM	9	10	mb5q	figs-metaphor	τοῦ πατρὸς ἡμῶν	1	our father	Here, **father** refers to **Isaac** as the ancestor of the Jewish people. If your readers would not understand this, you could express the meaning plainly. Alternative translation: “our forefather” (See: [[rc://en/ta/man/translate/figs-metaphor]])
ROM	9	10	q7t8	translate-names	Ἰσαὰκ	1		See how you translated this name in [verse 7](../08/07.md). (See: [[rc://en/ta/man/translate/translate-names]])
ROM	9	11	h16y	grammar-connect-words-phrases	γὰρ	1		Here, **for** indicates that what follows gives further information about what Paul says in the previous verse and the next verse. If this might confuse your readers, you could use a different expression. Alternate translation: “In fact,” (See: [[rc://en/ta/man/translate/grammar-connect-words-phrases]])
ROM	9	11	ekxa	figs-explicit	γὰρ	1		Here Paul is referring to God choosing to bless Jacob instead of Esau, who are the twin sons of Rebekah and Isaac. However, he does not state this explicitly until [verse 13](../09/13.md). If it would be helpful to your readers, you could state this explicitly here. Alternate translation: “for God chose to bless only one of Rebekah’s two sons,” (See: [[rc://en/ta/man/translate/figs-explicit]])
ROM	9	11	luly	figs-ellipsis	μήπω…γεννηθέντων, μηδὲ πραξάντων τι ἀγαθὸν ἢ φαῦλον	1		Paul is leaving out some words that these clauses would need in many languages to be complete. If your readers might misunderstand this, you could supply these words from the context. Alternate translation: “her sons not yet having been born, nor indeed having done anything good or bad” (See: [[rc://en/ta/man/translate/figs-ellipsis]])
ROM	9	11	h32d	grammar-connect-logic-goal	ἵνα	1	so that the purpose of God according to choice might stand	Here, **so that** indicates that what follows is the purpose for which God chose only one of Rebekah’s sons. Use a natural way in your language for introducing a purpose clause, as in the UST. (See: [[rc://en/ta/man/translate/grammar-connect-logic-goal]])
ROM	9	11	a1gz	figs-abstractnouns	ἡ…πρόθεσις τοῦ Θεοῦ	1	so that the purpose of God according to choice might stand	If your language does not use an abstract noun for the idea of **purpose**, you could express the same idea in another way. Alternate translation: “what God had purposed” (See: [[rc://en/ta/man/translate/figs-abstractnouns]])
ROM	9	11	ts50	figs-abstractnouns	κατ’ ἐκλογὴν	1		If your language does not use an abstract noun for the idea of **election**, you could express the same idea in another way. The context indicates that Paul is referring to **God** electing people. Alternate translation: “according to electing people” or “in relation to choosing people” (See: [[rc://en/ta/man/translate/figs-abstractnouns]])
ROM	9	12	ze3m	figs-explicit	οὐκ ἐξ ἔργων, ἀλλ’ ἐκ τοῦ καλοῦντος	1		Here Paul is referring to the election of one of Rebekah’s sons, Jacob, as stated in the next verse. If it would be helpful in your language, you could state this explicitly. Alternate translation: “God did not elect Jacob by works, but by the one who calls” (See: [[rc://en/ta/man/translate/figs-explicit]])
ROM	9	12	h6uj	figs-explicit	ἔργων	1		Here, **works** refers to human actions in general. It does not refer to “the works of the law” because God had not yet given the Law of Moses when Jacob and Esau lived. If it would be helpful to your readers, you could state this explicitly. Alternate translation: “what people do” (See: [[rc://en/ta/man/translate/figs-explicit]])
ROM	9	12	d6mr	figs-explicit	τοῦ καλοῦντος	1	because of him	Here, **the one who calls** refers to God. If it would be helpful in your language, you could state this explicitly. Alternate translation: “God who calls” (See: [[rc://en/ta/man/translate/figs-explicit]])
ROM	9	12	sie3	figs-ellipsis	τοῦ καλοῦντος	1	because of him	Paul is leaving out a word that a clause would need in many languages to be complete. If your readers might misunderstand this, you could supply the word from the context. Alternate translation: “the one who calls people” (See: [[rc://en/ta/man/translate/figs-ellipsis]])
ROM	9	12	wv7n	figs-activepassive	ἐρρέθη αὐτῇ	1	it was said to her, “The older will serve the younger.”	If your language does not use the passive form in this way, you can state this in active form or in another way that is natural in your language. Alternate translation: “God said to her” (See: [[rc://en/ta/man/translate/figs-activepassive]])
ROM	9	12	fcho	writing-quotations	ἐρρέθη αὐτῇ	1	it was said to her, “The older will serve the younger.”	This phrase indicates that what follows is a quotation from an Old Testament book ([Genesis 25:23](../../gen/25/23.md)). If it would be helpful in your language, you could use a comparable phrase that indicates that Paul is quoting from an important text. Alternate translation: “it was said to her, as recorded in the Scriptures” (See: [[rc://en/ta/man/translate/writing-quotations]])
ROM	9	12	y9cc	writing-pronouns	αὐτῇ	1	it was said to her, “The older will serve the younger.”	Here, the pronoun **her** refers to Rebekah. If it would be helpful in your language, you could state this explicitly, as in the UST. (See: [[rc://en/ta/man/translate/writing-pronouns]])
ROM	9	12	hwwn	figs-quotemarks	ὁ μείζων δουλεύσει τῷ ἐλάσσονι	1	it was said to her, “The older will serve the younger.”	This sentence is a quotation from [Genesis 25:23](../../gen/25/23.md). It may be helpful to your readers to indicate this by setting off all of this material with quotation marks or with whatever punctuation or convention your language uses to indicate a quotation. (See: [[rc://en/ta/man/translate/figs-quotemarks]])
ROM	9	12	b8px	figs-explicit	ὁ μείζων δουλεύσει τῷ ἐλάσσονι	1	it was said to her, “The older will serve the younger.”	The phrases **the older** and **the younger** refer to Rebekah’s **older** and **younger** sons. If it would be helpful in your language, you could state this explicitly, as in the UST. (See: [[rc://en/ta/man/translate/figs-explicit]])
ROM	9	13	heon	writing-quotations	καθὼς γέγραπται	1	Jacob I loved, but Esau I hated	See how you translated this phrase in [1:17](../01/17.md). (See: [[rc://en/ta/man/translate/writing-quotations]])
ROM	9	13	mxfw	figs-activepassive	καθὼς γέγραπται	1		If your language does not use the passive form in this way, you can state this in active form or in another way that is natural in your language. If you must state who did the action, the quotation was written by the prophet Malachi and God is the person speaking. Alternate translation: “It is just as God had Malachi write” (See: [[rc://en/ta/man/translate/figs-activepassive]])
ROM	9	13	xt7t	figs-quotemarks	τὸν Ἰακὼβ ἠγάπησα, τὸν δὲ Ἠσαῦ ἐμίσησα	1	Jacob I loved, but Esau I hated	This sentence is a quotation from [Malachi 1:2–3](../../mal/01/02.md). It may be helpful to your readers to indicate this by setting off all of this material with quotation marks or with whatever punctuation or convention your language uses to indicate a quotation. (See: [[rc://en/ta/man/translate/figs-quotemarks]])
ROM	9	13	jb9k	translate-names	Ἰακὼβ…Ἠσαῦ	1	Jacob I loved, but Esau I hated	**Jacob** and **Esau** are the names of men, the twin sons of Isaac and Rebekah. (See: [[rc://en/ta/man/translate/translate-names]])
ROM	9	13	jcfs	writing-pronouns	ἠγάπησα…ἐμίσησα	1	Jacob I loved, but Esau I hated	The pronoun **I** here refers to God. If this might confuse your readers, you could state the meaning explicitly. Alternate translation: “I, God, loved … I hated” (See: [[rc://en/ta/man/translate/writing-pronouns]])
ROM	9	13	y3zu	figs-hyperbole	ἐμίσησα	1	Jacob I loved, but Esau I hated	Paul quotes God using the word **hated** as an exaggeration to say that he did not love Esau and had completely rejected him. If it would be helpful in your language, you could express the meaning plainly. Alternate translation: “I completely rejected” (See: [[rc://en/ta/man/translate/figs-hyperbole]])
ROM	9	14	lf2k	grammar-connect-logic-result	τί οὖν ἐροῦμεν?	1	What then will we say?	Here, **then** indicates that what follows is a response to what Paul said in [verses 6–13](../09/06.md). See how you translated this phrase in [6:1](../06/01.md). (See: [[rc://en/ta/man/translate/grammar-connect-logic-result]])
ROM	9	14	m8xk	figs-rquestion	τί οὖν ἐροῦμεν? μὴ ἀδικία παρὰ τῷ Θεῷ?	1	What then will we say?	In these two sentences Paul is not asking for information, but is using questions to address an objection that some people may have to what he said in the previous verses because they misunderstood him. If you would not use rhetorical questions for this purpose in your language, you could translate his words as statements or exclamations or communicate the emphasis in another way. Alternate translation: “Then we will say that God is truly unrighteous!” (See: [[rc://en/ta/man/translate/figs-rquestion]])
ROM	9	14	xvei	figs-quotemarks	τί οὖν ἐροῦμεν? μὴ ἀδικία παρὰ τῷ Θεῷ?	1	What then will we say?	In these two sentences Paul is speaking as if he were a someone who misunderstood what Paul had taught in the previous verses. It may be helpful to your readers to indicate this with quotation marks or with whatever other punctuation or convention your language uses to indicate quotations, as in the UST. (See: [[rc://en/ta/man/translate/figs-quotemarks]])
ROM	9	14	ya6m	figs-abstractnouns	μὴ ἀδικία παρὰ τῷ Θεῷ	1		If your language does not use an abstract noun for the idea of **unrighteousness**, you could express the same idea in another way. Alternate translation: “There is no unrighteous character with God, is there” (See: [[rc://en/ta/man/translate/figs-abstractnouns]])
ROM	9	14	euci	figs-metaphor	μὴ ἀδικία παρὰ τῷ Θεῷ	1		Here Paul speaks of **unrighteousness** as if it were an object that could be **with God**. He is referring to the idea of God being unrighteous. If it would be helpful in your language, you could express the meaning plainly. Alternate translation: “God is not unrighteous, is he” (See: [[rc://en/ta/man/translate/figs-metaphor]])
ROM	9	14	s1hm	figs-explicit	μὴ γένοιτο!	1	May it never be	In this sentence Paul begins to respond to the rhetorical questions he wrote in the previous verse. If it might help your readers, you could state this explicitly. Alternate translation: “I would respond by saying, ‘May it never be!’” (See: [[rc://en/ta/man/translate/figs-explicit]])
ROM	9	14	jrp5	figs-exclamations	μὴ γένοιτο!	1	May it never be	See how you translated this phrase in [3:4](../03/04.md) and [6:2](../06/02.md). (See: [[rc://en/ta/man/translate/figs-exclamations]])
ROM	9	15	x9ri	grammar-connect-logic-result	γὰρ	1	For he says to Moses	**For** here indicates that what follows is the reason why what Paul said in the previous verse is true. If it would be helpful to your readers, you could state this explicitly. Alternate translation: “This is due to the fact that” (See: [[rc://en/ta/man/translate/grammar-connect-logic-result]])
ROM	9	15	k9i0	writing-quotations	τῷ Μωϋσεῖ γὰρ λέγει	1	For he says to Moses	Here Paul uses this clause to introduce a quotation from an Old Testament book ([Exodus 33:19](../../exo/33/19.md)). If it would be helpful in your language, you could use a comparable phrase that indicates that Paul is quoting from an important text. Alternate translation: “For he says to Moses what is written in the Scriptures” (See: [[rc://en/ta/man/translate/writing-quotations]])
ROM	9	15	v2x6	writing-pronouns	λέγει…ἐλεήσω…ἐλεῶ…οἰκτειρήσω…οἰκτείρω	1	For he says to Moses	The pronouns **he** and **I** here refer to God. If this might confuse your readers, you could state the meaning explicitly. Alternate translation: “God says … ‘I, God, will have mercy … I will have mercy … I, God, will have compassion … I will have compassion’” (See: [[rc://en/ta/man/translate/writing-pronouns]])
ROM	9	15	kq2c	figs-pastforfuture	λέγει	1	For he says to Moses	Here Paul uses the present tense verb **says** to refer to something that happened in the past. If it would not be natural to do that in your language, you can use the past tense in your translation. Alternate translation: “he said” (See: [[rc://en/ta/man/translate/figs-pastforfuture]])
ROM	9	15	tjgf	translate-names	Μωϋσεῖ	1		See how you translated this name in [5:14](../05/14.md). (See: [[rc://en/ta/man/translate/translate-names]])
ROM	9	15	c2t0	figs-quotemarks	ἐλεήσω ὃν ἂν ἐλεῶ, καὶ οἰκτειρήσω ὃν ἂν οἰκτείρω	1		This sentence is a quotation from [Exodus 33:19](../../exo/33/19.md). It may be helpful to your readers to indicate this by setting off all of this material with quotation marks or with whatever punctuation or convention your language uses to indicate a quotation. (See: [[rc://en/ta/man/translate/figs-quotemarks]])
ROM	9	15	f61q	figs-abstractnouns	ἐλεήσω ὃν ἂν ἐλεῶ, καὶ οἰκτειρήσω ὃν ἂν οἰκτείρω	1		If your language does not use abstract nouns for the ideas of **mercy** and **compassion**, you could express the same ideas in another way. Alternate translation: “I will act mercifully to whomever I will act mercifully, and I will act compassionately to whomever I will act compassionately” (See: [[rc://en/ta/man/translate/figs-abstractnouns]])
ROM	9	15	f1hi	figs-parallelism	ἐλεήσω ὃν ἂν ἐλεῶ, καὶ οἰκτειρήσω ὃν ἂν οἰκτείρω	1		These statements use parallelism internally and between each other. They emphasize that God does whatever he wants. If this form of parallelism would be misunderstood in your language, consider another form that emphasizes that God is graciously kind to exactly those and only those to whom he chooses to show kindness, and he does so without outside influence. (See: [[rc://en/ta/man/translate/figs-parallelism]])
ROM	9	16	y06j	grammar-connect-words-phrases	ἄρα οὖν	1		**So then** indicates that what follows in this verse summarizes the ideas of [verses 11–15](../09/11.md). If this might confuse your readers, you could use a clearer expression. See how you translated this phrase in [5:18](../05/18.md). (See: [[rc://en/ta/man/translate/grammar-connect-words-phrases]])
ROM	9	16	hn5j	writing-pronouns	οὐ	1		Here, **it** refers to God acting mercifully. If it would be helpful in your language, you could state this explicitly. Alternate translation: “God’s mercy is not” (See: [[rc://en/ta/man/translate/writing-pronouns]])
ROM	9	16	d4f5	figs-possession	τοῦ θέλοντος, οὐδὲ τοῦ τρέχοντος, ἀλλὰ…Θεοῦ	1	it is not because of him who wills, nor because of him who runs	Paul is using the possessive form to describe what God’s mercy does or does not depend on. If this is not clear in your language, you could use state this explicitly. Alternate translation: “depending on the one who wills, nor depending on the one who runs, but depending on God” (See: [[rc://en/ta/man/translate/figs-possession]])
ROM	9	16	ues3	figs-metaphor	τοῦ τρέχοντος	1	nor because of him who runs	Here Paul uses **the one who runs** to refer to a person who does good things to try to gain God’s favor as if that person were running a race. If it would be helpful in your language, you could express the meaning plainly. Alternate translation: “the one who tries to gain favor” or “the one who works very hard” (See: [[rc://en/ta/man/translate/figs-metaphor]])
ROM	9	16	plbr	figs-distinguish	τοῦ ἐλεῶντος	1		This phrase gives us further information about **God** in the previous clause. If it might be helpful in your language, you could make the relationship between these phrases clearer. Alternate translation: “he is the one who has mercy” (See: [[rc://en/ta/man/translate/figs-distinguish]])
ROM	9	16	p1fn	figs-abstractnouns	τοῦ ἐλεῶντος	1		See how you translated **mercy** in the previous verse. (See: [[rc://en/ta/man/translate/figs-abstractnouns]])
ROM	9	17	st77	grammar-connect-logic-result	γὰρ	1	For the scripture says	**For** here indicates that what follows is the another reason why what Paul said in [verse 14](../09/14.md) is true. If it would be helpful to your readers, you could state this explicitly. Alternate translation: “What I said previously is also true due to the fact that” (See: [[rc://en/ta/man/translate/grammar-connect-logic-result]])
ROM	9	17	x1cj	figs-personification	λέγει…ἡ Γραφὴ τῷ Φαραὼ	1	For the scripture says	Here Paul uses **the scripture** as if it were a person who could speak. He means that the scripture he is about to quote contains information that God said to **Pharaoh**. If this might confuse your readers, you could express the meaning plainly. Alternate translation: “God says to Pharaoh in the scripture” (See: [[rc://en/ta/man/translate/figs-personification]])
ROM	9	17	e0r9	writing-quotations	λέγει…ἡ Γραφὴ τῷ Φαραὼ	1	For the scripture says	This phrase indicates that what follows is a quotation from an Old Testament book ([Exodus 9:16](../../exo/09/16.md)). If it would be helpful in your language, you could use a comparable phrase that indicates that Paul is quoting from an important text. Alternate translation: “God said to Pharaoh in the Scriptures” (See: [[rc://en/ta/man/translate/writing-quotations]])
ROM	9	17	w1ki	figs-pastforfuture	λέγει	1	For the scripture says	Here Paul uses the present tense verb **says** to refer to something that happened in the past. If it would not be natural to do that in your language, you can use the past tense in your translation. Alternate translation: “said” (See: [[rc://en/ta/man/translate/figs-pastforfuture]])
ROM	9	17	hadc	translate-names	τῷ Φαραὼ	1	For the scripture says	**Pharaoh** is the title for the man who was the king of Egypt. (See: [[rc://en/ta/man/translate/translate-names]])
ROM	9	17	ipl3	figs-quotemarks	ὅτι εἰς αὐτὸ τοῦτο ἐξήγειρά σε, ὅπως ἐνδείξωμαι ἐν σοὶ τὴν δύναμίν μου, καὶ ὅπως διαγγελῇ τὸ ὄνομά μου ἐν πάσῃ τῇ γῇ	1		This sentence is a quotation from [Exodus 9:16](../../exo/09/16.md). It may be helpful to your readers to indicate this by setting off all of this material with quotation marks or with whatever punctuation or convention your language uses to indicate a quotation. (See: [[rc://en/ta/man/translate/figs-quotemarks]])
ROM	9	17	wfwo	figs-abstractnouns	αὐτὸ τοῦτο	1		See how you translated **purpose** in [verse 11](../09/11.md). (See: [[rc://en/ta/man/translate/figs-abstractnouns]])
ROM	9	17	xu7s	writing-pronouns	ἐξήγειρά σε…ἐνδείξωμαι…μου	1	I … my	Here the pronouns **I** and **my** refer to God. If it would be helpful in your language, you could state the meaning explicitly. Alternate translation: “I, God, raised you up … I might demonstrate my” (See: [[rc://en/ta/man/translate/writing-pronouns]])
ROM	9	17	pz5x	figs-idiom	ἐξήγειρά σε	1	I raised you up	Paul quotes God using the phrase **raised you up** to refer to causing someone to become king. If it would be helpful in your language, you can use a comparable idiom or express the idea plainly. Alternate translation: “I caused you to become king” (See: [[rc://en/ta/man/translate/figs-idiom]])
ROM	9	17	nfv5	figs-yousingular	σε…σοὶ	1	you	Both occurrences of **you** in this verse are singular and refer to Pharaoh. (See: [[rc://en/ta/man/translate/figs-yousingular]])
ROM	9	17	ho3g	grammar-connect-logic-goal	ὅπως…ὅπως	1	you	Both occurrences of **so that** in this verse introduce purpose clauses. Use a natural way in your language for introducing purpose clauses. Alternate translation (without a comma preceding): “for the purpose that … for the purpose that” (See: [[rc://en/ta/man/translate/grammar-connect-logic-goal]])
ROM	9	17	dp4p	figs-abstractnouns	τὴν δύναμίν μου	1		See how you translated **power** in [1:16](../01/16.md). (See: [[rc://en/ta/man/translate/figs-abstractnouns]])
ROM	9	17	wspw	figs-metaphor	ἐν σοὶ	1		Paul quotes God speaking of his **power** as if it were an object that could be **in** Pharaoh. He means that Pharaoh is the means by which God would show his power. If it would be helpful in your language, you could express the meaning plainly. Alternate translation: “by means of you” (See: [[rc://en/ta/man/translate/figs-metaphor]])
ROM	9	17	gps5	figs-activepassive	ὅπως διαγγελῇ τὸ ὄνομά μου	1	so that my name might be proclaimed	If your language does not use the passive form in this way, you can state this in active form or in another way that is natural in your language. Alternate translation: “so that people might proclaim my name” (See: [[rc://en/ta/man/translate/figs-activepassive]])
ROM	9	17	jp6i	figs-metonymy	τὸ ὄνομά μου	1	my name	Here, **my name** represents God himself. If it might be helpful in your language, you could use an equivalent expression or plain language. Alternate translation: “who I am” (See: [[rc://en/ta/man/translate/figs-metonymy]])
ROM	9	18	qlty	grammar-connect-words-phrases	ἄρα οὖν	1		**So then** indicates that what follows in this verse summarizes the ideas of [verses 14–17](../09/14.md). If this might confuse your readers, you could use a clearer expression. See how you translated this phrase in [5:18](../05/18.md) and in [verse 16](../09/16.md). (See: [[rc://en/ta/man/translate/grammar-connect-words-phrases]])
ROM	9	18	jrj5	writing-pronouns	θέλει, ἐλεεῖ…θέλει, σκληρύνει	1	whom he wishes, he makes stubborn	In this verse **he** refers to God. If it would be helpful in your language, you could state this explicitly. Alternate translation: “God has mercy … he wills … God wills … he hardens” (See: [[rc://en/ta/man/translate/writing-pronouns]])
