Book	Chapter	Verse	ID	SupportReference	OrigQuote	Occurrence	GLQuote	OccurrenceNote
ROM	6	17	pz14	figs-activepassive	ὃν παρεδόθητε	1	the pattern of teaching that you were given	If your language does not use the passive form in this way, you could express the idea in active form or in another way that is natural in your language. Alternate translation: “that God gave you over to” or (See: [[rc://en/ta/man/translate/figs-activepassive]])
ROM	6	18	fcd1	figs-personification	ἐλευθερωθέντες δὲ ἀπὸ τῆς ἁμαρτίας, ἐδουλώθητε τῇ δικαιοσύνῃ	1		Here Paul speaks of **sin** and **righteousness** figuratively as if they were slave-masters that people could be **enslaved** to. Paul means that his readers are no longer controlled by their sinful desires, but are controlled by the desire to live righteously. If this might confuse your readers, you could express the meaning plainly. Alternate translation: “And having been freed from having to live sinfully, you now have to live righteously” (See: [[rc://en/ta/man/translate/figs-personification]])
ROM	6	18	y2zg	figs-activepassive	ἐλευθερωθέντες δὲ ἀπὸ τῆς ἁμαρτίας, ἐδουλώθητε	1	You have been made free from sin	If your language does not use passive forms in this way, you could express these ideas in active forms or in another way that is natural in your language. If you must state who did the action, Paul implies that “God” did it. Alternate translation: “And God having freed you from sin, he enslaved you” (See: [[rc://en/ta/man/translate/figs-activepassive]])
ROM	6	18	twpq	figs-abstractnouns	ἁμαρτίας…δικαιοσύνῃ	1	You have been made free from sin	See how you translated the abstract nouns **sin** and **righteousness** in [verse 16](../06/16.md). (See: [[rc://en/ta/man/translate/figs-abstractnouns]])
ROM	6	19	jlmd	grammar-connect-logic-result	ἀνθρώπινον λέγω, διὰ τὴν ἀσθένειαν τῆς σαρκὸς ὑμῶν	1	because of the weakness of your flesh	If it would be more natural in your language, you could reverse the order of these phrases, since the second phrase gives the reason for the result that the first phrase describes. Alternate translation: “Because of the weakness of your flesh, I speak as a man” or “Because you are still immature, I have to speak in simple terms” (See: [[rc://en/ta/man/translate/grammar-connect-logic-result]])
ROM	6	19	puvh	figs-idiom	ἀνθρώπινον λέγω	1	because of the weakness of your flesh	Here, the phrase **as a man** is an idiom meaning “the way people do” or “like a human being.” If your readers would not understand this, you could use an equivalent idiom or use plain language. Alternate translation: “I am speaking based on how human beings perceive things” or “I am talking like a mere human being” (See: [[rc://en/ta/man/translate/figs-idiom]])
ROM	6	19	gt1n	figs-abstractnouns	τὴν ἀσθένειαν τῆς σαρκὸς ὑμῶν…τῇ ἀκαθαρσίᾳ, καὶ τῇ ἀνομίᾳ εἰς τὴν ἀνομίαν…τῇ δικαιοσύνῃ εἰς ἁγιασμόν	1	because of the weakness of your flesh	If your language does not use abstract nouns for the ideas of **weakness**, **uncleanness**, **lawlessness**, **righteousness**, and **sanctification**, you could express the same ideas in another way. Alternate translation: “how weak your flesh is … to act impurely and to be more and more lawless … for living righteously, which leads to being sanctified” (See: [[rc://en/ta/man/translate/figs-abstractnouns]])
ROM	6	19	l4ah	figs-idiom	τὴν ἀσθένειαν τῆς σαρκὸς ὑμῶν	1	because of the weakness of your flesh	Here, the term **flesh** is an idiom that refers to human nature. If your readers would not understand this, you could use an equivalent idiom or use plain language. Alternate translation: “your human weakness” or “your natural limitations” (See: [[rc://en/ta/man/translate/figs-idiom]])
ROM	6	19	psmw	grammar-connect-words-phrases	γὰρ	1	because of the weakness of your flesh	**For** here indicates that what follows explains what Paul said in [verses 17–18](../06/17.md). If this might confuse your readers, you could state this explicitly. Alternate translation: “In fact,” (See: [[rc://en/ta/man/translate/grammar-connect-words-phrases]])
ROM	6	19	x2kt	grammar-connect-words-phrases	ὥσπερ…οὕτως	1	because of the weakness of your flesh	See how you translated **just as** and **so** in the [5:19](../05/19.md). (See: [[rc://en/ta/man/translate/grammar-connect-words-phrases]])
ROM	6	19	jbcz	figs-personification	παρεστήσατε τὰ μέλη ὑμῶν δοῦλα τῇ ἀκαθαρσίᾳ, καὶ τῇ ἀνομίᾳ εἰς τὴν ἀνομίαν… παραστήσατε τὰ μέλη ὑμῶν, δοῦλα τῇ δικαιοσύνῃ	1	because of the weakness of your flesh	Paul speaks figuratively of body parts as if they were **slaves** that could be offered to someone or used by someone. He means that his readers used to use use their body parts to act impurely and to disobey God’s laws, but now they should use them to live in the way God wants. If this might confuse your readers, you could express the meaning plainly. See how you translated similar phrases in [verse 13](../06/13.md). Alternative translation: “you used your members to act uncleanly and to disobey God more and more … use your members to act righteously” (See: [[rc://en/ta/man/translate/figs-personification]])
ROM	6	19	o0ta	grammar-connect-logic-result	εἰς ἁγιασμόν	1	presented the parts of your body as slaves to uncleanness and to evil	The phrase **leading to** indicates result. Use a natural way in your language to express the result of something. Alternate translation: “resulting in sanctification” or “causing sanctification” (See: [[rc://en/ta/man/translate/grammar-connect-logic-result]])
ROM	6	20	s9pk	grammar-connect-logic-result	γὰρ	1		**For** here introduces a result clause. Use a natural way in your language to express the result of something. Alternate translation: “This reason for this is” (See: [[rc://en/ta/man/translate/grammar-connect-logic-result]])
ROM	6	20	i1ze	figs-personification	ὅτε…δοῦλοι ἦτε τῆς ἁμαρτίας, ἐλεύθεροι ἦτε τῇ δικαιοσύνῃ	1	you were free from righteousness	Here, **sin** and **righteousness** are spoken of figuratively as though they were slave-masters. Paul means that when his readers had previously used their bodies to act sinfully, they were not serving God’s purposes as **slaves** of **righteousness**. If this might confuse your readers, you could express the meaning plainly. Alternate translation: “when you were controlled by sin, you did not serve God” or “when you were living sinfully, you did not live righteously” (See: [[rc://en/ta/man/translate/figs-personification]])
ROM	6	20	mu0y	figs-irony	ἐλεύθεροι ἦτε τῇ δικαιοσύνῃ	1		Paul is not making a serious suggestion here that sinful people are not required to live righteously. Paul actually means to communicate the opposite of the literal meaning of **free**. If this would be misunderstood in your language, consider expressing the meaning plainly. Alternate translation: “you were unrighteous” or “you were unable to live righteously” (See: [[rc://en/ta/man/translate/figs-irony]])
ROM	6	21	x3bn	grammar-connect-logic-result	τίνα…καρπὸν εἴχετε τότε, ἐφ’ οἷς νῦν ἐπαισχύνεσθε? τὸ γὰρ τέλος ἐκείνων θάνατος	1		If it would be more natural in your language, you could reverse the order of these sentences, since the second sentence gives the reason for the result that the first sentence describes. Alternate translation: “since the outcome of those things is death, what fruit were you then having because of which things you are now ashamed?” (See: [[rc://en/ta/man/translate/grammar-connect-logic-result]])
ROM	6	21	kjl5	figs-rquestion	τίνα οὖν καρπὸν εἴχετε τότε, ἐφ’ οἷς νῦν ἐπαισχύνεσθε	1	At that time, what fruit then did you have of the things of which you are now ashamed?	Paul is using a rhetorical question here to emphasize the futility of being “slaves to sin” in the previous verse. If you would not use a rhetorical question for this purpose in your language, you could translate his words as a statement or an exclamation in order to communicate the emphasis in another way. Alternate translation: “So you were not then having any fruit because of which things you are now ashamed!” (See: [[rc://en/ta/man/translate/figs-rquestion]])
ROM	6	21	vgam	figs-idiom	καρπὸν	1	At that time, what fruit then did you have of the things of which you are now ashamed?	Here, **fruit** is an idiom meaning “benefit” or “advantage.” If your readers would not understand this, you could use an equivalent idiom or use plain language. Alternate translation: “advantage” or “profit” (See: [[rc://en/ta/man/translate/figs-idiom]])
ROM	6	21	pnbm	figs-explicit	ἐφ’ οἷς…ἐκείνων	1	At that time, what fruit then did you have of the things of which you are now ashamed?	Here, **which things** and **those things** refer to sins. If it might confuse your readers, you could state this explicitly. Alternate translation: “because of which sins … of those sins” (See: [[rc://en/ta/man/translate/figs-explicit]])
ROM	6	21	j2ie	figs-abstractnouns	τὸ γὰρ τέλος ἐκείνων θάνατος	1	At that time, what fruit then did you have of the things of which you are now ashamed?	If your language does not use an abstract noun for the ideas of **outcome** and **death**, you could express the same ideas in another way. Alternate translation: “For those things finally result in you dying” (See: [[rc://en/ta/man/translate/figs-abstractnouns]])
ROM	6	21	tj21	figs-explicit	θάνατος	1	At that time, what fruit then did you have of the things of which you are now ashamed?	Here, **death** refers to spiritual **death**, which is eternal punishment in hell that occurs after physical death. See how you translated the same use of **death** in [verse 16](../06/16.md). (See: [[rc://en/ta/man/translate/figs-explicit]])
ROM	6	22	x8vw	grammar-connect-logic-contrast	νυνὶ δέ	1	But now that you have been made free from sin and are enslaved to God	**But now** introduces a contrast with the previous two verses, a contrast that focuses on time. The word translated **now** refers to the time after the Roman believers became Christians. If this contrast would be misunderstood in your language, you could clarify what **now** refers to. Alternate translation: “But now that you believe in Jesus,” (See: [[rc://en/ta/man/translate/grammar-connect-logic-contrast]])
ROM	6	22	cqlf	grammar-connect-logic-contrast	ἐλευθερωθέντες ἀπὸ τῆς ἁμαρτίας, δουλωθέντες δὲ τῷ Θεῷ	1	But now that you have been made free from sin and are enslaved to God	This clause indicates the reason why Paul’s readers have **fruit leading to sanctification**. Use the most natural way in your language to indicate a reason clause. Alternate translation: “because you have been freed from sin and have been enslaved to God” (See: [[rc://en/ta/man/translate/grammar-connect-logic-result]])
ROM	6	22	fmtc	figs-personification	ἐλευθερωθέντες ἀπὸ τῆς ἁμαρτίας, δουλωθέντες δὲ τῷ Θεῷ	1	But now that you have been made free from sin and are enslaved to God	Here, **sin** and **God** are spoken of figuratively as though they were slave-masters. Paul means that Christians are no longer controlled by their desire to sin, but are supposed to obey **God** instead. See a similar phrase in [verse 18](../06/18.md). If this might confuse your readers, you could express the meaning plainly. Alternate translation: “having been freed from having to live sinfully and having began to serve God” (See: [[rc://en/ta/man/translate/figs-personification]])
ROM	6	22	z3ap	figs-activepassive	ἐλευθερωθέντες ἀπὸ τῆς ἁμαρτίας, δουλωθέντες δὲ τῷ Θεῷ	1	But now that you have been made free from sin and are enslaved to God	If your language does not use passive forms in this way, you could express these ideas in active forms or in another way that is natural in your language. If you must state who did the action, Paul implies that “God” did it. Alternate translation: “God having freed you from sin and having enslaved you to himself” or “God having released you from being controlled by your sin and having caused you to serve him” (See: [[rc://en/ta/man/translate/figs-activepassive]])
ROM	6	22	npf3	figs-idiom	ἔχετε τὸν καρπὸν ὑμῶν	1	you have your fruit for sanctification	See how you translated **fruit** in the previous verse. (See: [[rc://en/ta/man/translate/figs-idiom]])
ROM	6	22	a478	figs-abstractnouns	εἰς ἁγιασμόν, τὸ…τέλος ζωὴν αἰώνιον	1	The result is eternal life	See how you translated the abstract nouns **sanctification** in [verse 19](../06/19.md), **outcome** in [verse 21](../06/21.md), and **eternal life** in [5:21](../05/21.md). (See: [[rc://en/ta/man/translate/figs-abstractnouns]])
ROM	6	22	lvhh	grammar-connect-logic-result	εἰς ἁγιασμόν	1	you have your fruit for sanctification	See how you translated this phrase in [verse 19](../06/19.md). (See: [[rc://en/ta/man/translate/grammar-connect-logic-result]])
ROM	6	23	gacy	grammar-connect-logic-result	γὰρ	1	For the wages of sin are death	**For** here indicates that this verse gives the reason for what Paul said in the previous two verses. Use a natural way in your language to make this emphasis explicit. Alternate translation: “This is true because” (See: [[rc://en/ta/man/translate/grammar-connect-logic-result]])
ROM	6	23	ze3f	figs-personification	τὰ…ὀψώνια τῆς ἁμαρτίας θάνατος	1	For the wages of sin are death	Here, **sin** is spoken of figuratively as if it were a person who could pay **wages**. Paul means that the result of living sinfully is eternal **death**. If this might confuse your readers, you could express the meaning plainly. Alternate translation: “when a person lives sinfully it results in eternal death” (See: [[rc://en/ta/man/translate/figs-personification]])
ROM	6	23	juc4	figs-metaphor	τὰ…ὀψώνια τῆς ἁμαρτίας θάνατος	1	For the wages of sin are death	Paul speaks figuratively of **death** as if it were **wages** paid to those who **sin**. He means that the result of living sinfully is eternal **death**. If this might confuse your readers, you could express the meaning plainly or use a simile. Alternative translation: “whoever lives sinfully receives eternal death as the result” or “whoever lives sinfully earns eternal death as if it were wages for work” (See: [[rc://en/ta/man/translate/figs-metaphor]])
ROM	6	23	iyv3	figs-possession	τὰ…ὀψώνια τῆς ἁμαρτίας	1	For the wages of sin are death	Paul is using the possessive form to describe **the wages** that come from **sin**. If this is not clear in your language, you could use a different expression. Alternate translation: “sin’s wages” or “the wages that come from sin” (See: [[rc://en/ta/man/translate/figs-possession]])
ROM	6	23	pizh	figs-explicit	θάνατος	1	For the wages of sin are death	Here, **death** refers to spiritual **death**, which is eternal punishment in hell that occurs after physical death. See how you translated the same use of **death** in [verses 16](../06/16.md) and [21](../06/21.md). (See: [[rc://en/ta/man/translate/figs-explicit]])
ROM	6	23	slyb	figs-abstractnouns	θάνατος; τὸ…χάρισμα…ζωὴ αἰώνιος	1	For the wages of sin are death	See how you translated the abstract nouns **death** in [verse 21](../06/21.md), **gracious gift** in [5:15–16](../05/15.md), and **eternal life** in [verse 22](../06/22.md). (See: [[rc://en/ta/man/translate/figs-abstractnouns]])
ROM	6	23	cwkw	figs-possession	τὸ…χάρισμα τοῦ Θεοῦ	1	For the wages of sin are death	Paul is using the possessive form to describe **the gracious gift** that comes from **God**. If this is not clear in your language, you could use a different expression. Alternate translation: “God’s gracious gift” or “the gracious gift from God” (See: [[rc://en/ta/man/translate/figs-possession]])
ROM	6	23	jn66	figs-metaphor	ἐν Χριστῷ Ἰησοῦ	1	For the wages of sin are death	Paul speaks figuratively of **eternal life** as if it were occupying space inside of **Christ Jesus**. Paul means that **eternal life** comes by being united to **Christ Jesus**, as stated in [verse 11](../06/11.md). If this might confuse your readers, you could express the meaning plainly. Alternative translation: “for those who are united to Christ Jesus” or “comes through being united to Christ Jesus” (See: [[rc://en/ta/man/translate/figs-metaphor]])
ROM	7	intro	fl1y			0		# Romans 7 General Notes<br><br>## Structure and formatting<br><br>5. Becoming like Christ in this life (6:1–8:39)<br>    * Baptism represents union with Christ’s death (6:1–14)<br>    * Christians are now slaves of righteousness (6:15–23)<br>    * Christians have been freed from the law (7:1–6)<br>    * The law is not sinful (7:7–12)<br>    * Christians still struggle with indwelling sin (7:13–25)<br><br>## Special concepts in this chapter<br><br>### “The Law”<br><br>Throughout most of this chapter Paul uses the singular noun “the law” to refer to the group of laws that God gave Israel through Moses. However, in [verses 21–25](../07/21.md) Paul uses the word “law” in several different ways. Each of these different uses will be addressed in the notes. (See: [[rc://en/tw/dict/bible/kt/lawofmoses]])<br><br>## Important figures of speech in this chapter<br><br>### Marriage<br><br>Scripture commonly uses marriage as a metaphor. Here Paul uses it to describe how the church relates to the law of Moses and now to Christ. (See: [[rc://en/ta/man/translate/figs-metaphor]])<br><br>## Possible translation difficulties in this chapter<br><br>### Inclusive language<br><br>In this chapter the pronouns “we”, “us”, and “our” refer inclusively to all Jewish believers in Christ. Paul calls these people “brothers” in [verses 1](../07/01.md) and [4](../07/04.md). Your language may require you to mark these forms. (See: [[rc://en/ta/man/translate/figs-exclusive]])
ROM	7	1	mk7w	figs-rquestion	ἢ ἀγνοεῖτε, ἀδελφοί (γινώσκουσιν γὰρ νόμον λαλῶ), ὅτι ὁ νόμος κυριεύει τοῦ ἀνθρώπου ἐφ’ ὅσον χρόνον ζῇ?	1	do you not know, brothers … that the law controls a person for as long as he lives?	Paul is using a rhetorical question here to emphasize that the Jew is required to obey the Law of Moses his whole life. If you would not use a rhetorical question for this purpose in your language, you could translate his words as a statement or an exclamation and communicate the emphasis in another way. Alternate translation: “You surely know, brothers (for I am speaking to those who know the law), that the law is lord of the man for as long as he lives!” (See: [[rc://en/ta/man/translate/figs-rquestion]])
ROM	7	1	r9fl	figs-gendernotations	ἀδελφοί…τοῦ ἀνθρώπου…ζῇ	1	brothers	Although the term **brothers** and **the man** and **he** are masculine, Paul is using the words here in a generic sense that includes both males and females. Alternate translation: “fellow Jewish believers … a person … that person lives” (See: [[rc://en/ta/man/translate/figs-gendernotations]])
ROM	7	1	s4su		(γινώσκουσιν γὰρ νόμον λαλῶ)	1	brothers	Here Paul interrupts himself in order to clarify that he is specifically directing this part of the letter to the Jewish believers in the church at Rome. If this would be confusing in your language, you could add parentheses like the ULT or use a natural way in your language to indicate this.
ROM	7	1	j67x	grammar-connect-logic-result	γὰρ	1	brothers	Here, **for** indicates that what follows is the reason why Paul expects these **brothers** to understand what he is saying. Use the most natural way in your language to state a reason. Alternate translation: “I know you should understand this because” (See: [[rc://en/ta/man/translate/grammar-connect-logic-result]])
ROM	7	1	ajk4	writing-pronouns	λαλῶ	1	brothers	The pronoun **I** and throughout this chapter refers to Paul (see [6:19](../06/19.md)). If this might confuse your readers, you could say this explicitly. Alternate translation: “I, Paul, am speaking” (See: [[rc://en/ta/man/translate/writing-pronouns]])
ROM	7	1	k3h5	grammar-collectivenouns	νόμον…ὁ νόμος	1	brothers	For every occurrence of **the law** in [verses 1–20](../07/01.md) translate the phrase in the same way you translated it in [2:12](../02/12.md). (See: [[rc://en/ta/man/translate/grammar-collectivenouns]])
ROM	7	1	okz5	figs-personification	ὁ νόμος κυριεύει τοῦ ἀνθρώπου	1	brothers	Here Paul speaks of **the law** figuratively as if it were a king. Paul means that, like a king, **the law** must be obeyed by those who are obligated to do so. If this might confuse your readers, you could express the meaning plainly or with a simile. Alternate translation: “like a king, the law must be obeyed by every Jewish person” (See: [[rc://en/ta/man/translate/figs-personification]])
ROM	7	2	as1h	grammar-connect-words-phrases	γὰρ	1		**For** here indicates that what follows in this verse and the next verse is an example from God’s law that illustrates how “the law rules over the man for as long as he lives,” as Paul said in the previous verse. If this might confuse your readers, you could state this explicitly. Alternate translation: “For example,” or “As an illustration,” (See: [[rc://en/ta/man/translate/grammar-connect-words-phrases]])
ROM	7	2	j4sn	figs-genericnoun	ἡ…ὕπανδρος γυνὴ τῷ ζῶντι ἀνδρὶ δέδεται νόμῳ; ἐὰν δὲ ἀποθάνῃ ὁ ἀνήρ, κατήργηται…τοῦ ἀνδρός	1		Paul is speaking of Jewish **married** women and husbands in general, not of one particular **woman** or **husband**. If it would be helpful in your language, use a more natural phrase. Alternate translation: “married women remain bound by law to their living husbands, but if their husbands die, they have been released … of their husbands” (See: [[rc://en/ta/man/translate/figs-genericnoun]])
ROM	7	2	hpn4	figs-activepassive	ἡ…ὕπανδρος γυνὴ…δέδεται νόμῳ…κατήργηται	1		If your language does not use the passive form in this way, you can state this in active form or in another way that is natural in your language. Alternate translation: “the law continually binds the married woman … God releases her” (See: [[rc://en/ta/man/translate/figs-activepassive]])
ROM	7	2	l6d9	figs-personification	ἡ…ὕπανδρος γυνὴ τῷ ζῶντι ἀνδρὶ δέδεται νόμῳ…κατήργηται ἀπὸ τοῦ νόμου τοῦ ἀνδρός	1	the married woman is bound by law to the husband	Here Paul speaks of the **law** figuratively as if it were a person who could tie a **woman** to her **husband**. Paul means that the **law** of Moses requires a **married woman** to stay married to her **husband** only while he is alive. If this might confuse your readers, you could express the meaning plainly. Alternate translation: “God requires in his laws that the married woman remain married to her living husband … she is no longer required to remain married to the husband” (See: [[rc://en/ta/man/translate/figs-personification]])
ROM	7	2	ag23	figs-possession	τοῦ νόμου τοῦ ἀνδρός	1	the married woman is bound by law to the husband	Paul is using the possessive form to describe **the law** that is related to **the husband**. This phrase refers to the **law** already described in the previous clause. If this is not clear in your language, you could use a different expression. Alternate translation: “the law that requires her to remain bound to the husband” (See: [[rc://en/ta/man/translate/figs-possession]])
ROM	7	3	w3yw	grammar-connect-words-phrases	ἄρα οὖν	1		See how you translated this phrase in [5:18](../05/18.md). (See: [[rc://en/ta/man/translate/grammar-connect-words-phrases]])
ROM	7	3	ss60	figs-infostructure	ζῶντος τοῦ ἀνδρὸς, μοιχαλὶς χρηματίσει, ἐὰν γένηται ἀνδρὶ ἑτέρῳ	1		If it would be more natural in your language, you could reverse the order of these phrases. Alternate translation: “if she becomes married to another husband, the first husband being alive” (See: [[rc://en/ta/man/translate/figs-infostructure]])
ROM	7	3	jbvc	grammar-connect-time-simultaneous	ζῶντος τοῦ ἀνδρὸς	1		In this clause Paul is describing something that was occurring during the same time period as what he describes in the next clause. You can make this clear in your translation with an appropriate connecting word or phrase. Alternate translation: “at the same time that the husband is alive” (See: [[rc://en/ta/man/translate/grammar-connect-time-simultaneous]])
