Book	Chapter	Verse	ID	SupportReference	OrigQuote	Occurrence	GLQuote	OccurrenceNote
1TH	2	2	w0qu	grammar-connect-logic-contrast	ἀλλὰ προπαθόντες καὶ ὑβρισθέντες, καθὼς οἴδατε, ἐν Φιλίπποις ἐπαρρησιασάμεθα ἐν τῷ Θεῷ ἡμῶν	1		**But** begins a contrasting clause emphasizing that the coming of Paul, Silvanus, and Timothy was **not in vain** [2:1](../02/01.md). The verb translated **we were bold** is an emphatic contrast to the normal response one would expect from suffering. Paul, Silvanus, and Timothy are able to respond this way because their boldness comes from God. Use a natural way in your language for introducing a contrast. Alternate translation: “However … God made us confident in how powerful he is” or “Instead … God encouraged us” or  (See: [[rc://en/ta/man/translate/grammar-connect-logic-contrast]])
1TH	2	2	clqq	figs-infostructure	ἀλλὰ προπαθόντες καὶ ὑβρισθέντες, καθὼς οἴδατε, ἐν Φιλίπποις	1		Here, **just as you know** is meant to emphasize how well the Thessalonian church understands the apostles’ suffering. If it would be more natural in your language, you could reverse the order of these phrases. Alternate translation: “But, as you are well aware that we already suffered and were badly insulted at Philippi” (See: [[rc://en/ta/man/translate/figs-infostructure]])<br>
1TH	2	2	le4l	writing-background	προπαθόντες καὶ ὑβρισθέντες…ἐν Φιλίπποις	1		The phrase translated **having previously suffered and have been shamefully treated at Philippi** is a background information about what happened when Paul, Silvanus, and Timothy were in the city of Philippi (see Acts 16). Use the natural form in your language for expressing background information. Alternate translation: “Although we already suffered and were insultingly disgraced when visiting the city of Philippi” (See: [[rc://en/ta/man/translate/writing-background]])
1TH	2	2	fac4	figs-doublet	προπαθόντες καὶ ὑβρισθέντες	1		These two phrases mean basically the same thing. The repetition is used to emphasize that how badly the apostles suffered. If your language does not use repetition in this way, you could combine these phrases. Alternate translation: “despite the fact that we had earlier suffered being violently abused” or “since we already suffered being shamefully insulted”  (See: [[rc://en/ta/man/translate/figs-doublet]])<br>
1TH	2	2	lw7k	writing-background	ἐπαρρησιασάμεθα ἐν τῷ Θεῷ ἡμῶν, λαλῆσαι πρὸς ὑμᾶς τὸ εὐαγγέλιον τοῦ Θεοῦ ἐν πολλῷ ἀγῶνι	1		This is another background reference to the apostolic preaching during the persecution of the Thessalonian Church as recorded in Acts 17:1-10 (Also [1:6](../01/06.md)). Use the natural form in your language for expressing background information. Alternate translation: “God allowed us to courageously proclaim his good news to you at Thessalonica even while struggling intensely” (See: [[rc://en/ta/man/translate/writing-background]])
1TH	2	2	daei	figs-possession	τὸ εὐαγγέλιον τοῦ Θεοῦ	1		This possessive phrase **the gospel of God** expresses how **gospel** relates to **God**. It can refer to three main ideas: 1) possession. Alternate translation: “God’s gospel” 2) source. Alternate translation: “the gospel from God” 3) association. “the gospel about God” (See: [[rc://en/ta/man/translate/figs-possession]])
1TH	2	2	v4dg	figs-abstractnouns	ἐν πολλῷ ἀγῶνι	1	in much struggle	Here, **in much struggle** can also refer to a spiritual contest or game. If your language does not use an abstract noun for this idea, you could express the idea behind the abstract noun **in much struggle** in another way. Alternate translation: “although we struggled hard” or “despite how much we agonized” or “during the time we contested” (See: [[rc://en/ta/man/translate/figs-abstractnouns]])
1TH	2	3	hl9c	figs-litany	ἡ γὰρ παράκλησις ἡμῶν οὐκ ἐκ πλάνης, οὐδὲ ἐξ ἀκαθαρσίας, οὐδὲ ἐν δόλῳ	0		**For** is the beginning of a list of reasons describing why Paul, Silvanus, and Timothy had boldness to speak. This list of reasons also defends how their message was “the gospel of God” (See [2:2](../02/02.md)). (See: [[rc://en/ta/man/translate/figs-litany]])
1TH	2	3	xg1c	figs-abstractnouns	ἡ γὰρ παράκλησις ἡμῶν οὐκ ἐκ πλάνης, οὐδὲ ἐξ ἀκαθαρσίας, οὐδὲ ἐν δόλῳ	1		If your language does not use an abstract noun for this idea, you could express the idea behind these abstract nouns in another way. Alternate translation: “Certainly, when we appealed to you: we did not try to lead you astray, we did not speak impurely, we did not try to deceive you” (See: [[rc://en/ta/man/translate/figs-abstractnouns]])
1TH	2	3	jlly	figs-abstractnouns	 ἡ γὰρ παράκλησις ἡμῶν	1		The abstract noun **exhortation** can mean different things. Here, it is a synonym for “the gospel of God” (See [2:2](../02/02.md)). If your language does not use an abstract noun for this idea, you could express the idea behind the abstract noun **exhortation** in another way. Alternate translation: “Because when we encouraged you that it” or “Certainly when we warned you that it” or “When we urged you that it” (See: [[rc://en/ta/man/translate/figs-abstractnouns]])
1TH	2	3	t7ty	figs-doublenegatives	οὐκ ἐκ πλάνης, οὐδὲ ἐξ ἀκαθαρσίας, οὐδὲ ἐν δόλῳ	1	was not from error, nor from impurity, nor in deceit	This list of double negative phrases highlights the sincere motive and true content of the **exhortation** Paul, Silvanus, and Timothy shared with the Thessalonian church. If these double negative phrases would be misunderstood in your language, you could translate them as a positive statement. Alternate translation: “was from honest, pure, sincere motives” or “was made properly, purely, and sincerely” (See:[[rc://en/ta/man/translate/figs-doublenegatives]])
1TH	2	4	is1a	grammar-connect-logic-contrast	ἀλλὰ καθὼς	1	we have been approved by God to be entrusted	Here, **but just as** is meant to contrast the negative items in [2:3](../02/03.md), and reinforce that Paul, Silvanus, and Timothy are authorized to preach the gospel. Use a natural way in your language for introducing a contrast. Alternate translation: “It is actually true that” (See: [[rc://en/ta/man/translate/grammar-connect-logic-contrast]])
1TH	2	4	lfv7	grammar-connect-logic-result	ἀλλὰ καθὼς δεδοκιμάσμεθα ὑπὸ τοῦ Θεοῦ, πιστευθῆναι τὸ εὐαγγέλιον	1		Here, **to be entrusted** expresses the result of **been examined**. If it would be more natural in your language, you could reverse the order of these phrases. Alternate translation: “Certainly, God trusts us to proclaim the gospel because he tested and approved us” (See: [[rc://en/ta/man/translate/grammar-connect-logic-result]])<br>
1TH	2	4	ue4y	figs-explicit	δεδοκιμάσμεθα ὑπὸ τοῦ Θεοῦ, πιστευθῆναι τὸ εὐαγγέλιον	1		The combination of these two verbs **examined** and **entrusted** are meant to emphasize how the apostles have trustworthy credentials to preach the gospel. If it would be helpful to your readers, you could say that explicitly. Alternate translation: “we have been proved to be genuine guardians of the gospel” or “we are marked with God’s seal of approval as faithful preachers of the gospel” (See: [[rc://en/ta/man/translate/figs-explicit]])
1TH	2	4	m8sq	grammar-connect-logic-result	οὕτως λαλοῦμεν	1		Here, **so we speak** expresses the result of **been examined**. The reason why the apostles have confidence and authority to proclaim the gospel is because God tested and approved them. There are two main ways you could translate **so**: 1) reason for speaking. Alternate translation: “this is why we keep talking about it” or “so, we keep speaking” 2) manner of speaking. Alternate translation: “so this is how we speak”  (See: [[rc://en/ta/man/translate/grammar-connect-logic-result]])
1TH	2	4	qqj2	figs-explicit	λαλοῦμεν	1	we speak	The implicit information in the phrase **we speak** is that it refers to the apostles’ preaching or teaching of the gospel (See [2:2](../020/02.md) for the same verb). If it would be helpful to your readers, you could say that explicitly. Alternate translation: “we apostles keep proclaiming” (See: [[rc://en/ta/man/translate/figs-explicit]])
1TH	2	4	b0yy	grammar-connect-logic-contrast	οὐχ ὡς ἀνθρώποις ἀρέσκοντες, ἀλλὰ Θεῷ	1		This contrast clause summarizes the list of double negatives in [2:3](../02/03.md), in order to express the apostles’ godly motives. Use a natural way in your language for introducing a contrast. Alternate translation: “not to flatter people, but please God” or “not hoping to satisfy people, but God” (See: [[rc://en/ta/man/translate/grammar-connect-logic-contrast]])
1TH	2	4	k1m9	figs-parallelism	ἀλλὰ Θεῷ, τῷ δοκιμάζοντι τὰς καρδίας ἡμῶν	1	the one who examines our hearts	Here, the writers of this letter use the same verb form to reinforce that they **have been examined by God**. Alternate translation: “Actually, we seek to do what is pleasing to God. He is the one who continually examines our affections” (See: [[rc://en/ta/man/translate/figs-parallelism]])<br>
1TH	2	4	bq9a	figs-metonymy	τὰς καρδίας ἡμῶν	1		The phrase **our hearts** is a metonym for the apostles’ motives, affections, or deepest thoughts. If this would be misunderstood in your language, you could use an equivalent expression or plain language. Alternate translation: “what motivates us” or “our affections” or “our deepest thoughts” (See: [[rc://en/ta/man/translate/figs-metonymy]])
1TH	2	4	ntpt	figs-metaphor	τῷ δοκιμάζοντι τὰς καρδίας ἡμῶν	1		Here, **the one who examines our hearts** is a metaphor that compares God’s examination of our motives, our affections, or deepest thoughts to that of a doctor performing heart surgery, or a smelter testing the purity of refined metal. If you have an equivalent metaphor from your culture, you could use it. Alternate translation: “the one who can determine what motivates us” or “the one who refines the quality of our motives” (See: [[rc://en/ta/man/translate/figs-metaphor]])<br>
1TH	2	5	xk2o	grammar-connect-words-phrases	οὔτε γάρ ποτε ἐν λόγῳ κολακίας ἐγενήθημεν	1		Here, the phrase **For we did not come at that time** signals that Paul, Silvanus, and Timothy are going to defend their apostolic authorization from God. This phrase is also meant emphasize their godly motives. Alternate translation: “Because previously when we came, it was not to flatter you” or “Certainly we never came in order to flatter you” (See: [[rc://en/ta/man/translate/grammar-connect-words-phrases]])<br><br>
1TH	2	5	u28j	figs-litany	οὔτε…ἐν λόγῳ κολακίας…οὔτε ἐν προφάσει πλεονεξίας	1		Here, Paul uses a series of negative examples in [2:5-6](../02/05/md) to describe behavior that is not fitting for Christ’s apostles. This repetitive style of speaking or writing is called a “litany.” You can use a form in your language to list things that someone should not do. (See: [[rc://en/ta/man/translate/figs-litany]])<br>
1TH	2	5	hqih		οὔτε γάρ ποτε ἐν λόγῳ κολακίας ἐγενήθημεν,	1		Paul places **just as you know** in a position that gives it special emphasis (See also [2:2](../02/02..md)). It is meant to reinforce the sincere words of the apostles, and to validate their gospel message by how they behaved amongst the Thessalonian Church (See [1:5](../01/05.md)). If it would be more natural in your language, you could reverse the order of these phrases. Alternate translation: “As you are well aware, we did not previously come to flatter” <br>
1TH	2	5	q2yh	figs-metaphor	ἐν προφάσει πλεονεξίας	1		Here, **pretext** figuratively expresses the idea of people with greedy motives by comparing them to people wearing a mask or disguise to cover up their evil intent. If the concept of a masking or disguising would not communicate a covering over true motives, you could you could use an equivalent metaphor from your culture. Alternate translation: “disguising greedy intent” or “trying to hide greed” (See: [[rc://en/ta/man/translate/figs-metaphor]])
1TH	2	5	qqia	figs-ellipsis	(Θεὸς μάρτυς)	1		In the phrase **God {is} witness**, Paul is leaving some the words that a sentence would need in many languages to be complete. If this would be misunderstood in your language, you could supply these words from the context. Alternate translation: “God is our witness!”(See: [[rc://en/ta/man/translate/figs-ellipsis]])
1TH	2	5	lfym	figs-metaphor	(Θεὸς μάρτυς)	1		Again, the apostles are appealing to God to validate their gospel message and personal motives. Here, they utilize an emphatic courtroom metaphor, **God {is} witness**, as if they are summoning God as a witness to testify on their behalf before a judge. If your readers would not understand what **God {is} witness** means in this context, you could use an equivalent metaphor from your culture. Alternate translation: “We swear to/by God!” (See: [[rc://en/ta/man/translate/figs-metaphor]])
1TH	2	6	j6c4	figs-synecdoche	οὔτε ζητοῦντες ἐξ ἀνθρώπων δόξαν, οὔτε ἀφ’ ὑμῶν, οὔτε ἀπ’ ἄλλων	1		Here, Paul refers figuratively to **men** to speak of any individual person.” He also refers to **from you or from others** as another way of saying “all people.” If this would be misunderstood in your language, you could use an equivalent expression from your culture or plain language. Alternate translation: “We were not looking for praise from any human being–not you or anyone else–” or “We were not hoping for any human honors” (See: [[rc://en/ta/man/translate/figs-synecdoche]])<br>
1TH	2	6	afcc	figs-abstractnouns	ἐξ ἀνθρώπων δόξαν	1		If your language does not use an abstract noun for this idea, you could express the idea behind the abstract noun **glory** in another way. Alternate translation: “for humans to honor us” or “to have people praise us” (See: [[rc://en/ta/man/translate/figs-abstractnouns]])
1TH	2	7	u7y2	figs-hypo	δυνάμενοι ἐν βάρει εἶναι, ὡς Χριστοῦ ἀπόστολοι	1		With the phrase **being able to be a burden**, Paul uses a hypothetical condition to draw attention to the divine authority of the **apostles of Christ**. Use the natural form in your language for expressing a hypothetical situation. It could indicate two main things: 1) authority. “As Christ’s apostles we have authority to require obedience” 2) rights. Alternate translation: “As Christ’s apostles, we could have burdened you by demanding financial support” 3) authority and rights. Alternate translation: “As Christ’s apostles, we have the power to demand support and submission” (See: [[rc://en/ta/man/translate/figs-hypo]])<br>
1TH	2	7	a75z	figs-hypo	δυνάμενοι ἐν βάρει εἶναι	1		Paul speaks figuratively of the apostles as if they were a heavy weight or pack. He means that if they wanted to, they could impose their apostolic authority in a way that could seem oppressive to the Thessalonian church. If your readers would not understand what **burden** means in this context, you could use an equivalent metaphor from your culture. Alternatively, you could express Paul’s meaning in a non-figurative way. Alternative translation, “Although we could impose our authority” (See: [[rc://en/ta/man/translate/figs-metaphor]])
1TH	2	7	bslq	grammar-connect-logic-contrast	ἀλλὰ	1		Here, what follows the word **but** is in contrast to the idea of **burden**. Use a natural way in your language for introducing a contrast. (See: [[rc://en/ta/man/translate/grammar-connect-logic-contrast]])
1TH	2	7	y3bi	figs-metaphor	ἐγενήθημεν νήπιοι ἐν μέσῳ ὑμῶν	1		**became little children in the midst of you** is a metaphor indicating how gently the apostles treated the Thessalonian Church. You could translate this with an active form, using a simile. Alternate translation: “we acted as mild infants when we visited you” (see UST) (See: [[rc://en/ta/man/translate/figs-metaphor]])
1TH	2	7	rglp	translate-textvariants	ἐγενήθημεν νήπιοι	1		Some ancient manuscripts read the word translated **little children** as “gentle ones” or “mild ones” or “soothing ones.” Alternate translation: “we were gentle” (See: [[rc://en/ta/man/translate/translate-textvariants]])
1TH	2	7	bnp2	figs-idiom	ἐν μέσῳ ὑμῶν	1		**in the midst of you** is a common biblical idiom that means “spending time” or “visiting”. Alternate translation: “while visiting you” or “while spending time with you” or “when we were with you” (See: [[rc://en/ta/man/translate/figs-idiom]])
1TH	2	7	ag1l	figs-simile	ὡς ἐὰν τροφὸς θάλπῃ τὰ ἑαυτῆς τέκνα	1	as if a mother might comfort her own children	Here, what is translated **as if a mother might comfort** literally means “like a nurse warms” or “like a nurturer nourishes.” In the same way a **mother** would gently **comfort** her **children**, so Paul, Silvanus, and Timothy gently and affectionately [2:8](../02/08.md) nurtured the Thessalonian Church. (See: [[rc://en/ta/man/translate/figs-simile]])
1TH	2	8	r8b4	figs-abstractnouns	οὕτως ὁμειρόμενοι ὑμῶν	1	Having affection for you in this manner	The abstract noun phrase **having affection** can also be translated in a verb form. Alternate translation: “Since we constantly long for you this way” or "Because we desire you so much” or “Since we yearn for you like this” (See: [[rc://en/ta/man/translate/figs-abstractnouns]])
1TH	2	8	q86v	figs-metaphor	εὐδοκοῦμεν μεταδοῦναι ὑμῖν, οὐ μόνον τὸ εὐαγγέλιον τοῦ Θεοῦ, ἀλλὰ καὶ τὰς ἑαυτῶν ψυχάς	1	we were pleased to impart to you not only the gospel of God but also our own souls	**our own souls** is used as a metaphor for the whole person or the life of the apostles. The apostles became so fond of the Thessalonians that they were even willing to **impart** or give up their own lives through persecution (See [2:2](../02/022.md)) and labors (See [2:9](../02/09.md)). Alternate translation: “we were happy to share with you both the gospel and our own lives” or “we thought it appropriate to give you the gospel, even if it meant giving up our very lives” (See: [[rc://en/ta/man/translate/figs-metaphor]])
1TH	2	8	p4e4	figs-activepassive	διότι ἀγαπητοὶ ἡμῖν ἐγενήθητε	1	you had become beloved to us	This passive phrase **Because you had become beloved to us** could be translated as an active verb form. Alternate translation: “This is because we began to love you so much” or "This is because we were so fond of you” or “Because we had so much affection for you” (See: [[rc://en/ta/man/translate/figs-activepassive]])
1TH	2	9	f4nk	figs-imperative	μνημονεύετε γάρ	1		Here, **remember** is translated as a statement, but could also be translated as a polite request or appeal. Alternate translation: “Please remember” or “Indeed, we urge you to recall” (See: [[rc://en/ta/man/translate/figs-imperative]])
1TH	2	9	v837	grammar-connect-words-phrases	γάρ	1		This connecting word **For** can also be translated to express emphasis. Alternate translation: “Certainly” or “Indeed” (See: [[rc://en/ta/man/translate/grammar-connect-words-phrases]])
1TH	2	9	j9lu	figs-idiom	ἀδελφοί	1	brothers	Throughout this letter, **brothers** is an idiom meaning “fellow Christians” or “fellow believers in Christ” [2:1](../02/01.md).(See: [[rc://en/ta/man/translate/figs-idiom]])
1TH	2	9	exw6	figs-gendernotations	ἀδελφοί	1		Here, the idiom **brothers** includes females. If your language does not have this idiom, you can use a gender inclusive term that refers to male and female. Alternate translation: “brothers and sisters” or “spiritual brothers and sisters” or “fellow believers in Christ” or “fellow believers in God” (See [[rc://en/ta/man/translate/figs-gendernotations]])
1TH	2	9	tc98	figs-doublet 	τὸν κόπον ἡμῶν καὶ τὸν μόχθον	1	our labor and toil	The use of these synonyms emphasizes how hard they worked. It could be translated as a doublet. Alternate translation: “our hard work and exertion” (See: [[rc://en/ta/man/translate/figs-doublet]]) 
1TH	2	9	xph1	figs-hendiadys	τὸν κόπον ἡμῶν καὶ τὸν μόχθον	1	our labor and toil	The use of these synonyms emphasizes how hard they worked. It could be translated as a hendiadys. Alternate translation: "our toilsome labor” or “our hard labor” or “how hard we worked” (See: [[rc://en/ta/man/translate/figs-hendiadys]])
1TH	2	9	ilj2	grammar-connect-time-simultaneous	νυκτὸς καὶ ἡμέρας ἐργαζόμενοι	1		The word translated **working** combined with **preached** indicates the idea of concession or simultaneous activity. Alternate translation: “Although working night and day” or "Despite the fact that we kept working night and day” (See: [[rc://en/ta/man/translate/grammar-connect-time-simultaneous]])
1TH	2	9	ylkl	figs-idiom 	νυκτὸς καὶ ἡμέρας	1		**night and day working** is an idiom. Alternate translation: “we stayed busy working” or “we continued to work during the day and night” or “we never stopped working” (See: [[rc://en/ta/man/translate/figs-idiom]]) 
1TH	2	9	geb7	grammar-connect-logic-goal	πρὸς τὸ μὴ ἐπιβαρῆσαί τινα ὑμῶν	1		This is a purpose clause expressing the purpose for why the apostles were **night and day working**. The word translated **burden** means “weigh down” or “press down on,” and is the emphatic form of the word previously used [2:7](../02/07.md) Alternate translation: “so that we would not be a burden on any of you” or "so that we would not impose on anyone” (See: [[rc://en/ta/man/translate/grammar-connect-logic-goal]])
1TH	2	9	ezqn	figs-possession	ἐκηρύξαμεν εἰς ὑμᾶς τὸ εὐαγγέλιον τοῦ Θεοῦ	1		This is the apostles’ true purpose for visiting the Thessalonian Church. Again, the phrase **the gospel of God** is used to indicate that the apostles’ message is of Divine origin [2:2](../020/02.md). Alternate translation: “we announced God’s gospel” or “we declared the good news from God” or “we preached the gospel message about God” (See: [[rc://en/ta/man/translate/figs-possession]])
1TH	2	10	re18	figs-metaphor	ὑμεῖς μάρτυρες καὶ ὁ Θεός	1		This phrase again uses the metaphor of summoning a witness in a legal courtroom. Here, in addition to God being called to testify about the godly behavior of the apostles [2:5](../02/05.md), the Thessalonian Church is called on as a witness. Alternate translation: “You are our witnesses, as well as God himself” or “As well as God, you have personally testified” (See: [[rc://en/ta/man/translate/figs-metaphor]])
1TH	2	10	pgom	figs-parallelism	ὑμεῖς μάρτυρες καὶ ὁ Θεός, ὡς ὁσίως, καὶ δικαίως, καὶ ἀμέμπτως, ὑμῖν τοῖς πιστεύουσιν ἐγενήθημεν	1		This verse parallels the concepts that express the apostles’ pure motives and behavior in [2:5-6](../02/05.md). (See: [[rc://en/ta/man/translate/figs-parallelism]])
1TH	2	10	h52a	figs-ellipsis	ὑμεῖς μάρτυρες καὶ ὁ Θεός	1		The phrase translated **You {are} witnesses, and {so is} God** is an example of absolute ellipsis, where the implied verbs need to be supplied. (See: [[rc://en/ta/man/translate/figs-ellipsis]])
1TH	2	10	il3e	figs-litany	ὡς ὁσίως, καὶ δικαίως, καὶ ἀμέμπτως, ὑμῖν τοῖς πιστεύουσιν ἐγενήθημεν	1	holy, and righteous, and blameless	This phrase gives a litany of metaphorical “legal evidence” for why the Thessalonian Church and God are evoked as witnesses. Alternate translation: “how holy, and righteously, and blamelessly we lived among those who trust in God” or “just how faithful, and just, and innocent we conducted ourselves toward you believers in God” or “how we acted reverently, and fairly, and blamelessly while visiting the faithful” or “how perfectly we modeled the Christian life when visiting your church” (See: [[rc://en/ta/man/translate/figs-litany]])
1TH	2	10	lx4m	figs-metonymy	ὑμῖν τοῖς πιστεύουσιν	1		The phrase translated **toward you who believe** literally means “to you who continue to trust” or “with you who remain faithful” or “among you faithful ones.” Here, it describes all the believers in God or Christ at Thessalonica with metonymy [1:7](../01/07.md). Alternate translation: “toward you who continue to trust in Christ” or “among you who remain faithful to God” (See: [[rc://en/ta/man/translate/figs-metonymy]])
