Book	Chapter	Verse	ID	SupportReference	OrigQuote	Occurrence	GLQuote	OccurrenceNote
1PE	front	intro	c1uv			0		# Introduction to 1 Peter<br><br>## Part 1: General Introduction<br><br>### Outline of 1 Peter<br><br>1. Introduction (1:1–2)<br><br>1. Peter reminds the believers of their identity in Christ (1:3–2:10)<br><br>    * Praise to God for saving the believers (1:3–12)<br>    * Command to be holy (1:13–21)<br>    * Command to love each other as a family (1:22–2:10)<br><br>1. Peter tells the believers how they should behave (2:11–4:11)<br><br>    * How believers should act toward other people (2:11–3:12)<br>    * How believers should endure suffering (3:13–4:6)<br>    * How believers should act because the end is near (4:7–11)<br><br>1. Peter encourages the believers to persevere when suffering (4:12–5:11)<br><br>    * How believers should respond to trials (4:12–19)<br>    * How believers should interact with one another (5:1–11)<br><br>1. Conclusion (5:12–14)<br><br>### Who wrote the book of 1 Peter?<br><br>The author identified himself as Peter, who was also called Simon Peter. He was an apostle, and he also wrote the book of 2 Peter. Peter probably wrote this letter in Rome. He wrote the letter to Gentile Christians scattered throughout Asia Minor. (See: [[rc://en/tw/dict/bible/names/peter]])<br><br>### What is the book of 1 Peter about?<br><br>Peter wrote this letter to encourage Gentile Christians who were being persecuted and to exhort them to stand firm in “the true grace of God” ([5:12](../05/12.md)). Peter told his readers how they should act in the midst of a society that hated them. He encouraged Christians to continue obeying God even when they were suffering. He told them to do this because Jesus would return soon. Peter also instructed Christians about submitting to people in authority over them.<br><br>### How should the title of this book be translated?<br><br>Translators may choose to call this book by its traditional title “1 Peter” or “First Peter, ” or they may choose a clearer title, such as “The First Letter from Peter” or “The First Letter Peter Wrote.” (See: [[rc://en/ta/man/translate/translate-names]])<br><br>## Part 2: Important Religious and Cultural Concepts<br><br>### How were Christians treated in Rome?<br><br>Peter was probably in Rome when he wrote this letter. In [5:13](../05/13.md) Peter referred to Rome symbolically as “Babylon.” It appears that when Peter wrote this letter, Romans were severely persecuting Christians.<br><br>## Part 3: Important Translation Issues<br><br>### Singular and plural “you”<br><br>In this book, the word “I” refers to Peter, except in two places: [1:16](../01/16.md) and [2:6](../02/06.md). The word “you” is always plural and refers to Peter’s audience. Sometimes it refers to a specific group of people within Peter’s audience, such as wives, husbands, church leaders, or other groups. These groups are indicated in the notes. (See: [[rc://en/ta/man/translate/figs-you]])<br><br>### What are the major issues in the text of the book of 1 Peter?<br><br>“Having purified your souls by obedience to the truth for sincere brotherly love, love one another earnestly from a pure heart” ([1:22](../01/22.md)). The ULT, UST, and most other modern versions read this way. Some older versions read, “Having purified your souls by obedience to the truth *through the Spirit* for sincere brotherly love, love one another earnestly from the heart.” Translators are advised to follow the modern reading.<br><br>(See: [[rc://en/ta/man/translate/translate-textvariants]])
1PE	1	intro	ql4i			0		# 1 Peter 1 General Notes<br><br>## Structure and Formatting<br><br>1. Introduction (1:1–2)<br>2. Praise to God for saving the believers (1:3–12)<br>3. Command to be holy (1:13–21)<br>4. Command to love each other as a family (1:22–2:10)<br><br>Peter begins this letter in [1:1–2](../01/01.md) by giving his name, identifying the people to whom he is writing, and offering a greeting. That was the way people typically began letters at that time.<br><br>Some translations set each line of poetry farther to the right than the rest of the text to make it easier to read. The ULT does this with the poetry that is quoted from the Old Testament in [1:24–25](../01/24.md).<br><br>## Special Concepts in this Chapter<br><br>### What God reveals<br><br>When Jesus comes again, everyone will see how good God’s people were because they had faith in Jesus. Then God’s people will see how gracious God has been to them, and all people will praise both God and his people.<br><br>### Holiness<br><br>God wants his people to be holy because God is holy ([1:15](../01/15.md)). (See: [[rc://en/tw/dict/bible/kt/holy]])<br><br>### Eternity<br><br>Peter tells Christians to live for things that will last forever and not to live for the things of this world, which will end. (See: [[rc://en/tw/dict/bible/kt/eternity]])<br><br>## Other Possible Translation Difficulties in this Chapter<br><br>### Paradox<br><br>A paradox is a true statement that appears to describe something impossible. Peter writes that his readers are glad and sad at the same time ([1:6](../01/06.md)). He can say this because they are sad because they are suffering, but they are also glad because they know that God will save them “in the last time” ([1:5](../01/05.md))
1PE	1	1	g6b4	figs-123person	Πέτρος	1		In this culture, letter writers would give their own names first, and they would refer to themselves in the third person. If that would be confusing in your language, you could use the first person. If your language has a particular way of introducing the author of a letter, you could also use that. Alternate translation: “I, Peter, am writing this letter” or “From Peter” (See: [[rc://en/ta/man/translate/figs-123person]])
1PE	1	1	p0pd	translate-names	Πέτρος	1		**Peter** is the name of a man, a disciple of Jesus. See the information about him in Part 1 of the Introduction to 1 Peter. (See: [[rc://en/ta/man/translate/translate-names]])
1PE	1	1	h6om	figs-distinguish	ἀπόστολος Ἰησοῦ Χριστοῦ	1		This phrase gives further information about Simon Peter. He describes himself as being someone given the position and authority of being Christ’s apostle. (See: [[rc://en/ta/man/translate/figs-distinguish]])
1PE	1	1	owrg	figs-123person	ἐκλεκτοῖς παρεπιδήμοις	1		In this culture, after giving their own names, letter writers would then state to whom they were writing, naming those people in the third person. If that would be confusing in your language, you could use the second person. Alternate translation: “to you elect exiles” (See: [[rc://en/ta/man/translate/figs-123person]])
1PE	1	1	g3n3	figs-abstractnouns	ἐκλεκτοῖς παρεπιδήμοις διασπορᾶς	1		If your language does not use abstract nouns for the ideas of **elect** and **dispersion**, you could express the same ideas in another way. Alternate translation: “to those whom God has elected and exiled among those whom God has dispersed” (See: [[rc://en/ta/man/translate/figs-abstractnouns]])
1PE	1	1	u3zc	figs-metaphor	ἐκλεκτοῖς παρεπιδήμοις διασπορᾶς	1	to the elect foreigners of the dispersion	When Peter calls his readers **exiles**, he could mean: (1) they are **exiles** because they are far away from their true home in heaven. Alternate translation: “to the elect exiles of the dispersion who are far from their home in heaven” (2) they are **exiles** because they were forced to leave their homes and go far away to Pontus, Galatia, Cappadocia, Asia, and Bithynia. Alternate translation: “to you elect exiles of the dispersion who are far away from your homes” (See: [[rc://en/ta/man/translate/figs-metaphor]])
1PE	1	1	bg47	figs-metaphor	διασπορᾶς	1		Here, **dispersion** could refer to: (1) groups of Gentile Christians who were spread throughout the world instead of in their true home in heaven. In this case, **dispersion** would have a similar meaning to **exiles** and would add emphasis. Alternate translation: “among those dispersed outside of their true home in heaven” (2) the groups of Jewish people who were spread across the Greek-speaking world that was outside of the land of Israel, which is the common technical meaning for this word. Alternate translation: “among the dispersed Jews” (See: [[rc://en/ta/man/translate/figs-metaphor]])
1PE	1	1	qkl8	translate-names	Πόντου, Γαλατίας, Καππαδοκίας, Ἀσίας, καὶ Βιθυνίας	1	Cappadocia … Bithynia	**Pontus, Galatia, Cappadocia, Asia, and Bithynia** are names of Roman provinces that were located in what is now the country of Turkey. (See: [[rc://en/ta/man/translate/translate-names]])
1PE	1	2	ba1h	figs-abstractnouns	πρόγνωσιν Θεοῦ Πατρός	1	the foreknowledge of God the Father	If your language does not use an abstract noun for the idea of **foreknowledge**, you could express the same idea with a verbal phrase. Alternate translation: “what God the Father foreknew” (See: [[rc://en/ta/man/translate/figs-abstractnouns]])
1PE	1	2	lcps	figs-explicit	πρόγνωσιν Θεοῦ Πατρός	1		This phrase could mean: (1) God had determined what would happen ahead of time. Alternate translation: “what God the Father planned previously” (2) God knew what would happen ahead of time. Alternate translation: “what God the Father knew beforehand” (See: [[rc://en/ta/man/translate/figs-explicit]])
1PE	1	2	z59t	guidelines-sonofgodprinciples	Πατρός	1		**Father** is an important title for God. (See: [[rc://en/ta/man/translate/guidelines-sonofgodprinciples]])
1PE	1	2	huw6	figs-abstractnouns	ἐν ἁγιασμῷ Πνεύματος	1		If your language does not use an abstract noun for the idea of **sanctification**, you could express the same idea with a verbal phrase. Alternate translation: “by the Spirit sanctifying you” (See: [[rc://en/ta/man/translate/figs-abstractnouns]])
1PE	1	2	sfrr	figs-possession	ἐν ἁγιασμῷ Πνεύματος	1		Peter is using the possessive form to describe **sanctification** that is produced by the Holy **Spirit**. If this is not clear in your language, you could express this explicitly. Alternate translation: “by the Spirit causing you to be sanctified” (See: [[rc://en/ta/man/translate/figs-possession]])
1PE	1	2	ukos	figs-explicit	εἰς ὑπακοὴν καὶ ῥαντισμὸν αἵματος Ἰησοῦ Χριστοῦ	1		Here, **obedience** could refer to: (1) obeying God. Alternate translation: “for obedience of God and the sprinkling of the blood of Jesus Christ” (2) obeying Jesus Christ. Alternate translation: “for obedience of Jesus Christ and the sprinkling of his blood” (See: [[rc://en/ta/man/translate/figs-explicit]])
1PE	1	2	oiuz	figs-abstractnouns	εἰς ὑπακοὴν	1		If your language does not use an abstract noun for the idea of **obedience**, you could express the same idea with a verbal phrase. Alternate translation: “for you to obey” (See: [[rc://en/ta/man/translate/figs-abstractnouns]])
1PE	1	2	j96u	grammar-connect-logic-goal	εἰς ὑπακοὴν	1		Here, **for** introduces a purpose clause. Peter is stating a purpose for which the Holy Spirit sanctifies believers. Use a natural way in your language for introducing a purpose clause. Alternate translation: “for the purpose of obedience” (See: [[rc://en/ta/man/translate/grammar-connect-logic-goal]])
1PE	1	2	rwkk	figs-metaphor	ῥαντισμὸν αἵματος Ἰησοῦ Χριστοῦ	1	the sprinkling of the blood of Jesus Christ	Peter uses **sprinkling** figuratively to refer to believers being in a covenant relationship with God. Just as Moses sprinkled blood on the people of Israel in [Exodus 24:1–11](../exo/24/01.md) to symbolize that they were joining in a covenant relationship with God, believers are joined in a covenant relationship with God by means of Jesus’ death. Moses also sprinkled blood on the priests to set them apart to serve God as priests ([Leviticus 8:30](../lev/08/30.md)). If your readers would not understand this, you could use a simile or state the meaning plainly. Alternate translation: “the covenant between believers and God established by the blood of Jesus Christ” (See: [[rc://en/ta/man/translate/figs-metaphor]])
1PE	1	2	i9kf	figs-metonymy	αἵματος Ἰησοῦ Χριστοῦ	1	of the blood of Jesus Christ	Here, **blood** refers figuratively to the death of Jesus. If your readers would not understand this, you could use an equivalent expression or plain language. Alternate translation: “of the blood, the symbol of the death of Jesus Christ” (See: [[rc://en/ta/man/translate/figs-metonymy]])
1PE	1	2	k547	translate-blessing	χάρις ὑμῖν καὶ εἰρήνη πληθυνθείη	1		In this culture, letter writers would offer a good wish for the recipient before introducing the main business of the letter. Use a form in your language that makes it clear that this is a greeting and blessing. Alternate translation: “May God increase his kind acts to you and make you more peaceful” (See: [[rc://en/ta/man/translate/translate-blessing]])
1PE	1	2	iam1	figs-abstractnouns	χάρις ὑμῖν καὶ εἰρήνη πληθυνθείη	1		If your readers would misunderstand the abstract nouns **grace** and **peace**, you could express the ideas behind them with equivalent expressions. Alternate translation: “May God multiply his kind acts to you and give you a more peaceful spirit” (See: [[rc://en/ta/man/translate/figs-abstractnouns]])
1PE	1	2	z7df	figs-metaphor	χάρις ὑμῖν καὶ εἰρήνη πληθυνθείη	1	May grace be to you, and may your peace increase	Peter speaks of **grace** and **peace** figuratively as if they were objects that could increase in size or number. If this is confusing in your language, you can use a different metaphor that means that these things will increase, or use plain language. Alternate translation: “May grace and peace increase in your lives” (See: [[rc://en/ta/man/translate/figs-metaphor]])
1PE	1	2	gj71	figs-activepassive	χάρις ὑμῖν καὶ εἰρήνη πληθυνθείη	1		If your language does not use the passive form in this way, you can state this in active form or in another way that is natural in your language. Alternate translation: “May God multiply grace and peace to you” (See: [[rc://en/ta/man/translate/figs-activepassive]])
1PE	1	3	y6aq			0	General Information:	Peter begins to talk about the believers’ salvation and faith. [Verses 3–5](../01/03.md) are one sentence, but you may need to divide them into shorter sentences in your language.
1PE	1	3	l4vi	figs-declarative	εὐλογητὸς	1		Peter is using a statement to give an exhortation. If this is confusing in your language, you can use a more natural form for exhortation. Alternate translation: “Let us bless” or “Let us praise” (See: [[rc://en/ta/man/translate/figs-declarative]])
1PE	1	3	z6wk	guidelines-sonofgodprinciples	Πατὴρ	1		**Father** is an important title for God. (See: [[rc://en/ta/man/translate/guidelines-sonofgodprinciples]])
1PE	1	3	cyf6	figs-exclusive	ἡμῶν…ἡμᾶς	1	our … us	The words **our** and **us** are inclusive. They refer to Peter and those believers to whom he is writing. Your language may require you to mark these forms. (See: [[rc://en/ta/man/translate/figs-exclusive]])
1PE	1	3	ib1x	figs-possession	τοῦ Κυρίου ἡμῶν	1		Peter is using the possessive form to describe Jesus as the **Lord** who rules over those who believe in him. If this is not clear in your language, you could express the meaning explicitly. Alternate translation: “of the person who is lord over us,” or “of the person who rules over us,” (See: [[rc://en/ta/man/translate/figs-possession]])
1PE	1	3	mdvi	figs-abstractnouns	κατὰ τὸ πολὺ αὐτοῦ ἔλεος	1		If your language does not use an abstract noun for the idea of **mercy**, you could express the same idea in another way. Alternate translation: “according to his great merciful character” (See: [[rc://en/ta/man/translate/figs-abstractnouns]])
1PE	1	3	c92y	figs-metaphor	ἀναγεννήσας ἡμᾶς	1	he has given us new birth	The phrase **born again** is a metaphor that refers to spiritual rebirth. Since this is an important metaphor in the Bible, you should keep it in your translation and include an explanation if necessary. Alternate translation: “has caused us to be spiritually reborn” (See: [[rc://en/ta/man/translate/figs-metaphor]])
1PE	1	3	cbxb	figs-infostructure	ἀναγεννήσας ἡμᾶς εἰς ἐλπίδα ζῶσαν, δι’ ἀναστάσεως Ἰησοῦ Χριστοῦ ἐκ νεκρῶν	1		The clause **into a living hope** is parallel to “into an imperishable and undefiled and unfading inheritance” in the next verse. If it would be more natural in your language, you could change the order of the phrases in this verse in order to show that parallel structure. Alternate translation: “who has caused us to be born again through the resurrection of Jesus Christ from dead ones into a living hope” (See: [[rc://en/ta/man/translate/figs-infostructure]])
1PE	1	3	qe1c	grammar-connect-logic-goal	εἰς ἐλπίδα ζῶσαν	1		Here, **into** introduces a purpose clause. Peter is stating a purpose for which God causes believers to be born again. Use a natural way in your language for introducing a purpose clause. Alternate translation: “for the purpose of giving us a living hope” (See: [[rc://en/ta/man/translate/grammar-connect-logic-goal]])
1PE	1	3	kngt	figs-metaphor	εἰς ἐλπίδα ζῶσαν	1		Peter uses **living** figuratively to describe **hope** that is certain and will not lead to disappointment. If this might confuse your readers, you could express the meaning plainly. Alternate translation: “into a hope that will not disappoint you” (See: [[rc://en/ta/man/translate/figs-metaphor]])
1PE	1	3	lh0r	figs-abstractnouns	δι’ ἀναστάσεως Ἰησοῦ Χριστοῦ ἐκ νεκρῶν	1		If your language does not use an abstract noun for the idea of **resurrection**, you could express the same idea in another way. Alternate translation: “through Jesus Christ being resurrected from among dead ones” (See: [[rc://en/ta/man/translate/figs-abstractnouns]])
1PE	1	4	v9jq	grammar-connect-logic-goal	εἰς κληρονομίαν ἄφθαρτον, καὶ ἀμίαντον, καὶ ἀμάραντον	1		Here, **into** introduces a purpose clause. Peter is stating a second purpose for which God causes believers to be born again. This clause states what the “living hope” in the previous verse is. Use a natural way in your language for introducing a purpose clause. Alternate translation: “for the purpose of giving us an imperishable and undefiled and unfading inheritance” (See: [[rc://en/ta/man/translate/grammar-connect-logic-goal]])
1PE	1	4	b2zy	figs-abstractnouns	εἰς κληρονομίαν ἄφθαρτον, καὶ ἀμίαντον, καὶ ἀμάραντον	1	for an imperishable and undefiled and unfading inheritance	If your language does not use an abstract noun for the idea behind the word **inheritance**, you could express the same idea with a verb. Alternate translation: “into what we will inherit that is imperishable and undefiled and unfading” (See: [[rc://en/ta/man/translate/figs-abstractnouns]])
1PE	1	4	cy1g	figs-metaphor	κληρονομίαν ἄφθαρτον, καὶ ἀμίαντον, καὶ ἀμάραντον	1	an … inheritance	Peter uses **inheritance** figuratively to refer to what we will receive in heaven. This could refer to: (1) The promise of God that we will live forever with him. Alternate translation: “a sure and unfailing promise the we will live forever with God” (2) future blessings in heaven after this life. Alternate translation: “imperishable and undefiled and unfading blessings” (See: [[rc://en/ta/man/translate/figs-metaphor]])
1PE	1	4	z6w4	figs-activepassive	τετηρημένην ἐν οὐρανοῖς εἰς ὑμᾶς	1	reserved in heaven for you	If your language does not use the passive form in this way, you can state this in active form or in another way that is natural in your language. Alternate translation: “which God has kept in heaven for you” (See: [[rc://en/ta/man/translate/figs-activepassive]])
1PE	1	5	r4es	figs-activepassive	τοὺς ἐν δυνάμει Θεοῦ φρουρουμένους	1	who are protected by the power of God	If your language does not use the passive form in this way, you can state this in active form or in another way that is natural in your language. Alternate translation: “the ones whom God is protecting with his power” (See: [[rc://en/ta/man/translate/figs-activepassive]])
1PE	1	5	a4ab	figs-abstractnouns	διὰ πίστεως	1	through faith	If your language does not use an abstract noun for the idea of **faith**, you could express the same idea in another way. Alternate translation: “by believing in Jesus” (See: [[rc://en/ta/man/translate/figs-abstractnouns]])
1PE	1	5	ymh2	grammar-connect-logic-goal	εἰς σωτηρίαν	1		Here, **for** introduces a purpose clause. Peter is stating a purpose for which God is protecting believers. Use a natural way in your language for introducing a purpose clause. Alternate translation: “for the purpose of giving us a salvation” (See: [[rc://en/ta/man/translate/grammar-connect-logic-goal]])
1PE	1	5	gj5s	figs-abstractnouns	εἰς σωτηρίαν ἑτοίμην ἀποκαλυφθῆναι	1		If your language does not use an abstract noun for the idea of **salvation**, you could express the same idea in another way. Alternate translation: “for the time when God saves you, which is ready to be revealed” (See: [[rc://en/ta/man/translate/figs-abstractnouns]])
1PE	1	5	g4rb	figs-activepassive	ἑτοίμην ἀποκαλυφθῆναι	1	that is ready to be revealed	If your language does not use the passive form in this way, you can state this in active form or in another way that is natural in your language. Alternate translation: “that God is ready to reveal” (See: [[rc://en/ta/man/translate/figs-activepassive]])
1PE	1	5	xsp2	figs-explicit	ἐν καιρῷ ἐσχάτῳ	1		Here, **the last time** refers to “the day of the Lord,” which is the time when Jesus returns to the world to judge everyone and vindicate those who believe in him. (See: [[rc://en/tw/dict/bible/kt/dayofthelord]]) If it would be helpful to your readers, you could express this explicitly. Alternate translation: “in the last time, when Jesus returns and judges everyone” (See: [[rc://en/ta/man/translate/figs-explicit]])
1PE	1	6	p1ta	writing-pronouns	ἐν ᾧ	1		Here, **this** could refer to: (1) the “last time” referred to at the end of the previous verse. Alternate translation: “About this last time” (2) everything described in [verses 3–5](../01/03.md). Alternate translation: “In all of this that I have said” (See: [[rc://en/ta/man/translate/writing-pronouns]])
1PE	1	6	hy8d	grammar-connect-logic-result	ἐν ᾧ ἀγαλλιᾶσθε	1	In this you greatly rejoice	**In** here introduces the reason why Peter’s readers rejoice. If your readers would misunderstand this, you could express the meaning explicitly. Alternate translation: “On account of this you greatly rejoice” or “Because of this you greatly rejoice” (See: [[rc://en/ta/man/translate/grammar-connect-logic-result]])
1PE	1	6	dtvb	grammar-connect-condition-fact	ἄρτι, εἰ δέον λυπηθέντες	1		Peter is speaking as if this were a hypothetical possibility, but he means that it is actually true. If your language does not state something as a condition if it is certain or true, and if your readers might misunderstand and think that what Peter is saying is not certain, then you can translate his words as an affirmative statement. Alternate translation: “if now it is necessary, and it is, to have been distressed” (See: [[rc://en/ta/man/translate/grammar-connect-condition-fact]])
1PE	1	6	a2bq	figs-activepassive	ὀλίγον ἄρτι, εἰ δέον λυπηθέντες ἐν ποικίλοις πειρασμοῖς	1		If your language does not use the passive form in this way, you can state this in active form or in another way that is natural in your language. Alternate translation: “if now it is necessary for various trials to distress you a little while” (See: [[rc://en/ta/man/translate/figs-activepassive]])
1PE	1	7	vvp1	figs-metaphor	τὸ δοκίμιον ὑμῶν τῆς πίστεως…διὰ πυρὸς δὲ δοκιμαζομένου	1	so that the proof of your faith	Here Peter speaks of **faith** figuratively, as if it were gold that is refined by passing it through **fire**. He also uses **fire** figuratively to refer to the hardships that test how well believers trust in Christ. If this might confuse your readers, you could express the meaning plainly or use a simile. Alternate translation: “the genuineness of your faith … but being tested by hardships the way fire tests gold” (See: [[rc://en/ta/man/translate/figs-metaphor]])
1PE	1	7	ct3n	figs-abstractnouns	τὸ δοκίμιον ὑμῶν τῆς πίστεως	1	the proof of your faith	If your language does not use abstract nouns for the ideas of **genuineness** and **faith**, you could express the same ideas in another way. Alternate translation: “the fact that you genuinely believe” (See: [[rc://en/ta/man/translate/figs-abstractnouns]])
