Book	Chapter	Verse	ID	SupportReference	OrigQuote	Occurrence	GLQuote	OccurrenceNote
1TH	4	14	tjqj	figs-rpronouns	αὐτῷ	1	rose again	This is a reflexive pronoun that refers to Jesus. If it would be clearer in your language, you could make this explicit. Alternate translation: “Jesus” (See: [[rc://en/ta/man/translate/figs-rpronouns]])
1TH	4	15	vvda	grammar-connect-words-phrases	τοῦτο γὰρ ὑμῖν λέγομεν ἐν λόγῳ Κυρίου	1	by the word of the Lord	This clause indicates a strong emphasis in form and content (See [1:8](../01/08.md) for **the word of the Lord**). Alternate translation: “Certainly, what we now say to you is the Lord's message” or “In fact, what we are saying is from the Lord himself” (See: [[rc://en/ta/man/translate/grammar-connect-words-phrases]])
1TH	4	15	ni3m	figs-metonymy	ἐν λόγῳ Κυρίου	1	by the word of the Lord	Here, **word** is a metonym for “message.” It could refer to: 1) Means of the message. Alternate translation: “with the Lord's message” 2) Authority of the message. “with the authorization of the Lord” or “is the Lord's message” (See: [[rc://en/ta/man/translate/figs-metonymy]])
1TH	4	15	gbe1	grammar-connect-words-phrases	ὅτι	1	by the word of the Lord	This connecting word indicates that what follows is the content of **the word of the Lord**. (See: [[rc://en/ta/man/translate/grammar-connect-words-phrases]])
1TH	4	15	fdwk	figs-exclusive	ἡμεῖς οἱ ζῶντες	1	by the word of the Lord	Though, **we who are alive** could be exclusive of the apostles (See note at [4:14](../04/14.md)), the universal content of the following section, implies that this is inclusive of all Christians. (See [[rc://en/ta/man/translate/figs-exclusive]])
1TH	4	15	hdlr	figs-distinguish	οἱ περιλειπόμενοι	1	by the word of the Lord	The relative clause **who are left behind** refers to **we who are alive**. Alternate translation: “who survive” or “who are remain around” (See: [[rc://en/ta/man/translate/figs-distinguish]])
1TH	4	15	b786	figs-idiom	εἰς τὴν παρουσίαν τοῦ Κυρίου	1	at the coming of the Lord	Here, the word translated **coming** is a well-known idiom in 1-2 Thessalonians for the Second Coming of Christ [3:13](../03/13.md) or the “Day of the Lord” [5:2](../05/02.md). It literally means, “presence” or “being with or near.” Here, **coming** expresses “presence,” so the emphasis is on the lasting presence of the Lord Jesus (see also Matthew 24). The definite article **the** indicates either the one and only Coming of the Lord, or the well-known Coming of the Lord. The word translated **until** could indicate: 1) Duration. Alternate translation: “until the Lord returns” or “until the second coming of the Lord” 2) Event. Alternate translation: “at the coming of our Lord Jesus” or “at the arrival of the Lord Jesus” (See: [[rc://en/ta/man/translate/figs-idiom]])
1TH	4	15	byit	figs-explicit	τοῦ Κυρίου	1	at the coming of the Lord	It is assumed that the **Lord** refers to Jesus (See [4:1](../04/01.md)). If it is clearer in your language, you could make this explicit. Alternate translation: “the Lord Jesus” or “our Lord Jesus” (See: [[rc://en/ta/man/translate/figs-explicit]])
1TH	4	15	k9n9	translate-textvariants	 τοῦ Κυρίου	1	at the coming of the Lord	One important ancient manuscript reads “of Jesus” (See: [[rc://en/ta/man/translate/translate-textvariants]])
1TH	4	15	xd2y	figs-doublenegatives	οὐ μὴ φθάσωμεν τοὺς κοιμηθέντας	1	by the word of the Lord	This double negative **certainly not** is an idiom for “never.” Alternate translation: “will never precede those who are dead” or “can never overtake those already dead” or “are not permitted to come before those asleep in the Lord”. (See: [[rc://en/ta/man/translate/figs-doublenegatives]])
1TH	4	16	ah7p	grammar-connect-words-phrases	ὅτι 	1	the Lord himself … will descend	**For** marks the beginning of the sequence of events related to the Second Coming. The word then indicates that the events the story will now relate came after the event it has just described. Alternately translation: “Certainly” or “Because” (See: [[rc://en/ta/man/translate/grammar-connect-words-phrases]])<br>
1TH	4	16	yk2q	figs-litany	ὅτι αὐτὸς ὁ Κύριος ἐν κελεύσματι, ἐν φωνῇ ἀρχαγγέλου, καὶ ἐν σάλπιγγι Θεοῦ, καταβήσεται ἀπ’ οὐρανοῦ; καὶ οἱ νεκροὶ ἐν Χριστῷ ἀναστήσονται πρῶτον,	1	the Lord himself … will descend	The list of the events of the Second Coming continues through verse 17. (See: [[rc://en/ta/man/translate/figs-litany]])
1TH	4	16	c26b	grammar-connect-time-simultaneous	ὅτι αὐτὸς ὁ Κύριος ἐν κελεύσματι, ἐν φωνῇ ἀρχαγγέλου, καὶ ἐν σάλπιγγι Θεοῦ, καταβήσεται ἀπ’ οὐρανοῦ	1	the Lord himself … will descend	These things happen at the same time **the Lord** descends. The text emphasizes the order of events by listing them prior to the main verb. If it is clearer in your language, you could place the main verb before the accompanying actions. Alternate translation: “Certainly, the Lord Jesus himself will come down from heaven: with a commanding shout, with the archangel's voice, and with God's trumpet” (See: [[rc://en/ta/man/translate/grammar-connect-time-simultaneous]])
1TH	4	16	ygfp	figs-rpronouns	αὐτὸς ὁ Κύριος	1	the Lord himself … will descend	This reflexive noun **himself** emphasizes that “with him” in [4:14](../04/14.md) refers to **the Lord** Jesus. Alternate translation: “the Lord Jesus himself” or “it is the Lord Jesus who” (See: [[rc://en/ta/man/translate/figs-rpronouns]])
1TH	4	16	z9ka		ἀρχαγγέλου	1	of the archangel	See Jude 9.
1TH	4	16	pjrh	figs-parallelism	καταβήσεται ἀπ’ οὐρανοῦ; καὶ οἱ νεκροὶ ἐν Χριστῷ ἀναστήσονται πρῶτον	1	the Lord himself … will descend	The first main verb **descend** is listed after the events that describe it. This is to show a contrasting parallelism with the second verb **rise**. After the Lord Jesus comes down form heaven, the dead Christians will resurrect from the earth. (See: [[rc://en/ta/man/translate/figs-parallelism]])
1TH	4	16	k7sg	grammar-connect-time-sequential	καὶ	2	the Lord himself … will descend	Here, the word translated **and** indicates sequence. If it is clearer in your language, you could make this explicit. Alternate translation: “then next” (See: [[rc://en/ta/man/translate/grammar-connect-time-sequential]])
1TH	4	16	ni7n	figs-parallelism	οἱ νεκροὶ ἐν Χριστῷ	1	the dead in Christ will rise first	This is a parallel phrase to “those who are asleep through Jesus” in [4:14](../04/14.md). Alternate translation: “those who died in union with Christ” (See: [[rc://en/ta/man/translate/figs-parallelism]])
1TH	4	16	dr89	figs-explicit	οἱ νεκροὶ ἐν Χριστῷ ἀναστήσονται πρῶτον	1	the dead in Christ will rise first	**the dead in Christ** are the same as “the sleepers” in [4:13–15](../04/13.md). The verb translated “rise” refers to this section's main theme of resurrection. Alternate translation: “Christians who have already died will be the first to resurrect” or “those who died united with Christ will resurrect first” (See: [[rc://en/ta/man/translate/figs-explicit]])<br>
1TH	4	16	gnp0	figs-parallelism	οἱ νεκροὶ ἐν Χριστῷ ἀναστήσονται πρῶτον	1	the dead in Christ will rise first	This clause parallels and explains, “may not certainly go before those who have fallen asleep” [4:15](../04/15/md). (See: [[rc://en/ta/man/translate/figs-parallelism]])
1TH	4	16	wboi	figs-parallelism	ἐν Χριστῷ	1	the dead in Christ will rise first	**in Christ** is another reference to the important concept of union with Christ or God (See [2:14](../02/14.md)). This is also a parallel phrase to “those who are asleep through Jesus” in [4:14](../04/14.md). Alternate translation: “united to Christ” or “in union with Christ” (See: [[rc://en/ta/man/translate/figs-parallelism]])
1TH	4	16	offz	translate-textvariants	πρῶτον	1	the dead in Christ will rise first	Some ancient manuscripts read “**the first** ones” referring to **the dead**, not the timing of resurrection. (See: [[rc://en/ta/man/translate/translate-textvariants]])<br>
1TH	4	17	ay13	figs-parallelism	ἡμεῖς οἱ ζῶντες, οἱ περιλειπόμενοι	1	we who are alive	**who are alive, who are left behind** is a parallel reference to [4:15](../04/15.md). (See: [[rc://en/ta/man/translate/figs-parallelism]])
1TH	4	17	l5l1	figs-exclusive	ἡμεῖς οἱ ζῶντες	1	we who are alive	Though, **we who are alive** could be exclusive of the apostles (See note for the same phrase at [4:15](../04/15.md)), the universal content of this section, implies that all Christians are in view. It also implies that the apostles assumed Second Coming would happen in their lifetime. (See [[rc://en/ta/man/translate/figs-exclusive]])<br>
1TH	4	17	otiq	grammar-connect-time-simultaneous	ἅμα σὺν αὐτοῖς	1	we who are alive	**together with them** could indicate three things: 1) Simultaneous event. Alternate translation: “with them at the same time” 2) Association. Alternate translation: “along with them” 3) Both event and association. Alternate translation: “at the same time together with them” (See: [[rc://en/ta/man/translate/grammar-connect-time-simultaneous]])
1TH	4	17	wvi8	writing-pronouns	αὐτοῖς	1	with them	The word **them** refers to the resurrected dead who are united to Christ. Alternate translation: “the resurrected dead who are united to Christ” (See: [[rc://en/ta/man/translate/writing-pronouns]])
1TH	4	17	m3gb	writing-background	ἁρπαγησόμεθα ἐν νεφέλαις εἰς ἀπάντησιν τοῦ Κυρίου εἰς ἀέρα	1	with them	This phrase indicates a reference to the words of the angels at Jesus’ Ascension in Acts 1:9-11, as a fulfillment of the prophecy of Daniel 7:13-14. Alternate translation: “we will be snatched up on clouds to encounter the Lord Jesus in the air” (See: [[rc://en/ta/man/translate/writing-background]])
1TH	4	17	o7lj	grammar-connect-logic-goal	εἰς ἀπάντησιν	1	with them	Here, the word translated **to meet** indicates purpose, and a positive encounter and/or royal escort. Alternate translation: “as a royal escort of” or “for a meeting with” or “to encounter” (See Exodus 19:17 where this same root word is used when God's people encounter God, and Matthew 25:6 where this word is used in the same context of the Second Coming with bridal escorts). (See: [[rc://en/ta/man/translate/grammar-connect-logic-goal]])
1TH	4	17	ukh1	writing-symlanguage	ἐν νεφέλαις…εἰς ἀέρα	1	with them	Here, **clouds … air** could be considered symbolic language representing God’s presence and the spiritual realm. (See Exodus 19; Daniel 7:13-14; Matthew 24; Mark 13; Luke 17; 21; Ephesians 2:2). Alternate translation: “ (See: [[rc://en/ta/man/translate/writing-symlanguage]])
1TH	4	17	ti69	writing-endofstory	καὶ οὕτως πάντοτε σὺν Κυρίῳ ἐσόμεθα	1	will be caught up … in the clouds to meet the Lord in the air	This clause is meant to signal the end of the events related to the Second Coming. You can use the natural form in your language for expressing the conclusion of a story. (See: [[rc://en/ta/man/translate/writing-endofstory]])
1TH	4	17	ouvu	grammar-connect-logic-result	καὶ οὕτως πάντοτε σὺν Κυρίῳ ἐσόμεθα	1	will be caught up … in the clouds to meet the Lord in the air	This clause also indicates the result of the meeting with **the Lord**. Alternate translation: “and then we will always be together with the Lord Jesus” or “this is the how we will be with the Lord Jesus forever” or “as a result, we will always be together with the Lord” (See: [[rc://en/ta/man/translate/grammar-connect-logic-result]])
1TH	4	17	k6qc	figs-parallelism	σὺν Κυρίῳ	1	will be caught up … in the clouds to meet the Lord in the air	Here, **with the Lord** parallels **together with them** to express union with Christ as communion with his people. (See: [[rc://en/ta/man/translate/figs-parallelism]])
1TH	4	17	pdqi	translate-textvariants	σὺν	2	will be caught up … in the clouds to meet the Lord in the air	One important ancient manuscript reads “united to” (See: [[rc://en/ta/man/translate/translate-textvariants]])
1TH	4	18	gt91	grammar-connect-logic-result	ὥστε παρακαλεῖτε	1	will be caught up … in the clouds to meet the Lord in the air	This is a result clause. Alternate translation: “because of this, you should comfort" or “as a result, you can bring comfort to” or “so then, you ought to encourage” (See: [[rc://en/ta/man/translate/grammar-connect-logic-result]]
1TH	4	18	y7zi	figs-imperative	παρακαλεῖτε	1	will be caught up … in the clouds to meet the Lord in the air	This clause also could express an appeal or polite command. Alternate translation: “you should encourage” or “you must encourage” or “keep comforting” (See: [[rc://en/ta/man/translate/figs-imperative]])
1TH	4	18	aya5	writing-pronouns	ἀλλήλους	1	will be caught up … in the clouds to meet the Lord in the air	This pronoun indicates association among the Thessalonian Church. If your readers would misunderstand this, you could make it explicit. Alternate translation: “the fellow member of your church” or “your fellow Thessalonian Christian” (See: [[rc://en/ta/man/translate/writing-pronouns]])
1TH	4	18	xsus	figs-metonymy	ἐν τοῖς λόγοις τούτοις	1	will be caught up … in the clouds to meet the Lord in the air	**with these words** is a reference to “and in this way we will always be with the Lord” in [4:17](../04/17.md) or a metonymy for all that has been said in [4:13-17](../04/17.md). Alternate translation: (See UST) (See: [[rc://en/ta/man/translate/figs-metonymy]])
1TH	5	intro	ay3d			0		# 1 Thessalonians 5 General Notes<br><br>## Outline of 1 Thessalonians 5<br><br>1. Apostolic Teachings on the Second Coming of Christ (5:1-10)<br>* Timing (5:1-3)<br>* Preparation (5:4-8)<br>* God’s plan (5:9-10)<br>2. Final Instructions (5:11-28)<br>* Final Commands (5:11-22)<br>* Final Prayer (5:23-24)<br>* Final Appeals (5:25-27)<br>* Final blessing (5:25-27)<br><br>## Structure and formatting<br><br>Paul concludes his letter in a way that was typical of letters in the ancient Near East.<br><br>## Special concepts in this chapter<br><br>### Idiom<br><br>#### Day of the Lord<br><br>The “day of the Lord” is an idiom for the time of final salvation for God’s people final judgment for God’s enemies. “Day” is metaphorical for a time period. Thus, the exact time of the coming “day of the Lord” will be a surprise to the world. The simile “like a thief in the night” refers this surprise timing. Because of this, Christians must prepare for the coming of the Lord by living with faith, hope and love [5:8](../05/08.md) toward God and others. (See: [[rc://en/tw/dict/bible/kt/dayofthelord]]<br><br>### Simile<br><br>#### Like a Thief<br><br>The simile “like a thief in the night” refers this surprise timing. Because of this, Christians must prepare for the coming of the Lord by living with faith, hope and love [5:8](../05/08.md) toward God and others. (See: [[rc://en/ta/man/translate/figs-simile]])<br><br>### Metaphor<br><br>#### Day and Night, Light and Darkness<br><br>The apostles use many metaphors throughout [5:1-11](../05/1.md). “Night,” “darkness,” “drunk,” “sleep” are all metaphors about spiritual ignorance or lack of readiness. “Day,” “light,” “sober,” “watch” are all metaphors  about spiritual awareness and readiness. <br><br><br>#### Armor<br><br>Here, the apostles use a military metaphor to urge the Thessalonian Church to be ready for Christ's Second Coming at “the day of the Lord.” Just as soldiers must always be armed and ready to fight, so the Christian must live prepared for Christ's return. Faithfulness and love are compared to a breastplate, and the hope of salvation is likened to a helmet [5:8](../05/08.md).<br><br>#### Prophecy<br><br>Those who “despise prophecies” in [5:20](../05/20.md) are said to “quench the Spirit.” This is a metaphor for trying to hinder the Holy Spirit’s guidance in the Church. All prophecies are to be examined and tested to determine if they adhere to apostolic teaching [5:21](../05/21.md). All prophecies that are proven to agree with apostolic teaching, are to be retained as good [5:21-22](..05/21/.md).<br><br>### Submission to Christian Leadership<br><br><br>The apostles link the well-being and spiritual safety of the Thessalonian Church to obedience to their leaders. Christian leaders are to be given recognition and loving respect by the church [5:12-13](../05/13.md).<br><br>### Holy Kiss<br><br>This refers to the ancient practice of exchanging a kiss of peace on the cheek during the liturgy. Different cultures have different standards of appropriate physical contact. These different cultural standards may make translating this passage difficult. Translators will have to consider the most appropriate way to communicate this sensitive issue [5:26](../05/26.md).
1TH	5	1	i2vm	figs-explicit	περὶ δὲ	1	General Information:	**Now concerning** signals a change in subject (See [4:9](../04/09.md)). Here, the timing of and preparation for the Second Coming is in view. This phrase implies that the apostles are answering another specific question previously asked by the Thessalonian Church. If it could be misunderstood in your language, you could make this explicit. Alternate translation: “Now as it relates to your question about” or “Now, about your question referring to” or “Now, about your question relating to” (See: [[rc://en/ta/man/translate/figs-explicit]])
1TH	5	1	a8f3	figs-idiom	τῶν χρόνων καὶ τῶν καιρῶν	1	General Information:	Here, **the times and the seasons** is an idiom referring to: 1) a specific period in time. Alternate translation: “the appointed time of Jesus’ return” or “the fixed time when Jesus returns” (See Acts 1:7 for this exact phrase referring to the same thing). 2) a specific amount of time. Alternate translation: “how long it will take for the Lord Jesus to return” or “when the Lord Jesus will return” (See: [[rc://en/ta/man/translate/figs-idiom]])
1TH	5	1	z1s6	figs-idiom	ἀδελφοί	1	Connecting Statement:	Throughout this letter, **brothers** is an idiom meaning “fellow Christians” or “fellow believers in Christ” [4:13](../04/13.md). (See: [[rc://en/ta/man/translate/figs-idiom]])
1TH	5	1	pjf6	figs-gendernotations	ἀδελφοί	1	Connecting Statement:	Here, the idiom **brothers** includes females. If your language does not have this idiom, you can use a gender inclusive term that refers to male and female. Alternate translation: “brothers and sisters” or “spiritual brothers and sisters” or “fellow believers in Christ” or “fellow believers in God” (See [[rc://en/ta/man/translate/figs-gendernotations]])
1TH	5	1	bcsa	figs-activepassive	οὐ χρείαν ἔχετε ὑμῖν γράφεσθαι	1	General Information:	If you have no passive form in your language, you could make it active (See this same phrase in [4:9](../04/09.md)). Alternate translation: “we do not need to write to you” or “you have no need for us to write it for you” (See: [[rc://en/ta/man/translate/figs-activepassive]])
1TH	5	1	caue	figs-you	ἔχετε	1	General Information:	The word **you** is plural and refers to the believers in the Thessalonian Church. (See: [[rc://en/ta/man/translate/figs-you]])
1TH	5	2	dqgk	figs-rpronouns	αὐτοὶ γὰρ ἀκριβῶς οἴδατε	1	perfectly well	The words **For**, *yourselves**, and **perfectly** emphasize the how clearly the Thessalonian Church should understand when and how the Lord’s Second Coming will happen. Alternate translation: “Certainly you are well aware” or “Because you understand perfectly well” or “Indeed, you know precisely” or “In fact, you recognize accurately” (See: [[rc://en/ta/man/translate/figs-rpronouns]])<br>
1TH	5	2	yvg3	figs-simile	αὐτοὶ γὰρ ἀκριβῶς οἴδατε ὅτι ἡμέρα Κυρίου, ὡς κλέπτης ἐν νυκτὶ οὕτως ἔρχεται	1	perfectly well	This verse begins an extended list of contrasting similes that continues through [5:8](./05/08.md). (See: [[rc://en/ta/man/translate/figs-simile]])
1TH	5	2	mcq9	grammar-connect-logic-result	γὰρ	1	perfectly well	This connecting word gives the reason why the Thessalonian Church has no need to have anything written to them about the timing and manner of the Lord’s Second Coming. Alternate translation: “Because” or “Certainly” (See: [[rc://en/ta/man/translate/grammar-connect-logic-result]])
1TH	5	2	tu9t	figs-idiom	ἡμέρα Κυρίου	1	in this manner—like a thief in the night	This is an idiom that refers to the Old Testament concept of the time of God’s final judgment. This passage makes it clear that **the day of the Lord** is synonymous with “the coming of the Lord” in [2:15](../02/15.md). (See also Acts 2:20; 1 Corinthians 5:5; 2 Thessalonians 2:2; 2 Peter 3:10). (See: [[rc://en/ta/man/translate/figs-idiom]])
1TH	5	2	tmj3	figs-simile	ὡς κλέπτης ἐν νυκτὶ οὕτως ἔρχεται	1	in this manner—like a thief in the night	This simile expresses the unknown timing and exact manner, but certain reality of the Second Coming of the Lord. Alternate translation: “is coming as unexpectedly as a robber at night” or “is going to come so surprisingly” or “is going to happen like this–all of a sudden” (See UST) (See: [[rc://en/ta/man/translate/figs-simile]])
1TH	5	3	p1wi	figs-hypo	ὅταν λέγωσιν, εἰρήνη καὶ ἀσφάλεια	1	When they may say	This clause continues the theme of unexpected timing of the Lord's Coming, by using a hypothetical situation to express the suddenness of the “the day of the Lord.”  Alternate translation: “Whenever they might say, ‘Everything is safe and sound,’” or “At a time when people are saying, ‘All is well,’” (See: [[rc://en/ta/man/translate/figs-hypo]])
1TH	5	3	mjvd	grammar-connect-logic-contrast	τότε	1	When they may say	This verse expresses a contrast to what is expected. Use a natural way in your language for introducing a contrast. Alternate translation: “but then” (See: [[rc://en/ta/man/translate/grammar-connect-logic-contrast]]) 
1TH	5	3	ne9n	figs-parallelism	τότε αἰφνίδιος αὐτοῖς ἐφίσταται ὄλεθρος	1	then sudden destruction	**sudden destruction** parallels the idea of terror that accompanies a sudden attack by “a thief in the night” [5:2](../05/02.md). Alternate translation: “right then immediate destruction is looming over them” or “at that moment unseen destruction hovers over them” or “then swift destruction attacks” (See: [[rc://en/ta/man/translate/figs-parallelism]])
1TH	5	3	f1xr	figs-simile	ὥσπερ ἡ ὠδὶν τῇ ἐν γαστρὶ ἐχούσῃ; καὶ οὐ μὴ ἐκφύγωσιν	1	like birth pains to the one having in the womb	**like birth pains** is a simile of the suddenness and inescapable nature of God's judgment. Alternate translation: “just as suddenly as labor pains seize a pregnant woman–they can never escape this destruction” (See: [[rc://en/ta/man/translate/figs-simile]])
1TH	5	3	sde2	figs-parallelism	ὥσπερ ἡ ὠδὶν τῇ ἐν γαστρὶ ἐχούσῃ; καὶ οὐ μὴ ἐκφύγωσιν	1	like birth pains to the one having in the womb	**like birth pains** parallels **sudden**, and **destruction** parallels **certainly not escape**. (See: [[rc://en/ta/man/translate/figs-parallelism]])
1TH	5	4	sk6v	grammar-connect-logic-contrast	ὑμεῖς δέ	1	you, brothers	**But you** begins a clause that contrasts the destruction of those appointed “to wrath” (See [5:9](../05/09.md)) with the Thessalonian Church who are **not in darkness**. (See: [[rc://en/ta/man/translate/grammar-connect-logic-contrast]])
1TH	5	4	rr9j		ἀδελφοί	1	you, brothers	Throughout this letter, **brothers** is an idiom meaning “fellow Christians” or “fellow believers in Christ” [5:1](../05/01.md). (See: [[rc://en/ta/man/translate/figs-idiom]])
1TH	5	4	nr5f	figs-gendernotations	ἀδελφοί	1	you, brothers	Here, the idiom **brothers** includes females. If your language does not have this idiom, you can use a gender inclusive term that refers to male and female. Alternate translation: “brothers and sisters” or “spiritual brothers and sisters” or “fellow believers in Christ” or “fellow believers in God” (See [[rc://en/ta/man/translate/figs-gendernotations]])
1TH	5	4	b6lv	figs-metaphor	οὐκ ἐστὲ ἐν σκότει	1	are not in darkness	Here **in darkness** is a metaphor for “unaware” or “unprepared” or “living in sin (like a thief)” (See [4:6-8](../0406.md)). Alternate translation: “are not unaware” or “are not unprepared” or “are not living in sin” (See: [[rc://en/ta/man/translate/figs-metaphor]])
