Reference	ID	Tags	SupportReference	Quote	Occurrence	Note
3:2	yyio		rc://*/ta/man/translate/figs-metaphor	τὸν ἀδελφὸν ἡμῶν	1	Paul is using the term **brother** to mean a person who shares the same faith with him. If it would be helpful in your language, you could state the meaning plainly. Alternate translation: “our believing friend”
3:2	lkvo		rc://*/ta/man/translate/figs-possession	διάκονον τοῦ Θεοῦ	1	Here, Paul is using the possessive form to describe a **servant** who could: (1) serve **God**. Alternate translation: “one who serves God” (2) serve other people for God’s sake. Alternate translation: “one who serves others for God’s sake”
3:2	wykn		rc://*/ta/man/translate/translate-textvariants	διάκονον τοῦ Θεοῦ	1	Many ancient manuscripts read **a servant of God**. The ULT follows that reading. Other ancient manuscripts read “a fellow worker of God.” Other ancient manuscripts read “ fellow worker.” Other manuscripts read “a servant of God and our fellow worker.” If a translation of the Bible exists in your region, you may wish to use the reading that it uses. If a translation of the Bible does not exist in your region, you may wish to use the reading of the ULT.
3:2	dsnc		rc://*/ta/man/translate/figs-explicit	ἐν	1	The preposition **in** could refer to: (1) how Timothy works to preach the gospel. Alternate translation: “in preaching” (2) the means by which Timothy serves. Alternate translation: “by means of”
3:2	pqif		rc://*/ta/man/translate/figs-possession	τῷ εὐαγγελίῳ τοῦ Χριστοῦ	1	Here, Paul is using the possessive form to describe a **gospel** that could be: (1) about **Christ**. Alternate translation: “the gospel about Christ” (2) be from **Christ**. Alternate translation: “the gospel from Christ”
3:2	maoe		rc://*/ta/man/translate/figs-metaphor	στηρίξαι	1	Here, Paul is speaking of Timothy supporting or helping the Thessalonians in their faith as if he were making them stronger. If it would be clearer in your language, you could state the meaning plainly. Alternate translation: “help”
3:2	pizt		rc://*/ta/man/translate/figs-abstractnouns	τῆς πίστεως ὑμῶν	1	If your language does not use an abstract noun for the idea of **faith**, you could express the same idea in another way. Alternate translation: “how you believe”
3:3	o4w8		rc://*/ta/man/translate/grammar-connect-logic-goal	τὸ μηδένα σαίνεσθαι	1	Here, the word **that** could introduce: (1) another purpose for which Paul sent Timothy to the Thessalonians to strengthen and comfort them (see [3:2](../03/02.md)). Alternate translation: “in order that no one would be disturbed” (2) what Timothy strengthened and comforted the Thessalonians about. Alternate translation: “showing you that no one should be disturbed” or “that is, that no one be disturbed”
3:3	v8q7		rc://*/ta/man/translate/figs-activepassive	μηδένα σαίνεσθαι ἐν ταῖς θλίψεσιν ταύταις	1	If your language does not use this passive form, you could express the idea in active form or in another way that is natural in your language. Alternate translation: “these afflictions disturb no one”
3:3	u7vo		rc://*/ta/man/translate/figs-abstractnouns	ἐν ταῖς θλίψεσιν ταύταις	1	If your language does not use an abstract noun for the idea of **afflictions**, you could express the same idea in another way. Alternate translation: “by being afflicted” or “by how we are afflicted”
3:3	s8s2		rc://*/ta/man/translate/grammar-connect-words-phrases	γὰρ	1	Here, the word **For** introduces an explanation for why the Thessalonians should not **be disturbed**. If it would be helpful in your language, you could use a word or phrase that introduces an explanation for a claim. Alternate translation: “Indeed,” or “You should not be disturbed because”
3:3	t0vs		rc://*/ta/man/translate/figs-rpronouns	αὐτοὶ & οἴδατε	1	Here, the word translated **yourselves** emphasizes **you**. Consider using a natural way to emphasize **you** in your language. Alternate translation: “you indeed know” or “it is you who know”
3:3	cdaa		rc://*/ta/man/translate/writing-pronouns	εἰς τοῦτο	1	The pronoun **this** refers to experiencing the **afflictions** that Paul has mentioned. If this is not clear for your readers, you could refer to the **afflictions** more explicitly. Alternate translation: “for suffering these afflictions”
3:3	rkx9		rc://*/ta/man/translate/figs-activepassive	κείμεθα	1	If your language does not use this passive form, you could express the idea in active form or in another way that is natural in your language. If you need to say who did the action, it is clear from the context that it was God. Alternate translation: “God has appointed us”
3:3	gla7		rc://*/ta/man/translate/figs-exclusive	κείμεθα	1	By **we**, Paul includes himself, his fellow workers, and the Thessalonians, so use the inclusive form of that word in your translation if your language marks that distinction.
3:4	w95u		rc://*/ta/man/translate/grammar-connect-logic-result	καὶ γὰρ	1	Here, the phrase **For also** introduces a reason why the Thessalonians should “know” that believers are appointed to be afflicted (see [3:3](../03/03.md)). If it would be helpful in your language, you could use a word or phrase that introduces a reason for a claim. Alternate translation: “You should know that because” or “In fact,”
3:4	wo6q		rc://*/ta/man/translate/figs-exclusive	πρὸς ὑμᾶς ἦμεν, προελέγομεν ὑμῖν ὅτι μέλλομεν	1	Here, the word **we** in the clauses **we were with you** and **we were telling you** only includes Paul and his fellow workers. It does not include the Thessalonians. However, the word **we** in the clause **we are about to suffer affliction** does include the Thessalonians. Make sure that this is clear if your language marks these distinctions.
3:4	wuco		rc://*/ta/man/translate/figs-quotations	προελέγομεν ὑμῖν ὅτι μέλλομεν θλίβεσθαι, καθὼς	1	It may be more natural in your language to have a direct quotation here. Alternate translation: “we were telling you in advance, ‘We are about to be afflicted,’ just as”
3:4	nm1l		rc://*/ta/man/translate/figs-activepassive	μέλλομεν θλίβεσθαι	1	If your language does not use this passive form, you could express the idea in active form or in another way that is natural in your language. If you need to say who did the action, you could use an indefinite subject. Alternate translation: “people are about to afflict us”
3:4	qqri		rc://*/ta/man/translate/figs-explicit	ἐγένετο καὶ οἴδατε	1	Here Paul means that what he and his fellow workers told the Thessalonians would happen did indeed happen, and the Thessalonians know it. If it would be helpful in your language, you could make it more explicit that the Thessalonians **know** that the afflictions **happened**. Alternate translation: “it happened, which you know”
3:5	tj4e		rc://*/ta/man/translate/writing-pronouns	διὰ τοῦτο κἀγὼ μηκέτι στέγων, ἔπεμψα	1	Here, the word **this** could refer to: (1) what Paul said in the previous verse about how the believers have experienced affliction (see [3:4](../03/04.md)). Alternate translation: “Because of those afflictions, I also, no longer enduring it, sent” (2) what Paul says in this verse about how he could no longer endure. Alternate translation: “Because I could no longer endure it, I also sent”
3:5	o9ep		rc://*/ta/man/translate/grammar-connect-logic-result	μηκέτι στέγων	1	Here, much as in [3:1](../03/01.md), the word **enduring** could introduce: (1) the reason why Paul **sent** Timothy. Alternate translation: “since I could no longer endure it” (2) the time when Paul **sent** Timothy. Alternate translation: “when I could no longer endure it”
3:5	st3d		rc://*/ta/man/translate/figs-explicit	μηκέτι στέγων	1	Here, much as in [3:1](../03/01.md) Paul implies that he could no longer endure being separated from the Thessalonians and not knowing how they were doing. If it would be helpful in your language, you could make this idea more explicit. Alternate translation: “enduring my separation from you no longer” or “no longer enduring how I long to see you”
3:5	zn36		rc://*/ta/man/translate/figs-explicit	ἔπεμψα	1	Here Paul implies that he **sent** Timothy to the Thessalonians. If it would be helpful in your language, you could make this idea more explicit. Alternate translation: “sent Timothy to you”
3:5	judq		rc://*/ta/man/translate/figs-abstractnouns	τὴν πίστιν ὑμῶν	1	If your language does not use an abstract noun for the idea of **faith**, you could express the same idea in another way. Alternate translation: “whether you continue to believe”
3:5	raeh		rc://*/ta/man/translate/figs-explicit	μή πως	1	Here, the phrase **lest somehow** introduces something that Paul was worried about. If it would be helpful in your language, you could make this idea more explicit. Alternate translation: “fearing that somehow” or “worrying that somehow”
3:5	nopp		rc://*/ta/man/translate/figs-explicit	ὁ πειράζων	1	Here Paul uses the phrase **the tempter** to refer to the devil, Satan. If it would be helpful in your language, you could make this idea more explicit. Alternate translation: “the tempter, Satan,”
3:5	ua7i		rc://*/ta/man/translate/figs-explicit	ἐπείρασεν ὑμᾶς	1	Here Paul implies that he was worried not only that they would be **tempted** but also that they would stop believing when they were tempted. If it would be helpful in your language, you could make this idea more explicit. Alternate translation: “had somehow successfully tempted you” or “had tempted you with the result that you stopped believing”
3:5	gnow		rc://*/ta/man/translate/figs-abstractnouns	ὁ κόπος ἡμῶν	1	If your language does not use an abstract noun for the idea of **labor**, you could express the same idea in another way. Alternate translation: “what we had done among you”
3:5	jnzb		rc://*/ta/man/translate/figs-idiom	εἰς κενὸν	1	Here, the phrase **in vain** identifies a cause that does not have its intended effect. In this case, Paul’s **labor** will not help the Thessalonians if the tempter successfully tempts them. If it would be helpful in your language, you use a word or phrase that identifies a cause that does not have its intended effect. Alternate translation: “for nothing” or “to no purpose”
3:6	r4pa		rc://*/ta/man/translate/grammar-connect-logic-contrast	δὲ	1	Here, the word **But** introduces what has actually happened in contrast to what Paul said in the previous verse about what he was worried about. If it would be helpful in your language, you could use a word or phrase that contrasts a concern with what actually happened. Alternate translation: “Despite my fears,” or “But here is what really happened:”
3:6	esxw		rc://*/ta/man/translate/grammar-connect-time-background	ἄρτι	1	Here, the phrase **just now** introduces the event that prompted Paul to write this letter, 1 Thessalonians. When Paul writes that Timothy returned **just now**, he is referring to the time immediately before he began writing this letter. If it would be helpful in your language, you could use a word or phrase that introduces something that happened right before a person starts speaking about it. Alternate translation: “just before I started writing this letter,” or “a short while ago,”
3:6	gci4		rc://*/ta/man/translate/figs-exclusive	πρὸς ἡμᾶς & ἡμῖν & ἡμῶν & ἡμᾶς & ἡμεῖς	1	Every time the words **us** or **we** appear in this verse, they include Paul and Silvanus, but they do not include Timothy or the Thessalonians, so use the exclusive form of that word in your translation if your language marks that distinction.
3:6	tu8d		rc://*/ta/man/translate/figs-abstractnouns	τὴν πίστιν καὶ τὴν ἀγάπην ὑμῶν	1	If your language does not use an abstract noun for the idea of **text**, you could express the same idea in another way. Paul implies that the **faith** is in God and **love** is for other people. Alternate translation: “that you continue to believe in God and love other people”
3:6	fu8h		rc://*/ta/man/translate/figs-idiom	ἔχετε μνείαν ἡμῶν ἀγαθὴν πάντοτε	1	Here, the clause **you always have good memory of us** indicates that the Thessalonians remembered Paul and his fellow workers as people whom they liked and would want to meet again. If it would be helpful in your language, you could use a comparable clause or state the meaning plainly. Alternate translation: “you always have pleasant memories about us” or “you always remember us fondly”
3:6	tf95		rc://*/ta/man/translate/figs-explicit	ἐπιποθοῦντες	1	Here, the word **longing** could introduce: (1) another thing that the Thessalonians do. If you use the following alternate translation, you should delete the comma before **longing**. Alternate translation: “and that you long” (2) a result of the kind of **memory** that the Thessalonians have. Alternate translation: “so that you long”
3:6	e6kx		rc://*/ta/man/translate/figs-ellipsis	καὶ ἡμεῖς ὑμᾶς	1	Paul is leaving out some of the words that in many languages a sentence would need in order to be complete. You can supply these words from earlier in the sentence if it would be clearer in your language. Alternate translation: “we also long to see you”
3:7	dpij		rc://*/ta/man/translate/writing-pronouns	διὰ τοῦτο	1	Here, the word **this** refers to what Paul said in the previous verse about what Timothy said about the Thessalonians’ faith, love, and good memory of Paul and his fellow workers. If it would be helpful in your language, you could make this idea more explicit. Alternate translation: “Because of this good news” or “Because of what Timothy told us”
3:7	s9iv		rc://*/ta/man/translate/figs-metaphor	ἀδελφοί	1	Paul is using the term **brothers** to mean people who share the same faith. If it would be helpful in your language, you could state the meaning plainly. Alternate translation: “believing friends”
3:7	fotb		rc://*/ta/man/translate/figs-gendernotations	ἀδελφοί	1	Although the term **brothers** is masculine, Paul is using the word in a generic sense that includes both men and women. If you retain the metaphor in your translation, and if it would be helpful in your language, you could say “brothers and sisters” to indicate this.
3:7	by7h		rc://*/ta/man/translate/figs-activepassive	παρεκλήθημεν	1	If your language does not use this passive form, you could express the idea in active form or in another way that is natural in your language. If you need to say who did the action, it is clear from the context that it was God. Alternate translation: “we felt encouragement” or “God encouraged us”
3:7	grk5		rc://*/ta/man/translate/figs-explicit	ἐφ’ ὑμῖν	1	Here, the phrase **about you** could identify: (1) what Paul and his fellow workers are **encouraged** about. Alternate translation: “concerning you” (2) the reason why Paul and his fellow workers are **encouraged**. Alternate translation: “because of you”
3:7	csz7		rc://*/ta/man/translate/figs-doublet	ἐπὶ πάσῃ τῇ ἀνάγκῃ καὶ θλίψει ἡμῶν	1	The terms **distress** and **affliction** mean similar things. Paul is using the two terms together for emphasis. If it would be clearer for your readers, you could express the emphasis with a single phrase. Alternate translation: “in all our affliction” or “in all our troubles“
3:7	e96u		rc://*/ta/man/translate/figs-abstractnouns	ἐπὶ πάσῃ τῇ ἀνάγκῃ καὶ θλίψει ἡμῶν, διὰ τῆς ὑμῶν πίστεως	1	If your language does not use abstract nouns for the ideas of **distress**, **affliction**, and **faith**, you could express the same ideas in another way. Alternate translation: “whenever we were distressed and afflicted, through how you believe”
3:8	m2rq		rc://*/ta/man/translate/grammar-connect-logic-result	ὅτι	1	Here, the word **For** introduces a reason why what Paul said in the previous verse about being encouraged is true (see [3:7](../03/07.md)). If it would be helpful in your language, you could use a word or phrase that introduces a reason or basis for a previous claim. Alternate translation: “That is because” or “That happened because”
3:8	utk3		rc://*/ta/man/translate/figs-infostructure	νῦν ζῶμεν, ἐὰν ὑμεῖς στήκετε ἐν Κυρίῳ	1	If it would be helpful in your language, you could reverse the order of these phrases, since the second phrase gives the basis for the first phrase. Alternate translation: “if you yourselves stand firm in the Lord, now we live”
3:8	tcv6		rc://*/ta/man/translate/figs-explicit	νῦν	1	Here, the word **now** could refer to: (1) the time when Paul and his fellow workers **live**. Alternate translation: “presently” or “at this moment” (2) the result of how the Thessalonians **stand firm**. Alternate translation: “as a result” or “then”
3:8	y1vb		rc://*/ta/man/translate/figs-metaphor	ζῶμεν	1	Here, the phrase **we live** means that Paul and his fellow workers are refreshed and able to enjoy their lives. Paul does not mean that they were dead or about to die and are now alive again. If it would be helpful in your language, you could use a comparable figure of speech or state the meaning plainly. Alternate translation: “we can really live” or “we are refreshed”
3:8	zbyo		rc://*/ta/man/translate/grammar-connect-condition-fact	ἐὰν	1	Paul is speaking as if this were a hypothetical possibility, but he means that it is actually true. If your language does not state something as a condition if it is certain or true, and if your readers might think that what Paul is saying is not certain, then you could translate his words as an affirmative statement. Alternate translation: “since”
3:8	x4zn		rc://*/ta/man/translate/figs-idiom	ὑμεῖς στήκετε ἐν Κυρίῳ	1	Here, the phrase **stand firm in** indicates that people are remaining faithful to whomever they are **in**. If it would be helpful in your language, you could use a comparable phrase or state the meaning plainly. Alternate translation: “you yourselves remain faithful to the Lord” or “you yourselves persist in trusting the Lord”
3:8	e3pe		rc://*/ta/man/translate/figs-rpronouns	ὑμεῖς στήκετε	1	Here, the word translated **yourselves** emphasizes **you**. Consider using a natural way to emphasize **you** in your language. Alternate translation: “you indeed stand firm” or “it is you who stand firm”
3:9-10	pzq7		rc://*/ta/man/translate/figs-rquestion	τίνα γὰρ εὐχαριστίαν δυνάμεθα τῷ Θεῷ ἀνταποδοῦναι περὶ ὑμῶν, ἐπὶ πάσῃ τῇ χαρᾷ ᾗ χαίρομεν δι’ ὑμᾶς, ἔμπροσθεν τοῦ Θεοῦ ἡμῶν. νυκτὸς καὶ ἡμέρας, ὑπέρἐκπερισσοῦ δεόμενοι εἰς τὸ ἰδεῖν ὑμῶν τὸ πρόσωπον, καὶ καταρτίσαι τὰ ὑστερήματα τῆς πίστεως ὑμῶν?	1	Here Paul is using the question form to show the Thessalonians how thankful he is that they continue to trust God. If you would not use the question form for this purpose in your language, you could translate this as a statement or an exclamation. Alternate translation: “For we give back to God very many thanks concerning you for all the joy in which we rejoice before our God because of you, night and day pleading earnestly to see your face and to provide what is lacking in your faith!”
3:9	b5o6		rc://*/ta/man/translate/grammar-connect-words-phrases	γὰρ	1	Here, the word **For** introduces further information about how Paul and his fellow workers responded to the good news about the Thessalonians. If it would be helpful in your language, you could use a word or phrase that introduces more information, or you could leave **For** untranslated. Alternate translation: “Indeed,” or “Further,”
3:9	vu2k		rc://*/ta/man/translate/figs-exclusive	δυνάμεθα & χαίρομεν & ἡμῶν	1	Here, the word **we** in the phrases **are we able** and **we rejoice** only includes Paul and his fellow workers. It does not include the Thessalonians. However, the word **our** in the phrase **our God** does include the Thessalonians. Make sure that this is clear if your language marks these distinctions.
3:9	pdc5		rc://*/ta/man/translate/figs-metaphor	τίνα & εὐχαριστίαν δυνάμεθα τῷ Θεῷ ἀνταποδοῦναι	1	Here Paul speaks as if he and his fellow workers owe God a debt that they can pay back by giving **thanks**. He means that the appropriate response to God’s work among the Thessalonians is give thanks to God. If it would be helpful in your language, you could state the meaning plainly. Alternate translation: “how can we be thankful enough to God” or “what kind of thanksgiving could we give to God”
3:9	gvvx		rc://*/ta/man/translate/translate-textvariants	τῷ Θεῷ & τοῦ Θεοῦ ἡμῶν	1	Many ancient manuscripts read **to God** and **our God**. The ULT follows that reading. A few ancient manuscripts read “to the Lord” and “our Lord.” If a translation of the Bible exists in your region, you may wish to use the reading that it uses. If a translation of the Bible does not exist in your region, you may wish to use the reading of the ULT.
3:9	j6pj		rc://*/ta/man/translate/figs-abstractnouns	ἐπὶ πάσῃ τῇ χαρᾷ ᾗ χαίρομεν	1	If your language does not use an abstract noun for the idea of **joy**, you could express the same idea in another way. Alternate translation: “for how joyfully we rejoice”
3:9	u00t		rc://*/ta/man/translate/figs-doublet	ἐπὶ πάσῃ τῇ χαρᾷ ᾗ χαίρομεν	1	Here Paul uses both the word **joy** and the word **rejoice** to emphasize how much joy he and his fellow workers have. If it would be clearer for your readers, you could express the emphasis with a single phrase. Alternate translation: “for how greatly we rejoice” or “for how much joy we experience”
3:9	p5ka		rc://*/ta/man/translate/figs-idiom	ἔμπροσθεν τοῦ Θεοῦ ἡμῶν	1	Here, the phrase **before our God** means that Paul and his fellow workers **rejoice** in God’s presence. If it would be helpful in your language, you could make this idea more explicit. Alternate translation: “in the presence of our God” or “when we approach God”
3:10	v6y0		rc://*/ta/man/translate/figs-idiom	νυκτὸς καὶ ἡμέρας	1	Here, the phrase **night and day** indicates that Paul and his fellow workers were **pleading earnestly** during both the day and the night. This means that they were **pleading earnestly** very often every day. If it would be helpful in your language, you could use a comparable expression or state the meaning plainly. Alternate translation: “all the time” or “always”
3:10	wj8y		rc://*/ta/man/translate/figs-explicit	ὑπέρἐκπερισσοῦ δεόμενοι	1	Here Paul implies that he and his fellow workers pray to God when they are **pleading**. If it would be helpful in your language, you could make this idea more explicit. Alternate translation: “pleading earnestly with God”
3:10	eb26		rc://*/ta/man/translate/figs-idiom	εἰς τὸ ἰδεῖν ὑμῶν τὸ πρόσωπον	1	The phrase **to see your face** refers to visiting someone and being with them. If it would be helpful in your language, you could use an equivalent expression from your language or state the meaning plainly. Alternate translation: “to visit you” or “to spend time with you”
3:10	s0xz		rc://*/ta/man/translate/grammar-collectivenouns	ὑμῶν τὸ πρόσωπον	1	Here Paul speaks as if the Thessalonians together had one **face**, but he is referring to each of their faces. If it would be helpful in your language, you could state the meaning plainly. Alternate translation: “your faces”
3:10	uqwr		rc://*/ta/man/translate/figs-explicit	καταρτίσαι τὰ ὑστερήματα τῆς πίστεως ὑμῶν	1	Here Paul could be implying that the Thessalonians are **lacking**: (1) knowledge about God that should be included in their **faith**. Alternate translation: “to teach you more about your faith” (2) some aspects of **faith** in God. Alternate translation: “to enable you to have faith completely”
3:10	e5fh		rc://*/ta/man/translate/figs-abstractnouns	τῆς πίστεως ὑμῶν	1	If your language does not use an abstract noun for the idea of **faith**, you could express the same idea in another way. Alternate translation: “in the way you believe”
3:11-13	tet9		rc://*/ta/man/translate/translate-blessing	δὲ & κατευθύναι	1	Here the verb forms indicate that this is a blessing or prayer that continues through [3:13](../03/13.md). Use a form that people would recognize as a blessing or prayer in your language. Alternate translation: “Now we pray that … would guide”
3:11	kdk9		rc://*/ta/man/translate/grammar-connect-words-phrases	δὲ	1	Here, the word **But** introduces a new topic. If it would be helpful in your language, you could use a word or phrase that introduces a new topic, or you could leave **But** untranslated. Alternate translation: “Now”
