Reference	ID	Tags	SupportReference	Quote	Occurrence	Note
1:14	z5lv		rc://*/ta/man/translate/figs-idiom	μετὰ πίστεως καὶ ἀγάπης τῆς ἐν Χριστῷ Ἰησοῦ	1	This could refer to: (1) **faith and love** that he received from Jesus when he became **in** him, which would mean “in relationship with” him. Alternate translation: “and enabled me to trust him and love him” (2) **faith and love** that Jesus himself possesses and could be saying that these were the basis of the mercy that Jesus showed him. Alternate translation: “because he believed in me and loved me”
1:15	z48s			πιστὸς ὁ λόγος	1	In this context, the term **word** refers to an entire statement. Alternate translation: “this statement is dependable”
1:15	rh2r			καὶ πάσης ἀποδοχῆς ἄξιος	1	If it would be helpful in your language, you could state explicitly who does this action. Alternate translations: “and we should believe it without any doubt” or “and we should have full confidence in it”
1:15	t163		rc://*/ta/man/translate/figs-quotemarks	Χριστὸς Ἰησοῦς ἦλθεν εἰς τὸν κόσμον ἁμαρτωλοὺς σῶσαι	1	Paul uses this phrase as a direct quotation. It may be helpful to your readers if you indicate this by setting off the words that follow, “Christ Jesus came into the world to save sinners,” with quotation marks or with whatever other punctuation or convention your language may use to indicate a quotation.
1:15	t164			ὧν πρῶτός εἰμι ἐγώ	1	Here the term **first** has the sense of the superlative example of a class, in this case a negative class. Alternate translation: “and I am the worst one of all”
1:16	z5kg		rc://*/ta/man/translate/figs-activepassive	ἠλεήθην	1	If it would be helpful in your language, you could express who showed **mercy** to Paul with an active form, and you could state who did the action. Alternate translation: “Jesus had mercy on me”
1:16	epe2			ἵνα ἐν ἐμοὶ πρώτῳ	1	Alternate translation: “so that through me, the worst sinner of all”
1:17	k9sc			δὲ	1	Paul here uses the word **Now** to introduce a change in what he is writing. As a result of what he has been teaching Timothy, he now writes a blessing to and about God. Use a word to indicate this change in your language, such as “so” or “now.”
1:17	ts5z		rc://*/ta/man/translate/figs-abstractnouns	τιμὴ καὶ δόξα	1	If it would be helpful in your language, you could express the abstract nouns **honor** and **grace** by stating the ideas behind the them with verbs. Alternate translation: “may people honor and glorify”
1:18	ijn8		rc://*/ta/man/translate/figs-metaphor	ταύτην τὴν παραγγελίαν παρατίθεμαί σοι	1	Paul speaks of his instructions as if he could physically put them in front of Timothy. Alternate translations: “I am entrusting you with this command” or “this is what I am commanding you”
1:18	b6uq		rc://*/ta/man/translate/figs-metaphor	τέκνον	1	Paul speaks of his close relationship to Timothy as though they were father and **child**. This shows Paul’s sincere love and approval of Timothy. It is also likely that Paul personally led Timothy to trust in Christ, and that would be another reason why Paul considered him to be like his own child. Alternate translation: “you who are like my very own child”
1:18	y6jg			κατὰ τὰς προαγούσας ἐπὶ σὲ προφητείας	1	If it would be helpful in your language, you could state explicitly how these prophecies happened and who did this action. Alternate translation: “in agreement with what other believers prophesied about you”
1:18	w2ex		rc://*/ta/man/translate/figs-metaphor	στρατεύῃ & τὴν καλὴν στρατείαν	1	Paul speaks about Timothy doing his best for the Lord as if he were a soldier fighting a battle. Alternate translation: “continue to do your best on behalf of the Lord”
1:19	jj6k		rc://*/ta/man/translate/figs-abstractnouns	ἔχων πίστιν	1	If it would be helpful to your readers, you could express the idea behind the abstract noun **faith** with a phrase that uses a verb such as “trust” or “believe.” Here, **faith** could refer to: (1) a relationship with Jesus. Alternate translation: “continue trusting in Jesus” (2) a belief in the message about Jesus. Alternate translation: “keep believing the true teaching”
1:19	ly6q		rc://*/ta/man/translate/figs-abstractnouns	ἀγαθὴν συνείδησιν	1	See how you translated this phrase in [1:5](../01/05.md). Alternate translation: “continuing to choose to do what is right instead of what is wrong”
1:19	h2wk		rc://*/ta/man/translate/figs-metaphor	τινες & περὶ τὴν πίστιν ἐναυάγησαν	1	Paul speaks of these people as if they were a ship that had sunk. He means that these people no longer believe in Jesus and no longer live as his followers. You could use this same figure, or a similar one from your culture, if your readers would understand this meaning. Otherwise, you could state as an alternative translation, “no longer belong to Jesus”
1:19	dyr6		rc://*/ta/man/translate/figs-abstractnouns	περὶ τὴν πίστιν	1	If it would be helpful to your readers, you could express the idea behind the abstract noun **faith**. Here, **faith** could refer to: (1) a relationship with Jesus (or God). Alternate translation: “their relationship with Jesus” (2) the teachings about Jesus. Alternate translation: “the message about Jesus”
1:20	pv7f		rc://*/ta/man/translate/translate-names	Ὑμέναιος & Ἀλέξανδρος	1	**Hymenaeus** and **Alexander** are names of two men.
1:20	ty7n		rc://*/ta/man/translate/figs-metaphor	οὓς παρέδωκα τῷ Σατανᾷ	1	Paul speaks as if he physically took hold of these men and handed them **to Satan**. If this does not make sense in your language, you could state it plainly. Alternate translation: “I have allowed Satan to command them”
1:20	az10		rc://*/ta/man/translate/figs-explicit	οὓς παρέδωκα τῷ Σατανᾷ	1	This probably means that Paul expelled them from the community of believers. Since they are no longer a part of the community, Satan has access to them and can harm them. If it would be helpful to your readers, you may want to include this information in a footnote. Alternate translation: “I have allowed Satan to make them suffer”
1:20	s76c		rc://*/ta/man/translate/figs-activepassive	ἵνα παιδευθῶσι	1	If it would be helpful in your language, you could express this passive phrase with an active form, and you could state who would do the action. Alternate translation: “so that God may teach them”
2:intro	c6rf				0	# 1 Timothy 2 General Notes\n\n## Special concepts in this chapter\n\n### Peace\n\nPaul encourages Christians to pray for everyone. They should pray for rulers so that Christians can live peacefully, in a godly and dignified way.\n\n### Women in the church\n\nScholars are divided over how to understand this passage in its historical and cultural context. Some scholars believe that God created men and women to serve in distinctly different roles in marriage and the church. Other scholars believe that God wants women to use the gifts He gives them on an equal basis with men. Translators should be careful not to let how they understand this issue affect how they translate this passage.
2:1	yk2z		rc://*/ta/man/translate/figs-idiom	πρῶτον πάντων	1	As in [1:15](../01/15.md), the term **first** means the superlative example of a class. Alternate translation: “most importantly”
2:1	iag7			παρακαλῶ	1	Alternate translation: “I encourage” or “I exhort”
2:1	ql7a		rc://*/ta/man/translate/figs-activepassive	ποιεῖσθαι δεήσεις, προσευχάς, ἐντεύξεις, εὐχαριστίας	1	If it would be helpful in your language, you could express this passive phrase with an active form, and you could state who would do the action and who would receive the action. Alternate translation: “I urge all believers to make requests, prayers, intercessions, and thanksgivings to God”
2:1	t183		rc://*/ta/man/translate/figs-gendernotations	ἀνθρώπων	1	Paul uses the term **men** here in a generic sense that includes both men and women. Alternate translation: “people”
2:2	g4va		rc://*/ta/man/translate/figs-doublet	ἤρεμον καὶ ἡσύχιον βίον	1	The terms **peaceful** and **quiet** mean the same thing. Paul uses them together for emphasis. He wants all believers to be able to live their lives without having trouble with the authorities. If it would be helpful in your language, you could combine these terms. Alternate translation: “an undisturbed life”
2:2	pb58		rc://*/ta/man/translate/figs-abstractnouns	ἐν πάσῃ εὐσεβείᾳ καὶ σεμνότητι	1	If it would be helpful to your readers, you could express the idea behind the abstract nouns **godliness** and **dignity** with phrases that use verbs such as “honor” and “respect.” Alternate translation: “that honors God and that other people will respect”
2:3	t186		rc://*/ta/man/translate/figs-doublet	καλὸν καὶ ἀπόδεκτον ἐνώπιον & Θεοῦ	1	The terms **good** and **acceptable** mean similar things. Paul may be using them together for emphasis. If you think that having both terms in your translation might be confusing for your readers, you could combine them. Alternate translation: “very pleasing to God”
2:4	i3ze		rc://*/ta/man/translate/figs-activepassive	ὃς πάντας ἀνθρώπους θέλει σωθῆναι	1	If it would be helpful in your language, you could express this passive phrase with an active form. Alternate translation: “who wants to save everyone”
2:4	t188		rc://*/ta/man/translate/figs-gendernotations	πάντας ἀνθρώπους	1	Paul uses the term **men** here in a generic sense that includes both men and women. Alternate translation: “everyone”
2:4	n26m		rc://*/ta/man/translate/figs-metaphor	εἰς ἐπίγνωσιν ἀληθείας ἐλθεῖν	1	Paul speaks of learning the truth about God as if it were a place where people could **come**. Alternate translation: “to know and accept what is true”
2:5	t666		rc://*/ta/man/translate/translate-unknown	εἷς καὶ μεσίτης Θεοῦ καὶ ἀνθρώπων	1	A **mediator** is a person who helps negotiate a peaceful settlement between two parties who disagree with each other. Alternate translation: “and one person who is able to reconcile God and people”
2:5	t191		rc://*/ta/man/translate/figs-gendernotations	ἀνθρώπων	1	Paul uses the term **men** here in a generic sense that includes both men and women. Alternate translation: “people”
2:5	t192		rc://*/ta/man/translate/figs-gendernotations	ἄνθρωπος Χριστὸς Ἰησοῦς	1	Paul is likely using the term **man** in a generic sense to refer to the humanity of Jesus. Alternate translation: “Christ Jesus, who is also human”
2:6	u8r1			δοὺς ἑαυτὸν	1	Alternate translation: “sacrificed himself” or “died willingly”
2:6	vz12			ἀντίλυτρον ὑπὲρ πάντων	1	Alternate translation: “as the price of freedom for everyone”
2:6	fm1c		rc://*/ta/man/translate/figs-explicit	τὸ μαρτύριον	1	If it would be helpful to your readers, you could make it explicit that this demonstrated specifically that God wants to save all people. Alternate translation: “as the proof that God wants to save all people”
2:6	fq7r		rc://*/ta/man/translate/figs-idiom	καιροῖς ἰδίοις	1	This is an idiom. Alternate translation: “at the time that God had chosen”
2:7	qxv9			εἰς ὃ	1	Here, **which** refers back to the testimony about God in the previous verse. Alternate translation: “of this testimony”
2:7	iz4y		rc://*/ta/man/translate/figs-activepassive	ἐτέθην ἐγὼ κῆρυξ καὶ ἀπόστολος	1	If it would be helpful in your language, you could express this passive phrase with an active form, and you could state who did the action. Alternate translation: “Jesus has made me, Paul, a preacher and a representative for him”
2:7	cbn6		rc://*/ta/man/translate/translate-unknown	κῆρυξ	1	A **herald** is someone who is sent out to announce a message. If your language does not have a similar term and your readers would not know what a herald is, you can use a general expression for this. Alternate translations: “an announcer” or “a messenger”
2:7	qa8d		rc://*/ta/man/translate/figs-metaphor	κῆρυξ	1	Paul compares himself to a **herald** because God has sent him out to announce the gospel message. Alternate translation: “a preacher”
2:7	hb97			ἐν Χριστῷ	1	Alternate translation: “as a follower of Christ”
2:7	yllf			ἀλήθειαν λέγω ἐν Χριστῷ, οὐ ψεύδομαι	1	In order to emphasize what he is saying, Paul says the same thing twice, first positively and then negatively. If this is confusing in your language, you can express this once. Alternate translation: “I am telling you the truth as a follower of Christ”
2:7	h18q			διδάσκαλος ἐθνῶν ἐν πίστει καὶ ἀληθείᾳ	1	Here, **faith and truth** could mean: (1) the content of what Paul teaches. Alternate translation: “I teach the Gentiles the message of faith and truth” (2) Paul’s character as a teacher. Alternate translation: “a true and faithful teacher of the Gentiles”
2:7	t201		rc://*/ta/man/translate/figs-hendiadys	διδάσκαλος ἐθνῶν ἐν πίστει καὶ ἀληθείᾳ	1	If this phrase has the second meaning that the previous note discusses, Paul may be using the two terms **faith** and **truth** together to express one idea. Alternate translation: “I teach the Gentiles about the true faith”
2:8	a841		rc://*/ta/man/translate/figs-gendernotations	τοὺς ἄνδρας ἐν παντὶ τόπῳ	1	Here the word **men** refers specifically to males. The term is not generic, since Paul addresses women next. Alternate translations: “the males in all places” or “men everywhere”
2:8	unw6		rc://*/ta/man/translate/translate-symaction	ἐπαίροντας ὁσίους χεῖρας	1	It was the customary posture in this culture for people to raise their **hands** while praying. You could translate this in a way that would make that clear. Alternate translation: “reverently lifting up their hands in the customary way”
2:8	yzg3		rc://*/ta/man/translate/figs-synecdoche	προσεύχεσθαι & ἐπαίροντας ὁσίους χεῖρας	1	Paul describes one part of the person, the **hands**, as holy to indicate that the entire person is to be holy. Alternate translation: “to lift up their hands to pray in holiness”
2:8	t206		rc://*/ta/man/translate/figs-hendiadys	χωρὶς ὀργῆς καὶ διαλογισμοῦ	1	Here Paul expresses a single idea by using two words connected with **and.** The word **anger** tells what kind of **argument** the men should avoid. If it would be helpful in your language, you could express this meaning with an equivalent phrase. Alternate translation: “without angry arguments”
2:9	t207		rc://*/ta/man/translate/figs-ellipsis	ὡσαύτως	1	Here Paul leaves out some of the words that a sentence would ordinarily need in order to be complete. Alternate translation: “in the same way, I also want”
2:9	sw21		rc://*/ta/man/translate/translate-unknown	μὴ ἐν πλέγμασιν	1	During this time, many Roman women braided their hair lavishly to try to make themselves attractive. If your readers would not be familiar with the practice of braiding hair, you could express this idea in a more general way. Alternate translations: “they should not have fancy hairstyles” or “they should not have elaborate hairstyles that attract attention”
2:9	t210		rc://*/ta/man/translate/figs-synecdoche	μὴ ἐν πλέγμασιν	1	Paul mentions **braids** and **gold** as ways a woman could give undue attention to her hair. At the time, women would make elaborate braided hairstyles, often weaving in chains of gold. Alternate translations: “not with fancy hairstyles” or “not by means of elaborate hairstyles that attract attention”
2:9	rf5v		rc://*/ta/man/translate/translate-unknown	μαργαρίταις	1	These **pearls** are beautiful and valuable mineral balls that people use as jewelry. They are formed inside the shell of a small animal that lives in the ocean. If your readers would not be familiar with pearls, you could express this idea in a more general way. Alternate translation: “decorations made from valuable materials”
2:10	g35m			ἐπαγγελλομέναις θεοσέβειαν, δι’ ἔργων ἀγαθῶν	1	Alternate translation: “who want to honor God by the good things that they do”
2:11	gb7a		rc://*/ta/man/translate/figs-idiom	ἐν ἡσυχίᾳ	1	Paul may be saying that he wants the women to listen rather than to speak. Alternate translation: “by listening”
2:11	c7sh			ἐν πάσῃ ὑποταγῇ	1	Alternate translation: “and submit to the authority of the teacher”
2:12	t216			εἶναι ἐν ἡσυχίᾳ	1	As in [2:11](../02/11.md), Paul may be saying that he wants the women to listen rather than to speak. Alternate translation: “she should listen quietly”
2:13	iv31		rc://*/ta/man/translate/figs-activepassive	Ἀδὰμ & πρῶτος ἐπλάσθη	1	If it would be helpful in your language, you could express this passive phrase with an active form, and you could state who did the action. Alternate translation: “God created Adam first”
2:13	v7v6		rc://*/ta/man/translate/figs-ellipsis	εἶτα Εὕα	1	Here Paul leaves out some of the words that a sentence would ordinarily need in order to be complete. Alternate translation: “and then God created Eve”
2:14	wq5k		rc://*/ta/man/translate/figs-activepassive	Ἀδὰμ οὐκ ἠπατήθη	1	If it would be helpful in your language, you could express this passive phrase with an active form, and you could state who did the action. Alternate translation: “Adam was not the one whom the serpent deceived”
2:14	n6td		rc://*/ta/man/translate/figs-activepassive	ἡ δὲ γυνὴ ἐξαπατηθεῖσα, ἐν παραβάσει γέγονεν	1	If it would be helpful in your language, you could express this passive phrase with an active form, and you could state who did the action. Alternate translation: “but it was the woman who disobeyed God when the serpent deceived her”
2:14	t221		rc://*/ta/man/translate/figs-abstractnouns	ἐν παραβάσει γέγονεν	1	If it would be helpful in your language, you could express the abstract noun **transgression** by stating the ideas behind it with a verbal phrase. Alternate translations: “began to sin” or “began to disobey God”
2:15	krx4		rc://*/ta/man/translate/grammar-connect-logic-contrast	δὲ	1	Paul uses the word **But** to indicate that this sentence provides a contrast to the previous sentence.
2:15	t222			σωθήσεται	1	Here, **she** likely refers to Eve, mentioned in the preceding verse, and whom Paul describes as “the woman.” Later in the sentence, **they** refers to women in general. To show how Paul shifts the topic from Eve, a representative woman, to all women, the word **she** could be translated here as “women.”
2:15	u8iv			σωθήσεται & διὰ τῆς τεκνογονίας	1	This could mean: (1) people thought that women would be condemned because of Eve’s sin and punished even more than with the pain of childbearing (See: Genesis 3:16), or they may have thought that a woman who believed in Jesus was no longer under the punishment that God gave in Genesis 3:16. Since the Greek word translated **through** can also mean “with” or “while,” Paul may be saying here that women continue to have the punishment of pain in childbirth but will be saved from additional punishment as long as they have faith in Jesus. Alternate translation: “God will save women, although they do have to endure childbirth” (2) the women of the church in Ephesus were being led away from faith in Jesus by the false teachers (See: 2 Timothy 3:6), so Paul is recommending that they focus on raising their families rather than listening to (or participating in) the “foolish talk” (1:6). Alternate translation: “God will save women as they attend to their families” (3) a reference to the birth of Jesus as a human child to be the Savior. Alternate translation: “God will save women through Jesus, who was born as a child”
2:15	i0ap		rc://*/ta/man/translate/figs-synecdoche	διὰ τῆς τεκνογονίας	1	If option number 2 from the previous note is correct, then Paul is referring to all of the aspects of motherhood by mentioning the beginning part of it: **childbearing**. Alternate translation: “as they attend to their families”
2:15	n818		rc://*/ta/man/translate/figs-activepassive	σωθήσεται	1	If it would be helpful in your language, you could express this passive phrase with an active form, and you could state who did the action. Alternate translation: “God will save women”
2:15	gh3c			ἐὰν μείνωσιν	1	Here, **they** refers to women. Paul switches from the singular to the plural as he switches from talking about Eve as the representative of women to women in general. Alternate translation: “if women continue living”
2:15	sl57		rc://*/ta/man/translate/figs-abstractnouns	ἐν πίστει, καὶ ἀγάπῃ, καὶ ἁγιασμῷ	1	If it would be helpful in your language, you could express the abstract nouns **faith**, **love**, and **holiness** by stating the ideas behind them with verbs. Alternate translation: “trusting Jesus, loving others, and living in a holy way”
2:15	dcf3		rc://*/ta/man/translate/figs-idiom	μετὰ σωφροσύνης	1	Here, **with self-control** could mean: (1) with good judgment. (2) with modesty. (3) with clear thinking.
3:intro	d9db				0	# 1 Timothy 3 General Notes\n\n## Structure and formatting\n\n[3:16](../03/16.md) was probably a song, poem, or creed the early church used to express what it understood to be the meaning of who Jesus was and what he did.\n\n### Overseers and deacons\n\nThe church has used different titles for church leaders. Some titles include elder, pastor, and bishop. The word “overseer” reflects the Greek term in verses 1–2, which means literally an “over-seer.” The word “bishop” is derived directly from the letters of this Greek term. Paul writes about another kind of church leader, a “deacon,” in verses 8 and 12.\n\n### Character qualities\n\nThis chapter lists several qualities that an overseer or deacon in the church must have. (See: [[rc://*/ta/man/translate/figs-abstractnouns]])
3:1	t227			πιστὸς ὁ λόγος	1	As in [1:15](../01/15.md), in this context the term **word** has a meaning more like “statement” or “message.” Alternate translation: “this statement is dependable”
3:1	t228		rc://*/ta/man/translate/figs-quotemarks	πιστὸς ὁ λόγος	1	Paul uses this phrase to introduce a direct quotation. It may be helpful to your readers if you indicate this by setting off the words that follow in the rest of the verse with quotation marks or with whatever other punctuation or convention your language may use to indicate a quotation.
3:1	t229		rc://*/ta/man/translate/translate-unknown	ἐπισκοπῆς	1	The term **overseer** describes a leader of the early Christian church whose work was to take care of the spiritual needs of believers and make sure that they received accurate biblical teaching. Alternate translation: “spiritual leader”
3:1	f133			καλοῦ ἔργου	1	Alternate translations: “an honorable task” or “an honorable role”
3:2	dff6			μιᾶς γυναικὸς ἄνδρα	1	Here, **of one wife** means that he has only one wife, that is, he does not have any other wives or concubines. This also means that he does not commit adultery and may also mean that he has not divorced a previous wife. Alternate translations: “a man who has only one woman” or “a man who is faithful to his wife”
3:2	qnq9			νηφάλιον, σώφρονα, κόσμιον, φιλόξενον	1	Alternate translation: “not do anything to excess, reasonable and behave well, welcoming to strangers”
3:3	c2c7			μὴ πάροινον, μὴ πλήκτην, ἀλλὰ ἐπιεικῆ, ἄμαχον	1	Alternate translation: “not drink alcohol to excess, not fight and argue, but instead, gentle and peaceful”
3:3	pc2g		rc://*/ta/man/translate/figs-metaphor	ἀφιλάργυρον	1	If the expression **loving** money would not convey the idea of something inappropriate in your language, it might be helpful to use a term that expresses the idea of “greed.” Alternate translation: “not greedy for money”
3:4	a8gu			προϊστάμενον	1	Alternate translations: “he should lead” or “he should take care of”
3:4	w3un			ἐν ὑποταγῇ, μετὰ πάσης σεμνότητος	1	This could mean: (1) the overseer’s children should obey their father and show respect to him. Alternate translation: “who obey him completely respectfully” (2) the overseer’s children should show respect to everyone. Alternate translation: “who obey him and show respect to everyone” or (3) the overseer should show respect to those in his household as he leads them. Alternate translation: “who obey him as he treats them with respect”
