Reference	ID	Tags	SupportReference	Quote	Occurrence	Note
front:intro	jp2y				0	# Introduction to 1 Thessalonians\n\n## Part 1: General Introduction\n\n### Outline of the book of 1 Thessalonians\n\nIn this letter, the apostle Paul, along with Silvanus and Timothy, encourages and makes appeals to the Thessalonian church (See: rc://*/tw/bible/names/thessalonica.md). Paul is the spokesman for all of them, using “we” to refer to the group, but in certain places Paul speaks for himself using “I” (See [2:18](../02/18.md); [3:5](../03/05.md); [5:27](../05/27.md)). The background story for the apostles’ activity in Thessalonica can be found in Acts 17:1–10.\n\n1. Apostolic memories of the Thessalonian church (1:1–10)\n    * Greeting (1:1)\n    * Thanksgiving for the Thessalonian Christians (1:2–4)\n    * Examples of Thessalonian suffering (1:6–10)\n2. Apostolic authority (2:1–16)\n    * Persecution of the church (2:1–13)\n    * Opposition to the church (2:14–16)\n3. Timothy’s visit to Thessalonica (3:1–13)\n    * Reason for the visit (3:1–5)\n    * Report about the visit (3:6–13)\n4. Apostolic teachings (4:1–18)\n    * Holiness (4:1–8)\n    * Christian love (4:9–12)\n    * Manner of the Second Coming of Christ (4:13–18)\n5. Final teachings (5:1–28)\n    * Timing of the Second Coming of Christ (5:1–10)\n    * Final appeals and teachings (5:11–28)\n\n### Who wrote 1 Thessalonians?\n\nPaul wrote 1 Thessalonians, writing with the agreement of Silvanus and Timothy. Paul was from the city of Tarsus. He had been known as Saul in his early life. Before becoming a Christian, Saul was a Pharisee. He persecuted Christians. After he became a Christian, Paul traveled several times throughout the Roman Empire, telling people about Jesus. Paul wrote this letter while staying in the city of Corinth. Many scholars think 1 Thessalonians was the first letter Paul wrote of all Paul’s letters that are in the Bible.\n\nSilvanus is also mentioned in 2 Corinthians 1:19; 2 Thessalonians 1:1; 1 Peter 5:12. “Silas,” the name used in the book of Acts, is a contracted form of Silvanus; Silas and Silvanus are considered to be the same person. Timothy was leader of the church at Ephesus (See 1 Timothy 1:1–4). Paul wrote this letter while staying in the city of Corinth with these two men. The mention of all three men in 1:1 indicates they were in Thessalonica together at some point.\n\n### What is the book of 1 Thessalonians about?\n\nPaul wrote this letter to the church in the city of Thessalonica, after the Jews in the city forced him to leave. Ancient Thessalonica was located on the southeast coast of ancient Macedonia, and is now called Thessaloniki, located in northeast Greece. (See: rc://*/ta/man/translate/writing-background). In this letter Paul said he considered his visit to them a success, even though he was forced to leave (See Acts 17:1–10).\n\nPaul responded to the news from Timothy about the Thessalonian believers. The believers there were being persecuted. He encouraged them to continue living in a way that pleased God. He also comforted them by explaining what happens to those who die before Christ returns.\n\n### How should the title of this book be translated?\n\nTranslators may choose to call this book by its traditional title, “1 Thessalonians” or “First Thessalonians.” They may instead prefer to choose a clearer title, such as “Paul’s First Letter to the Church in Thessalonica,” or “The First Letter to the Church in Thessalonica.” (See: [[rc://*/ta/man/translate/translate-names]])\n\n## Part 2: Important Religious and Cultural Concepts\n\n### Trinity\n\nIn this letter, the doctrine of the Holy Trinity finds solid support. The terms: God, Father, Son, Lord, Jesus, and Holy Spirit appear numerous times. (See: [[rc://*/tw/dict/bible/kt/god]])\n\n### The gospel\n\nIn this letter, Paul frequently refers to the apostles’ ministry of the gospel and uses different phrases to communicate the concept of God’s good news about Jesus Christ. (See: [[rc://*/tw/dict/bible/kt/goodnews]])\n\n### Prayer\n\nPaul reassures the Thessalonians that his group of apostles frequently prays for them (See [1:2](../01/02.md)). He also gives instructions about prayer (See [5:2](../05/02.md)), and asks the Thessalonians to pray for them (See [5:25](../05/25.md)). (See: [[rc://*/tw/dict/bible/kt/pray]])\n\n### Faith and Faithfulness\n\nThrough the letter the Thessalonians are commended for their faithfulness to God. They are reminded to trust God and remain faithful to gospel living. (See: [[rc://*/tw/dict/bible/kt/faithful]], [[rc://*/tw/dict/bible/kt/faith]])\n\n### Apostolic authority\n\nMuch of this letter is a defense of the apostles authority, based on their teaching and living. The term “apostles” is used in [2:6](../02/06.md)) to reinforce that Paul, Silvanus, and Timothy are sent by God. (See: [[rc://*/tw/dict/bible/kt/apostle]])\n\n### Second Coming of Christ\n\nPaul wrote much in this letter about Jesus’ eventual return to Earth. When Jesus returns, he will judge all mankind. He will also rule over creation, and there will be peace everywhere.\n\n### The fate of reposed Christians\n\nPaul made clear that those who die before Christ’s return will come back to life and be with Jesus. They will not remain dead forever. Paul wrote this to encourage the Thessalonians, for some of them worried that those Christians who died would miss the great “day of the Lord” when Jesus returns.\n\n### Idolatry\n\nThe Greek and Roman cultural background in Thessalonica meant that many members of the church were former pagans who practiced some sort of idolatry (See [1:9](../01/09.md)(See: [[rc://*/tw/dict/bible/other/image]]).\n\n### Suffering\n\nMuch of this letter addresses both the sufferings of the apostles and the Thessalonian church for faithfulness to the gospel. (See: [[rc://*/tw/dict/bible/other/afflict]], [[rc://*/tw/dict/bible/other/persecute]], [[rc://*/tw/dict/bible/other/suffer]])\n\n### Sanctification\n\nThe concept of holiness is prevalent in this letter. Chapter four discusses how a Christian should practice a holy life. (See: [[rc://*/tw/dict/bible/kt/sanctify]])\n\n## Part 3: Important Translation Issues\n\n### What did Paul mean by expressions like “in Christ” and “in Christ Jesus” and “in the Lord Jesus Christ” and “in God the Father” and “in the Holy Spirit”?\n\nPaul meant to express the idea of a union between God and Christians that includes all three persons of the Trinity. Please see the introduction to the book of Romans for more details about these kinds of expressions.\n\n### What did Paul mean by expressions like “his coming” and “the coming of the Lord Jesus” and “the coming of the Lord Jesus Christ”?\n\nPaul used “coming” in a specific way in relation to Jesus Christ to refer to the time when he will come again to earth, this time displaying his glory and power and gathering his people to himself. Depending on the nuances of your language, you may need to translate this with a special concept or word.\n\n### What did Paul mean by expressions like “the word of God” or “the word of the Lord”?\n\nThroughout this letter, Paul uses these well-known phrases or abbreviations to refer to the gospel message.\n\n### What did Paul mean by expressions like “brothers”?\n\nThroughout this letter, “brothers” is a metaphor that refers to all believers, including females. (See [1:4](../01/04.md); 2:1, 9, 14, 17; 3:7; 4:1, 6, 10, 13; 5:1, 4, 12, 14, 26, 27)\n\n### “We” and “you”\n\nIn this letter, the words “we”, “us,” and “our” refer to Paul, Silvanus, and Timothy, unless otherwise noted. In addition, “we”, “us,” and “our” are used to convey that all three apostles are in agreement with the letter.\n\n### Major textual issues in the text of the book of First Thessalonians\n\nWhen ancient manuscripts of the Bible differ, ULT puts in its text the reading that scholars consider to be the most accurate, but it puts other possibly accurate readings in footnotes. The introductions to each chapter will discuss places where the ancient manuscripts differ in significant ways, and notes will address those places again where they occur in the book. If a translation of the Bible already exists in your region, consider using the readings found in that version. If not, we recommend that you follow the readings in the ULT text. (See: rc://*/ta/man/translate/translate-textvariants)\n* “Grace and peace to you” (See [1:1](../01/01.md)). Some other manuscripts read: “Grace and peace to you from God our Father and the Lord Jesus Christ.”\n* “but we became little children in the midst of you, as if a mother might comfort her own children” (See [2:7](../02/07.md)). Some other manuscripts read, “Instead, we were as gentle among you as a mother comforting her own children.”\n* “Timothy, our brother and a servant of God” (See [3:2](../03/02.md)). Some other manuscripts read: “Timothy, our brother and fellow worker for God.”\n\n(See: [[rc://*/ta/man/translate/translate-textvariants]])
1:intro	y8c5				0	# 1 Thessalonians 1 General Notes\n\n## Structure and Formatting\n\n1. Greeting (1:1)\n2. Prayer of thanksgiving for the Thessalonian church (1:2–10)\n      * Memory of the Thessalonians (1:2–5)\n          * apostolic prayers (1:2)\n          * work of the Thessalonians (1:2–3)\n          * God’s election of the Thessalonians (1:4–5)\n      * Thessalonians’ example (1:6–10)\n          * reception of the apostles’ teaching (1:6)\n          * examples to Macedonia and Achaia (1:7–10)\n            * example of suffering (1:7)\n            * preaching of the gospel (1:8)\n            * turned away from idolatry to God (1:9)\n            * waiting for the Second Coming of Christ (1:10)\n\nVerse 1 formally introduces this letter. Letters in the ancient Near East commonly had introductions of this type in which the senders identified themselves and the recipient and then gave a greeting.\n\n## Special Concepts in this Chapter\n\n### Trinity\n\nGod the Father, God the Son, and God the Holy Spirit are mentioned numerous times in this chapter. Paul can speak of each of them individually, but he describes them working together as God. Make sure that your translation distinguishes between Father, Son, and Holy Spirit but still identifies them as God. \n\n### Imitators and examples\n\nIn [1:8](../01/08.md), Paul describes how the Thessalonians became “imitators” of the apostles and of Jesus. They became “imitators” when they suffered but still experienced joy from the Holy Spirit. Paul then describes how this behavior made them “examples” for other believers to imitate (see [1:7–8](../01/07.md)). Make sure that your translation indicates that the Thessalonians are imitating the apostles and Christ, which means that other people should imitate them. \n\n### The second coming\n\nIn [1:10](../01/10.md), Paul refers to the “second coming,” a specific day in the future in which Jesus will come back to earth, all dead people will come back to life, the world will be renewed, and God will judge people, punishing those who have sinned but rewarding those who believe in Jesus and obey him. Paul’s focus in this verse is especially on God’s judgment. Consider whether your readers will infer this information from what Paul says in [1:10](../01/10.md) or whether you should include some of this implied information.
1:1	ms5e		rc://*/ta/man/translate/figs-explicit	Παῦλος, καὶ Σιλουανὸς, καὶ Τιμόθεος; τῇ ἐκκλησίᾳ	1	Your language may have a particular way of introducing the author of a letter and its intended audience. For example, you may want to indicate that this is a letter. Alternate translation: “I, Paul, along with Silvanus and Timothy, wrote this letter to you, the church”
1:1	zivb		rc://*/ta/man/translate/figs-explicit	Παῦλος, καὶ Σιλουανὸς, καὶ Τιμόθεος	1	**Paul** is the author of this letter. **Silvanus and Timothy** are with him as he writes and are in agreement with what he writes. If it would be helpful in your language, you could make this idea more explicit. Alternate translation: “I, Paul, together with Silvanus and Timothy, write”
1:1	r7n0		rc://*/ta/man/translate/translate-names	Σιλουανὸς	1	The name **Silvanus** is a longer form of the name **Silas**, the form of the name used for this same man in the book of Acts. You could choose to use the shorter form here as well, or you could choose to use the longer form here and include a footnote explaining that they are forms of the same name.
1:1	z7wu		rc://*/ta/man/translate/figs-metaphor	ἐν Θεῷ Πατρὶ καὶ Κυρίῳ Ἰησοῦ Χριστῷ	1	Here Paul uses the spatial metaphor **in God the Father and the Lord Jesus Christ** to describe the union of believers with **God** and **Christ**. In this case, being **in God** and **Christ**, or united to God and Christ, identifies the Thessalonians as Christians. If it would be helpful in your language, you could use a phrase that indicates that the Thessalonians have a very close relationship with **God** and **Christ**. Alternative translation: “that is united to God the Father and the Lord Jesus Christ” or “in union with God the Father and the Lord Jesus Christ”
1:1	vlb3		rc://*/ta/man/translate/guidelines-sonofgodprinciples	Θεῷ Πατρὶ καὶ Κυρίῳ Ἰησοῦ Χριστῷ	1	When **God** is called **Father**, it highlights his relationship to **Jesus** as “Son” (See [1:10](../01/10.md)). Here, the Old Testament title for **God**, **Lord**, is applied to **Jesus**, equating him with **God**. Be sure to accurately translate these titles in your translation.
1:1	luw5		rc://*/ta/man/translate/translate-blessing	χάρις ὑμῖν καὶ εἰρήνη	1	After stating his name and the people to whom he is writing, Paul adds a blessing. Use a form that people would recognize as a blessing in your language. Alternate translation: “May you experience kindness and peace within you” or “I pray that you will have grace and peace”
1:1	qx70		rc://*/ta/man/translate/figs-abstractnouns	χάρις ὑμῖν καὶ εἰρήνη	1	If your language does not use abstract nouns for the ideas of **Grace** and **peace**, you could express the same ideas in another way. Alternate translation: “I pray that God will be favorable to you and give you a peaceful spirit”
1:1	nn67		rc://*/ta/man/translate/figs-you	ὑμῖν	1	Throughout this letter the word **you** is plural and refers to the Thessalonian believers, unless otherwise noted.
1:1	e5eu		rc://*/ta/man/translate/translate-textvariants	χάρις ὑμῖν καὶ εἰρήνη	1	Many ancient manuscripts read **Grace to you and peace**. The ULT follows that reading. Other ancient manuscripts read “Grace to you and peace from God our Father and the Lord Jesus Christ.” If a translation of the Bible exists in your region, you may wish to use the reading that it uses. If a translation of the Bible does not exist in your region, you may wish to use the reading of the ULT.
1:2	of3g		rc://*/ta/man/translate/figs-infostructure	εὐχαριστοῦμεν τῷ Θεῷ πάντοτε περὶ πάντων ὑμῶν, μνείαν ποιούμενοι ἐπὶ τῶν προσευχῶν ἡμῶν, ἀδιαλείπτως	1	Here Paul states what he, Silvanus, and Timothy do more specifically first (they **give thanks to God**) and then describes it more generally (they are **making mention** of the Thessalonians). If it would be clearer in your language, you could reverse the order of the clauses. Alternate translation: “We continually make mention of you in our prayers, always giving thanks to God for all of you”
1:2	o7cp		rc://*/ta/man/translate/figs-hyperbole	πάντοτε & ἀδιαλείπτως	1	Paul says **always** and **continually** here as generalizations for emphasis. If it would be helpful in your language, you could use a different way to express the emphasis. Alternate translation: “very regularly … extremely often”
1:2	ga1b		rc://*/ta/man/translate/figs-infostructure	μνείαν ποιούμενοι ἐπὶ τῶν προσευχῶν ἡμῶν, ἀδιαλείπτως	1	Here, the word **continually** could modify: (1) **making mention {of you}**. Alternate translation: “making mention of you continually in our prayers” (2) “remembering” in the following verse ([1:3](../01/03.md)). If you use the following alternate translation, you will need to omit the comma at the end of this verse. Alternate translation: “making mention of you in our prayers, continually”
1:3	ecw0		rc://*/ta/man/translate/figs-explicit	μνημονεύοντες ὑμῶν τοῦ ἔργου τῆς πίστεως, καὶ τοῦ κόπου τῆς ἀγάπης, καὶ τῆς ὑπομονῆς τῆς ἐλπίδος τοῦ Κυρίου ἡμῶν, Ἰησοῦ Χριστοῦ, ἔμπροσθεν τοῦ Θεοῦ καὶ Πατρὸς ἡμῶν;	1	Here, when Paul says that he and those with him are **remembering** things **before our God and Father**, he means that they are thanking God about specific things. If it would be helpful in your language, you could make this idea more explicit. Alternate translation: “gratefully mentioning to our God and Father your work of faith and labor of love and endurance of hope of our Lord Jesus Christ”
1:3	w769		rc://*/ta/man/translate/figs-abstractnouns	ὑμῶν τοῦ ἔργου τῆς πίστεως, καὶ τοῦ κόπου τῆς ἀγάπης, καὶ τῆς ὑπομονῆς τῆς ἐλπίδος τοῦ Κυρίου ἡμῶν, Ἰησοῦ Χριστοῦ	1	If your language does not use abstract nouns for the ideas of **faith**, **love**, **endurance**, and **hope**, you could express the same ideas in another way. Alternate translation: “how you work because you believe, and how you labor because you love, and how you endure because you hope in our Lord Jesus Christ”
1:3	s8as		rc://*/ta/man/translate/figs-possession	ὑμῶν τοῦ ἔργου τῆς πίστεως	1	Here, Paul could be using the possessive form to describe **work** that is: (1) a result of **faith**. Alternate translation: “your work produced by faith” (2) a proof of **faith**. Alternate translation: “your work that proves that you have faith”
1:3	tq4e		rc://*/ta/man/translate/figs-possession	τοῦ κόπου τῆς ἀγάπης	1	Here, Paul could be using the possessive form to describe **labor** that is: (1) a result of **love** for other believers. Alternate translation: “labor produced by love for others” (2) a result of **love** for God. Alternate translation: “labor produced by love for God” (3) a proof of **love**. Alternate translation: “labor that proves that you have love”
1:3	mshs		rc://*/ta/man/translate/figs-possession	τῆς ὑπομονῆς τῆς ἐλπίδος	1	Here, Paul could be using the possessive form to describe **endurance** that is: (1) a result of **hope**. Alternate translation: “endurance produced by hope” (2) a characteristic of **hope**. Alternate translation: “enduring hope”
1:3	kr8q		rc://*/ta/man/translate/figs-possession	τῆς ἐλπίδος τοῦ Κυρίου ἡμῶν, Ἰησοῦ Χριστοῦ	1	Here, Paul is using the possessive form to describe a **hope** that is about **our Lord Jesus Christ**. If it would be helpful in your language, you could express the idea in another way. Alternate translation: “of hope in our Lord Jesus Christ”
1:3	tvrg		rc://*/ta/man/translate/figs-hendiadys	τοῦ Θεοῦ καὶ Πατρὸς ἡμῶν	1	Here, **our God and Father** refers to the one divine person who is both God and Father. The word **God** and the word **Father** refer to the same person. If it would be helpful in your language, you could make this idea more explicit. Alternate translation: “God our Father” or “our Father God”
1:3	v01e		rc://*/ta/man/translate/figs-exclusive	ἡμῶν	1	Here, the word **our** includes Paul, Silvanus, Timothy, the Thessalonians, and all believers. Your language may require you to mark this form.
1:4	psc4		rc://*/ta/man/translate/grammar-connect-logic-result	εἰδότες	1	Here, the word **knowing** introduces a reason why Paul and those with him give thanks to God (see [1:2](../01/02.md)). If it would be helpful in your language, you could use a word or phrase that introduces a reason. Alternate translation: “that is because we know” or “since we know”
1:4	erb6		rc://*/ta/man/translate/figs-metaphor	ἀδελφοὶ	1	Paul is using the term **brothers** to mean people who share the same faith. If it would be helpful in your language, you could state the meaning plainly. Alternate translation: “believers”
1:4	egkq		rc://*/ta/man/translate/figs-gendernotations	ἀδελφοὶ	1	Although the term **brothers** is masculine, Paul is using the word in a generic sense that includes both men and women. If it would be helpful in your language, you could use a phrase that makes this clear. Alternate translation: “brothers and sisters”
1:4	j08t		rc://*/ta/man/translate/figs-activepassive	ἠγαπημένοι ὑπὸ τοῦ Θεοῦ	1	If your language does not use this passive form, you could express the idea in active form or in another way that is natural in your language. Alternate translation: “whom God is loving”
1:4	ohtl		rc://*/ta/man/translate/figs-abstractnouns	τὴν ἐκλογὴν ὑμῶν,	1	If your language does not use an abstract noun for the idea of **election**, you could express the same idea in another way. Alternate translation: “that you have been chosen” or “that God has selected you”
1:5	jxfs		rc://*/ta/man/translate/grammar-connect-logic-result	ὅτι	1	Here, **because** introduces a reason why Paul and those with him are sure about the Thessalonians’ “election” (see [1:4](../01/04.md)). If it would be helpful in your language, you could use a word or phrase that introduces a reason for a previous statement. Alternate translation: “which we are sure about because”
1:5	ude4		rc://*/ta/man/translate/figs-personification	τὸ εὐαγγέλιον ἡμῶν οὐκ ἐγενήθη εἰς ὑμᾶς	1	Here, Paul speaks of **our gospel** as if it were a person who could **come to you**. He means that the Thessalonians heard the gospel from Paul and his fellow workers. If it would be helpful in your language, you could state the meaning plainly. Alternate translation: “you did not receive our gospel”
1:5	sm4j		rc://*/ta/man/translate/figs-metonymy	ἐν λόγῳ	1	Paul is using the term **word** to refer to speaking words. If it would be helpful in your language, you could state the meaning plainly. Alternate translation: “in speech” or “in spoken words”
1:5	t1w3		rc://*/ta/man/translate/figs-abstractnouns	ἐν δυνάμει, καὶ ἐν Πνεύματι Ἁγίῳ, καὶ πληροφορίᾳ πολλῇ	1	If your language does not use abstract nouns for the ideas of **power** and **assurance**, you could express the same ideas in another way. Alternate translation: “in us acting powerfully and in the Holy Spirit working and in us being fully assured”
1:5	kjin		rc://*/ta/man/translate/figs-explicit	ἐν δυνάμει, καὶ ἐν Πνεύματι Ἁγίῳ, καὶ πληροφορίᾳ πολλῇ	1	Here Paul could mean that: (1) Paul and those with him preached the gospel with **power** and with the help of **the Holy Spirit** and with **much assurance** that what they preached was true. Alternate translation: “we preached with power and with the Holy Spirit and with much assurance that it is true” (2) the Thessalonians experienced **power** and **the Holy Spirit** and **much assurance** when they heard the gospel. Alternate translation: “you experienced its power and the presence of the Holy Spirit and much assurance that it is true”
1:5	wdr7		rc://*/ta/man/translate/figs-explicit	καθὼς οἴδατε οἷοι	1	Here, the phrase **just as you know** could introduce: (1) a basis for Paul’s claim about how the Thessalonians experienced the gospel. Alternate translation: “and you know that is true because you remember what kind of men” (2) a comparison between what Paul has said about how the Thessalonians experienced the gospel and what the Thessalonians know about Paul and his fellow workers. Alternate translation: “and that fits with what you know about what kind of men”
1:6	kgjr		rc://*/ta/man/translate/figs-rpronouns	ὑμεῖς & ἐγενήθητε	1	Here, the word translated **yourselves** emphasizes **you**. Consider using a natural way to emphasize **you** in your language. Alternate translation: “you indeed became” or “it is you who became”
1:6	cs49		rc://*/ta/man/translate/grammar-connect-time-simultaneous	δεξάμενοι	1	Here, the phrase **having received** could introduce: (1) the way in which the Thessalonians **became imitators**. Alternate translation: “that is, you received” (2) when the Thessalonians **became imitators**. Alternate translation: “which you did when you received”
1:6	c2hl		rc://*/ta/man/translate/figs-metonymy	τὸν λόγον	1	Here, **the word** represents a message that is made up of words, specifically the gospel. If it would be helpful in your language, you could express the idea in another way. Alternate translation: “the gospel message” or “the words of the gospel”
