Reference	ID	Tags	SupportReference	Quote	Occurrence	Note
front:intro	wy83				0	# Introduction to 1 Timothy\n\n## Part 1: General Introduction\n\n### Outline of the Book of 1 Timothy\n\nIn this letter, Paul alternates between personal commands to Timothy that empower him to act as his representative and with his authority, and instructions for how followers of Jesus should live in community.\n\n1. Greetings (1:1–2)\n2. Paul commands Timothy to tell people not to teach false doctrines (1:3–20)\n3. Paul gives instructions about how to re-establish order and decency in the church (2:1–15)\n4. Paul gives instructions about how to ensure that elders and deacons are properly qualified (3:1–13)\n5. Paul commands Timothy regarding his own personal conduct (3:14–5:2)\n6. Paul gives instructions to ensure church support for worthy widows (5:3–16) and elders (5:17–20)\n7. Paul commands Timothy that he must be impartial (5:21–25)\n8. Paul gives instructions to ensure order in master-servant relationships (6:1–2a)\n9. Paul commands Timothy regarding how he should teach and conduct himself (6:2b–16)\n10. Paul gives instructions for how people who are rich should live (6:17–19)\n11. Paul commands Timothy to guard what has been entrusted to his care (6:20–21a)\n12. Closing blessing to the whole church (6:21b)\n\n### Who wrote the Book of 1 Timothy?\n\nA man named Paul wrote 1 Timothy. Paul was from the city of Tarsus. He had been known as Saul in his early life. Before becoming a Christian, Paul was a Pharisee. He persecuted Christians. After he became a Christian, he traveled several times throughout the Roman Empire telling people about Jesus.\n\nPaul may have written other letters to Timothy, but this is the earliest one that we still have. That is why it is known as 1 Timothy or First Timothy. Timothy was Paul’s disciple and close friend. Paul probably wrote this letter near the end of his life.\n\n### What is the Book of 1 Timothy about?\n\nPaul had left Timothy in the city of Ephesus to help the believers there. Paul wrote this letter to instruct Timothy about various matters. The topics he addressed included church worship, qualifications for church leaders, and warnings against false teachers. This letter shows how Paul was training Timothy to be a leader among the churches while Timothy himself trained other leaders.\n\n### How should the title of this book be translated?\n\nTranslators may choose to call this book by its customary title, “1 Timothy” or “First Timothy.” Or they may choose a different title, such as “Paul’s First Letter to Timothy.” (See: [[rc://*/ta/man/translate/translate-names]])\n\n## Part 2: Important Religious and Cultural Concepts\n\n### What is discipleship?\n\nDiscipleship is the process of making people to be disciples of Christ. The goal of discipleship is to encourage other Christians to be more like Christ. This letter gives many instructions about how a leader should train a less mature Christian. (See: [[rc://*/tw/dict/bible/kt/disciple]])\n\n## Part 3: Important Translation Issues\n\n### What did Paul mean by the expression “in Christ”?\n\nPaul meant to express the idea of a very close union with Christ and the believers. Please see the introduction to the Book of Romans for more details about this kind of expression.\n\n### What are the major textual issues in the text of the book of 1 Timothy?\n\nIn [6:5](../06/05.md), the oldest Greek manuscripts differ from later Greek manuscripts. Modern translations may also differ depending on the Greek manuscript that they translate from. The ULT text translates the Greek from the oldest manuscripts and puts the differences from later manuscripts in a footnote. If a translation of the Bible exists in the general region, translators should consider following the decision in that translation. If not, translators are advised to follow the oldest Greek manuscripts as reflected in the ULT text. (See: [[rc://*/ta/man/translate/translate-textvariants]])
1:intro	a4v2				0	# 1 Timothy 1 General Notes\n\n## Structure and formatting\n\nPaul formally introduces this letter in verses 1–2. Writers often began letters in this way in the ancient Near East.\n\n## Special concepts in this chapter\n\n### Spiritual children\n\nIn this chapter, Paul calls Timothy a “son” and his “child.” Paul discipled Timothy as a Christian and a church leader. Paul may also have led him to believe in Christ. Therefore, Paul called Timothy his “son in the faith.” (See: [[rc://*/tw/dict/bible/kt/disciple]], [[rc://*/tw/dict/bible/kt/faith]] and [[rc://*/tw/dict/bible/kt/spirit]] and [[rc://*/ta/man/translate/figs-metaphor]])\n\n### Metaphor\n\nIn this chapter Paul speaks of people who are not fulfilling the purpose of their faith as if they had “missed the mark” that they were aiming at, as if they had “turned away” down a wrong path, and as if they had been “shipwrecked.” He speaks of following Jesus faithfully as “fighting the good fight.”
1:1	i3zz		rc://*/ta/man/translate/figs-123person\t	Παῦλος, ἀπόστολος	1	In this culture, letter writers would give their own names first, referring to themselves in the third person. If it would be helpful in your language, you could use the first person here. Or if your language has a particular way of introducing the author of a letter, and if it would be helpful to your readers, you could use it here. Alternate translation: “From Paul. I am an apostle”\n
1:1	xl6d		rc://*/ta/man/translate/figs-abstractnouns	κατ’ ἐπιταγὴν Θεοῦ Σωτῆρος ἡμῶν, καὶ Κυρίου Ἰησοῦ Χριστοῦ	1	If your language does not use an abstract noun for the idea of **command**, you could express the same idea in another way. Alternate translation: “as it was commanded by God our Savior and by the Lord Jesus Christ”
1:1	wb8j		rc://*/ta/man/translate/figs-possession	Σωτῆρος ἡμῶν	1	Here, Paul is using the possessive form to describe a **Savior** who saves us. If this is not clear in your language, you could express the idea in another way. Alternate translation: “who saves us”
1:1	sw77		rc://*/ta/man/translate/figs-metonymy	Κυρίου Ἰησοῦ Χριστοῦ τῆς ἐλπίδος ἡμῶν	1	Here, **our hope** refers to the person in whom we have hope. If it would be helpful in your language, you could use an equivalent expression from your language or state the meaning plainly.  Alternate translations: “of the Lord Jesus Christ, the one in whom we have hope”\n
1:1	kdwn		rc://*/ta/man/translate/figs-abstractnouns	Χριστοῦ τῆς ἐλπίδος ἡμῶν	1	If your language does not use an abstract noun for the idea of **hope**, you could express the same idea in another way. Alternate translation: “Christ, in whom we hope”
1:2	p3h5		rc://*/ta/man/translate/figs-123person	Τιμοθέῳ	1	In this culture, after giving their own names, letter writers would name those to whom they sent the letter, referring to them in the third person. If that is confusing in your language, you could use the second person here. Or if your language has a particular way of introducing the recipient of a letter, and if it would be helpful to your readers, you could use it here. Alternate translation: “This letter is for you, Timothy”
1:2	pyi6		rc://*/ta/man/translate/figs-metaphor	γνησίῳ τέκνῳ	1	Paul speaks of his close relationship to Timothy as though Timothy were his **genuine child**. Paul means that he is Timothy’s spiritual father, and Paul loves Timothy in the way a father loves his **child**. If it would be helpful in your language, you could express the idea in simile form or state the meaning plainly. Alternate translation: “who is like a genuine child to me” or “truly my spiritual son”
1:2	lf30		rc://*/ta/man/translate/translate-unknown	γνησίῳ	1	Here, the word **genuine** indicates that the **child** is considered to be someone’s child in the full legal sense. Someone who was born to a woman who was not married would not be considered **genuine** for example. In the context of the metaphor, the word indicates that Timothy has acted as he should have toward Paul. If your readers would not be familiar with the concept of a **genuine child**, you could use the name of a similar concept in your culture or you could use a more general phrase. Alternate translation: “legitimate” or “true”
1:2	sbnq		rc://*/ta/man/translate/figs-abstractnouns	ἐν πίστει	1	If your language does not use an abstract noun for the idea of **faith**, you could express the same idea in another way. Alternate translation: “since we both believe” or “as we together believe”
1:2	rd5v		rc://*/ta/man/translate/translate-blessing	χάρις, ἔλεος, εἰρήνη ἀπὸ Θεοῦ Πατρὸς καὶ Χριστοῦ Ἰησοῦ τοῦ Κυρίου ἡμῶν	1	After stating his name and the name of the person to whom he is writing, Paul adds a blessing for Timothy. Use a form that people would recognize as a blessing in your language. Alternate translation: “May you experience grace, mercy, and peace from God the Father and Christ Jesus our Lord” or “I pray that grace, mercy, and peace from God the Father and Christ Jesus our Lord will always be with you”\n
1:2	zx37		rc://*/ta/man/translate/figs-abstractnouns	χάρις, ἔλεος, εἰρήνη ἀπὸ Θεοῦ Πατρὸς καὶ Χριστοῦ Ἰησοῦ τοῦ Κυρίου ἡμῶν	1	If your language does not use abstract nouns for the ideas of **Grace**, **mercy**, and **peace**, you could express the same ideas in another way. Alternate translation: “May you be treated graciously, mercifully, and peacefully by God the Father and by Christ Jesus our Lord”
1:2	p4lz		rc://*/ta/man/translate/guidelines-sonofgodprinciples	Θεοῦ Πατρὸς	1	**Father** is an important title for **God the Father** that describes his relationship with **Jesus**, his Son.
1:3	k4tm			καθὼς παρεκάλεσά σε	1	Alternate translation: “As I told you”
1:3	k35a		rc://*/ta/man/translate/figs-yousingular	σε	1	In this letter, with one exception, the words **you**, “your,” and “yourself” refer to Timothy and so are singular. A note will discuss the one exception in [6:21](../06/21.md).
1:3	amp4			προσμεῖναι ἐν Ἐφέσῳ	1	Alternate translation: “wait for me there in the city of Ephesus”
1:3	t113			τισὶν	1	Alternate translation: “certain people”
1:3	v4g2		rc://*/ta/man/translate/figs-explicit	ἑτεροδιδασκαλεῖν	1	The implication is that these people were not teaching in a different way, but teaching different things than what Paul and Timothy taught. If it would be helpful to your readers, you could state that explicitly. Alternate translation: “a different doctrine from what we teach”
1:4	pw2h			μύθοις	1	These **myths** were fanciful stories of some kind, perhaps about the supposed exploits of various spiritual beings. But since we no longer know exactly what these stories were about, it would probably be best to use a general term for them. Alternate translation: “made-up stories”
1:4	qpv9		rc://*/ta/man/translate/figs-hyperbole	γενεαλογίαις ἀπεράντοις	1	Paul uses the term **endless** as an exaggeration to emphasize that these are very long. Alternate translation: “lists of names that seem as if they will never end”
1:4	ft33			γενεαλογίαις	1	Usually, the term **genealogies** refers to a record of a person’s ancestors. However, in this case it could also mean a record of the supposed ancestors of spiritual beings. Alternate translation: “lists of names”
1:4	qb9l			αἵτινες ἐκζητήσεις παρέχουσι	1	The people were debating about these stories and lists of names, but no one could know for certain whether they were true. Alternate translation: “these make people disagree angrily”
1:4	eu9f		rc://*/ta/man/translate/figs-abstractnouns	οἰκονομίαν Θεοῦ	1	If it would be helpful in your language, you could express the idea behind this phrasebehind the abstract noun **stewardship** with a concrete noun such as “plan” or “work.” Alternate translations: “helping us to understand God’s plan to save us” or “helping us to do God’s work”
1:4	p2sr		rc://*/ta/man/translate/figs-abstractnouns	τὴν ἐν πίστει	1	If it would be helpful in your language, you could express the idea behind the word **faith** with a verb such as “trust” or “believe.” Alternate translations: “which we learn by believing in God” or “which we do by trusting in God”
1:5	myi5			δὲ	1	Paul here uses the word **Now** to introduce background information that will help Timothy understand the purpose of what he is commanding him. You can translate it with a word or phrase in your language that introduces background information.
1:5	iwnk		rc://*/ta/man/translate/grammar-connect-logic-goal	τὸ δὲ τέλος τῆς παραγγελίας ἐστὶν	1	Here Paul is expressing to Timothy the **goal** or the outcome that he desires from the commands that Paul gave him. Alternate translation: “I am commanding these things in order to get this result”
1:5	l7un			τῆς παραγγελίας	1	Here, **this command** refers to the instructions that Paul has given Timothy in [1:3](../01/03.md) and [1:4](../01/04.md).
1:5	i9rs		rc://*/ta/man/translate/figs-explicit	ἐστὶν ἀγάπη	1	That God’s people would show **love** is the goal of the command. If it is necessary to include the object of “love,” you could state “each other” or “others.” This may also include love for God. Alternate translation: “is that God’s people would love others”
1:5	t123		rc://*/ta/man/translate/figs-metaphor	ἐκ καθαρᾶς καρδίας	1	Here the **heart** represents a person’s thoughts and inclinations. Alternate translation: “from a desire for only what is good”
1:5	mbe6		rc://*/ta/man/translate/figs-metonymy	ἐκ καθαρᾶς καρδίας	1	Here, **pure** indicates that the person wants only good things and does not have mixed motives that also include some bad ones. Alternate translation: “from a desire for only what is good”
1:5	ar8t			συνειδήσεως ἀγαθῆς	1	Your translation should make it clear that love is the one goal of the command and is followed by three things that lead to this love. This is the second thing, after “a pure heart.” Alternate translation: “and from a conscience that leads a person to choose right instead of wrong”
1:5	m53g			πίστεως ἀνυποκρίτου	1	Paul presents **a sincere faith** as the third thing that leads to love, which is the one goal of the command. It is not a third goal of the command. Alternate translations: “and from faith that is genuine” or “and from faith that is without hypocrisy”
1:5	zziu		rc://*/ta/man/translate/figs-abstractnouns	πίστεως ἀνυποκρίτου	1	If it would be helpful in your language, you could express the idea behind the phrase **a sincere faith** by expressing the abstract noun **faith** with a verb such as “trust” or “believe.” Here, **faith** could refer to: (1) trust in God. (2) belief in true teaching about God. Alternate translations: “firmly trusting in God” or “sincerely believing the true message about God”
1:6	j4z3		rc://*/ta/man/translate/figs-metaphor	τινες ἀστοχήσαντες	1	Paul speaks of faith in Christ as if it were a target that people should aim at. Paul means that some people are not fulfilling the purpose of their faith, which is to love, as he has just explained. Alternate translation: “some people, who are not fulfilling the purpose of faith in Jesus”
1:6	se38		rc://*/ta/man/translate/figs-metaphor	ἐξετράπησαν εἰς	1	Here, **turned away** means these people have stopped doing what God has commanded. Alternate translation: “are no longer doing what God commands. Instead of that, they just engage in”
1:7	v28u		rc://*/ta/man/translate/figs-explicit	νομοδιδάσκαλοι	1	Here, **law** refers specifically to the law of Moses. If it would be helpful to your readers, you could state that explicitly, as in the UST.
1:7	kz8x		rc://*/ta/man/translate/grammar-connect-logic-contrast	μὴ νοοῦντες	1	If the contrast is not clear in your language between what these people want to be (teachers of the law) and their ability to do it, you may want to mark the contrast. Alternate translations: “but not understanding” or “and yet they do not understand”
1:7	t131		rc://*/ta/man/translate/figs-doublenegatives	μὴ & μήτε & μήτε	1	Paul uses a triple negative in Greek for emphasis here, “not … neither … nor.” None of these negatives cancel each other to create a positive meaning. Instead, the negative meaning is retained throughout. If your language uses double negatives for emphasis that do not cancel one another, it would be appropriate to use that construction here.
1:7	t132		rc://*/ta/man/translate/figs-parallelism	ἃ λέγουσιν, μήτε περὶ τίνων διαβεβαιοῦνται	1	These two phrases mean similar things. Paul uses the repetition for emphasis. You do not need to put both phrases in your translation if that might be confusing for your readers. Alternate translation: “the things that they say so confidently are true”
1:8	d6dz			οἴδαμεν δὲ ὅτι καλὸς ὁ νόμος	1	Alternate translations: “we understand that the law is useful” or “we understand that the law is beneficial”
1:8	t134		rc://*/ta/man/translate/figs-exclusive	οἴδαμεν	1	In this letter, Paul uses the words **we**, “us,” and “our” to refer either to Timothy and himself, or else to all believers, which would also include the two of them. So generally, these words include the addressee. A note will discuss the one possible exception in [4:10](../04/10.md).
1:8	r86g			ἐάν τις αὐτῷ νομίμως χρῆται	1	Alternate translations: “if a person uses it correctly” or “if a person uses it in the way that God intended”
1:9	xs94			εἰδὼς τοῦτο	1	Alternate translation: “we also know this”
1:9	fq4i		rc://*/ta/man/translate/figs-activepassive	δικαίῳ νόμος οὐ κεῖται	1	If it would be helpful in your language, you could express this passive phrase with an active form, and you could state who did the action. Alternate translation: “God did not make the law for people who are righteous”
1:9	dl5l		rc://*/ta/man/translate/figs-nominaladj	δικαίῳ	1	Paul is using the adjective **righteous** as a noun, to refer to a class of people that it describes. If it would be helpful in your language, you could express this term by translating it with a noun phrase. Alternate translation: “for people who are righteous”
1:9	t139		rc://*/ta/man/translate/figs-nominaladj	ἀνόμοις δὲ καὶ ἀνυποτάκτοις, ἀσεβέσι καὶ ἁμαρτωλοῖς, ἀνοσίοις καὶ βεβήλοις	1	Paul is also using these adjectives as nouns to refer to the classes of people that they describe. If it would be helpful in your language, you could express this phrase by translating each of these adjectives with a noun phrase. Alternate translation: “people who break the law, people who defy authority, people who do not honor God, people who commit sins, people who live as if God did not matter, people who live as if nothing was sacred”
1:9	t141			πατρολῴαις καὶ μητρολῴαις, ἀνδροφόνοις	1	In this list Paul uses several compound words to express his meaning concisely and vividly. In each case the first term in the compound, a noun, is the object of the second term in the compound, a verb. Three of these compound words are in this verse, and two more are in the next verse. If it would be helpful in your language, you could express these terms by translating them either with single terms or with phrases. Alternate translations: “patricides and matricides, murders” or “people who kill other people, even their own fathers and mothers”
1:9	t142		rc://*/ta/man/translate/figs-gendernotations	ἀνδροφόνοις	1	Paul uses the term **man** here in a generic sense that includes both men and women. Alternate translation: “murderers”
1:10	y5dx		rc://*/ta/man/translate/figs-nominaladj	πόρνοις	1	Paul is using the adjective **immoral** as a noun to refer to a class of people that it describes. If it would be helpful in your language, you could express this term by translating it with a noun phrase. Alternate translation: “people who have sexual relations outside of marriage”
1:10	v1gh		rc://*/ta/man/translate/figs-idiom	ἀρσενοκοίταις	1	The term **male-liers** is the fourth compound word on the list. The term “lie” means to have sexual relations. Alternate translation: “men who have sexual relations with other males”
1:10	bzw4		rc://*/ta/man/translate/figs-gendernotations	ἀνδραποδισταῖς	1	The term **man-stealers** is the fifth and last compound word on the list. Paul uses the term **man** here in a generic sense that includes both men and women. Alternate translation: “people who kidnap other people to sell them as slaves”
1:10	gg42			καὶ εἴ τι ἕτερον τῇ ὑγιαινούσῃ διδασκαλίᾳ ἀντίκειται	1	Here Paul leaves out some of the words that, in many languages, a sentence would need to be complete. He means that if anything else is contrary to healthy teaching, then the law is made for people who do that, too. Alternate translation: “and for people who do anything else that is against wholesome teaching”
1:10	t147		rc://*/ta/man/translate/figs-metonymy	τῇ ὑγιαινούσῃ διδασκαλίᾳ	1	The phrase **healthy teaching** is a figurative way to say that the teaching is good and reliable in every way and has no defect or corruption. A person with a healthy mind would recognize this teaching as correct. Alternate translation: “correct teaching”
1:11	mg4t			τὸ εὐαγγέλιον τῆς δόξης τοῦ μακαρίου Θεοῦ	1	This phrase could mean one of two things. Alternate translations: “the gospel about the glory that belongs to the blessed God” or “the glorious gospel about the blessed God”
1:11	a58d		rc://*/ta/man/translate/figs-activepassive	ὃ ἐπιστεύθην ἐγώ	1	If it would be helpful in your language, you could express what had been entrusted to Paul with an active form, and you could state who did the action. Alternate translation: “for which God made me responsible”
1:12	t150			χάριν ἔχω	1	Alternate translation: “I am thankful”
1:12	uu6n			πιστόν με ἡγήσατο	1	Alternate translation: “he believed that he could rely on me”
1:12	ff1n		rc://*/ta/man/translate/figs-metaphor	θέμενος εἰς διακονίαν	1	Paul speaks of the task of serving God as if it were a location that one could be placed in. Alternate translations: “he assigned me to serve him” or “he appointed me as his servant”
1:13	q75p		rc://*/ta/man/translate/figs-explicit	ὄντα βλάσφημον	1	Paul is referring to his character before he believed in Jesus. He is probably referring to how he used to say that Jesus was not the Messiah and that people should not believe in him. Alternate translation: “I was a person who said wrong things about Jesus”
1:13	gbd4		rc://*/ta/man/translate/figs-explicit	διώκτην	1	Paul is referring to his character before he believed in Jesus. Alternate translation: “a person who persecuted those who believed in Jesus”
1:13	k85c		rc://*/ta/man/translate/figs-explicit	ὑβριστήν	1	Paul is referring to his character before he believed in Jesus. Alternate translations: “a violent person” or “a person who used violence against those who believed in Jesus”
1:13	rq2m		rc://*/ta/man/translate/grammar-connect-logic-result	ἠλεήθην, ὅτι ἀγνοῶν, ἐποίησα ἐν ἀπιστίᾳ	1	If it would be helpful in your language, you could change the order of these phrases since the second phrase, “not knowing,” gives the reason for the action that the first phrase, “I was shown mercy,” describes. Alternate translation: “I did not act the way God would have trusted me to act, but that was because I did not know what I was doing, and so Jesus had mercy on me”
1:13	nv6k		rc://*/ta/man/translate/figs-activepassive	ἠλεήθην	1	If it would be helpful in your language, you could express who showed **mercy** to Paul with an active form, and you could state who did the action. Alternate translation: “Jesus had mercy on me”
1:14	t158			δὲ	1	Paul here uses the word **Indeed** to introduce an expanded description of the way Jesus treated him mercifully even though he persecuted the followers of Jesus. This description will help Timothy and the other believers in Ephesus to understand how great the mercy of Jesus is. Alternate translation: “in fact”
1:14	c1lg		rc://*/ta/man/translate/figs-metaphor	ὑπερεπλεόνασεν & ἡ χάρις τοῦ Κυρίου ἡμῶν	1	Paul speaks of the **grace** of Jesus as if it were a liquid that fills a container until it flows over the top. Alternate translation: “Jesus showed me unlimited grace”
