Reference	ID	Tags	SupportReference	Quote	Occurrence	Note
4:intro	ys57				0	# Jonah 4 General Notes\n\n## Structure and Formatting\n\nJonah continues the narrative while bringing the book to what seems like an unusual end. This emphasizes that the book is not really about Jonah. It is about God’s desire to be merciful to everyone, whether Jew or pagan. (See: [[rc://*/tw/dict/bible/kt/mercy]])\n\n## Special Concepts in this Chapter\n\n### Prophecy not coming true\n\nIt is important to see the relationship between a prophet and Yahweh. A prophet was to prophesy for Yahweh, and his words must come true. According to the law of Moses, if that did not happen, the penalty was death, because that shows that he was not a real prophet. But when Jonah told the city of Nineveh that it was going to be destroyed in 40 days, it did not happen at that time. This is because God reserves the right to be merciful. (See: [[rc://*/tw/dict/bible/kt/prophet]] and [[rc://*/tw/dict/bible/kt/lawofmoses]])\n\n## Jonah’s anger\n\nWhen God did not destroy Nineveh, Jonah was angry with God because Jonah hated the people of Nineveh. They were enemies of Israel. But God wanted Jonah and the readers of this book to learn that God loves all people.\n\n## Important Figures of Speech in this Chapter\n\n### Rhetorical questions\n\nAs in other places, Jonah asks rhetorical questions to show how angry he was at Yahweh. (See: [[rc://*/ta/man/translate/figs-rquestion]])\n\n### Parallel to Mount Sinai\n\nIn verse 2, Jonah attributes a series of characteristics to God. A Jewish reader of this book would recognize this as a formula Moses used in speaking about God when he was meeting God on Mount Sinai. (See: [[rc://*/ta/man/translate/figs-explicit]])\n\n## Other Possible Translation Difficulties in this Chapter\n\n### God’s grace\n\nWhen Jonah went outside the city, he got very hot; God graciously provided some relief through the plant. God was trying to teach Jonah through an object lesson. It is important for the reader to see this clearly. (See: [[rc://*/tw/dict/bible/kt/grace]])
4:1	jdr8		rc://*/ta/man/translate/writing-newevent	וַ⁠יֵּ֥רַע אֶל־יוֹנָ֖ה רָעָ֣ה גְדוֹלָ֑ה וַ⁠יִּ֖חַר לֽ⁠וֹ׃	1	The author is using the word translated **But** to introduce a new event in the story. This sentence introduces the next part of the story, where Jonah responds to God saving the city of Nineveh. Use a word, phrase, or other method in your language that is natural for introducing a new event. Alternate translation: “Now” 
4:1	abc3		rc://*/ta/man/translate/figs-idiom	וַ⁠יִּ֖חַר לֽ⁠וֹ	1	The phrase **it burned to him** is an idiom that speaks of Jonah’s anger as if it were a fire burning inside him. Alternate translation: “and he was very angry”
4:2	q6bb		rc://*/ta/man/translate/figs-exclamations	אָנָּ֤ה	1	This is an exclamation that is emphasizing intense frustration. Use an exclamation that would communicate that meaning in your language. 
4:2	k24b		rc://*/ta/man/translate/figs-rquestion	יְהוָה֙ הֲ⁠לוֹא־זֶ֣ה דְבָרִ֗⁠י עַד־הֱיוֹתִ⁠י֙ עַל־אַדְמָתִ֔⁠י	1	Jonah used this rhetorical question to tell God how angry he was. If you would not use the question form for this purpose in your language, you could translate this as a statement or an exclamation. Alternate translation: “Yahweh, this is what I said when I was still in my own country”
4:2	ab79		rc://*/ta/man/translate/figs-explicit	יְהוָה֙ הֲ⁠לוֹא־זֶ֣ה דְבָרִ֗⁠י עַד־הֱיוֹתִ⁠י֙ עַל־אַדְמָתִ֔⁠י	1	The implication is that Jonah correctly foretold what would happen. You could include this information if that would be helpful to your readers. What Jonah said when he was back in his own country can be stated explicitly. Alternate translation: “now Yahweh, when I was still in my own country, I knew that if I warned the people of Nineveh, they would repent, and you would not destroy them”
4:2	ab81		rc://*/ta/man/translate/figs-idiom	אֶ֤רֶךְ אַפַּ֨יִם֙	1	The phrase **long of nostrils** is an idiom meaning that Yahweh does not get angry quickly. If this phrase does not have that meaning in your language, you could use an idiom from your language that does have this meaning or state the meaning plainly. Alternate translation: “slow to get angry” or “very patient”
4:2	jv5c			וְ⁠רַב־חֶ֔סֶד	1	Alternate translation: “and very faithful” or “and full of love for your people”
4:2	wl7j		rc://*/ta/man/translate/figs-explicit	וְ⁠נִחָ֖ם עַל־הָ⁠רָעָֽה	1	Here, **evil** refers to the physical destruction of the city of Nineveh and its people. It does not refer to moral evil. In this context, this phrase means that God feels sadness about causing bad things to happen to people who sin, and he acts differently when sinners repent of their sin. You could include this information if that would be helpful to your readers. Alternate translation: “and you feel sadness about causing disaster for sinners” or “and you decide not to punish sinners who repent”
4:3	dm5t		rc://*/ta/man/translate/figs-explicit	קַח־נָ֥א אֶת־נַפְשִׁ֖⁠י מִמֶּ֑⁠נִּי	1	Jonah’s reason for wanting to die, that now God will not punish his former enemies, can be stated explicitly. You could include this information if that would be helpful to your readers. Alternate translation: “since you will not destroy Nineveh as you said you would, please allow me to die”
4:3	yk5v			כִּ֛י ט֥וֹב מוֹתִ֖⁠י מֵ⁠חַיָּֽ⁠י	1	Alternate translation: “for I would prefer to die rather than to live” or “because I want to die. I do not want to live”
4:4	ab82		rc://*/ta/man/translate/figs-idiom	הַ⁠הֵיטֵ֖ב חָ֥רָה לָֽ⁠ךְ	1	The phrase **it burns to you** is an idiom that speaks of Jonah’s anger as if it were a fire burning inside him. If this phrase does not have that meaning in your language, you could use an idiom from your language that does have this meaning or state the meaning plainly. See how you translated it in [4:1](../04/01.md). Alternate translation: “is it right for you to be angry about this”
4:4	ab83		rc://*/ta/man/translate/figs-explicit	הַ⁠הֵיטֵ֖ב חָ֥רָה לָֽ⁠ךְ	1	The reason for Jonah’s anger can be made explicit. You could include this information if that would be helpful to your readers. Alternate translation: “Is it right for you to be angry that I did not destroy Nineveh”
4:5	q1f7			וַ⁠יֵּצֵ֤א יוֹנָה֙ מִן־הָ⁠עִ֔יר	1	Alternate translation: “then Jonah left the city of Nineveh”
4:5	af46		rc://*/ta/man/translate/figs-explicit	מַה־יִּהְיֶ֖ה בָּ⁠עִֽיר	1	The implication is that Jonah wanted to see whether God would destroy the city or not. You could include this information if that would be helpful to your readers. Alternate translation: “what would become of the city” or “what God would do to the city”
4:6	i4r4			מֵ⁠עַ֣ל לְ⁠יוֹנָ֗ה לִֽ⁠הְי֥וֹת צֵל֙ עַל־רֹאשׁ֔⁠וֹ	1	Alternate translation: “over Jonah’s head for shade”
4:6	t21k			לְ⁠הַצִּ֥יל ל֖⁠וֹ מֵ⁠רָֽעָת֑⁠וֹ	1	Here the term **evil** could mean two things (or both at the same time). It could mean: (1) “discomfort” or “distress,” meaning the intense heat of the sun shining on Jonah’s head. Alternate translation: “to protect Jonah from the heat of the sun” (2) “wrong,” meaning Jonah’s wrong attitude concerning God’s decision not to destroy Nineveh. Alternate translation: “to save Jonah from his wrong attitude” If both meanings can be preserved, that is preferable. Alternate translation: “to save Jonah from his wrong attitude”
4:7	t7il			וַ⁠יְמַ֤ן הָֽ⁠אֱלֹהִים֙ תּוֹלַ֔עַת	1	Alternate translation: “then God sent a worm”
4:7	rw7z			וַ⁠תַּ֥ךְ אֶת־הַ⁠קִּֽיקָי֖וֹן	1	Alternate translation: “and the worm chewed the plant”
4:7	d16m		rc://*/ta/man/translate/figs-explicit	וַ⁠יִּיבָֽשׁ	1	The implication of **it withered** is that the plant became dry and died and would no longer shelter Jonah from the hot sun. You could include this information if that would be helpful to your readers. Alternate translation: “so that the plant died”
4:8	jdr9		rc://*/ta/man/translate/grammar-connect-time-background	וַ⁠יְהִ֣י׀ כִּ⁠זְרֹ֣חַ הַ⁠שֶּׁ֗מֶשׁ	1	This clause provides background information about the time of day to help readers understand what happens next in the story. In your translation, present this information in a way that makes it clear that this is background information.
4:8	hmi4		rc://*/ta/man/translate/figs-explicit	וַ⁠יְמַ֨ן אֱלֹהִ֜ים ר֤וּחַ קָדִים֙ חֲרִישִׁ֔ית	1	The implication is that **a hot east wind** will  make Jonah very uncomfortable. You could include this information if that would be helpful to your readers. If “wind” in your language can only mean a cool air, then you can try this alternate translation: “God sent a great warmth from the east to Jonah.”
4:8	mnu9		rc://*/ta/man/translate/figs-personification	וַ⁠תַּ֥ךְ הַ⁠שֶּׁ֛מֶשׁ	1	Here, the author speaks of **the sun** as if it were a person who could **beat down** another person. If it would be helpful in your language, you could express the meaning plainly. Alternate translation: “the sun was very hot” or "the sun sent its great heat"
4:8	u2pl		rc://*/ta/man/translate/figs-synecdoche	עַל־רֹ֥אשׁ יוֹנָ֖ה	1	The phrase **on the head of Jonah** may have a literal meaning or a figurative meaning. Perhaps Jonah felt the heat most on his head, or perhaps the phrase **the head of Jonah** is means Jonah’s entire body. Alternate translation: “on Jonah”
4:8	z95v			וַ⁠יִּתְעַלָּ֑ף	1	Alternate translation: “and he became very weak” or “and he lost his strength”
4:8	ab87			וַ⁠יִּשְׁאַ֤ל אֶת־נַפְשׁ⁠וֹ֙ לָ⁠מ֔וּת	1	Alternate translation: “Then, he talked to himself of his desire for death” or “Then he told himself that he wanted to die”
4:8	eln6			ט֥וֹב מוֹתִ֖⁠י מֵ⁠חַיָּֽ⁠י	1	Alternate translation: “I would rather die than live” or “I want to die; I do not want to live” See how you translated this in [4:3](../04/03/yk5v).
4:9	w24z		rc://*/ta/man/translate/figs-explicit	הַ⁠הֵיטֵ֥ב חָרָֽה־לְ⁠ךָ֖ עַל־הַ⁠קִּֽיקָי֑וֹן	1	In this context, God’s question is intended to lead Jonah to draw a conclusion about his selfish attitude. The implication is that Jonah is wrong to be angry about the plant. You could include this information if that would be helpful to your readers. Alternate translation: “Is it right that you should be so angry about the plant that only gave shade to you”
4:9	h43a			הֵיטֵ֥ב חָֽרָה־לִ֖⁠י עַד־מָֽוֶת	1	Alternate translation: “I am right to be angry. I am angry enough to die”
4:10	gkz7		rc://*/ta/man/translate/figs-explicit	וַ⁠יֹּ֣אמֶר יְהוָ֔ה	1	Here Yahweh is speaking to Jonah. You could include this information if that would be helpful to your readers. Alternate translation: “Yahweh said to Jonah”
4:10	ab88		rc://*/ta/man/translate/figs-idiom	שֶׁ⁠בִּן־לַ֥יְלָה הָיָ֖ה וּ⁠בִן־לַ֥יְלָה אָבָֽד	1	The expression **son of** describes a person or thing which shares the qualities of something else. This idiom, **son of a night** means that the plant existed only briefly. If it would be helpful, you could use an equivalent idiom from your language or state the meaning plainly. Alternate translation: “it grew in one night and died the next” or “it grew quickly and died just as quickly”
4:11	jdr0		rc://*/ta/man/translate/grammar-connect-words-phrases	וַֽ⁠אֲנִי֙	1	This expression, **So as for me,** paired with "As for you" in verse [4:10](../04/10.md), shows a comparison between Yahweh’s attitude toward the people of Nineveh and Jonah’s attitude toward the plant. Express this comparison in a natural way in your language. 
4:11	ecl1		rc://*/ta/man/translate/figs-rquestion	וַֽ⁠אֲנִי֙ לֹ֣א אָח֔וּס עַל־נִינְוֵ֖ה הָ⁠עִ֣יר הַ⁠גְּדוֹלָ֑ה אֲשֶׁ֣ר יֶשׁ־בָּ֡⁠הּ הַרְבֵּה֩ מִֽ⁠שְׁתֵּים־עֶשְׂרֵ֨ה רִבּ֜וֹ אָדָ֗ם אֲשֶׁ֤ר לֹֽא־יָדַע֙ בֵּין־יְמִינ֣⁠וֹ לִ⁠שְׂמֹאל֔⁠וֹ וּ⁠בְהֵמָ֖ה רַבָּֽה	1	God used this rhetorical question to emphasize his claim that he should have compassion on Nineveh. Alternate translation: “I certainly should have compassion for Nineveh, that great city, in which there are more than 120,000 people who cannot distinguish between their right hand and their left hand, and also many cattle”
4:11	dqi1		rc://*/ta/man/translate/figs-rquestion	אֲשֶׁ֣ר יֶשׁ־בָּ֡⁠הּ הַרְבֵּה֩	1	This part of the question can also be translated as the beginning of a new sentence. To do that, end the previous phrase, **the great city**, with a question mark, and end this new sentence with a period. Alternate translation: “There are more” or “It has more”
4:11	c3b7		rc://*/ta/man/translate/translate-numbers	מִֽ⁠שְׁתֵּים־עֶשְׂרֵ֨ה רִבּ֜וֹ אָדָ֗ם	1	Alternate translation: "one hundred twenty thousand people"
4:11	j35h		rc://*/ta/man/translate/figs-idiom	אֲשֶׁ֤ר לֹֽא־יָדַע֙ בֵּין־יְמִינ֣⁠וֹ לִ⁠שְׂמֹאל֔⁠וֹ	1	This idiom means “who do not know the difference between right and wrong.” If this phrase does not have that meaning in your language, you could use an idiom from your language that does have this meaning or state the meaning plainly.
