Reference	ID	Tags	SupportReference	Quote	Occurrence	Note
2:2	jdrc		rc://*/ta/man/translate/writing-poetry	קָ֠רָאתִי מִ⁠צָּ֥רָה לִ֛⁠י אֶל־יְהוָ֖ה וַֽ⁠יַּעֲנֵ֑⁠נִי	1	This is poetic language. If your language has a way to indicate poetry, you could use it here. This line begins a poem describing Jonah’s experience and prayer in the belly of the fish. The poem does not give the exact words that Jonah prayed at the time because the poem was written later, describing Jonah’s experience in the fish, his prayer, and God’s answer as if they had already happened. This first line of the poem can be understood in one of two ways: either as being addressed to Yahweh as part of the description of the prayer, or as being addressed to another person as an introduction to the description of the prayer.  See also the Note concerning the phrase “Salvation belongs to Yahweh!” in [2:9](../02/09/jdrh).
2:2	s7fi			קָ֠רָאתִי מִ⁠צָּ֥רָה לִ֛⁠י אֶל־יְהוָ֖ה	1	Alternate translation: “I prayed to Yahweh during my great trouble” or “Yahweh, I cried out to you during my distress”
2:2	wdr4			וַֽ⁠יַּעֲנֵ֑⁠נִי	1	Alternate translation: “and Yahweh responded to me" or "and he helped me" or "and you answered me”
2:2	w8wn		rc://*/ta/man/translate/figs-metaphor	מִ⁠בֶּ֧טֶן שְׁא֛וֹל	1	The possible meanings of the metaphor **from the belly of Sheol** could include: (1) that Jonah was speaking of being in the belly of the fish as being in Sheol; or (2) that Jonah believed that he was about to die and go to Sheol; or (3) that he was speaking as if he already had died and gone to Sheol.
2:2	ab77		rc://*/ta/man/translate/translate-names	שְׁא֛וֹל	1	**Sheol** was the name of the place where people went after they died. It was thought to be a shadowy world located somewhere under the ground. The New Testament equivalent seems to be “Hades,” where the dead wait for judgment (see Rev. 20:13). If your language has a word for this place, you may want to use it here, or borrow the word “Sheol.”
2:2	jdrd		rc://*/ta/man/translate/figs-idiom	שָׁמַ֥עְתָּ קוֹלִֽ⁠י	1	This phrase probably has both a literal and a figurative meaning. The phrase probably means literally that Yahweh heard Jonah’s voice while he was praying inside the belly of the fish. However, the phrase “to hear someone’s voice” in the Old Testament often means “to listen and obey (comply).” In this context, Jonah is expressing that Yahweh both heard him and acted to save him. If this phrase does not have that meaning in your language, you could use an idiom from your language that does have this meaning or state the meaning plainly.
2:3	glp2		rc://*/ta/man/translate/figs-metaphor	בִּ⁠לְבַ֣ב יַמִּ֔ים	1	Here the term **heart** is a metaphor for “being inside” something. The phrase “in the heart of” means to be “in the middle of” or “completely surrounded by” sea water. Alternate translation: “in the middle of the sea”
2:3	p8fd			וְ⁠נָהָ֖ר יְסֹבְבֵ֑⁠נִי	1	Alternate translation: “the sea water flowed all around me”
2:3	c6jx		rc://*/ta/man/translate/figs-doublet	מִשְׁבָּרֶ֥י⁠ךָ וְ⁠גַלֶּ֖י⁠ךָ	1	Both of these are disturbances on the surface of the ocean. They could be combined into one term, such as “waves.”
2:4	jdr5		rc://*/ta/man/translate/grammar-connect-logic-contrast	וַ⁠אֲנִ֣י	1	This expression shows that there is a contrast between the actions of Yahweh, which Jonah had just talked about, and his own response. Now he is going to speak of his own response. Alternate translation: “And I”
2:4	x1w9		rc://*/ta/man/translate/figs-activepassive	נִגְרַ֖שְׁתִּי	1	If your language does not use the passive form in this way, you can state this in active form or in another way that is natural in your language. Alternate translation: “You drove me out”
2:4	z1yx		rc://*/ta/man/translate/figs-metonymy	מִ⁠נֶּ֣גֶד עֵינֶ֑י⁠ךָ	1	Here, **eyes** is a metonym meaning seeing, and seeing is a metonym for the knowledge, notice, and attention of God. Alternate translation: “from before you” or “from your presence” or “to where you do not notice me”
2:4	b8vk			אַ֚ךְ אוֹסִ֣יף לְ⁠הַבִּ֔יט אֶל־הֵיכַ֖ל קָדְשֶֽׁ⁠ךָ	1	Jonah still has hope that, in spite of all that he is going through, God will allow him to see the temple in Jerusalem again.
2:5	abc2		rc://*/ta/man/translate/figs-parallelism	אֲפָפ֤וּ⁠נִי מַ֨יִם֙ עַד־נֶ֔פֶשׁ תְּה֖וֹם יְסֹבְבֵ֑⁠נִי	1	Jonah uses two similar phrases to express the severity and hopelessness of his situation.
2:5	rf4b			מַ֨יִם֙	1	Alternate translation: "The sea"
2:5	ca31			עַד־נֶ֔פֶשׁ	1	Here the Hebrew term **life** can possibly mean “my life” or “my neck” or “my spirit.” In any case, the water was threatening to end his life. Alternate translation: “up to my neck” or “as far as my spirit”
2:5	nr3v			תְּה֖וֹם יְסֹבְבֵ֑⁠נִי	1	Alternate translation: “deep water was all around me”
2:5	p1fw		rc://*/ta/man/translate/translate-unknown	ס֖וּף	1	**Seaweed** is grass that grows in the sea.
2:6	z36i		rc://*/ta/man/translate/figs-metaphor	הָ⁠אָ֛רֶץ בְּרִחֶ֥י⁠הָ בַעֲדִ֖⁠י לְ⁠עוֹלָ֑ם	1	Here Jonah uses a metaphor to compare the earth to a prison. Alternate translation: “the earth was like a prison that was about to lock me in forever”
2:6	dc3r		rc://*/ta/man/translate/figs-metaphor	וַ⁠תַּ֧עַל מִ⁠שַּׁ֛חַת חַיַּ֖⁠י	1	Here the term **pit** has more than one meaning. This could mean: (1) a way to describe being in a very deep place underground or underwater. Alternate translation: “but you saved me from dying in a deep place” (2) a metaphor meaning the place of the dead. In either case, the term probably refers to the fact that Jonah felt certain that he would die. Alternate translation: “but you saved my life from the place of the dead”
2:6	i3mx		rc://*/ta/man/translate/figs-infostructure	יְהוָ֥ה אֱלֹהָֽ⁠י	1	If it would be more natural in your language, you could put this at the beginning of the sentence or next to the word “you.”
2:7	jdr6		rc://*/ta/man/translate/grammar-connect-time-simultaneous	בְּ⁠הִתְעַטֵּ֤ף עָלַ⁠י֙ נַפְשִׁ֔⁠י	1	This phrase could mean that: (1) Jonah was already in the process of dying when he remembered Yahweh. Alternate translation: Alternate translation: “when my life was fainting away from me” (2) Jonah had given up hope of being rescued and resigned himself to the fact that he would die.  Alternate translation: “when my spirit inside me had fainted”
2:7	l2b6			אֶת־יְהוָ֖ה זָכָ֑רְתִּי	1	Alternate translation: “Yahweh, I thought about you”
2:7	ue9g		rc://*/ta/man/translate/figs-metaphor	וַ⁠תָּב֤וֹא אֵלֶ֨י⁠ךָ֙ תְּפִלָּתִ֔⁠י אֶל־הֵיכַ֖ל קָדְשֶֽׁ⁠ךָ	1	Jonah speaks as if his prayers could travel to God and his temple. This means that God heard his prayer and responded to it. Alternate translation: “then you in your holy temple heard my prayer”
2:7	jdrf		rc://*/ta/man/translate/figs-metonymy	הֵיכַ֖ל קָדְשֶֽׁ⁠ךָ	1	Here the term **holy temple** may have either a literal or a figurative meaning or perhaps both. Jonah might be speaking about the literal temple in Jerusalem, or he might be speaking about God’s dwelling place in heaven. 
2:7	jdre			נַפְשִׁ֔⁠י	1	Here the Hebrew term **my spirit** could also mean **my life**.
2:8	u1l9		rc://*/ta/man/translate/figs-idiom	מְשַׁמְּרִ֖ים הַבְלֵי־שָׁ֑וְא	1	Here the term **empty vanities** is probably an idiom referring to idols of false gods. Alternate translation: “Those who give attention to useless idols” or “Those who pay attention to useless gods”
2:8	fac9			חַסְדָּ֖⁠ם יַעֲזֹֽבוּ	1	Here, **covenant faithfulness** could mean: (1) the faithfulness of God. Alternate translation:  “are rejecting you, who would be faithful to them” (2) the faithfulness of the people. Alternate translation: “are abandoning their commitment to you”
2:9	q3yb		rc://*/ta/man/translate/grammar-connect-logic-contrast	וַ⁠אֲנִ֗י	1	This expression shows that there is a contrast between Jonah himself and the people about whom Jonah had just spoken. They paid attention to useless gods, but he would worship Yahweh. Alternate translation: “But I”
2:9	nfd2		rc://*/ta/man/translate/figs-idiom	בְּ⁠ק֤וֹל תּוֹדָה֙ אֶזְבְּחָה־לָּ֔⁠ךְ	1	The phrase **with a voice of thanksgiving** is an idiom that means “giving God praise.” If this phrase does not have that meaning in your language, you could use an idiom from your language that does have this meaning or state the meaning plainly. This full phrase probably means that Jonah would thank God while he offered a sacrifice to him. It is not clear whether Jonah planned to thank God by singing or shouting joyfully.
2:9	jdrh			יְשׁוּעָ֖תָ⁠ה לַ⁠יהוָֽה	1	This last line of the poem could be understood as: (1) being addressed to Yahweh as part of the description of the prayer. (2) being addressed to another person as a conclusion to the description of the prayer. See also the Note concerning the phrase “I cried out to Yahweh from my distress … ” in [2:2](../02/02/jdrc).
2:9	r4j4		rc://*/ta/man/translate/figs-abstractnouns	יְשׁוּעָ֖תָ⁠ה לַ⁠יהוָֽה	1	If your language does not use an abstract noun for the idea behind the word **Salvation**, you can express the same idea with a verbal form such as “save.” Alternate translation: “Yahweh is the one who saves people”
2:10	dz3j			אֶל־הַ⁠יַּבָּשָֽׁה	1	Alternate translation: “upon the ground” or “onto the shore”
3:intro	z3ut				0	# Jonah 3 General Notes\n\n## Structure and Formatting\n\nThis chapter returns to a narrative of Jonah’s life.\n\n## Special Concepts in this Chapter\n\n### Animals\n\nAccording to the king’s proclamation, the animals had to participate in the fast which he had ordered. This most likely reflects their pagan mindset. There was nothing in the law of Moses that instructed the people to have the animals participate in any religious acts. (See: [[rc://*/tw/dict/bible/kt/lawofmoses]])\n\n## Other Possible Translation Difficulties in this Chapter\n\n### Size of Nineveh\n\nWhen the author talks about the size of Nineveh, the measurements he gives are confusing. The phrase “three days’ journey” is ambiguous in Hebrew, as many scholars have remarked. In Jonah’s day, cities were not as big as they are today. So, although Nineveh was a big city, it was not as big as most modern cities.\n\n### God repenting or relenting\n\nThe last verse of this chapter says, “So then God changed his mind about the punishment that he had said he would do to them, and he did not do it.” This concept of God changing His mind may seem inconsistent with the fact that God’s character and his plans do not change. But this whole book is written from a human viewpoint, and so it presents the actions of God as Jonah saw them. God had told Jonah to warn the Ninevites of judgment for their sin.\n\nYahweh is just, but he is also merciful. Because the Ninevites repented, God did not follow through with a judgment in this instance, and Jonah described that in a human way as “changing his mind.” The reader understands that this was God’s plan from the beginning. (See: [[rc://*/tw/dict/bible/kt/justice]], [[rc://*/tw/dict/bible/kt/mercy]] and [[rc://*/tw/dict/bible/kt/judge]] and [[rc://*/tw/dict/bible/kt/evil]])
3:1	jdr7		rc://*/ta/man/translate/writing-newevent	וַ⁠יְהִ֧י דְבַר־יְהוָ֛ה	1	This phrase introduces the second half of the story of Jonah. The same phrase introduced the first half of the story [1:1](../01/01.md).
3:1	xj6n		rc://*/ta/man/translate/figs-idiom	וַ⁠יְהִ֧י דְבַר־יְהוָ֛ה	1	This is an idiom meaning that Yahweh spoke in some way. See how you translated this in [1:1](../01/01.md). Alternate translation: “Then Yahweh spoke his message”
3:2	ve4i			ק֛וּם לֵ֥ךְ אֶל־נִֽינְוֵ֖ה הָ⁠עִ֣יר הַ⁠גְּדוֹלָ֑ה	1	Alternate translation: “Go to the large and important city of Nineveh”
3:2	cl3b		rc://*/ta/man/translate/figs-idiom	ק֛וּם	1	**Get up** here is an idiom intended to motivate Jonah to obey the next command, which is “go.” If this phrase does not have that meaning in your language, you could use an idiom from your language that does have this meaning or state the meaning plainly. See how you translated this in [1:2](../01/02.md) and [1:3](../01/03.md).
3:2	ir79			וִּ⁠קְרָ֤א אֵלֶ֨י⁠הָ֙ אֶת־הַ⁠קְּרִיאָ֔ה אֲשֶׁ֥ר אָנֹכִ֖י דֹּבֵ֥ר אֵלֶֽי⁠ךָ	1	Alternate translation: “and tell the people there what I tell you to tell them”
3:3	k7k9		rc://*/ta/man/translate/figs-idiom	וַ⁠יָּ֣קָם יוֹנָ֗ה וַ⁠יֵּ֛לֶךְ אֶל־נִֽינְוֶ֖ה כִּ⁠דְבַ֣ר יְהוָ֑ה	1	Here the words **got up** mean that Jonah took action in response to God’s command to go, and this time he obeyed instead of disobeying. If this phrase does not have that meaning in your language, you could use an idiom from your language that does have this meaning or state the meaning plainly. Alternate translation: “This time Jonah obeyed Yahweh and went to Nineveh” or “So Jonah left the beach and went to Nineveh, as Yahweh had commanded him”
3:3	g4nk		rc://*/ta/man/translate/figs-metonymy	כִּ⁠דְבַ֣ר יְהוָ֑ה	1	Alternate translation: “as instructed by the message of Yahweh” or “obeying the command of Yahweh”
3:3	dt1b		rc://*/ta/man/translate/writing-background	וְ⁠נִֽינְוֵ֗ה הָיְתָ֤ה עִיר־גְּדוֹלָה֙ לֵֽ⁠אלֹהִ֔ים מַהֲלַ֖ךְ שְׁלֹ֥שֶׁת יָמִֽים	1	This verse provides background information about the city of Nineveh to help readers understand what happens next in the story. In your translation, present this information in a way that makes it clear that this is background information.
3:3	jd8r		rc://*/ta/man/translate/figs-idiom	עִיר־גְּדוֹלָה֙ לֵֽ⁠אלֹהִ֔ים	1	Here, **great city** is an idiom that means “the city is both extremely large and one of the largest cities in the world.” If this phrase does not have that meaning in your language, you could use an idiom from your language that does have this meaning or state the meaning plainly.
3:3	ye82		rc://*/ta/man/translate/figs-idiom	מַהֲלַ֖ךְ שְׁלֹ֥שֶׁת יָמִֽים	1	This appears to mean that a person had to walk for three days to completely go through it from one side of the city to the opposite side. It could also mean that it took three days to see the whole city. If this phrase does not have a similar meaning in your language, you could use an idiom from your language that does have this meaning or state the meaning plainly. Alternate translation: “a city so large that it would take a person three days to walk through it”
3:4	r2al		rc://*/ta/man/translate/figs-idiom	וַ⁠יָּ֤חֶל יוֹנָה֙ לָ⁠ב֣וֹא בָ⁠עִ֔יר מַהֲלַ֖ךְ י֣וֹם אֶחָ֑ד וַ⁠יִּקְרָא֙	1	The phrase **a journey of one day** could mean: (1) Jonah walked a day’s journey into the city and then he started calling out.  (2) while Jonah was walking through the city on the first day, he started calling out.
3:4	r94k			וַ⁠יִּקְרָא֙ וַ⁠יֹּאמַ֔ר	1	Alternate translation: “and he proclaimed” or “and he shouted”
3:4	ab78			ע֚וֹד אַרְבָּעִ֣ים י֔וֹם	1	Alternate translation: “After 40 days” or “in 40 days” or “When 40 days have passed”
3:4	q2nc		rc://*/ta/man/translate/translate-numbers	אַרְבָּעִ֣ים י֔וֹם	1	**forty days**
3:5	ab90		rc://*/ta/man/translate/translate-symaction	וַ⁠יִּקְרְאוּ־צוֹם֙	1	The men of Nineveh **proclaimed a fast** as a symbolic action to show that they were repentant. People fasted to show sadness or devotion to God or both. If this would not be clear to your readers, you could explain the significance of this action in the text or in a footnote. 
3:5	e5lm		rc://*/ta/man/translate/figs-explicit	וַ⁠יִּלְבְּשׁ֣וּ שַׂקִּ֔ים	1	The implication for why they **put on sackcloth** is that they repented of their sin. You could include this information if that would be helpful to your readers. Alternate translation: “they also put on coarse cloth to show that they were sorry for having sinned”
3:5	isk5			מִ⁠גְּדוֹלָ֖⁠ם וְ⁠עַד־קְטַנָּֽ⁠ם	1	Alternate translation: “from the most significant to the least significant people” or “including all of the important people and all of the unimportant people”
3:6	pna3			הַ⁠דָּבָר֙	1	Alternate translation: “Jonah’s message”
3:6	h9wz		rc://*/ta/man/translate/translate-symaction	וַ⁠יָּ֨קָם֙ מִ⁠כִּסְא֔⁠וֹ	1	The king **rose up from his throne** as a symbolic action to show that he was acting humbly. If this would not be clear to your readers, you could explain the significance of this action in the text or in a footnote. Alternate translation:  “he got up from his throne” or “he stood up from his throne” 
3:6	pvp7		rc://*/ta/man/translate/translate-unknown	מִ⁠כִּסְא֔⁠וֹ	1	A **throne** is a a special, ceremonial chair that a king sits on when performing his official duties as king. It is reserved for only the king. If your readers would not be familiar with this type of royal seat, you could use the name of something similar in your area or you could use a more general term. Alternate translation: "his royal chair"
3:6	ab91		rc://*/ta/man/translate/translate-symaction	וַ⁠יֵּ֖שֶׁב עַל־הָ⁠אֵֽפֶר	1	The act of sitting **on the ash heap** as a symbolic action meant to show deep sorrow. If this would not be clear to your readers, you could explain the significance of this action in the text or in a footnote. Alternate translation: "and sat among the ashes to show his humility and deep sorrow"
3:7	v29b			וַ⁠יַּזְעֵ֗ק וַ⁠יֹּ֨אמֶר֙ & לֵ⁠אמֹ֑ר	1	Alternate translation: “And he sent out an official announcement … which said” or “And he sent his messengers to announce … and they said”
3:7	zi06			מִ⁠טַּ֧עַם הַ⁠מֶּ֛לֶךְ וּ⁠גְדֹלָ֖י⁠ו	1	Alternate translation: “a command with the full authority of the king and his officials”
3:7	n5fn		rc://*/ta/man/translate/translate-unknown	וּ⁠גְדֹלָ֖י⁠ו	1	The term **nobles** refers to important men who helped the king rule the city. If your readers would not be familiar with this type of person, you could use the name of something similar in your area or you could use a more general term. 
3:7	xw6c		rc://*/ta/man/translate/translate-unknown	הַ⁠בָּקָ֣ר וְ⁠הַ⁠צֹּ֗אן	1	This refers to two groups of animals that people care for. A **herd** is made up of large livestock (such as oxen or cattle) and a **flock** is made up of small livestock (such as sheep or goats). If your readers would not be familiar with these terms, you could use the name of something similar in your area or you could use a more general term. Alternate translation: “cattle or sheep”
3:7	fw18		rc://*/ta/man/translate/figs-explicit	אַ֨ל־יִרְע֔וּ וּ⁠מַ֖יִם אַל־יִשְׁתּֽוּ	1	The implication is that they were not to eat or drink anything in order to show that they are sorry for their sins. You could include this information if that would be helpful to your readers. Alternate translation: “they must not eat or drink anything”
3:8	mzx6			וְ⁠הַ⁠בְּהֵמָ֔ה	1	Alternate translation: "and every animal that they own"
3:8	jh7e		rc://*/ta/man/translate/figs-explicit	וְ⁠יִקְרְא֥וּ אֶל־אֱלֹהִ֖ים בְּ⁠חָזְקָ֑ה	1	The writer assumes that his readers will understand that what the people were to pray for. You could include this information if that would be helpful to your readers. Alternate translation: “and they must cry out loudly to God and ask for mercy” or “and they must pray earnestly to God for mercy” 
3:8	n3ls		rc://*/ta/man/translate/figs-metonymy	הֶ⁠חָמָ֖ס אֲשֶׁ֥ר בְּ⁠כַפֵּי⁠הֶֽם	1	Here, **hands** represents "doing." This refers to the violence that the people of Nineveh were doing. If it would be helpful in your language, you could use an equivalent expression from your language or state the meaning plainly. Alternate translation: “the violent things that he has done”
3:9	wbt6		rc://*/ta/man/translate/figs-rquestion	מִֽי־יוֹדֵ֣עַ	1	The king used this rhetorical question to get the people to think about something that is possible but uncertain: that if they would stop sinning, God might not kill them. It could be translated as a statement: “We do not know.” Or it could be stated as a word and be part of the next sentence: “Perhaps”
3:9	z3jj		rc://*/ta/man/translate/figs-metaphor	יָשׁ֔וּב וְ⁠נִחַ֖ם הָ⁠אֱלֹהִ֑ים	1	Here the author speaks of God changing his mind about bringing judgment as if God were turning around and walking in the opposite direction. If it would be helpful in your language, you could state the meaning plainly. Alternate translation: “God may decide instead to have compassion” or “God may do the opposite of what he said and be merciful”
3:9	jdrg		rc://*/ta/man/translate/figs-idiom	מֵ⁠חֲר֥וֹן אַפּ֖⁠וֹ	1	Here **the burning of his nose** is an idiom meaning that the person is angry.  If this phrase does not have that meaning in your language, you could use an idiom from your language that does have this meaning or state the meaning plainly. Alternate translation: “from his anger”
3:9	uvp9			וְ⁠לֹ֥א נֹאבֵֽד	1	Alternate translation: “and spare our lives”
3:10	w3uu			וַ⁠יַּ֤רְא הָֽ⁠אֱלֹהִים֙ אֶֽת־מַ֣עֲשֵׂי⁠הֶ֔ם כִּי־שָׁ֖בוּ מִ⁠דַּרְכָּ֣⁠ם הָ⁠רָעָ֑ה	1	Alternate translation: “God saw that they stopped doing evil actions”
3:10	k8am		rc://*/ta/man/translate/figs-metaphor	שָׁ֖בוּ מִ⁠דַּרְכָּ֣⁠ם הָ⁠רָעָ֑ה	1	Here the author is speaking of them stopping their sinning as if they **turned away** from walking on a path toward **evil ways** and started walking in the opposite direction. If it would be helpful in your language, you could state the meaning plainly. Alternate translation: "they repented from doing evil"
3:10	ab85		rc://*/ta/man/translate/figs-explicit	וַ⁠יִּנָּ֣חֶם הָ⁠אֱלֹהִ֗ים עַל־הָ⁠רָעָ֛ה	1	The word translated as “evil” here is very broad, including moral evil, physical evil, and everything that is bad. It is the same word used in the previous sentence (and verse 8) to describe the actions of the Ninevites. The author is showing that when people repent of moral evil, God relents from doing physical evil (punishment). God never does moral evil. If this is clear in your language, you may want to use the same word in both sentences. If that is not clear, you may want to use different words.
3:10	it1a		rc://*/ta/man/translate/figs-explicit	וְ⁠לֹ֥א עָשָֽׂה	1	Here, what God **did not do** could be made explicit if it would be helpful in your language. Alternate translation: “and he did not punish them” or “and he did not destroy them”
