Reference	ID	Tags	SupportReference	Quote	Occurrence	Note
front:intro	r2f2				0	# Introduction to the Gospel of Mark\n\n## Part 1: General Introduction\n\n### Outline of the book of Mark\n\n1. Introduction (1:1–13)\n1. The ministry of Jesus in Galilee\n    * Early ministry (1:14–3:6)\n    * Becoming more popular among the people (3:7–5:43)\n    * Moving away from Galilee and then returning (6:1–8:26)\n1. Progress toward Jerusalem; Jesus repeatedly predicts his own death; the disciples misunderstand, and Jesus teaches them how difficult it will be to follow him (8:27–10:52)\n1. Last days of ministry and preparation for final conflict in Jerusalem (11:1–13:37)\n1. The death of Christ and the empty tomb (14:1–16:8)\n\n### What is the book of Mark about?\n\nThe Gospel of Mark is one of four books in the New Testament that describe some of the life of Jesus Christ. The authors of the Gospels wrote about who Jesus was and what he did during his lifetime. Mark wrote much about how Jesus suffered and died on the cross. He did this to encourage his readers who were being persecuted. Mark also explained Jewish customs and some Aramaic words. This may indicate that Mark expected most of his first readers to be Gentiles.\n\n### How should the title of this book be translated?\n\nTranslators may choose to call this book by its traditional title, “The Gospel of Mark,” or “The Gospel According to Mark.” They may also choose a title that may be clearer, such as, “The Good News about Jesus that Mark Wrote.” (See: [[rc://*/ta/man/translate/translate-names]])\n\n### Who wrote the book of Mark?\n\nThe book does not give the name of the author. However, since early Christian times, most Christians have thought that the author was Mark. Mark was also known as John Mark. He was a close friend of Peter. Mark may not have witnessed what Jesus said and did. Many experts think that Peter the Apostle was the source of what Mark wrote about Jesus.\n\n## Part 2: Important Religious and Cultural Concepts\n\n### What were Jesus’ teaching methods?\n\nThe people regarded Jesus as a rabbi. A rabbi is a teacher of God’s law. Jesus taught in ways similar to the ways other religious teachers in Israel. He had students who followed him wherever he went. These students were called disciples. Jesus often taught by telling parables, stories that teach moral lessons. (See: [[rc://*/tw/dict/bible/kt/lawofmoses]] and [[rc://*/tw/dict/bible/kt/disciple]] and [[rc://*/tw/dict/bible/kt/parable]])\n\n## Part 3: Important Translation Issues\n\n### What are the Synoptic Gospels?\n\nThe Gospels of Matthew, Mark, and Luke are called the Synoptic Gospels because they have many similar passages. The word “synoptic” means to “see together.”\n\nThe texts are considered “parallel” when they are the same or almost the same among two or three of the Gospels. When translating parallel passages, translators should use the same wording and make them as similar as possible.\n\n### Why does Jesus refer to himself as the “Son of Man”?\n\nIn the Gospels, Jesus calls himself the “Son of Man.” This phrase could mean a few things:\n* The phrase “son of man” can simply be describing that someone’s father is also a human being. Therefore, the person being described is literally a son of a man, a human being.\n* The phrase sometimes is a reference to Daniel 7:13–14. In this passage there is a person described as a “Son of Man.” This description tells us that the person ascending to the throne of God looked like a human being. This description is different than the first because God gives this Son of Man authority forever. Therefore, the title “Son of Man” became a title for the Messiah.\n\nTranslating the title “Son of Man” can be difficult in many languages. Readers may misunderstand a literal translation. Translators can consider alternatives, such as “The Human One.” It may also be helpful to include a footnote to explain the title.\n\n### Why does Mark frequently use terms indicating short periods of time?\n\nThe Gospel of Mark uses the word “immediately” 42 times. Mark does this to make the events more exciting and vivid. It moves the reader quickly from one event to the next.\n\n### Sabbath/Sabbaths\n\nOften in the culture of the Bible, religious festivals would be written in the plural form of the word instead of a singular form. This occurs in Mark as well. In the ULT, the word should be kept plural, “Sabbaths.” This is simply for the sake of rendering the translated text as close to the original text as possible. In the UST, Sabbaths is changed to singular, Sabbath, to make more sense of the use of the word in its context.\n\n### What are the major issues in the text of the book of Mark?\n\nSome verses found in older versions of the Bible are not included in most modern versions. Translators are advised not to include these verses. However, if there are older versions of the Bible in the translator’s region that include one or more of these verses, the translators can include them. If they are included, they should be surrounded by square brackets ([]) to indicate that they were probably not original to Mark’s Gospel.\n* “If any man has ears to hear, let him hear.” (7:16)\n* “where their worm never dies and the fire is never quenched” (9:44)\n* “where their worm never dies and the fire is never quenched” (9:46)\n* “And the scripture was fulfilled that says, ‘He was counted with the lawless ones’” (15:28)\n\nThe following passage is not found in the earliest manuscripts. Most Bibles include this passage, but modern Bibles put it in brackets ([]) or indicate in some way that this passage may not have been original to Mark’s Gospel. Translators are advised to do something similar to the modern versions of the Bible.\n* “Early on the first day of the week, after he arose, he appeared first to Mary Magdalene, from whom he had cast out seven demons. She went and told those who were with him, while they were mourning and weeping. They heard that he was alive and that he had been seen by her, but they did not believe. After these things he appeared in a different form to two of them, as they were walking out into the country. They went and told the rest of the disciples, but they did not believe them. Jesus later appeared to the eleven as they were reclining at the table, and he rebuked them for their unbelief and hardness of heart, because they did not believe those who saw him after he rose from the dead. He said to them, ‘Having gone into all the world, and preach the gospel to the entire creation. The one having believed and having been baptized will be saved, and the one not having believed will be condemned. These signs will go with the ones believing: In my name they will cast out demons. They will speak in new languages. They will pick up snakes with their hands, and if they drink anything deadly, it will not hurt them. They will lay hands on the sick, and they will get well.’ After the Lord had spoken to them, he was taken up into heaven and sat down at the right hand of God. The disciples left and preached everywhere, while the Lord worked with them and confirmed the word by the signs that went with them.” (16:9–20)\n\n(See: [[rc://*/ta/man/translate/translate-textvariants]])
1:intro	c6ep				0	# Mark 1 General Notes\n\n## Structure and Formatting\n\nSome translations set each line of poetry farther to the right than the rest of the text to make it easier to read. The ULT does this with the poetry in 1:2–3, words from the Old Testament.\n\n## Special Concepts in this Chapter\n\n### “You can make me clean”\n\nLeprosy is a disease of the skin. It made a person unclean and unable to properly worship God. Jesus is capable of making people physically “clean” or healthy as well as spiritually “clean” or right with God. (See: [[rc://*/tw/dict/bible/kt/clean]])\n\n### “The kingdom of God is near”\n\nScholars debate whether the “kingdom of God” was present at this time or is something that is still coming or is a combination of both. English translations frequently use the phrase “at hand,” but this can create difficulty for translators. Other versions use the phase “is coming” and “has come near.”\n\n## Important Figures of Speech in this Chapter\n\n### The historic present\n\nTo call attention to a development in the story, Mark uses the present tense in past narration. In this chapter, the historic present occurs in verses 12, 21, 30, 37, 38, 40, 41, and 44. If it would not be natural to do that in your language, you could use the past tense in your translation. (See: [[rc://*/ta/man/translate/figs-pastforfuture]])
1:1	kpq1		rc://*/ta/man/translate/writing-newevent	ἀρχὴ τοῦ εὐαγγελίου Ἰησοῦ Χριστοῦ, Υἱοῦ Θεοῦ	1	This verse introduces the reader to the history of Jesus the Messiah as told by Mark. This functions as an introduction to the entire book of Mark. Use the natural form in your language for beginning the telling of something that actually happened.
1:1	i3bc		rc://*/ta/man/translate/guidelines-sonofgodprinciples	Υἱοῦ Θεοῦ	1	The words **Son of God** form an important title that describes the relationship between God and Jesus. If it would be helpful in your language, you could use the alternate translation: “who is God’s Son”
1:2	fc4t		rc://*/ta/man/translate/figs-activepassive	καθὼς γέγραπται ἐν τῷ Ἠσαΐᾳ τῷ προφήτῃ	1	If your language does not use the passive form in this way, you can state this in active form or in another way that is natural in your language. Alternate translation: “Just as Isaiah the prophet wrote”
1:2	e3by		rc://*/ta/man/translate/writing-quotations	καθὼς γέγραπται ἐν τῷ Ἠσαΐᾳ τῷ προφήτῃ	1	Consider natural ways of introducing direct quotations in your language. Alternate translation: “Just as it is written in Isaiah the prophet, we read,” or “Just as it is written in Isaiah the prophet, he wrote,”
1:2	z8b7		rc://*/ta/man/translate/figs-ellipsis	ἐν τῷ Ἠσαΐᾳ τῷ προφήτῃ	1	Mark is leaving out some of the words that this sentence would need in many languages to be complete. If it would be helpful in your language, you could supply these words. Alternate translation: “in the scroll of Isaiah the prophet”
1:2	gu7i		rc://*/ta/man/translate/figs-idiom	πρὸ προσώπου σου	1	Here, **before your face** is an idiom which means that the **messenger** was sent first, and then the second person came after him. If it would be helpful in your language, you could clarify. Alternate translation: “first” or “before you”.
1:2	fsqn		rc://*/ta/man/translate/figs-metaphor	ἰδοὺ	1	The term **Behold** focuses the attention of the listener on what the speaker is about to say. Though it literally means “look” or “see,” in this case “seeing” means giving attention to what follows. Alternate translation, as a new sentence: “Pay attention!”
1:2	s28q		rc://*/ta/man/translate/figs-yousingular	προσώπου σου & τὴν ὁδόν σου	1	Here, both uses of the pronoun **your** refer to Jesus and are singular.
1:2	kl12		rc://*/ta/man/translate/figs-metaphor	ὃς κατασκευάσει τὴν ὁδόν σου	1	That the messenger **will prepare your way** represents preparing the people for the Lord’s arrival. If it would be helpful in your language, you could express this explicitly. Alternate translation: “who will prepare the people for your arrival”
1:3	lkm3		rc://*/ta/man/translate/writing-quotations	φωνὴ βοῶντος ἐν τῇ ἐρήμῳ,	1	Consider natural ways of introducing direct quotations in your language. Alternate translation: “a voice crying out in the wilderness, he is saying,” or “a voice crying out in the wilderness, hear him saying,”
1:3	dqi9		rc://*/ta/man/translate/figs-quotesinquotes	φωνὴ βοῶντος ἐν τῇ ἐρήμῳ, ἑτοιμάσατε τὴν ὁδὸν Κυρίου, εὐθείας ποιεῖτε τὰς τρίβους αὐτοῦ	1	Here there is a direct quotation nested inside a direct quotation as Mark quotes Isaiah, who quotes the messenger. If it would be helpful in your language, you could translate the second direct quotation as an indirect quotation. Alternate translation: “a voice crying out in the wilderness, telling people to make ready the way of the Lord and to make his paths straight”
1:3	cf0e		rc://*/ta/man/translate/figs-synecdoche	φωνὴ βοῶντος	1	Here, **a voice** refers to the messenger who uses his voice to cry out. If it would be helpful in your language, you could use an equivalent expression from your culture or use plain language. Alternate translation: “people will hear his voice as he cries out”
1:3	v3n3		rc://*/ta/man/translate/figs-parallelism	ἑτοιμάσατε τὴν ὁδὸν Κυρίου, εὐθείας ποιεῖτε τὰς τρίβους αὐτοῦ	1	**Make ready the way of the Lord** and **make his paths straight** mean the same thing. If it would be helpful in your language, you could combine the two. See the next note for alternate translations.
1:3	peh5		rc://*/ta/man/translate/figs-metaphor	ἑτοιμάσατε τὴν ὁδὸν Κυρίου	1	Here Isaiah uses the metaphor of preparing **paths** or **the way** on which someone will travel to make them walkable. If a person in high authority were coming, the people would clear the roads of any hazards. So this metaphor means that the people should prepare themselves to receive the Lord’s message when he comes. If it would be helpful in your language, you could use an equivalent metaphor from your culture or use plain speech. Alternate translation: “Prepare to hear and obey the Lord’s message when he comes”
1:3	yyk3		rc://*/ta/man/translate/figs-extrainfo	Κυρίου	1	In this quotation from Isaiah, **the Lord** refers to God, but Mark is showing how it also refers to Jesus the Messiah. However, do not translate this as “Jesus” here, because this double reference must be maintained.
1:3	h8rt		rc://*/ta/man/translate/figs-idiom	ἑτοιμάσατε τὴν ὁδὸν	1	The imagery of a path, or **the way**, is used here to indicate that John will prepare the people to listen to the Lord’s message. If someone prepares a path for someone else, the preparer makes the path walkable. If someone in high authority was coming, others would make sure the roads were cleared of any hazards. If it would be helpful in your language, you could use an alternate translation: “Prepare the people for the arrival of the Lord”
1:3	wltl		rc://*/ta/man/translate/figs-yousingular	ἑτοιμάσατε & ποιεῖτε	1	In the original language in which Mark wrote this Gospel, both occurrences of the word **Make** are plural and are commands addressing a group of people. Use the natural forms in your language to express this meaning.
1:4	s05n		rc://*/ta/man/translate/figs-explicit	καὶ κηρύσσων βάπτισμα μετανοίας εἰς ἄφεσιν ἁμαρτιῶν	1	The **baptism of repentance** proclaimed by John the Baptizer likely had its origin in baptisms done by Gentiles who were converting to Judaism. This baptism was done one time and showed that these people were converting from their former way of life to the new way of life. If it would be helpful in your language, you could express that explicitly. Alternate translation: “and preaching that he must baptize them to show that they have turned from their former evil ways, accepted God’s forgiveness for their sins, and were now following God”
1:4	dtqv		rc://*/ta/man/translate/figs-abstractnouns	καὶ κηρύσσων βάπτισμα μετανοίας εἰς ἄφεσιν ἁμαρτιῶν	1	If your language does not use abstract nouns for the ideas behind **repentance**, **forgiveness**, and **sins**, you can express those ideas with verbs. Alternate translation: “and preaching that he must baptize them to show that they have repented of their former evil way of living and that God has forgiven them for sinning against him”
1:5	u9yg		rc://*/ta/man/translate/figs-synecdoche	πᾶσα ἡ Ἰουδαία χώρα	1	The phrase **region of Judea** is used here to refer to the people living within Judea, a large area in which the city of Jerusalem was located. Alternate translation: “the people from Judea”
1:5	cf75		rc://*/ta/man/translate/figs-hyperbole	πᾶσα ἡ Ἰουδαία χώρα καὶ οἱ Ἱεροσολυμεῖται πάντες	1	Here, **the whole region** and **all the inhabitants** are generalizations that refer to a great number of people but not to every single person. If it would be helpful in your language, you could use an equivalent expression from your language or use plain language. Alternate translation: “many people from Judea and Jerusalem”
1:5	h8h7		rc://*/ta/man/translate/figs-activepassive	καὶ ἐβαπτίζοντο ὑπ’ αὐτοῦ ἐν τῷ Ἰορδάνῃ ποταμῷ, ἐξομολογούμενοι τὰς ἁμαρτίας αὐτῶν	1	If it would be more natural in your language, you could say this with an active form. Alternate translation: “and he was baptizing them in the Jordan River, and they were confessing their sins”
1:6	n3rk		rc://*/ta/man/translate/writing-background	καὶ ἦν ὁ Ἰωάννης ἐνδεδυμένος τρίχας καμήλου, καὶ ζώνην δερματίνην περὶ τὴν ὀσφὺν αὐτοῦ, καὶ ἔσθων ἀκρίδας καὶ μέλι ἄγριον.	1	This verse helps provide background information about John. Use the natural form in your language for expressing background information.
1:6	kyy3		rc://*/ta/man/translate/figs-activepassive	ἦν ὁ Ἰωάννης ἐνδεδυμένος τρίχας καμήλου, καὶ ζώνην δερματίνην περὶ τὴν ὀσφὺν αὐτοῦ, καὶ ἔσθων ἀκρίδας	1	If your language does not use the passive form **was clothed**, you could express the idea in active form or in another way that is natural in your language. Alternate translation: “John wore camel hair and a leather belt around his waist, and ate locusts”
1:6	j141		rc://*/ta/man/translate/figs-explicit	ἦν ὁ Ἰωάννης ἐνδεδυμένος τρίχας καμήλου	1	The camels’ hair that John wore had been woven into rough, course material which was then made into clothing. If it would be helpful in your language, you could express that explicitly. Alternate translation: “John was clothed in rough clothing woven from camel’s hair”
1:6	h518		rc://*/ta/man/translate/translate-unknown	καμήλου	1	If your readers would not know what a **camel** is, you could include a description in a footnote or use a more general term. Alternate translation: “animal”
1:6	jpzh		rc://*/ta/man/translate/translate-unknown	ἀκρίδας	1	If your readers would not know what **locusts** are, you could include a description in a footnote or use a more general term. Alternate translation: “grasshoppers” or “insects”
1:7	p7tl		rc://*/ta/man/translate/writing-quotations	ἐκήρυσσεν λέγων	1	Consider natural ways of introducing direct quotations in your language. Alternate translation: “he announced loudly to the people” or “he proclaimed these things, saying”
1:7	l7jd		rc://*/ta/man/translate/writing-pronouns	ἐκήρυσσεν	1	The pronoun **he** is referring to John. If it would be helpful in your language, you could say that explicitly in your translation. Alternate translation: “John was proclaiming”
1:7	bk1j		rc://*/ta/man/translate/figs-explicit	ἔρχεται & ὀπίσω μου	1	Here, **coming after me** means that this mightier person would come at a later time than John came. It does not mean that he is behind John, chasing John, or following John as a disciple of his. If it would be helpful in your language, you could express that explicitly.
1:7	g8fw		rc://*/ta/man/translate/figs-explicit	οὗ οὐκ εἰμὶ ἱκανὸς, κύψας λῦσαι τὸν ἱμάντα τῶν ὑποδημάτων αὐτοῦ	1	Untying the straps of sandals was a duty of a slave. John is saying implicitly that the one who is coming will be so great that John is not even worthy to be his slave. If it would be helpful in your language, you could say that explicitly. Alternate translation: “and I am not even worthy to be his slave”
1:8	e4qi		rc://*/ta/man/translate/figs-metaphor	αὐτὸς δὲ βαπτίσει ὑμᾶς ἐν Πνεύματι Ἁγίῳ	1	John is using literal baptism, which puts a person under water, to speak of spiritual baptism, which will put people under the influence of the Holy Spirit. If possible, use the same word for **baptize** here as you used for John’s baptism. That should aid the comparison between the two. If this is not possible, you could use a simile or plain language. Alternate translation: “but he will join you to the Holy Spirit”
1:8	r1j9		rc://*/ta/man/translate/grammar-connect-logic-contrast	δὲ	1	Here, baptism by water and baptism by the Holy Spirit are being contrasted. Use a natural way in your language to introduce a contrast.
1:9	u65k		rc://*/ta/man/translate/writing-newevent	καὶ ἐγένετο ἐν ἐκείναις ταῖς ἡμέραις	1	This phrase, **And it happened that in those days**, marks the beginning of a new event in the storyline. Use the natural form in your language for introducing a new event
1:9	y8ea		rc://*/ta/man/translate/writing-pronouns	ἐν ἐκείναις ταῖς ἡμέραις	1	The phrase **those days** refers to the time period when John was preaching and baptizing people at the Jordan River. If it would be helpful in your language, you could state it more clearly. Alternate translation: “John was preaching and baptizing people when”
1:9	gi39		rc://*/ta/man/translate/figs-activepassive	ἐβαπτίσθη & ὑπὸ Ἰωάννου	1	If your language does not use the passive form in this way, you can express this idea in active form or in another way that is natural in your language. Alternate translation: “John baptized him”
1:9	zv8t		rc://*/ta/man/translate/figs-go	ἦλθεν Ἰησοῦς ἀπὸ Ναζαρὲτ τῆς Γαλιλαίας	1	Your language may say “went” rather than **came** in contexts such as this. Use whichever is more natural. Alternate translation: “Jesus went from Nazareth in Galilee” or “Jesus went out from Nazareth in Galilee”
1:10	stwh		rc://*/ta/man/translate/grammar-connect-time-sequential	εὐθὺς	1	The word **immediately** occurs often throughout the book of Mark. As used here, it means that the event it introduces occurs directly after the previous event. Use a natural form in your language for communicating this.
1:10	n8sg		rc://*/ta/man/translate/figs-activepassive	εἶδεν σχιζομένους τοὺς οὐρανοὺς	1	If your language does not use the passive form in this way, you can express this idea in active form or in another way that is natural in your language. Alternate translation: “he saw the heavens bursting open” or “he saw God tearing the heavens open”
1:10	m5f6		rc://*/ta/man/translate/figs-simile	τὸ Πνεῦμα ὡς περιστερὰν καταβαῖνον ἐπ’ αὐτόν	1	The phrase **like a dove** could mean: (1) the Spirit looked like a dove as he descended upon Jesus. Alternate translation: “the Spirit coming down from heaven, looking like a dove” (2) the Spirit descended upon Jesus as a dove descends from the sky toward the ground. Alternate translation: “the Spirit of God coming down from heaven as a dove comes down to earth”
1:11	jh9m		rc://*/ta/man/translate/figs-personification	καὶ φωνὴ ἐγένετο ἐκ τῶν οὐρανῶν	1	Mark speaks of this voice as if it were a living thing that could come from heaven to earth. If it would be helpful in your language, you could express this meaning plainly. Alternate translation: “And God spoke from heaven and said”
1:11	s6f4		rc://*/ta/man/translate/guidelines-sonofgodprinciples	ὁ Υἱός μου ὁ ἀγαπητός	1	The term **Son** is an important title for Jesus. The title **Son** describes Jesus’ relationship with God the Father.
1:12	mh8n			εὐθὺς	1	See how you translated the word **immediately** in [Mark 1:10](../mrk/01/10.md)
1:12	yv6v			τὸ Πνεῦμα αὐτὸν ἐκβάλλει εἰς τὴν ἔρημον	1	# Connecting Statement:\n\nAlternate translation: “the Spirit led Jesus into the wilderness”
1:13	k2kt		rc://*/ta/man/translate/figs-activepassive	πειραζόμενος ὑπὸ τοῦ Σατανᾶ	1	If your language does not use the passive form in this way, you can express this idea in active form or in another way that is natural in your language. Alternate translation: “and all the while Satan tempted him” or “during which time Satan kept trying to persuade him to disobey God”
1:13	siu3			ἦν μετὰ τῶν θηρίων	1	Alternate translation: “Jesus was living among the wild animals”
1:14	q12s		rc://*/ta/man/translate/figs-activepassive	μετὰ δὲ τὸ παραδοθῆναι τὸν Ἰωάννην	1	If your language does not use the passive form in this way, you can express this idea in active form or in another way that is natural in your language. Alternate translation: “But after the governor, Herod, had John arrested” or “But after Herod’s soldiers arrested John”
