Reference	ID	Tags	SupportReference	Quote	Occurrence	Note
6:53	p316		rc://*/ta/man/translate/translate-names	Γεννησαρὲτ	1	The word **Gennesaret** is the name of the region to the northwest of the Sea of Galilee.
6:55	d9k9			περιέδραμον & ἤκουον	1	Both occurrences of the word **they** in this verse refer to the people who recognized Jesus, not to the disciples.
6:56	gi6y			ἐτίθεσαν	1	Here, **they** refers to the people. It does not refer to Jesus’ disciples.
6:56	y6hs		rc://*/ta/man/translate/figs-nominaladj	τοὺς ἀσθενοῦντας	1	The phrase **the sick** refers to sick people. If it would be helpful in your language, you could state it explicitly. Alternate translation: “the sick people”
6:56	bqzf		rc://*/ta/man/translate/figs-parallelism	εἰς κώμας, ἢ εἰς πόλεις, ἢ εἰς ἀγροὺς	1	These three phrases mean basically the same thing. The second and third emphasize the meaning of the first by repeating the same idea with different words. If the repetition might be confusing, you could connect the phrases with a word other than **and** in order to show that the second phrase is repeating the first one, not saying something additional. Alternate translation: “any village and city, or even in the rural area”
7:intro	vq1j				0	# Mark 7 General Notes\n\n## Structure and Formatting\n\nSome translations set each line of poetry farther to the right than the rest of the text to make it easier to read. The ULT does this with the poetry in 7:6–7, which are words quoted from the Old Testament.\n\n## Special Concepts in this Chapter\n\n### Hand washing\n\nThe Pharisees washed many things that were not dirty, because they were trying to make God think that they were good. They washed their hands before they ate, even when their hands were not dirty. and even though the law of Moses did not say that they had to do it. Jesus told them that they were wrong and that people please God by trusting and obeying him. (See: [[rc://*/tw/dict/bible/kt/lawofmoses]] and [[rc://*/tw/dict/bible/kt/clean]])\n\n## Other Possible Translation Difficulties in this Chapter\n\n### “Ephphatha”\n\nThis is an Aramaic word. Mark wrote it the way it sounds using Greek letters and then explained what it means. (See: [[rc://*/ta/man/translate/translate-transliterate]])\n\n## Important Figures of Speech in this Chapter\n\n### The historic present\n\nTo call attention to a development in the story, Mark uses the present tense in past narration. In this chapter, the historic present occurs in verses 1, 18, 32, 34. If it would not be natural to do that in your language, you could use the past tense in your translation. Alternate translation: (See: [[rc://*/ta/man/translate/figs-pastforfuture]])
7:1	b9ul		rc://*/ta/man/translate/writing-newevent	καὶ συνάγονται πρὸς αὐτὸν οἱ Φαρισαῖοι καί τινες τῶν γραμματέων, ἐλθόντες ἀπὸ Ἱεροσολύμων	1	This verse introduces a new event that happened some time after the events the story has just related. The story does not say how long after those events this new event happened. Use the natural form in your language for introducing a new event.
7:2	wd6i		rc://*/ta/man/translate/figs-extrainfo		0	# General Information:\n\nThe following verses explain the significance of this verse. Since it is explained in the following verses, you do not need to explain its meaning here.
7:3	mj6u		rc://*/ta/man/translate/writing-background	γὰρ	1	This verse and the next verse are added to explain why the Jewish leaders did not approve of what Jesus’ disciples were doing. Use the natural form in your language for expressing background information. Alternate translation: “They were appalled because”
7:3	x0b6		rc://*/ta/man/translate/figs-explicit	κρατοῦντες τὴν παράδοσιν τῶν πρεσβυτέρων	1	The **tradition of the elders** consisted of teachings that were handed down from generation to generation. If it would be helpful in your language, you could say that explicitly. Alternate translation: “observing strictly the teachings which past generations had taught them”
7:4	d3qc		rc://*/ta/man/translate/figs-explicit	ποτηρίων καὶ ξεστῶν καὶ χαλκίων	1	The **cups, and pots, and copper vessels** would have been used for consuming food and drinks. If it would be helpful in your language, you could say that explicitly. Alternate translation: “cups, pots, and copper vessels for eating and drinking”
7:5	hts4		rc://*/ta/man/translate/figs-metaphor	διὰ τί οὐ περιπατοῦσιν οἱ μαθηταί σου κατὰ τὴν παράδοσιν τῶν πρεσβυτέρων	1	The phrase **walk according to** is way of saying “obey.” If your readers would not understand what **walk** means in this context, you could use an equivalent metaphor from your culture. Alternatively, you could express the meaning plainly. Alternate translation: “Why do your disciples not obey what the elders have taught us”
7:5	ugom		rc://*/ta/man/translate/grammar-connect-logic-contrast	ἀλλὰ	1	Here, **but** is used here to contrast what the Pharisees thought Jesus’ disciples should be doing with what they were actually doing. Use a natural way in your language for introducing a contrast.
7:5	j7ht		rc://*/ta/man/translate/figs-synecdoche	ἄρτον	1	Here, **bread** represents food in general. Alternate translation: “food”
7:6	oavh		rc://*/ta/man/translate/figs-quotesinquotes	ὁ δὲ ἀποκριθεὶς εἶπεν αὐτοῖς, ὅτι καλῶς ἐπροφήτευσεν Ἠσαΐας περὶ ὑμῶν τῶν ὑποκριτῶν, ὡς γέγραπται, ὅτι οὗτος ὁ λαὸς τοῖς χείλεσίν με τιμᾷ, ἡ δὲ καρδία αὐτῶν πόρρω ἀπέχει ἀπ’ ἐμοῦ	1	If the direct quotation inside a direct quotation would be confusing in your language, you could translate the second direct quotation as an indirect quotation. Alternate translation: “Jesus said to them, ‘Isaiah prophesied well about you hypocrites when God wrote through him that people honor him with their lips, but their desires are for other things’”
7:6	ep7u		rc://*/ta/man/translate/figs-metonymy	τοῖς χείλεσίν	1	Here, **lips** is used to signify speaking. If it would be helpful in your language, you could use an equivalent expression or plain language. Alternate translation: “by what they say”
7:6	zgt9		rc://*/ta/man/translate/figs-metonymy	ἡ & καρδία αὐτῶν	1	The word **heart** means inner thoughts and desires. If it would be helpful in your language, you could use an equivalent expression or plain language. Alternate translation: “their desire”
7:6	xtab		rc://*/ta/man/translate/figs-idiom	ἡ δὲ καρδία αὐτῶν πόρρω ἀπέχει ἀπ’ ἐμοῦ	1	The expression **their heart is far from me** is a way that God is saying that the people are not truly devoted to him. If it would be helpful in your language, you could use an equivalent idiom or use plain language. Alternate translation: “but they do not really love me” or “but they are not truly devoted to me” or “but they are not really committed to honoring me”
7:8	hnw4		rc://*/ta/man/translate/figs-metaphor	κρατεῖτε	1	Here, to **hold fast to** something means to adhere to something consistently. If your readers would not understand what **hold fast** means in this context, you could use an equivalent metaphor from your culture. Alternatively, you could express the meaning plainly. Alternative translation: “you cling to”
7:9	e3qv		rc://*/ta/man/translate/figs-irony	καλῶς ἀθετεῖτε τὴν ἐντολὴν τοῦ Θεοῦ, ἵνα τὴν παράδοσιν ὑμῶν τηρήσητε	1	Jesus says **You do well at rejecting the commandment of God so that you may keep your tradition** to rebuke his listeners for forsaking God’s **commandment**. If it would be helpful in your language, consider expressing the meaning plainly. Alternate translation: “You think you have done well by rejecting the commandment of God so that you may keep your own traditions, but what you have done is not good at all”
7:10	d4sd		rc://*/ta/man/translate/figs-quotesinquotes	Μωϋσῆς γὰρ εἶπεν, τίμα τὸν πατέρα σου καὶ τὴν μητέρα σου; καί, ὁ κακολογῶν πατέρα ἢ μητέρα θανάτῳ τελευτάτω	1	If the direct quotation inside a direct quotation would be confusing in your language, you could translate the second direct quotation as an indirect quotation. Alternate translation: “For Moses said to honor your father and mother. He also said that the person who speaks evil against his father or mother deserves to die”
7:11	cd57		rc://*/ta/man/translate/translate-transliterate	κορβᾶν	1	**Corban** is a Hebrew word that refers to things that people promise to give to God. Translators normally transliterate it, using the target language alphabet. Some translators translate its meaning and then leave out Mark’s explanation of the meaning that follows. In your translation you can spell it the way it sounds in your language and then explain its meaning.
7:11	ev2r		rc://*/ta/man/translate/grammar-connect-time-background	ὅ ἐστιν δῶρον	1	The author says **that is, a gift** to provide background information to his audience, who may not have understood this word. Use a natural way in your language for introducing background information. Alternate translation: “meaning ‘a gift’”
7:14	u3nk		rc://*/ta/man/translate/figs-doublet	ἀκούσατέ μου πάντες καὶ σύνετε	1	The words **Listen** and **understand** are related. Jesus uses them together to emphasize that his hearers should pay close attention to what he is saying. If your language does not use repetition to do this, you can use one phrase and provide emphasis in another way. Alternate translation: “All of you, take heed to what I am about to say to you”
7:15	gk5i		rc://*/ta/man/translate/figs-explicit	οὐδέν & ἔξωθεν τοῦ ἀνθρώπου	1	Jesus is speaking about what a person eats. If it would be helpful in your language, you could express that explicitly. Alternate translation: “nothing which a person can eat”
7:15	ms5c		rc://*/ta/man/translate/figs-metonymy	τὰ ἐκ τοῦ ἀνθρώπου ἐκπορευόμενά	1	By using the phrase **the things that come out from the man**, Jesus is speaking about the thoughts and desires of a person. If it would be helpful in your language, you could use an equivalent expression or plain language. Alternate translation: “the things which a person thinks and does”
7:17	l7d7		rc://*/ta/man/translate/writing-endofstory	καὶ ὅτε	1	Here, the phrase **And when** is being used as a comment about what happened after the story as a result of the events within the story itself. Use the natural form in your language for expressing the conclusion of a story.
7:18	z8w1		rc://*/ta/man/translate/figs-rquestion	οὕτως καὶ ὑμεῖς ἀσύνετοί ἐστε?	1	Jesus uses this question to express his disappointment that they do not understand. If you would not use a rhetorical question for this purpose in your language, you could translate his words as a statement or an exclamation and communicate the emphasis in another way. Alternate translation: “After all I have said and done, I am amazed that you still do not understand!”
7:18	yqve		rc://*/ta/man/translate/figs-metonymy	πᾶν τὸ ἔξωθεν εἰσπορευόμενον εἰς τὸν ἄνθρωπον, οὐ δύναται αὐτὸν κοινῶσαι	1	See the note in [7:15](../07/15.md) regarding the similar expression.
7:19	y2cr		rc://*/ta/man/translate/figs-metonymy	οὐκ εἰσπορεύεται αὐτοῦ εἰς τὴν καρδίαν	1	Here, **heart** means a person’s inner being or mind. Here, Jesus means that food does not affect a person’s character. If it would be helpful in your language, you could use an equivalent expression or plain language. Alternate translation: “it cannot go into his inner being” or “it cannot go into his mind”
7:19	hm98		rc://*/ta/man/translate/writing-background	καθαρίζων πάντα τὰ βρώματα	1	The phrase **making all foods clean** explains to the reader the significance of Jesus’ saying. Use the natural form in your language for expressing background information.
7:20	r12p		rc://*/ta/man/translate/figs-metonymy	τὸ ἐκ τοῦ ἀνθρώπου ἐκπορευόμενον, ἐκεῖνο κοινοῖ	1	**What is coming out from the man** means the thoughts and intentions of a person. If it would be helpful in your language, you could use an equivalent expression from your culture or plain language. Alternate translation: “It is what a person thinks and desires that defiles”
7:21	chkk		rc://*/ta/man/translate/figs-metonymy	ἐκ τῆς καρδίας τῶν ἀνθρώπων οἱ διαλογισμοὶ οἱ κακοὶ ἐκπορεύονται	1	Here, **heart** refers to a person’s inner being or mind. Alternate translation: “out of the inner being of a person come evil thoughts” or “out of the mind of a person come evil thoughts”
7:21	eey1		rc://*/ta/man/translate/figs-litany	πορνεῖαι, κλοπαί, φόνοι	1	Mark lists out a number of sins here and in the next verse. Use a natural form in your language that someone would use to list things that someone has done wrong.
7:24	k9bl		rc://*/ta/man/translate/writing-background	καὶ εἰσελθὼν εἰς οἰκίαν, οὐδένα ἤθελεν γνῶναι, καὶ οὐκ ἠδυνάσθη λαθεῖν	1	# Connecting Statement:\n\nThe phrase **and having entered into a house, he was wanting no one to know {it}, but he was not able to hide** provides background information to what Jesus was thinking as he traveled to this area. Use the natural form in your language for expressing background information. Alternate translation: “Having entered someone’s house, he was hoping he would not be found, but he was unable to hide from the people of that place”
7:26	aik7		rc://*/ta/man/translate/writing-background	ἡ δὲ γυνὴ ἦν Ἑλληνίς, Συροφοινίκισσα τῷ γένει	1	This sentence gives us background information about **the woman**. Use the natural form in your language for expressing background information.
7:26	e39y		rc://*/ta/man/translate/translate-names	Συροφοινίκισσα	1	The phrase **a Syrophoenician** explains the woman’s nationality. She was born in the Phoenician region in Syria.
7:27	gsj7		rc://*/ta/man/translate/figs-metaphor	ἄφες πρῶτον χορτασθῆναι τὰ τέκνα; οὐ γάρ ἐστιν καλόν λαβεῖν τὸν ἄρτον τῶν τέκνων, καὶ τοῖς κυναρίοις βαλεῖν	1	Here, Jesus speaks about the Jews as if they are **children** and the Gentiles as if they are **dogs**. This is not meant as a derogatory remark, but he is talking in terms of whether they are Israelites or not. If it would be helpful in your language, you could use an equivalent expression from your culture. Alternatively, you could express the meaning plainly. Alternate translation: “Let the children of Israel first eat, for it is not right to take the children’s bread and throw it to the Gentiles, who are like household pets compared to them”
7:27	r898		rc://*/ta/man/translate/figs-activepassive	ἄφες πρῶτον χορτασθῆναι τὰ τέκνα	1	If your language does not use the passive form in this way, you can state this in active form or in another way that is natural in your language. Alternate translation: “We must first feed the children of Israel”
7:27	k2wb		rc://*/ta/man/translate/figs-synecdoche	ἄρτον	1	Here, **bread** refers to food in general.
7:29	sa9t		rc://*/ta/man/translate/figs-explicit	ὕπαγε	1	Jesus was implying that the woman no longer needed to stay to ask him to help her daughter. He would do it. If it would be helpful in your language, you could clarify this. Alternate translation: “you may go now” or “you may go home in peace”
7:29	sbqp		rc://*/ta/man/translate/figs-explicit	ἐξελήλυθεν τὸ δαιμόνιον, ἐκ τῆς θυγατρός σου	1	**The demon** left the **daughter** because Jesus commanded it too. If it would be helpful in your language, you could say that explicitly. Alternate translation: “I have commanded the demon to leave your daughter”
7:31	cxa8		rc://*/ta/man/translate/translate-names	Δεκαπόλεως	1	This word, **Decapolis**, is the name of a region that means Ten Cities. It is located to the southeast of the Sea of Galilee. See how you translated this in [Mark 5:20](../05/20.md).
7:32	jlj4		rc://*/ta/man/translate/figs-explicit	παρακαλοῦσιν αὐτὸν ἵνα ἐπιθῇ αὐτῷ τὴν χεῖρα	1	Prophets and teachers would put place their **hand on** a person in order to heal them or bless them. In this case, people plead with Jesus to heal a man. If it would be helpful in your language, you could say that explicitly. Alternate translation: “they begged Jesus to put his hand on the man to heal him”
7:33	ld3f		rc://*/ta/man/translate/figs-explicit	πτύσας	1	Here, Jesus **spit** on his fingers. If it would be helpful in your language, you could say that explicitly. Alternate translation: “after spitting on his fingers”
7:34	lbw4		rc://*/ta/man/translate/translate-transliterate	ἐφφαθά	1	**Ephphatha** is an Aramaic word. Mark spelled it using Greek letters so his readers would know how it sounded, and then he told what it meant, “**Be opened**”. In your translation you could spell it the way it sounds in your language and then explain its meaning.
7:35	yg15		rc://*/ta/man/translate/figs-idiom	ἠνοίγησαν αὐτοῦ αἱ ἀκοαί	1	The phrase **his ears were opened** means that the man was enabled to hear. Alternate translation: “Jesus opened his ears, and he was able to hear” or “he was able to hear”
7:35	yj4j		rc://*/ta/man/translate/figs-activepassive	ἐλύθη ὁ δεσμὸς τῆς γλώσσης αὐτοῦ	1	The phrase **his tongue was released** is passive in form. If your language does not use the passive form in this way, you can state this in active form or in another way that is natural in your language. Alternate translation: “Jesus took away what prevented his tongue from speaking” or “Jesus loosened his tongue”
7:35	gssm		rc://*/ta/man/translate/figs-idiom	ἐλύθη ὁ δεσμὸς τῆς γλώσσης αὐτοῦ	1	Here, **the band of his tongue was released** means he became able to speak. Alternate translation: “his tongue was freed and he was able to speak” or “he was able to speak”
7:36	eb2y		rc://*/ta/man/translate/figs-ellipsis	ὅσον & αὐτοῖς διεστέλλετο, αὐτοὶ	1	This refers to Jesus ordering them not to tell anyone about what he had done. If it would be helpful in your language, you could supply these words from the context. Alternate translation: “the more he ordered them not to tell anyone”
7:37	dh17		rc://*/ta/man/translate/figs-metonymy	τοὺς κωφοὺς & ἀλάλους	1	The phrase **the deaf** and the phrase **the mute** both refer to groups of people. If it would be helpful in your language, you could indicate this explicitly. Alternate translation: “deaf people … mute people” or “people who cannot hear … people who cannot speak”
8:intro	ry56				0	# Mark 8 General Notes\n\n## Special Concepts in this Chapter\n\n### Bread\n\nWhen Jesus worked a miracle and provided bread for a large crowd of people, they probably thought about when God miraculously provided food for the people of Israel when they were in the wilderness.\n\nYeast is the ingredient that causes bread to expand before it is baked. In this chapter, Jesus uses yeast as a metaphor for things that change the way people think, speak, and act. (See: [[rc://*/ta/man/translate/figs-metaphor]])\n\n### “Adulterous generation”\n\nWhen Jesus called the people an “adulterous generation,” he was telling them that they were not faithful to God. (See: [[rc://*/tw/dict/bible/kt/faithful]] and [[rc://*/tw/dict/bible/kt/peopleofgod]])\n\n## Important Figures of Speech in this Chapter\n\n### The historic present\n\nTo call attention to a development in the story, Mark uses the present tense in past narration. In this chapter, the historic present occurs in verses 1, 2, 6, 12, 17, 19, 20, 22, 29 and 33. If it would not be natural to do that in your language, you could use the past tense in your translation. (See: [[rc://*/ta/man/translate/figs-pastforfuture]])\n\n### Rhetorical questions\n\nJesus used many rhetorical questions as a way of both teaching the disciples [Mark 8:17–21](./17.md) and rebuking the people [Mark 8:12](../mrk/08/12.md). (See: [[rc://*/ta/man/translate/figs-rquestion]])\n\n## Other Possible Translation Difficulties in this Chapter\n\n### Paradox\n\nA paradox is a true statement that appears to describe something impossible. Jesus uses a paradox when he says, “Whoever wants to save his life will lose it, and whoever loses his life for my sake will find it” [Mark 8:35–37](../08/35.md)
8:1	rmd8		rc://*/ta/man/translate/writing-newevent	ἐν ἐκείναις ταῖς ἡμέραις	1	The phrase **In those days** introduces a new event that happened some time after the events in the story that Mark has just related. The story does not say how long after those events this new event happened. Use the natural form in your language for introducing a new event.
8:1	sgv6		rc://*/ta/man/translate/figs-extrainfo	μὴ ἐχόντων τι φάγωσιν	1	# Connecting Statement:\n\nFollowing this, Jesus explains why the crowd did not have **anything to eat**. Since the expression is explained in the next verse, you do not need to explain its meaning further here.
8:3	u3mu		rc://*/ta/man/translate/grammar-connect-condition-hypothetical	καὶ ἐὰν ἀπολύσω αὐτοὺς νήστεις εἰς οἶκον αὐτῶν, ἐκλυθήσονται ἐν τῇ ὁδῷ	1	Jesus is using a hypothetical situation to bring to the disciples attention the dangers of making the people return home without eating. Alternate translation: “If I should send them to their houses hungry, some of them might collapse on the way home”
8:4	jdk2		rc://*/ta/man/translate/figs-rquestion	πόθεν τούτους δυνήσεταί τις ὧδε χορτάσαι ἄρτων ἐπ’ ἐρημίας?	1	The disciples are expressing surprise that Jesus would expect them to be able to find enough food for the crowd. If you would not use a rhetorical question for this purpose in your language, you could translate their words as a statement or an exclamation and communicate the emphasis in another way. Alternate translation: “This place is so deserted that there is no place here for us to get enough loaves of bread to satisfy these people!”
8:6	x2jr		rc://*/ta/man/translate/figs-quotations	παραγγέλλει τῷ ὄχλῳ ἀναπεσεῖν ἐπὶ τῆς γῆς	1	If it would be more natural in your language, you could express **to recline on the ground** as a direct quotation, as modeled by the UST.
8:7	bio6		rc://*/ta/man/translate/figs-quotations	εἶπεν καὶ ταῦτα παρατιθέναι	1	If it would be more natural in your language, you could express **to serve these also** as a direct quotation. Alternate translation: “Jesus said to the disciples, ‘Serve these fish also’”
8:8	v5zi		rc://*/ta/man/translate/figs-explicit	περισσεύματα κλασμάτων ἑπτὰ σπυρίδας	1	This refers to the **broken pieces** of bread that were left over after the people ate. Alternate translation: “the remaining broken pieces of bread, which filled seven large baskets”
8:9	m81z		rc://*/ta/man/translate/writing-background	ἦσαν δὲ ὡς τετρακισχίλιοι	1	Mark includes the phrase **Now there were about 4,000** to help his reader to know how many people are there. Use the natural form in your language for expressing background information. Alternate translation: “There were approximately 4,000 people that Jesus fed”
8:10	qnt3		rc://*/ta/man/translate/writing-endofstory	καὶ εὐθὺς ἐμβὰς εἰς τὸ πλοῖον μετὰ τῶν μαθητῶν αὐτοῦ	1	**And immediately, having gotten into the boat with his disciples** is a comment concluding the story of Jesus feeding the 4,000 people. Use the natural form in your language for expressing the conclusion of a story.
8:10	y8u3		rc://*/ta/man/translate/figs-explicit	ἦλθεν εἰς τὰ μέρη Δαλμανουθά	1	They went to **Dalmanutha** in a boat. If it would be helpful in your language, you could say that explicitly. Alternate translation: “he traveled over the Sea of Galilee to the region of Dalmanutha”
8:10	x33a		rc://*/ta/man/translate/translate-names	Δαλμανουθά	1	The word **Dalmanutha** is the name of a place on the northwestern shore of the Sea of Galilee.
8:11	zi91		rc://*/ta/man/translate/figs-metonymy	σημεῖον ἀπὸ τοῦ οὐρανοῦ	1	Here, **heaven** refers to where God dwells and is an indirect way of referring to “God” himself. If your readers would not understand the use of the word **heaven** in this context, you could use an equivalent expression or plain language. Alternate translation: “a sign from God”
