Reference	ID	Tags	SupportReference	Quote	Occurrence	Note
10:44	e7sn		rc://*/ta/man/translate/figs-metaphor	εἶναι πρῶτος	1	Here, **to be first** means being the most important. See how you translated **first** in [Mark 9:35](../mrk/09/35.md). Alternate translation: “to be the most important”
10:44	qzo8		rc://*/ta/man/translate/figs-declarative	ἔσται πάντων δοῦλος	1	Jesus is using the future statement **will be a slave of all** to give an instruction. See how you translated the phrase “will be” in [10:43](../10/43.md), where it occurs with the same meaning. Alternate translation: “must be a slave of all”
10:44	u5yb		rc://*/ta/man/translate/figs-hyperbole	ἔσται & δοῦλος	1	Jesus speaks of being **a slave** to emphasize the great effort Jesus’ followers should make to serve others. If it would be helpful in your language, you could use an equivalent expression from your language that shows service, or you could clarify that Jesus is teaching that his followers must act in a way that is similar to slaves in their service to others. as modeled by the UST.
10:45	ctta		rc://*/ta/man/translate/figs-123person	καὶ γὰρ ὁ Υἱὸς τοῦ Ἀνθρώπου	1	Jesus is referring to himself in the third person. If it would be helpful in your language, you could translate this in the first person as modeled by the UST.
10:45	pmk3		rc://*/ta/man/translate/figs-go	οὐκ ἦλθεν	1	Your language may say “go” rather than **come** in contexts such as this. Use whichever is more natural. Alternate translation: “did not leave heaven and go to earth”
10:45	a3fr		rc://*/ta/man/translate/figs-activepassive	διακονηθῆναι	1	The phrase **to be served** is passive in form. If your language does not use the passive form in this way, you can state this in active form or in another way that is natural in your language. Alternate translation: “to have people serve him”
10:45	rik1			διακονηθῆναι, ἀλλὰ διακονῆσαι	1	Alternate translation: “to be served by people, but to serve people”
10:45	d9jd			ἀντὶ πολλῶν	1	Alternate translation: “in place of many people’s lives” or “in exchange for many people”
10:46	n4i3		rc://*/ta/man/translate/figs-go	ἔρχονται εἰς Ἰερειχώ	1	# Connecting Statement:\n\nYour language may say “go” or “went” rather than **come** in contexts such as this. Use whichever is more natural. Alternate translation: “they went into Jericho”
10:46	bq3j		rc://*/ta/man/translate/figs-go	ἐκπορευομένου αὐτοῦ	1	Your language may say “coming” rather than **going** in contexts such as this. Use whichever is more natural. Alternate translation: “as he is coming out”
10:47	ow3g		rc://*/ta/man/translate/translate-names	Ἰησοῦς ὁ Ναζαρηνός	1	The people call Jesus **Jesus the Nazarene** because he was from the town of Nazareth in Galilee. Alternate translation: “Jesus from the town of Nazareth”
10:47	opm0		rc://*/ta/man/translate/grammar-connect-logic-result	καὶ	1	Here, Mark uses **And** to introduce a reason-result statement. **And** introduces the reason, **having heard that it was Jesus**, which resulted in Bartimaeus beginning **to cry out and to say, “Son of David, Jesus, have mercy on me!”** When the blind man learned that Jesus was walking by, he knew that Jesus would hear him if he called out, so as a result, he shouted to him. Use a natural way in your language for introducing a reason-result statement. Alternate translation: “So”
10:47	ynr7		rc://*/ta/man/translate/figs-metaphor	Υἱὲ Δαυεὶδ	1	The blind man is using the word **Son** to mean “descendant.” If it would be helpful in your language, you could use an equivalent expression or express the meaning using plain language. Alternate translation: “Descendant of David”
10:47	vwz9		rc://*/ta/man/translate/figs-explicit	Υἱὲ Δαυεὶδ	1	**David** was Israel’s most important king, and God had promised him that one of his descendants would be the Messiah. So the title **Son of David** implicitly meant “Messiah.” Alternate translation: “Messiah”
10:47	ylls		rc://*/ta/man/translate/figs-abstractnouns	ἐλέησόν με	1	If your language does not use an abstract noun for the idea of **mercy**, you can express the idea behind the abstract noun **mercy** by using an adjective form such as “merciful” or by expressing it some other way. Alternate translation: “be merciful to me”
10:47	s2dr		rc://*/ta/man/translate/figs-imperative	ἐλέησόν με	1	The phrase **have mercy** is an imperative, but it should be translated as a polite request rather than as a command. It may be helpful to add a word such as “please” to make this clear. Alternate translation: “please be merciful to me”
10:47	tvkh		rc://*/ta/man/translate/figs-explicit	ἐλέησόν με	1	The blind man assumes that Jesus will know that he is asking to be healed. If it would be helpful in your language, you could say that explicitly. Alternate translation: “please have mercy on me and heal me” or “please be merciful to me by healing me”
10:48	ca5u			ἐπετίμων αὐτῷ πολλοὶ ἵνα σιωπήσῃ	1	Alternate translation: “many people kept telling him not to shout”
10:48	m32u			πολλῷ μᾶλλον ἔκραζεν	1	The phrase **was crying out much more** could mean: (1) that the blind man shouted even louder to Jesus. (2) that the blind man called out even more persistently. Alternate translation: “called out even more persistently”
10:48	l86a		rc://*/ta/man/translate/figs-explicit	Υἱὲ Δαυείδ, ἐλέησόν με	1	See how you decided to translate this phrase in [10:47](../010/47.md). Alternate translation: “Messiah, please have mercy on me and heal me”
10:49	ac7h		rc://*/ta/man/translate/writing-pronouns	φωνοῦσι	1	Here, the pronoun **they** refers to the crowd. If it would be helpful in your language, you could state explicitly who **they** refers to. Alternate translation: “some people in the crowd called” or “some people in the front of the crowd called”
10:49	n6xl		rc://*/ta/man/translate/figs-abstractnouns	θάρσει	1	If your language does not use an abstract noun for the idea of **courage**, you can express the idea behind the abstract noun **courage** by using an adjective form such as “courageous” or by expressing it some other way. Alternate translation: “Be courageous”
10:52	s5d2		rc://*/ta/man/translate/figs-explicit	ἡ πίστις σου σέσωκέν σε	1	This phrase is written this way to place emphasis on the man’s **faith**. Jesus heals the man because the man believes that Jesus can heal him. If it would be helpful in your language, this could be made explicit. Alternate translation: “I am healing you because you have believed in me”
10:52	bjuw		rc://*/ta/man/translate/figs-abstractnouns	ἡ πίστις σου σέσωκέν σε	1	If your language does not use an abstract noun for the idea of **faith**, you can express the idea behind this word by using a verb such as “trusted,” as modeled by the UST, or by expressing the meaning of **faith** some other way that is natural in your language.
10:52	ub7w		rc://*/ta/man/translate/figs-abstractnouns	ἀνέβλεψεν	1	If your language does not use an abstract noun for the idea of **sight**, you can express the idea behind this word by using a verb such as “see,” as modeled by the UST, or by expressing the meaning of **sight** in some other way that is natural in your language.
11:intro	xg3t				0	# Mark 11 General Notes\n\n## Structure and Formatting\n\nSome translations set each line of poetry farther to the right than the rest of the text to make it easier to read. The ULT does this with the poetry in [Mark 11:9–10](../mrk/11/09.md) and [Mark 11:17](../mrk/11/17.md), which are words from the Old Testament.\n\n## Special Concepts in this Chapter\n\n### The donkey and the colt\n\nJesus rode into Jerusalem on an animal. In this way he was like a king who came into a city after he had won an important battle. Also, the kings of Israel in the Old Testament rode on a donkeys. Other kings rode on horses. So Jesus was showing that he was the king of Israel and that he was not like other kings.\n\nMatthew, Mark, Luke, and John all wrote about this event. Matthew and Mark wrote that the disciples brought Jesus a donkey. John wrote that Jesus found a donkey. Luke wrote that they brought him a colt. Only Matthew wrote that there were both; the donkey had a colt. No one knows for sure whether Jesus rode the donkey or the colt. It is best to translate each of these accounts as it appears in the ULT without trying to make them all say exactly the same thing. (See: [Matthew 21:1–7](../mat/21/01.md) and [Mark 11:1–7](../mrk/11/01.md) and [Luke 19:29–36](../luk/19/29.md) and [John 12:14–15](../jhn/12/14.md))
11:1	ch4j		rc://*/ta/man/translate/figs-go	ἐγγίζουσιν	1	Your language may say “went” rather than **come** in contexts such as this. Use whichever is more natural. Alternate translation: “they went near”
11:1	g1fy		rc://*/ta/man/translate/translate-names	Βηθφαγὴ	1	The word **Bethphage** is the name of a village.
11:2	bi22		rc://*/ta/man/translate/figs-go	ὑπάγετε εἰς τὴν κώμην	1	Your language may say “Come” rather than **Go** in contexts such as this. Use whichever is more natural. Alternate translation: “Come into the village”
11:2	si41		rc://*/ta/man/translate/figs-youdual	ὑμῶν & εὑρήσετε	1	Since the word **you** applies to the two disciples in both of these instances, it would be dual, if your language uses that form. Otherwise, it would be plural.
11:2	r41g		rc://*/ta/man/translate/translate-unknown	πῶλον	1	The term **colt** refers to a young donkey. If your readers would not be familiar with what a donkey is, you could use a general expression. Alternate translation: “a young donkey” or “a young riding animal”
11:2	yw78		rc://*/ta/man/translate/figs-gendernotations	οὐδεὶς ἀνθρώπων οὔπω ἐκάθισεν	1	Although the term **man** is masculine, Mark is using the word here in a generic sense, that includes both men and women. He means that “no one” had yet sat on the donkey. If it would be helpful in your language, you could indicate that explicitly. Alternate translation: “no person has yet sat” or “no one has yet sat”
11:2	zloo		rc://*/ta/man/translate/figs-metonymy	οὐδεὶς ἀνθρώπων οὔπω ἐκάθισεν	1	Jesus is using the term **sat** to refer to riding on an animal by association with the way people sit on an animal they are riding. If it would be helpful in your language, you could use an equivalent expression or plain language. Alternate translation: “no person has ever ridden”
11:3	aw3v		rc://*/ta/man/translate/figs-quotesinquotes	καὶ ἐάν τις ὑμῖν εἴπῃ, τί ποιεῖτε τοῦτο? εἴπατε, ὅτι ὁ Κύριος αὐτοῦ χρείαν ἔχει, καὶ εὐθὺς αὐτὸν ἀποστέλλει πάλιν ὧδε	1	This verse contains two direct quotations within a direct quotation. If this would be confusing in your language, you could translate the two direct quotations in this verse as indirect quotations. Alternate translation: “And if anyone asks you why you are untying the donkey, tell them that the Lord needs it and will send it back here as soon as he is done using it”
11:3	q446		rc://*/ta/man/translate/figs-youdual	ποιεῖτε	1	The villagers would be speaking to the two disciples, so **you** would be dual if your language uses that form. Otherwise, it would be plural.
11:3	xw55		rc://*/ta/man/translate/figs-explicit	τί ποιεῖτε τοῦτο?	1	If it would be helpful in your language, you could say explicitly what the phrase **doing this** refers to. Alternate translation: “Why are you untying and taking the colt”
11:3	k7fd		rc://*/ta/man/translate/figs-abstractnouns	αὐτοῦ χρείαν ἔχει	1	If your language does not use an abstract noun for the idea of **need**, you can express the same idea in another way. Alternate translation: “requires it”
11:3	yj5y			εὐθὺς αὐτὸν ἀποστέλλει πάλιν ὧδε	1	Alternate translation: “will immediately send it back when he no longer needs it”
11:4	y381		rc://*/ta/man/translate/writing-pronouns	ἀπῆλθον	1	Here, **they** refers to the two disciples mentioned in [11:1](../11/01.md). If it would be helpful in your language, you could say that explicitly, as modeled by the UST.
11:4	f6hc			πῶλον	1	See how you translated **colt** in [Mark 11:2](../11/02.md). Alternate translation: “a young donkey” or “a young riding animal”
11:7	k9g7		rc://*/ta/man/translate/translate-unknown	τὰ ἱμάτια	1	The word **cloaks** refers to outer garments. You could translate this with the name of an outer garment that your readers would recognize or with a general expression. Alternate translation: “coats” or “outer garments”
11:7	sbqy		rc://*/ta/man/translate/figs-explicit	ἐπιβάλλουσιν αὐτῷ τὰ ἱμάτια αὐτῶν	1	The disciples did this to show that the person riding the colt was special and important. In this culture, animals that important people rode were draped with rich fabrics. If it would be helpful in your language, you could indicate that explicitly. Alternate translation: “draped the colt with their cloaks as a sign of honor”
11:8	t8hy		rc://*/ta/man/translate/figs-explicit	πολλοὶ τὰ ἱμάτια αὐτῶν ἔστρωσαν εἰς τὴν ὁδόν, ἄλλοι δὲ στιβάδας κόψαντες ἐκ τῶν ἀγρῶν	1	Spreading **cloaks on the road** and **branches** was a way of showing honor to someone. If it would be helpful in your language, you could indicate that explicitly. It may be helpful to make this a separate sentence. Alternate translation: “many people spread their cloaks on the road, and others spread branches they had cut from the fields. They did this in order to honor Jesus”
11:8	jk2o		rc://*/ta/man/translate/translate-symaction	πολλοὶ τὰ ἱμάτια αὐτῶν ἔστρωσαν εἰς τὴν ὁδόν, ἄλλοι δὲ στιβάδας κόψαντες ἐκ τῶν ἀγρῶν	1	The words **many**, **others**, and **they** all refer to other people besides the disciples. Alternate translation: “many people spread their cloaks on the road, and other people spread branches they had cut”
11:8	fwl0			ἱμάτια	1	See how you translated the word **cloaks** in [11:7](../11/07.md). Alternate translation: “coats” or “outer garments”
11:9	d8se		rc://*/ta/man/translate/translate-transliterate	ὡσαννά	1	The word **Hosanna** is a Hebrew word. Mark spelled it out using Greek letters so his readers would know how it sounded. **Hosanna** had an original meaning of “save now,” but by the time of this event it had become a way of praising God. In your translation you can spell **Hosanna** the way it sounds in your language or you could translate it according to how the word was used, as the UST does.
11:9	ye41		rc://*/ta/man/translate/figs-activepassive	εὐλογημένος ὁ ἐρχόμενος ἐν ὀνόματι Κυρίου	1	The word **Blessed** is passive in form. If your language does not use the passive form in this way, you can express the idea in active form or in another way that is natural in your language. If you must state who did the action, “God” is the one doing the blessing.
11:9	suib			εὐλογημένος ὁ ἐρχόμενος ἐν ὀνόματι Κυρίου	1	The phrase **Blessed is the one** could be: (1) a request for God to bless Jesus. Alternate translation: “May God bless the one who comes in his name” (2) stating that God had already blessed Jesus. Alternate translation: “God has blessed the one who comes in his name”
11:9	x1bz		rc://*/ta/man/translate/figs-explicit	εὐλογημένος ὁ ἐρχόμενος	1	Here, the phrase **the one** refers to Jesus. If it would be helpful in your language, you could state that explicitly. Alternate translation: “Blessed are you, the one who comes”
11:9	e2p6		rc://*/ta/man/translate/figs-metonymy	ἐν ὀνόματι Κυρίου	1	Here, the phrase **in the name of** expresses authority. The phrase **in the name of the Lord** means “with the authority of the Lord.” If it would help in your language, you could use an equivalent expression from your language or express this plainly. Alternate translation: “with the authority of the Lord” or “with the Lord’s authority”
11:10	kkfo		rc://*/ta/man/translate/figs-activepassive	εὐλογημένη	1	The word **Blessed** is passive in form. See how you translated this word in [11:9](../11/09.md).
11:10	a6b4			εὐλογημένη ἡ ἐρχομένη βασιλεία τοῦ πατρὸς ἡμῶν, Δαυείδ	1	The phrase **Blessed is the coming kingdom of our father David** could be: (1) an exclamation proclaiming that the future messianic kingdom promised to a descendant of David is blessed by God. (2) a prayer expressing the desire that God would bless the coming messianic kingdom. Alternate translation: “May God bless the coming kingdom of our father David”
11:10	yuap		rc://*/ta/man/translate/figs-metaphor	τοῦ πατρὸς ἡμῶν, Δαυείδ	1	Here, the term **father** means “ancestor.” If your readers would not understand the use of **father** in this context, you could use an equivalent metaphor from your culture. Alternatively, you could express the meaning plainly. Alternate translation: “of our ancestor David”
11:10	b1si			ὡσαννὰ ἐν τοῖς ὑψίστοις	1	See how you translated the word **Hosanna** in [11:9](../11/09.md). The phrase **Hosanna in the highest** could be (1) an exclamation of praise to God. (2) a prayer to God for salvation from Israel’s enemies. Alternate translation: “Please save us now, God in the highest”
11:10	vqm2		rc://*/ta/man/translate/figs-explicit	ἐν τοῖς ὑψίστοις	1	The phrase ** in the highest** is a way of referring to heaven, where God dwells. If it would be helpful in your language, you could use an equivalent expression from your culture or state this explicitly, as modeled by the UST.
11:11	h2du		rc://*/ta/man/translate/figs-synecdoche	ἱερόν	1	Since only priests could enter the temple building, here the word **temple** means the temple courtyard. Mark is using the word for the entire building to refer to one part of it. If it would be helpful in your language, you could state this plainly, as modeled by the UST.
11:11	t5nv		rc://*/ta/man/translate/figs-go	ἐξῆλθεν εἰς Βηθανίαν	1	Your language may say “came” rather than **went** in contexts such as this. Use whichever is more natural. Alternate translation: “he came to Bethany”
11:11	rvd7		rc://*/ta/man/translate/figs-nominaladj	τῶν δώδεκα	1	See how you translated the phrase **the Twelve** in [3:16](../03/16.md).
11:12	zr8n		rc://*/ta/man/translate/figs-go	ἐξελθόντων αὐτῶν ἀπὸ Βηθανίας	1	Your language may say “went” rather than **come** in contexts such as this. Use whichever is more natural. Alternate translation: “when they had gone out from Bethany”
11:13	y447		rc://*/ta/man/translate/figs-go	ἦλθεν	1	# Connecting Statement:\n\nYour language may say “came” rather than **went** in contexts such as this. Use whichever is more natural. Alternate translation: “he came”
11:13	yg5n		rc://*/ta/man/translate/figs-go	ἐλθὼν ἐπ’ αὐτὴν	1	Your language may say “went” rather than **come** in contexts such as this. Use whichever is more natural. Alternate translation: “having gone to it”
11:13	j6cq		rc://*/ta/man/translate/grammar-connect-exceptions	οὐδὲν εὗρεν εἰ μὴ φύλλα	1	If, in your language, it would appear that Jesus was making a statement here and then contradicting it, you could reword this to avoid using an exception clause. Alternate translation: “he found only leaves”
11:13	g76z			ὁ & καιρὸς οὐκ ἦν σύκων	1	Alternate translation: “it was not the time of year for figs”
11:14	u3bk		rc://*/ta/man/translate/figs-apostrophe	εἶπεν αὐτῇ, μηκέτι εἰς τὸν αἰῶνα, ἐκ σοῦ μηδεὶς καρπὸν φάγοι	1	Jesus is addressing an object that he knows cannot hear him, the fig tree, in order to teach his listeners something. If it would be helpful in your language, consider expressing this fact by talking about the fig tree. Alternate translation: “Jesus said regarding the fig tree that no one would ever eat fruit from it again” or “Jesus said regarding the fig tree that no one would ever eat fruit from it again”
11:14	b362		rc://*/ta/man/translate/figs-explicit	εἰς τὸν αἰῶνα	1	The phrase **to eternity** is a Jewish expression which means “forever.” In this context it specifically means “ever again.” Mark assumed his readers would be familiar with this expression. If it would be helpful in your language, you could state the meaning of the expression **to eternity** explicitly. Alternate translation: “ever again”
11:14	ij5h		rc://*/ta/man/translate/figs-doublenegatives	μηκέτι & ἐκ σοῦ μηδεὶς καρπὸν φάγοι	1	The phrase **no one will any longer** is a double negative. Jesus uses a double negative here for emphasis. If is would be helpful in your language, you could translate the idea using only one negative statement and show the emphasis some other way. Alternate translation: “Surely, no one will eat from you”
11:15	hj7z		rc://*/ta/man/translate/figs-go	ἔρχονται εἰς Ἱεροσόλυμα	1	Your language may say “going” rather than **coming** in contexts such as this. Use whichever is more natural. Alternate translation: “going to Jerusalem”
11:15	c2wl		rc://*/ta/man/translate/figs-synecdoche	ἱερὸν	1	See how you translated the word **temple** in [11:11](../11/11.md), where it is used with the same meaning.
11:15	hoym			ἐκβάλλειν	1	Alternate translation: “to throw out” or “to force out” or “to drive out”
11:15	s4m2			τοὺς πωλοῦντας καὶ τοὺς ἀγοράζοντας	1	Alternate translation: “the people who were buying and selling”
11:15	ve56		rc://*/ta/man/translate/figs-synecdoche	ἱερῷ	1	See how you translated the word **temple** in [11:11](../11/11.md), where it is used with the same meaning.
11:16	ohxg		rc://*/ta/man/translate/figs-synecdoche	ἱεροῦ	1	See how you translated the word **temple** in [11:11](../11/11.md), where it is used with the same meaning.
11:17	xrz2		rc://*/ta/man/translate/figs-rquestion	οὐ γέγραπται, ὅτι ὁ οἶκός μου, οἶκος προσευχῆς κληθήσεται πᾶσιν τοῖς ἔθνεσιν?	1	**Has it not been written** is a rhetorical question which Jesus is using to emphasize God’s purpose for the temple, as recorded in the Old Testament Scriptures. If you would not use a rhetorical question for this purpose in your language, you could translate Jesus’ words as a statement and communicate the emphasis in another way. Alternate translation: “Listen to me! You should have paid closer attention to the scripture which says.”
11:17	dxwe		rc://*/ta/man/translate/figs-quotesinquotes	οὐ γέγραπται, ὅτι ὁ οἶκός μου, οἶκος προσευχῆς κληθήσεται πᾶσιν τοῖς ἔθνεσιν? ὑμεῖς δὲ ἐποιήσατε αὐτὸν σπήλαιον λῃστῶν	1	If it would be helpful in your language, you could translate this so that there is not a quotation within a quotation. Alternate translation: “God says in the Scriptures that his temple would be a place of prayer for all nations, but you have made it a den of robbers”
11:17	t9x9		rc://*/ta/man/translate/figs-activepassive	οὐ γέγραπται	1	If your readers might not understand the phrase **been written**, you could say this with an active form, and you could say who has done the action. Alternate translation: “Has God not said in the Scriptures”
11:17	qeix		rc://*/ta/man/translate/figs-metaphor	οἶκός μου	1	God, speaking through the prophet Isaiah, refers to his temple as his **house** because his presence is there. Alternate translation: “My temple”
11:17	t1ho		rc://*/ta/man/translate/figs-metaphor	οἶκος προσευχῆς κληθήσεται πᾶσιν τοῖς ἔθνεσιν	1	God, speaking through the prophet Isaiah, refers to a place where people would pray as a **house of prayer**. Alternate translation: “will be called a place where people from all nations can pray to me”
11:17	npdf		rc://*/ta/man/translate/figs-activepassive	οἶκός μου, οἶκος προσευχῆς κληθήσεται	1	The phrase **will be called** is passive in form. If your language does not use the passive form in this way, you can express the idea in active form or in another way that is natural in your language. If you must state who did the action, it is probably best to say that people will call God’s temple a house of prayer, although it is also possible to say that God will call it that as well. Alternate translation: “People will call my house a house of prayer” or “Everyone will call my temple a house of prayer”
