Reference	ID	Tags	SupportReference	Quote	Occurrence	Note
front:intro	x7kl				0	# Introduction to Nahum\n\n## General Introduction\n\n### Outline of the Book of Nahum\n\n1. Nahum introduces this book (1:1)\n1. Yahweh will destroy his enemies (1:2–6)\n1. Yahweh cares for his people and will destroy Nineveh (1:7-15)\n1. Nahum describes how Nineveh will fall (2:1–3:19)\n\n### What is the Book of Nahum about?\n\nThe Book of Nahum contains prophecies about how Yahweh would judge and punish Nineveh.\n\nNineveh was the capital city of the Assyrian Empire. The Assyrian Empire was very powerful and cruel and was conquering and absorbing the kingdoms all around it. The Assyrians had already conquered the northern kingdom of Israel. They were threatening the southern kingdom of Judah. The audience of the book is the people of Judah. This book was to encourage their faith in God and to give them confidence that the Assyrians would be defeated.\n\n### How should the title of this book be translated?\n\n“The Book of Nahum” or just “Nahum” is the traditional title of this book. Translators may choose to call it “The Prophecies of Nahum.” (See: [[rc://*/ta/man/translate/translate-names]])\n\n### Who wrote the Book of Nahum?\n\nThe prophet Nahum spoke these prophecies and either he or one of his disciples wrote them down. Nahum was a prophet from Elkosh, an unknown city, probably in Judah.\n\nNahum mentions the destruction of Thebes, a city in Egypt, as a past event, which happened about 663 B.C. He prophesied about the destruction of Nineveh, which happened in 612 B.C. Therefore, the Book of Nahum was written sometime between 663 and 612 B.C. (See: [[rc://*/tw/dict/bible/kt/prophet]])\n\n## Translation Issues \n\n### Personification\n\nIn this prophecy, Yahweh often addresses the people of Judah and the people of Nineveh as simply “Judah” and “Nineveh,” using the names of the nation and city to represent the people. He also uses verbs in the singular that describe the nation or city doing things that people do, such as Judah wearing a yoke and shackles [1:13](../01/13.md) or celebrating festivals and fulfilling vows [1:15](../01/15.md). He describes Nineveh as a soldier who guards walls, watches a road, and strengthens his loins [2:1](../02/01.md), and also as a prostitute whom Yahweh will strip naked and cover with filth [3:4-6](../03/04.md), and as a drunkard who hides himself [3:11](../03/11.md). If it is not clear that these things describe the people as a whole, you could explain this in a footnote or use one of the ideas in [personification]([[rc://*/ta/man/translate/figs-personification]]).\n\n### Short, unconnected statements\n\nIn the descriptions of the battle for Nineveh, Nahum uses short statements that are not connected to the rest of the prophecy. For example, it is difficult to tell who “He” and “they” are in 2:5 or who is saying “Stop, stop” in 2:8. There is no explanation of who the statements of 2:10 apply to, “Empty and desolate and ruined! And the heart is melted, and a shaking of knees, and anguish {is} in all loins, and all of their faces gather beauty.” The statements of 3:1-3 are similar. The reason seems to be that Nahum is reproducing in his description the confusion and anguish and overwhelming of the senses that occur in battle. Try to reproduce this effect in your translation in a way that makes sense in your language.\n\n
1:intro	fa8i				0	# Nahum 1 General Notes\n\n## Structure and Formatting\n\nSome translations prefer to set apart extended quotations, prayers and songs. The ULT and many other English translations set the lines of the entire book (except for verse 1 of this chapter) farther to the right on the page than regular text to show that they are poetic prophecy. (See: [[rc://*/tw/dict/bible/kt/prophet]])\n\nDespite being divided into three chapters, this book consists of one long prophecy.\n\n### Outline of chapter 1\n\n1. Nahum introduces this book (1:1)\n1. Yahweh will destroy his enemies (1:2–6)\n1. Yahweh cares for his people and will destroy Nineveh (1:7-15)\n\n## Religious and Cultural Concepts in This Chapter\n\n### Yahweh’s anger against Nineveh\n\nThis prophecy should be read in reference to the book of Jonah. That book described how the people of Nineveh, Assyria’s capital city, repented when Jonah warned them that Yahweh was angry at them. The book of Nahum, written a little over one hundred years later than the book of Jonah, indicates that the Ninevites had returned to their evil ways and would soon be punished by God. Reading the two books together shows God's mercy and patience and also his anger and judgement for cruelty, evil, and sin.\n\n### Complete destruction\n\nAt the time of Nahum's prophecy, Assyria controlled almost the entire Near East. They were terribly violent and cruel to the peoples that they conquered, including Israel. Because of this, Nahum prophesied that the Assyrians would be completely destroyed as a nation and as a people (1:14). This prophecy came true very suddenly in 612 B.C.\n\n## Translation Issues in This Chapter\n\n### Direct Address\n\nThe audience for this book is the people of Judah. They are in danger of attack by the cruel and powerful nation of Assyria, represented in this book by its capitol, Nineveh. This chapter begins by describing Yahweh's anger at his enemies and love for his people. Then Yahweh begins to address Nineveh directly in verse 9 and continues to do so in various places throughout the book. The people of Nineveh are not part of the audience of this book, however. The address to Nineveh is intended to show the people of Judah Yahweh's attitude towards the people of Nineveh and their evil actions. This direct address is also to let the people of Judah know that Yahweh will destroy Nineveh. Yahweh also addresses Judah directly in verses 12, 13, and 15.  
1:1	ab12		rc://*/ta/man/translate/figs-metaphor	burden	1	Here the author is speaking of a message as though it were a **burden**, that is, a heavy load to carry. If it would be helpful in your language, you could state the meaning plainly. Alternate translation: “message about”
1:1	ab34		rc://*/ta/man/translate/translate-unknown	Elkoshite	1	An **Elkoshite** is someone from a place called Elkosh. If your readers would not be familiar with this place, you could use a more general term.
1:2	ab56		rc://*/ta/man/translate/figs-abstractnouns	takes vengeance on	1	If your language does not use an abstract noun for the idea of **vengeance**, you could express the same idea in another way. Alternate translation: “punishes”
1:2	ab78		rc://*/ta/man/translate/figs-ellipsis	maintains against his haters	1	The author is leaving out some of the words that in many languages a sentence would need in order to be complete. You could supply “anger“ from earlier in the sentence if it would be clearer in your language. Alternate translation: “maintains anger against those who hate him”
1:3	ab89		rc://*/ta/man/translate/figs-idiom	long of nostrils	1	Here, **long of nostrils** is an idiom that means “slow to become angry.” If this phrase does not have that meaning in your language, you could use an idiom from your language that does have that meaning or state the meaning plainly. Alternate translation: “patient” or “slow to anger”
1:3	ac12		rc://*/ta/man/translate/figs-abstractnouns	great in power	1	If your language does not use an abstract noun for the idea of **power**, you could express the same idea in another way. Alternate translation: “very powerful”
1:3	ac34		rc://*/ta/man/translate/figs-reduplication	to acquit he will not acquit	1	The author is repeating the verb **acquit** in order to intensify the idea that it expresses. If your language can repeat words for intensification, it would be appropriate to do that here in your translation. If not, your language may have another way of expressing the emphasis. Alternate translation: “he will certainly not leave the guilty unpunished”
1:4	ac56		rc://*/ta/man/translate/figs-metaphor	rebukes	1	Here the author says that Yahweh **rebukes** the sea as if Yahweh were scolding the sea like a person. If it would be helpful in your language, you could state the meaning plainly. Alternate translation: “commands the sea to be still”
1:4	ac78		rc://*/ta/man/translate/translate-unknown	Carmel	1	**Carmel** is the name of a mountain range. If your readers would not be familiar with this place, you could include an explanation. Alternate translation: “the Carmel mountain range”
1:4	ad12		rc://*/ta/man/translate/figs-ellipsis	Carmel	1	The author is leaving out some of the words that in many languages a sentence would need in order to be complete. You could supply “withers” from earlier in the sentence if it would be clearer in your language. Alternate translation: “Carmel withers”
1:5	ad34		rc://*/ta/man/translate/figs-hyperbole	shake&melt&rise	1	The author is using extreme language of physical events to emphasize how powerful Yahweh is. If it would be clearer in your language, you could express this in a non-figurative way. Alternate translation: “It is as though mountains quake ... hills crumble ... earth trembles” 
1:5	ad56		rc://*/ta/man/translate/figs-ellipsis	dwellers in it	1	The author is leaving out some of the words that in many languages a sentence would need in order to be complete. You could supply “shake” from earlier in the sentence if it would be clearer in your language. Alternate translation: “all who dwell in it shake before his face”
1:6	ad78		rc://*/ta/man/translate/figs-idiom	face	1	Here, **face** is an idiom that means “presence.” If this phrase does not have that meaning in your language, you could use an idiom from your language that does have that meaning or state the meaning plainly. Alternate translation: “Before his anger”
1:6	ae12		rc://*/ta/man/translate/figs-idiom	nose	1	Here, **the burning of his nose** is an idiom meaning that the person is angry. If this phrase does not have that meaning in your language, use an idiom from your language that does have that meaning or state the meaning plainly. Alternate translation: “his fierce anger”
1:6	ae34		rc://*/ta/man/translate/figs-parallelism	To the face of his indignation, who can stand? And who can arise against the burning of his nose?	1	These two sentences mean basically the same thing. The second clause emphasizes the meaning of the first by repeating the same idea with different words. If it would be helpful to your readers, you could connect the clauses with a word or phrase that shows that the second clause is repeating the first one, not saying something additional. Alternate translation: “To the face of his indignation, who can stand? I say again, who can arise against the burning of his nose?”
1:6	ae56		rc://*/ta/man/translate/figs-abstractnouns	indignation&wrath	1	If your language does not use abstract nouns for the ideas of **indignation** and **wrath**, you could express the same ideas in other ways. Alternate translation: “when he is angry” ... “when he is furious”
1:6	ae78		rc://*/ta/man/translate/figs-doublet	indignation&wrath	1	The terms **indignation** and **wrath** mean similar things. The author is using the two terms together for emphasis. If it would be clearer for your readers, you could express the emphasis with a single phrase. Alternate translation: “his fierce anger”
1:6	af12		rc://*/ta/man/translate/figs-rquestion	To the face of his indignation, who can stand?	1	The author is using the question form to emphasize that no one can endure when Yahweh is angry. If you would not use the question form for this purpose in your language, you could translate this as a statement or an exclamation. Alternate translation: “No one can endure when he is angry!”
1:6	af34		rc://*/ta/man/translate/figs-rquestion	And who can arise against the burning of his nose?	1	The author is using the question form to emphasize that no one can resist when Yahweh is angry. If you would not use the question form for this purpose in your language, you could translate this as a statement or an exclamation. Alternate translation: “No one can resist his fierce anger!”
1:7	af56		rc://*/ta/man/translate/figs-ellipsis	for a stronghold	1	The author is leaving out some of the words that in many languages a sentence would need in order to be complete. You could supply “he is” from earlier in the sentence if it would be clearer in your language. Alternate translation: “for he is a stronghold”
1:7	af78		rc://*/ta/man/translate/figs-possession	day of trouble	1	Here the author is using the possessive form to describe a **day** that is characterized by **trouble**. If your language would not use the possessive form for this, you could express this as a time when trouble happens. Alternate translation: “time when there is trouble”
1:7	ag12		rc://*/ta/man/translate/figs-metaphor	refuge	1	Here the author is speaking of Yahweh as if he were a **refuge**, that is, a safe place to hide. If it would be helpful in your language, you could state the meaning plainly. Alternate translation: “those who come to him for protection”
1:8	ag34		rc://*/ta/man/translate/writing-pronouns	its	1	The pronoun **its** refers to Nineveh. If this is not clear for your readers, you could use the city's name here. Alternate translation: “Nineveh's”
1:8	ax34		rc://*/ta/man/translate/figs-metaphor	darkness will pursue his enemies	1	Here **darkness** represents all kinds of bad things, and Nahum speaks of it as if it were a person pursuing his enemies. It means that Yahweh will not allow his enemies to escape their punishment.  If it would be helpful in your language, you could state the meaning plainly.  Alternate translation: “his enemies will not escape their punishment”
1:9	ag56		rc://*/ta/man/translate/writing-pronouns	you	1	The pronoun **you** refers to the Ninevites. If this is not clear for your readers, you could use the people's name here. Alternate translation: “you Ninevites”
1:9	ag78		rc://*/ta/man/translate/figs-yousingular	you	1	Here, **you** is plural. It refers to the Ninevites, so use the plural form in your translation if your language marks that distinction.
1:9	ah12		rc://*/ta/man/translate/figs-abstractnouns	trouble	1	If your language does not use an abstract noun for the idea of **trouble**, you could express the same idea in another way. Alternate translation: “bad events”
1:9	ah34		rc://*/ta/man/translate/figs-metaphor	rise up	1	Here the author is speaking of **trouble** as if it were a person who could **rise up**. If it would be helpful in your language, you could state the meaning plainly. Alternate translation: “happen”
1:10	ah56		rc://*/ta/man/translate/figs-simile	like...like	1	The author is saying that the Ninevites are like tangled thorn bushes and dried stubble in a fire and like the drink in their own hands because all of these things are quickly consumed. If it would be helpful in your language, you could state that explicitly. Alternate translation: “Just as tangled thorn bushes are in a fire and just as a drink is in the hands of a Ninevite, they are quickly consumed”
1:10	ah78		rc://*/ta/man/translate/writing-pronouns	their&they	1	The pronouns **their** and **they** refer to the Ninevites. If this is not clear for your readers, you could use the people's name here. Alternate translation: “the Ninevites' drink” ... “the Ninevites are devoured”
1:10	ai12		rc://*/ta/man/translate/figs-activepassive	they are devoured	1	If your language does not use this passive form, you could express the idea in active form or in another way that is natural in your language. If you need to say who did the action, it is clear from the context that it was God. Alternate translation: “God will destroy them”
1:11	ai34		rc://*/ta/man/translate/writing-pronouns	you	1	The pronoun **you** refers to Nineveh. If this is not clear for your readers, you could add the city's name here. Alternate translation: “you, Nineveh”
1:11	ai56		rc://*/ta/man/translate/figs-yousingular	you	1	Here, **you** is singular. It refers to Nineveh, so use the singular form in your translation if your language marks that distinction.
1:11	bz01		rc://*/ta/man/translate/figs-apostrophe	From you came out	1	Nahum has been referring to Nineveh in the third person, but now he addresses the city directly in the second person. He does this even though he knows that the people of Nineveh cannot hear him, in order to more powerfully express his prophecy against the people of Nineveh to his audience, which is the people of Judah. If it would be helpful in your language, you could express the transition here more clearly or add the name of the city. Alternate translation: “This is what I say to Nineveh: From you came out” or “From you, Nineveh, came out”
1:11	bx35		rc://*/ta/man/translate/figs-parallelism	a plotter of evil&an advisor of wickedness	1	These two clauses mean basically the same thing. The second clause emphasizes the meaning of the first by repeating the same idea with different words. If it would be helpful to your readers, you could combine the clauses or connect them with a word that shows that the second clause is repeating the first one, not saying something additional. Alternate translation: “a plotter of evil … indeed, an advisor of wickedness”
1:11	pa78		rc://*/ta/man/translate/figs-abstractnouns	a plotter of evil&an advisor of wickedness	1	If your language does not use abstract nouns for the ideas of **evil** and **wickedness**, you could express the same ideas in another way. Alternate translation: “an evil plotter … a wicked advisor”
1:12	ai78		rc://*/ta/man/translate/figs-explicit	full	1	The implication is that they are full in strength. You could include this information if that would be helpful to your readers. Alternate translation: “full of strength”
1:12	aj12		rc://*/ta/man/translate/translate-tense	sheared&passed away	1	The author uses the past tense here in order to refer to something that will certainly happen in the future. If it would not be natural to do that in your language, you could use the future tense. Alternate translation: “will be sheared” ... “will pass away”
1:12	aj34		rc://*/ta/man/translate/figs-explicit	sheared	1	The implication is that they are sheared like sheep. You could include this information if that would be helpful to your readers. Alternate translation: “sheared like sheep”
1:12	aj56		rc://*/ta/man/translate/writing-pronouns	he has passed away	1	In this verse, the word **he** refers to the “plotter of evil” in verse 10. It is probable, however, that this person represents the many plotters of evil in Nineveh, and so **he** here refers to all of them as a group. If it would be helpful in your language, you could say this plainly. Alternate translation: “those plotters have passed away”
1:12	aj78		rc://*/ta/man/translate/writing-pronouns	you	1	The pronoun **you** refers to the people of Judah. If this is not clear for your readers, you could use the nation's name here. Alternate translation: “you, Judah”
1:12	ak12		rc://*/ta/man/translate/figs-activepassive	they have been sheared	1	If your language does not use this passive form, you could express the idea in active form or in another way that is natural in your language. If you need to say who did the action, it is clear from the context that it was God. Alternate translation: “God has sheared them”
1:12	al12		rc://*/ta/man/translate/writing-pronouns	they	1	The pronoun **they** refers to the Ninevites. If this is not clear for your readers, you could use the people's name here. Alternate translation: “the Ninevites”
1:13	ak34		rc://*/ta/man/translate/figs-metaphor	yoke	1	Here the author is speaking of oppression as if it were a **yoke** that weighs down a work animal. If it would be helpful in your language, you could state the meaning plainly. Alternate translation: “their control over you”
1:13	ak56		rc://*/ta/man/translate/figs-metaphor	shackles	1	Here the author is speaking of oppression as if it were **shackles** that bind a prisoner. If it would be helpful in your language, you could state the meaning plainly. Alternate translation: “their power over you”
1:13	ak78		rc://*/ta/man/translate/writing-pronouns	you&your	1	The pronouns **you** and **your** refer to the people of Judah. If this is not clear for your readers, you could use the nation's name here. Alternate translation: “you, Judah” or “you, people of Judah”
1:14	ax78		rc://*/ta/man/translate/writing-pronouns	you	1	The pronoun **you** here refers to the people of Nineveh. If this is not clear for your readers, you could use the city’s name here. Alternate translation: “you, Nineveh” or “you, people of Nineveh”
1:14	al34		rc://*/ta/man/translate/figs-idiom	sown from your name	1	Here, **sown from your name** is an idiom that means “descendants who will carry on your name.” If this phrase does not have that meaning in your language, you could use an idiom from your language that does have that meaning or state the meaning plainly. Alternate translation: “There will not be descendants to carry on your name”
1:14	al56		rc://*/ta/man/translate/figs-metaphor	cut off	1	Here the author is speaking of destroying something as if it were **cut off**. If it would be helpful in your language, you could state the meaning plainly. Alternate translation: “I will destroy”
1:15	al78		rc://*/ta/man/translate/figs-metaphor	Behold	1	The author is using the term **Behold** to: (1) tell his readers to actually look toward the mountains, where a messenger will come from. (2) focus his readers' attention on what he is about to say. Your language may have a comparable expression that you could use in your translation. Alternate translation: “Listen!” or “Pay attention to what I am about to tell you”
1:15	am12		rc://*/ta/man/translate/figs-synecdoche	feet	1	Here, **feet** represents the whole person of the messenger. Alternate translation: “a messenger”
1:15	am34		rc://*/ta/man/translate/writing-poetry	celebrate&celebrations	1	Here, **celebrate celebrations** is an emphatic construction that uses a verb and its object that come from the same root. You may be able to use the same construction in your language to express the meaning here. Alternatively, your language may have another way of showing the emphasis.
1:15	am56		rc://*/ta/man/translate/figs-metonymy	Judah	1	Here, **Judah** represents the people who live in Judah. Alternate translation: “people of Judah”
1:15	am78		rc://*/ta/man/translate/figs-activepassive	cut off	1	If your language does not use this passive form, you could express the idea in active form or in another way that is natural in your language. If you need to say who did the action, it is clear from the context that it was God. Alternate translation: “God has destroyed him”
1:15	an12		rc://*/ta/man/translate/figs-metaphor	cut off	1	Here the author is speaking of destroying someone as if they were **cut off**. If it would be helpful in your language, you could state the meaning plainly. Alternate translation: “destroyed”
1:15	an34		rc://*/ta/man/translate/figs-genericnoun	the wicked	1	The word **wicked** represents evil people in general, not one particular person. If it would be helpful in your language, you could use a more natural expression. Alternate translation: “wicked people”
1:15	an56		rc://*/ta/man/translate/writing-pronouns	he	1	The pronoun **he** refers to the wicked. If you have decided to use a plural form for **wicked**, you could use a plural pronoun here, or repeat your form for **wicked**. Alternate translation: “they are completely cut off” or “those wicked people are completely cut off”
2:intro	m3yl				0	# Nahum 2 General Notes\n\n## Structure and Formatting\n\nIf you have decided to set the text of this book into short lines of poetry, you will want to continue to do so in this chapter. \n\nDespite being divided into three chapters, this book contains one long prophecy.\n\n### Outline of chapter 2\n\n1. Description of the battle that destroys Nineveh (2:1-10)\n1. Comparison of Nineveh to a lion's den (2:11-13)\n\n## Translation Issues\n\n### Past and present for future\n\nIn this chapter, Nahum describes a battle for Nineveh in which the city is destroyed. He describes the battle and the resulting devastation of the city as though he is watching it happen, probably because God showed it to him in a vision (1:1). However, the actual battle and destruction did not happen until many years after Nahum spoke this prophecy. If it would be helpful in your translation, you could explain this in a footnote, or change the verbs to future so that your readers will know that Nahum was predicting something that would happen later; it was not happening at that time.\n\n### Extended metaphor\n\nThere is an extended metaphor in 2:11-13. In this metaphor, Yahweh compares Nineveh to a lion's den and its inhabitants to lions who kill and devour their enemies. If this is unclear for your readers, you may want to provide an explanation in a footnote. (See: [extended metaphor](rc://*/ta/man/translate/figs-exmetaphor)).
2:1	by01		rc://*/ta/man/translate/figs-apostrophe	A scatterer has come up against your face	1	Here Nahum turns from addressing Judah to addressing Nineveh. He does this even though he knows that the people of Nineveh cannot hear him, in order to more powerfully express his prophecy against the people of Nineveh to his audience, which is the people of Judah. If it would be helpful in your language, you could express the transition here more clearly or add the name of the city. Alternate translation: “To Nineveh, I say: A scatterer has come up against your face” or “A scatterer has come up against your face, Nineveh”
