Reference	ID	Tags	SupportReference	Quote	Occurrence	Note
2:1	pq12		rc://*/ta/man/translate/translate-tense	has come up	1	The author uses the past tense here in order to refer to something that will certainly happen in the future. If it would not be natural to do that in your language, you could use the future tense. Alternate translation: “will come up”
2:1	pq34		rc://*/ta/man/translate/writing-pronouns	your face	1	The pronoun **your** refers to the Ninevites. If this is not clear for your readers, you could use the people's name here. Alternate translation: “your face, Ninevites'”
2:1	pq56		rc://*/ta/man/translate/figs-metonymy	your face	1	Here, **face** represents the whole person. Alternate translation: “you”
2:1	pq78		rc://*/ta/man/translate/figs-abstractnouns	power	1	If your language does not use an abstract noun for the idea of **power**, you could express the same idea in another way. Alternate translation: “make yourself much more powerful”
2:2	pq90		rc://*/ta/man/translate/translate-tense	has restored	1	The author uses the past tense here in order to refer to something that will certainly happen in the future. If it would not be natural to do that in your language, you could use the future tense. Alternate translation: “will restore”
2:2	qr12		rc://*/ta/man/translate/figs-abstractnouns	restored the majesty of Jacob, like the majesty of Israel	1	If your language does not use an abstract noun for the idea of **majesty**, you could express the same idea in another way. Alternate translation: “made Jacob great again, just like Israel is great”
2:2	qr34		rc://*/ta/man/translate/writing-poetry	plunderers plundered	1	Here, **plunderers plundered** is an emphatic construction that uses a verb and its object that come from the same root. You may be able to use the same construction in your language to express the meaning here. Alternatively, your language may have another way of showing the emphasis.
2:3	ba01		rc://*/ta/man/translate/writing-pronouns	his	1	The pronoun **his** refers to Yahweh. If this is not clear for your readers, you could use the name. Alternate translation: “Yahweh's”
2:3	ba02		rc://*/ta/man/translate/figs-ellipsis	clothed in scarlet	1	The author is leaving out some of the words that in many languages a sentence would need in order to be complete. You could supply these words if it would be clearer in your language. Alternate translation: “clothed in scarlet uniforms”
2:3	ba03		rc://*/ta/man/translate/grammar-collectivenouns	the chariot {flashes}	1	In this verse, the word **chariot** is singular in form, but it refers to all of the chariots as a group. If it would be helpful in your language, you could say this plainly. Alternate translation: “the chariots flash”
2:3	ba04		rc://*/ta/man/translate/figs-metaphor	fire of metal	1	Here the author is speaking of **metal** as if it were **fire** because of how it gleams in the sunlight. If it would be helpful in your language, you could state the meaning plainly. Alternate translation: “metal that flashes like fire in the sunlight”
2:3	ba05		rc://*/ta/man/translate/figs-metonymy	cypresses	1	Here, **cypresses** represents spears made with cypress wood shafts. If it would be helpful in your language, you could use an equivalent expression from your language or state the meaning plainly. Alternate translation: “spears made with cypress shafts”
2:4	ba06		rc://*/ta/man/translate/figs-explicit	race madly	1	The implication is that the chariots are rushing wildly and without control. You could include this information if that would be helpful to your readers. Alternate translation: “rush wildly and uncontrollably”
2:4	ba07		rc://*/ta/man/translate/figs-simile	like torches	1	The author is saying that the chariots are like torches because they shine brightly. If it would be helpful in your language, you could state that explicitly. Alternate translation: “shines brightly like torches”
2:4	ba08		rc://*/ta/man/translate/figs-simile	run like lightning	1	The author is saying that the chariots are like lightning because they move with great speed. If it would be helpful in your language, you could state that explicitly. Alternate translation: “move as fast as lightning”
2:5	bx09		rc://*/ta/man/translate/writing-pronouns	He	1	The pronoun **He** could refer to: (1) Yahweh or Yahweh’s chosen commander, the “scatterer” from verse 1. Alternate translation: “The attacker”  (2) The commander of Nineveh’s army.  Alternate translation: “Nineveh's commander” 
2:5	ba09		rc://*/ta/man/translate/writing-pronouns	her	1	The pronoun **her** refers to Nineveh. If this is not clear for your readers, you could use the name. Alternate translation: “Nineveh's”
2:5	ba10		rc://*/ta/man/translate/figs-activepassive	The siege-shelter is prepared	1	If your language does not use a passive form like **is prepared**, you could express the idea in active form or in another way that is natural in your language. Alternate translation: “They prepare the siege-shelter”
2:6	ba11		rc://*/ta/man/translate/figs-activepassive	have been opened	1	If your language does not use a passive form like **have been opened**, you could express the idea in active form or in another way that is natural in your language. Alternate translation: “have come open”
2:6	ba12		rc://*/ta/man/translate/translate-tense	have been opened&have melted away	1	The author uses the past tense here in order to refer to something that will certainly happen in the future. If it would not be natural to do that in your language, you could use the future tense. Alternate translation: “will open” … “will melt away”
2:6	br36		rc://*/ta/man/translate/figs-metaphor	the palace has melted away 	1	Here the author is speaking of **the palace** as if it could melt to express how the flood of water will destroy the palace. If it would be helpful in your language, you could state the meaning plainly. Alternate translation: “the water has destroyed the palace”
2:6	bi3c			The gates of the rivers	1	This refers to the gates that controlled the flow and direction of the river.
2:7	ba13		rc://*/ta/man/translate/figs-activepassive	It is established	1	If your language does not use this passive form, you could express the idea in active form or in another way that is natural in your language. If you need to say who did the action, it is clear from the context that it was God. Alternate translation: “God has established it”
2:7	ba14		rc://*/ta/man/translate/figs-activepassive	she is taken	1	If your language does not use a passive form like **she is taken**, you could express the idea in active form or in another way that is natural in your language. Alternate translation: “Her enemies take her”
2:7	ba15		rc://*/ta/man/translate/figs-activepassive	she is led away	1	If your language does not use a passive form like **she is led away**, you could express the idea in active form or in another way that is natural in your language. Alternate translation: “they lead her away”
2:7	ba16		rc://*/ta/man/translate/writing-pronouns	she&she&her	1	The pronouns **she** and **her** refer to Nineveh. If this is not clear for your readers, you could use the name. Alternate translation: “Nineveh” … “Nineveh” … “Nineveh's”
2:7	ba17		rc://*/ta/man/translate/figs-metonymy	hearts	1	Here, **hearts** represents chests. If it would be helpful in your language, you could use an equivalent expression from your language or state the meaning plainly. Alternate translation: “chests”
2:7	bz17		rc://*/ta/man/translate/figs-personification	she is taken into exile; she is led away, and her female servants	1	Here Nahum speaks of Nineveh as if the city were a woman who had female servants and who could be led away into exile. He also speaks of the female inhabitants of the city as if they served this woman. If it would be helpful in your language, you could express the meaning plainly. Alternate translation: “the inhabitants of Nineveh are taken into exile; they are led away and the women of Nineveh”
2:7	bxy9		rc://*/ta/man/translate/translate-symaction	beating on their hearts	1	People beat on their hearts or chests as a symbolic action to show that they are sad. If this would not be clear to your readers, you could explain the significance of this action in the text or in a footnote. Alternate translation: “beating on their hearts in sadness”
2:8	ba18		rc://*/ta/man/translate/figs-simile	pool of water	1	The author is saying that Nineveh was like a pool of water because it was calm and peaceful. If it would be helpful in your language, you could state that explicitly. Alternate translation: “as calm as a pool of water”
2:8	ba19		rc://*/ta/man/translate/figs-metonymy	her days	1	Here, **her days** represents the time when Nineveh was a city. If it would be helpful in your language, you could use an equivalent expression from your language or state the meaning plainly. Alternate translation: “the time when Nineveh was a city”
2:8	ba20		rc://*/ta/man/translate/writing-pronouns	they	1	The pronoun **they** refers to the people of Nineveh. If this is not clear for your readers, you could use the name. Alternate translation: “the people of Nineveh”
2:8	ba21		rc://*/ta/man/translate/figs-explicit	”Stop, stop!”	1	The implication is that the officials are the ones calling out to the people. You could include this information if that would be helpful to your readers. Alternate translation: “The officials call out, “Stop, stop!””
2:9	ba22		rc://*/ta/man/translate/figs-explicit	Plunder silver, plunder gold, for there is no end to the supply; a wealth of all things of delight.	1	The implication is that these are the words of the attackers. You could include this information if that would be helpful to your readers. Alternate translation: “The attackers say, 'Plunder silver, plunder gold, for there is no end to the supply; a wealth of all things of delight'”
2:9	ba23		rc://*/ta/man/translate/figs-possession	things of delight	1	Here the author is using the possessive form to describe **things** that are characterized by **delight**. If your language would not use the possessive form for this, you could use an adjective. Alternate translation: “delightful things”
2:9	bx70		rc://*/ta/man/translate/figs-hyperbole	no end to the supply	1	The author is using an exaggeration to emphasize how much wealth Nineveh had. If it would be helpful in your language, you could state the meaning plainly. Alternate translation: “a very great amount”
2:10	ba24		rc://*/ta/man/translate/figs-ellipsis	Empty and desolate and ruined!	1	The author is leaving out some of the words that in many languages a sentence would need in order to be complete. You could supply these words if it would be clearer in your language. Alternate translation: “Nineveh is empty and desolate and ruined!”
2:10	ba25		rc://*/ta/man/translate/grammar-collectivenouns	the heart	1	In this verse, the word **heart** is singular in form, but it refers to each person’s heart as a group. If it would be helpful in your language, you could say this plainly. Alternate translation: “everyone's heart”
2:10	ba26		rc://*/ta/man/translate/figs-metaphor	the heart is melted	1	Here Nahum is speaking of a **heart** as if it could melt to express how people have lost their courage. If it would be helpful in your language, you could state the meaning plainly. Alternate translation: “everyone has lost courage”
2:10	ba27		rc://*/ta/man/translate/figs-metonymy	anguish {is} in all loins	1	Here, **loins** represents the abdomen area where people feel strong emotions. If it would be helpful in your language, you could use an equivalent expression from your language or state the meaning plainly. Alternate translation: “everyone feels anguish in their abdomens”
2:10	ba28		rc://*/ta/man/translate/figs-metonymy	gather beauty	1	Nahum is using the term **beauty** to mean paleness by association with the way pale skin was considered beautiful in that culture. If it would be helpful in your language, you could state the meaning plainly. Alternate translation: “become pale”
2:11	ba29		rc://*/ta/man/translate/figs-rquestion	Where {now} {is} the lions' den and that feeding place for the young lions, where the lion walked, the lioness there, the cubs of the lion, and nothing made {them} afraid?	1	The author is using the question form to emphasize that this place is gone. If you would not use the question form for this purpose in your language, you could translate this as a statement or an exclamation. Alternate translation: “The lions' den and that feeding place for the young lions, where the lion walked, the lioness there, the cubs of the lion, and nothing made them afraid, is gone!”
2:11	by26		rc://*/ta/man/translate/figs-exmetaphor	the lion’s den	1	Here through verse 13 Nahum uses an extended metaphor in which he speaks of the people of Nineveh as though they were lions, and of their victims as though they were the lion’s prey. See the discussion in the chapter introduction.
2:11	ba30		rc://*/ta/man/translate/figs-ellipsis	the lioness there	1	The author is leaving out some of the words that in many languages a sentence would need in order to be complete. You could supply these words from earlier in the sentence if it would be clearer in your language. Alternate translation: “the lioness also walked there”
2:11	ba31		rc://*/ta/man/translate/figs-ellipsis	the cubs of the lion	1	The author is leaving out some of the words that in many languages a sentence would need in order to be complete. You could supply these words from earlier in the sentence if it would be clearer in your language. Alternate translation: “the cubs of the lion also walked there”
2:12	ba32		rc://*/ta/man/translate/figs-ellipsis	tearing enough	1	The author is leaving out some of the words that in many languages a sentence would need in order to be complete. You could supply these words if it would be clearer in your language. Alternate translation: “tearing enough prey”
2:12	ba33		rc://*/ta/man/translate/figs-ellipsis	strangling	1	The author is leaving out some of the words that in many languages a sentence would need in order to be complete. You could supply these words if it would be clearer in your language. Alternate translation: “strangling victims”
2:12	ba34		rc://*/ta/man/translate/figs-ellipsis	his dens	1	The author is leaving out some of the words that in many languages a sentence would need in order to be complete. You could supply these words from earlier in the sentence if it would be clearer in your language. Alternate translation: “he filled his dens”
2:12	ba35		rc://*/ta/man/translate/figs-parallelism	he filled his caves with prey, his dens with torn carcasses	1	These two clauses mean basically the same thing. The second clause emphasizes the meaning of the first by repeating the same idea with different words. If it would be helpful to your readers, you could connect the clauses with a word that shows that the second clause is repeating the first one, not saying something additional. Alternate translation: “he filled his caves with prey, that is, his dens with torn carcasses”
2:13	ba36		rc://*/ta/man/translate/figs-ellipsis	Behold me, against you	1	The author is leaving out some of the words that in many languages a sentence would need in order to be complete. You could supply these words if it would be clearer in your language. Alternate translation: “I am against you”
2:13	ba37		rc://*/ta/man/translate/figs-metaphor	behold me, against you	1	Yahweh is using the term **behold** to focus attention on what he is about to say. Your language may have a comparable expression that you could use in your translation. Alternate translation: “Listen carefully—I am against you”
2:13	ba38		rc://*/ta/man/translate/figs-ellipsis	the declaration	1	The author is leaving out some of the words that in many languages a sentence would need in order to be complete. You could supply these words if it would be clearer in your language. Alternate translation: “this is the declaration”
2:13	ay56		rc://*/ta/man/translate/writing-pronouns	her	1	The pronoun **her** refers to the city of Nineveh. Since Yahweh is speaking directly to the city of Nineveh in the rest of the verse, it may be more natural in your language to continue using direct address here. Alternate translation: “your”
2:13	ba39		rc://*/ta/man/translate/grammar-collectivenouns	chariot	1	In this verse, the word **chariot** is singular in form, but it refers to all of the chariots as a group. If it would be helpful in your language, you could say this plainly. Alternate translation: “chariots”
2:13	ba40		rc://*/ta/man/translate/figs-metaphor	the sword will devour	1	Here Yahweh is speaking of **the sword** as if it could devour like an animal. If it would be helpful in your language, you could state the meaning plainly. Alternate translation: “soldiers will kill”
2:13	ba41		rc://*/ta/man/translate/figs-idiom	I will cut off	1	The phrase **I will cut off** is an expression that means that Yahweh will take it away. Your language may have a comparable expression that you could use in your translation. Alternate translation: “I will take away”
3:intro	k8ee				0	# Nahum 3 General Notes\n\n## Structure and Formatting\n\nIf you have decided to set the text of this book into short lines of poetry, you will want to continue to do so in this chapter. \n\nDespite being divided into three chapters, the book contains one long prophecy.\n\n### Outline of chapter 3\n\n1. Woe to Nineveh (3:1-3)\n1. Nineveh the prostitute (3:4–7)\n1. The example of Thebes (3:8-11)\n1. The destruction of Nineveh is sure (3:12–19)\n\n## Religious and Cultural Concepts in This Chapter\n\n### The Locusts in 3:15–17\n\nLocust attacks occurred often in the ancient Near East. A locust is a kind of grasshopper that would come in countless numbers. There would be so many that they would darken the sky like a black cloud that blocked the sunlight. They often came after a long period of no rain. They came down on whatever crops were surviving in the fields and stripped them bare. The locusts could not be stopped and caused terrible damage. For this reason, locust invasions served as a powerful image of overwhelming military attacks in the Old Testament.\n\n## Translation Issue\n\nThere is an extended metaphor in 3:4-7. In this metaphor, Yahweh compares Nineveh to a prostitute who brings men under her control by charm and witchcraft. Both prostitution and witchcraft were associated with idol worship, and in the Bible, prostitution is used as a metaphor for idol worship. Just as a prostitute is not faithful to a husband, people who worship idols are not faithful to the only true God who deserves worship. Nineveh was a very powerful and prosperous city and thus it was attractive to others to adopt Nineveh's ways and to worship Nineveh's gods. If this is unclear for your readers, you may want to provide an explanation in a footnote. (See: [extended metaphor](rc://*/ta/man/translate/figs-exmetaphor)).
3:1	ba42		rc://*/ta/man/translate/figs-metonymy	the city of bloodshed	1	Here, **the city of bloodshed** represents the murderous people in Nineveh. If it would be helpful in your language, you could use an equivalent expression from your language or state the meaning plainly. Alternate translation: “the murderous people in Nineveh”
3:1	ba43		rc://*/ta/man/translate/figs-metonymy	all of it {is} lies	1	Here, **lies** represents lying people. If it would be helpful in your language, you could use an equivalent expression from your language or state the meaning plainly. Alternate translation: “It is full of lying people”
3:2	ba44		rc://*/ta/man/translate/grammar-collectivenouns	a whip&a rattling wheel&a galloping horse&a bounding chariot	1	In this verse, the words **whip**, **wheel**, **horse**, and **chariot** are singular in form, but each refers to multiple items as a group. If it would be helpful in your language, you could say this plainly. Alternate translation: “whips” … “rattling wheels” … “galloping horses” … “bounding chariots”
3:3	ba45		rc://*/ta/man/translate/grammar-collectivenouns	A charging horseman&a flash of a sword&a gleam of a spear	1	In this verse, the words **horseman**, **sword**, and **spear** are singular in form, but each refers to multiple items as a group. If it would be helpful in your language, you could say this plainly. Alternate translation: “charging horsemen” … “flashing swords” … “gleaming spears”
3:3	ba46		rc://*/ta/man/translate/figs-ellipsis	A charging horseman, and a flash of a sword and a gleam of a spear	1	The author is leaving out some of the words that in many languages a sentence would need in order to be complete. You could supply these words if it would be clearer in your language. Alternate translation: “There are charging horsemen, and flashing swords and gleaming spears”
3:3	bc70		rc://*/ta/man/translate/figs-hyperbole	no end	1	The author is using an exaggeration to emphasize how many bodies there are. If it would be helpful in your language, you could state the meaning plainly. Alternate translation: “a very great amount”
3:3	ba47		rc://*/ta/man/translate/writing-pronouns	they	1	The pronoun **they** refers to the attackers. If this is not clear for your readers, you could use the name. Alternate translation: “the attackers”
3:3	ba48		rc://*/ta/man/translate/writing-pronouns	their	1	The pronoun **their** refers to the Ninevites. If this is not clear for your readers, you could use the name. Alternate translation: “the Ninevites'”
3:4	bd26		rc://*/ta/man/translate/figs-exmetaphor	harlotries of the prostitute	1	Here through verse 7 Nahum uses an extended metaphor in which he speaks of the people of Nineveh as though they were a prostitute who is also a witch. See the discussion in the chapter introduction.
3:4	ba49		rc://*/ta/man/translate/figs-ellipsis	From	1	The author is leaving out some of the words that in many languages a sentence would need in order to be complete. You could supply these words if it would be clearer in your language. Alternate translation: “This is happening from”
3:4	ba50		rc://*/ta/man/translate/figs-ellipsis	and peoples	1	The author is leaving out some of the words that in many languages a sentence would need in order to be complete. You could supply these words from earlier in the sentence if it would be clearer in your language. Alternate translation: “and she sells peoples”
3:5	ba52		rc://*/ta/man/translate/figs-metaphor	behold me, against you	1	Yahweh is using the term **behold** to focus attention on what he is about to say. Your language may have a comparable expression that you could use in your translation. See how you translated this in [2:13](../02/13.md). Alternate translation: “Listen carefully—I am against you”
3:5	ba53		rc://*/ta/man/translate/writing-pronouns	you	1	The pronoun **you** refers to Nineveh, which Yahweh has been describing as a prostitute. If this is not clear for your readers, you could use the name. Alternate translation: “you prostitute”
3:5	ba54		rc://*/ta/man/translate/figs-ellipsis	the declaration	1	The author is leaving out some of the words that in many languages a sentence would need in order to be complete. You could supply these words if it would be clearer in your language. Alternate translation: “this is the declaration”
3:5	ba55		rc://*/ta/man/translate/figs-ellipsis	your shame	1	The author is leaving out some of the words that in many languages a sentence would need in order to be complete. You could supply these words from earlier in the sentence if it would be clearer in your language. Alternate translation: “I will show your shame”
3:5	ba56		rc://*/ta/man/translate/figs-abstractnouns	your shame	1	If your language does not use an abstract noun for the idea of **shame**, you could express the same idea in another way. Alternate translation: “how shameful you are”
3:6	ba57		rc://*/ta/man/translate/writing-pronouns	you	1	The pronoun **you** refers to Nineveh, which Yahweh described as a prostitute in [3:4](../03/04.md). If this is not clear for your readers, you could use the name. Alternate translation: “you prostitute”
3:6	s894		rc://*/ta/man/translate/translate-symaction	I will throw filth on you	0	The word translated as **filth** refers to all kinds of garbage. Throwing garbage on a person was a sign of strong contempt. Alternate translation: “I will show utter contempt for you”
3:7	ba58		rc://*/ta/man/translate/figs-activepassive	Nineveh is destroyed	1	If your language does not use a passive form like **is destroyed**, you could express the idea in active form or in another way that is natural in your language. Alternate translation: “Attackers have destroyed Nineveh”
3:7	aj99		rc://*/ta/man/translate/translate-tense	Nineveh is destroyed	1	The author uses the past tense here in order to refer to something that will certainly happen in the future. If it would not be natural to do that in your language, you could use the future tense. Alternate translation: “Nineveh will be destroyed”
3:7	ba59		rc://*/ta/man/translate/figs-rquestion	who will sympathize with her?	1	The author is using the question form to emphasize that no one will sympathize with Nineveh. If you would not use the question form for this purpose in your language, you could translate this as a statement or an exclamation. Alternate translation: “no one will sympathize with her!”
